job_title,company,company_rating,location,job_text,date
"Research Analyst - Washington, DC",Dentons,3.3 out of 5 from 100 employee ratings,"Washington, DC","['Find jobs', 'Company Reviews', 'Find salaries', 'Employers', 'Change country', 'Help Center', 'Performing quantitative and qualitative data analysis.', 'Conduct secondary research and literature reviews.', 'Develop quantitative analysis of markets, including demand analysis (marketing sizing), market segmentation and forecasts.', 'Analyze data gathered in the course of primary and secondary research to develop key elements to further inform the business planning process.', 'Profile various industries and sectors.', 'Work with lawyers and team members in other Business Services functions in a collaborative manner to deliver high-value results as part of a multi-disciplinary team.', 'Stay current with industry and macroeconomic trends impacting the legal profession.', 'Present research findings and recommendations to leadership.', 'Contribute to reporting, proposals and presentations as required.', 'Contribute to internal performance improvement initiatives to implement new analytical techniques or tools.', 'Other duties as may be assigned to fully meet the requirements of the position.', 'Excellent verbal and writing skills.', 'Strong quantitative skills and attention to detail.', 'A self-starter and ability to work independently.', 'Ability to analyze and organize data into meaningful presentations.', 'Ability to effectively and professionally communicate findings.', 'Experience working in a team-based environment.', 'Creativity in solving problems and developing approaches to complex analytical questions.', 'A solid understanding of market research methodologies.', 'Experience in professional services organizations and a finance or economics degree a plus but not required.', 'The position will require some travel, both nationally and internationally.']",2021-01-05 13:05:38
Data Analyst,Harpro Tech INC,N/A,"Reston, VA 20190","['Find jobs', 'Company Reviews', 'Find salaries', 'Employers', 'Change country', 'Help Center', 'Develop, implement, and maintain leading-edge analytic systems, taking complicated problems and building simple frameworks.', 'Preemptively recognize and resolve technical issues utilizing knowledge of policies and processes.', 'Create best-practice reports based on data mining, analysis, and visualization.', 'Solves critical issues and shares knowledge such as trends, aggregate, quantity volume regarding specific data sources.', 'Collaborates with technology and platform management partners.', 'Determines appropriateness of data for storage and optimum storage organization.', 'Determines how tables relate to each other and how fields interact within the tables to develop relational models.', 'Optimize data sourcing and processing rules to ensure appropriate data quality.']",2021-01-05 13:05:38
"Product Management Intern, Business Intelligence and Data Analytics",Alarm.com,4.1 out of 5 from 27 employee ratings,"Tysons, VA","['Find jobs', 'Company Reviews', 'Find salaries', 'Employers', 'Change country', 'Help Center', 'Conducting market research – gathering feedback from customers/team and analyzing product landscape.', 'Provide analytical and data-driven decision-making support for key projects in health, fitness and/or wellness.', 'Execute quantitative analyses and build predictive models that translate data into actionable insights.', 'Create and manage data analysis product lifecycle roadmaps.', 'Gather product requirements from PM teams, dealers and other stakeholders to help deliver data driven solutions.', 'Interpret data, analyze results using statistical techniques and provide ongoing reports.', 'Currently BA/BS in Computer Science, Management Information Systems, Data Science, Math, Physics, Engineering, Statistics or other technical field. Advanced degrees preferred.', 'Understanding of Statistical Concepts, Data Management and data lifecycle.', 'Excellent written/oral communication.', 'Strong quantitative, analytical, and critical thinking skills.', 'Highly motivated, resourceful, self-starter with ability to deliver results.', 'Strong computer skills (e.g. Excel, Word, PowerPoint)', 'Any prior experience and/or interest in AI', 'Collaborate with outstanding people: We hire only the best. Our standards are high and our employees enjoy working alongside other high achievers.', 'Make an immediate impact: New employees can expect to be given real responsibility for bringing new technologies to the marketplace. You are empowered to perform as soon as you join the Alarm.com team!', 'Gain well rounded experience: Alarm.com offers a diverse and dynamic environment where you will get the chance to work directly with executives and develop expertise across multiple areas of the business.', ""Work with the latest technologies: You'll gain exposure to a broad spectrum of IoT, SaaS and M2M technologies including wireless communication, video monitoring, smart home automation, web development, and backend application development and hosting."", 'Focus on fun: Alarm.com places high value on our team culture. We even have a committee dedicated to hosting a stand-out holiday party, happy hours, and other fun corporate events.']",2021-01-05 13:05:38
Data Analyst,PHOENIX,N/A,Remote,"['Find jobs', 'Company Reviews', 'Find salaries', 'Employers', 'Change country', 'Help Center', 'Create operational reporting to internal stakeholders and clients across all our business lines', 'Clean, prep, map, and load client data into our data warehouse', 'Work with clients directly, when required, to understand client-provided data and client reporting needs', 'Develop, test, and deploy robust reporting to our business lines to replace ad hoc reporting whenever possible', 'Participate in the ongoing discussions around how to best organize and analyze our data', 'Develop and maintain documentation to empower colleagues to use and explore our data', 'Work with business leaders to create data marts in support of new products, existing services, and internal reporting', 'Help create appropriate data quality strategies and actively ensure high-quality data through automated and manual systems', 'Support the evolution of PHOENIX’s business intelligence strategies', 'Build, develop, and grow relationships with business users and other stakeholders to establish mutual trust and provide a foundation for high level project partnership', '3+ years of experience in data management, advanced analytics, and business intelligence activities and/or relevant educational experience', 'Previous reporting and analysis experience in the mortgage industry, with particular emphasis in origination and/or servicing activities, highly desired', 'Strong SQL skills (SQL Server and Snowflake experience preferred)', 'Experience with data management and ETL tools (Alteryx experience preferred)', 'Strong attention to detail', 'Ability to adapt quickly and hit deadlines while working in a high-pressure, team-oriented environment', 'Experience with business intelligence tools like Power BI, Qlik, Looker, Sigma, and Tableau', 'Exceptional oral and written communication skills', 'Full-time work in Denver, CO (remote options available)', 'Competitive salary and paid time off', 'Health, dental, and vision benefits', '401k with employer match', 'Profit sharing', '401(k)', 'Dental insurance', 'Health insurance', 'Paid time off', 'Vision insurance', 'Monday to Friday', 'Fully Remote', 'Yes']",2021-01-05 13:05:38
Junior Business Analyst,ID.me,3.8 out of 5 from 8 employee ratings,"McLean, VA","['Find jobs', 'Company Reviews', 'Find salaries', 'Employers', 'Change country', 'Help Center', 'Drive continuous alignment between internal Training, Product, and Operations teams', 'Standardize and streamline communication flow between organizations', 'Document and communicate processes, programs, and rollouts across stakeholders', 'Improve user interface and overall experience', 'Conduct thorough data and root cause analysis to improve the status quo', 'Create training content for various softwares', 'Operate as a Subject Matter Expert across all internal training paths', 'Accelerate path to proficiency for new hires and improve their retention coming out of training', ""Bachelor's degree and at least one year of experience as an analyst"", 'Experience working with training teams, preferably in a call center setting', 'Proven results in improving organizational performance and efficiency', 'Advanced proficiency with MS Excel', 'Prior technical experience with various softwares', 'Top-notch writing skills', 'Self-starter with a track record of delivering results with minimal instruction', 'Team player with low ego', 'Highly organized with the ability to independently prioritize', 'Project management experience a plus', 'Prior experience with Tableau a plus']",2021-01-05 13:05:38
Program Analyst (Business Analyst),Government of the District of Columbia,3.6 out of 5 from 234 employee ratings,"Washington, DC 20024","['Find jobs', 'Company Reviews', 'Find salaries', 'Employers', 'Change country', 'Help Center']",2021-01-05 13:05:38
Data Analyst,Hendall Inc.,3.4 out of 5 from 17 employee ratings,"Rockville, MD 20850","['Find jobs', 'Company Reviews', 'Find salaries', 'Employers', 'Change country', 'Help Center', 'Receive data in electronic and hard copy formats and prepare for input and processing', 'Analyze data files, produce error reports and work with stakeholders to resolve processing errors.', 'Create, document, and implement quality control procedures that eliminate data errors', 'Prepare and submit monthly status reports documenting the status of data submissions', 'Generate tabulations from survey data files', 'Conduct routine ad hoc data runs and prepare write-ups in response to data queries', 'Develop the structure, specifications, and code for new data elements', 'Revise processing operations to incorporate new data elements and data quality control and timeliness procedures related to new elements.', 'Develops imputation plans', 'Produce analytic data file with imputed variables flagged', 'Generate analytic data file documentation, in ASCII and SAS format with SAS input statements and programming specifications', 'Create 508 compliant, searchable information for posting on public facing websites', 'Prepare error-free annual data reports', 'Produce public-use data files and documentation in ASCII and SAS format, with SAS input statements', 'Bachelor’s degree in math, statistics, data science, computer science, or related fields. Strong math and analysis skills are needed.', '5 years of professional experience in receiving, analyzing, processing large datasets (substance abuse and mental health domain knowledge preferred)', '5 years’ experience using SAS and Structured Query Language', 'Strong problem-solving skills', 'Strong written and verbal communications skills']",2021-01-05 13:05:38
Data Analyst,"Tecolote Research, Inc.",4.3 out of 5 from 38 employee ratings,"Arlington, VA 22202","['Find jobs', 'Company Reviews', 'Find salaries', 'Employers', 'Change country', 'Help Center', 'Experience obtaining, integrating, analyzing, and reporting client data, esp. acquisition data.', 'Ability to apply analytic techniques to define project objectives and strategic direction, resolving complex problems using an in-depth knowledge of analytic methodologies and principles.', 'Strong researching, data gathering, and technical reviews needed to produce written deliverables to include reports, spreadsheets, databases, formal process mapping, and technical designs.', 'Microsoft Access experience required', 'Experience with R and Sharepoint are required.', 'U.S. Citizenship required. Ability to obtain and maintain a security clearance and/or DHS Suitability.', 'Assess requirements, determine necessary resources to accomplish task, hypothesize solutions, develop solution, and report findings to various levels of government leadership.', 'Develop algorithms for data analysis.', 'Plan and conducts work requiring judgment in the evaluation, selection, and adaptation and/or modification of methodologies and tools.', 'Consult with senior consultants or functional specialists on unusual or complex problems Assess requirements, determine necessary resources to accomplish task, hypothesize solutions, develop solution, and report findings.', 'Comprehensive health, dental, life, long and short term disability insurance', '100% Company funded Retirement Plans', 'Generous vacation, holiday and sick pay plans', 'Tuition assistance']",2021-01-05 13:05:38
Data Analyst,Entrepreneurs' Organization,3.8 out of 5 from 12 employee ratings,"Alexandria, VA 22314","['Find jobs', 'Company Reviews', 'Find salaries', 'Employers', 'Change country', 'Help Center', 'Develops statistics and key metrics from various types of raw data', 'Develops data dashboards and visualizations using a BI platform', 'Utilizes ETL and SQL to transform and visualize datasets', 'Assist in survey development and implementation of all member surveys', 'Works with communications and marketing teams to identify key metrics on social media and marketing', 'Utilizes web analytics platforms such as Sprout Social and Google Analytics to aggregate online interaction statistics and key metrics', 'Performs other duties as assigned', 'Bachelor’s degree in analytics, statistics or relevant field', 'Minimum one (1) year of work experience in a data focused role', 'Advanced Microsoft Excel skills, including pivot tables, vlookup, and macros', 'Experience in creating data visualizations', 'Experience tracking and analyzing metrics and generating reports', 'Experience with web analytics platforms such as Google Analytics and Sprout Social', 'Experience in a business information/analysis team', 'Experience working with volunteers', 'Multilingual or international experience', 'Advanced knowledge of a BI platform such as Domo, Tableau, Looker, Exago or Power BI', 'The employee is normally required to work in a high-rise building equipped with elevators in an environment where the noise level is usually moderate. May be assigned to an internal work space without windows to the outside, located in close proximity to other office personnel.', 'Professional workplace where business casual attire is required.', 'Ability to work in a fast paced and high pressure environment.', 'Reasonable accommodations may be made to enable individuals with disabilities to perform the essential duties and responsibilities of the role.']",2021-01-05 13:05:38
Data Analyst I/II,Cambium Learning Group,3.6 out of 5 from 9 employee ratings,"Washington, DC","['Find jobs', 'Company Reviews', 'Find salaries', 'Employers', 'Change country', 'Help Center', 'Our systems are infinitely scalable and mission critical serving close to 1 million students simultaneously and over 60 million annually!', 'Our machine scoring methods are driven by artificial intelligence allowing computers to perform such complex operations as grading essays with more accuracy than humans.', 'Our processes use intensive algorithmic computing allowing a customized experience for each student as the exam adapts real-time based upon answers given.', 'Integrate data from multiple data sets, analyze and interpret complex data sets and make findings relevant and actionable for both internal and external stakeholders', 'Set-up, deploy, configure, and monitor multiple systems', 'Provide timely, accurate and reliable management reporting and analysis of data.', 'Create innovative solutions to an extensive range of complex data analysis requests.', 'Assist in the development of additional information system projects, as needed', 'Verify data quality to ensure accurate analysis and reporting', 'Bachelor’s degree in MIS, Statistics, Mathematics, Business Management or a related field and a minimum of 2 years of demonstrated experience with databases, SQL query development and at least one scripting language (Python, R, or other).', 'Detail-oriented with excellent analytical and quantitative skills. Demonstrated ability to apply innovative and resourceful solutions to solve challenges', 'Ability to meet detailed project goals while working independently', 'Excellent written and verbal skills with the ability to clearly organize thoughts and/or document content and convey complex concepts effectively regardless of audience.', 'Proficient with Microsoft SQL Server and SQL Reporting Services, Microsoft Excel, Microsoft Access and other database tools.']",2021-01-05 13:07:16
Data Analyst,ZERO TO THREE,3.5 out of 5 from 8 employee ratings,"Washington, DC 20037","['Find jobs', 'Company Reviews', 'Find salaries', 'Employers', 'Change country', 'Help Center', ""Bachelor's (Required)related data analytics: 5 years (Required)US work authorization (Required)"", 'Conduct data extraction, management, analysis and visualization of analytics for the following platforms used to disseminate NCECDTL resources:', 'Websites, including Head Start (HS) Early Childhood Learning & Knowledge Center (ECLKC) and Early Educator Central (EEC)', 'Social media platforms, including Facebook and Twitter', 'Texting programs developed by the NCECDTL', 'Online learning modules developed by the NCECDTL', 'Mobile applications developed by the NCECDTL', 'Information requests system managed by the NCECDTL', 'Online peer collaboration portal used by OHS, MyPeers', 'Conduct data extraction, management, analysis and visualization for three large datasets maintained by OHS:', 'HS Program Information Report (PIR), which is updated annually', 'HS Early Enterprise System (HSES), which is updated continually', 'HS Training & Technical Assistance (TTA) Smart Hub, which is updated continually', 'Lead administration, collation and analysis of evaluation data for standard NCECDTL TTA events, such as regional trainings and webinars', 'Prepare data visualizations- ranging from simple, static charts to infographics to interactive dashboards- depicting the data above on both a standard cycle (e.g. quarterly, annually) and an ad hoc basis to support NCECDTLs performance management and CQI efforts, using data visualization software such as Piktochart, Microsoft Power BI and Tableau', 'Track life cycle of key NCECDTL resources disseminated through various platforms to assess resources lifecycles and relative marketing effectiveness.', 'Respond to quick turnaround requests for specific data analyses, including analyses needed for quarterly and annual reporting.', 'Participate in regular full team and Data Team meeting, as well as ad hoc meetings.', 'Advance knowledge of Microsoft Office applications, including Word, Excel, Access and PowerPoint.', 'Experience running descriptive statistics in Excel or more advanced quantitative analysis software (experience with SPSS preferred) and some experience in qualitative analysis.', 'Ability to create data visualizations for non-research audiences using tools such as Excel, Tableau and PowerBI.', 'Experience with various analytics, including Google Analytics, application analytics and learning management system analytics.', 'Experience or strong interest in using data for continuous quality improvement (CQI).', 'Ability to communicate complex topics in simple terms and present results to diverse internal and external stakeholders.', 'Ability to work independently as well as in a team structure.', 'Ability to communicate effectively, verbally and in writing with diverse audiences.', 'Strong organizational, prioritization and time management skills.', 'Ability to be flexible in responding to emerging data needs.', 'Encourages and practices critical thinking.', 'Is self-reflective and empathetic.', 'Recognizes the influence of workplace relationships on outcomes and results.', 'Maintains a respectful and accepting approach to others.', 'Awareness of the influence of the larger context on individual behavior.', 'Collaboratively and creatively supports the work efforts of colleagues at all levels and in all areas of the organization.', 'Dental insurance', 'Disability insurance', 'Employee assistance program', 'Flexible schedule', 'Flexible spending account', 'Health insurance', 'Life insurance', 'Paid time off', 'Parental leave', 'Professional development assistance', 'Retirement plan', 'Vision insurance', 'Day shift', 'Monday to Friday', ""Bachelor's (Required)"", 'related data analytics: 5 years (Required)', 'CQI: 5 years (Required)', 'Remote interview process', 'Virtual meetings']",2021-01-05 13:07:16
Jr. Data Analyst,Synergy BIS,2.4 out of 5 from 17 employee ratings,"Arlington, VA 22209","['Find jobs', 'Company Reviews', 'Find salaries', 'Employers', 'Change country', 'Help Center', 'Experience interpreting data between source and target system architectures, having the capability to articulate the similarities, differences, and present analysis of findings.', 'Proficiency with MS Excel, MS Access, and relational databases (e.g. PostgreSQL).', 'Identify business and functional requirements, align data elements to functional requirements for traceability back to the process activities; capture AS-IS vs. TO-BE states and document gap analysis.', 'Author technical documents used for best practices, training, and user guides.', 'Responsible for stakeholder communication, data collection and requirements for system integration.', 'Prepare presentations, analyses, reports, demonstrations, and other related program documentation for senior leadership presentations.', 'Knowledge of and/or experience working within a software development team.', 'Develop, update, and maintain data governance artifacts.', 'Support and provide end-user training for DoD financial management system, as required.', 'Have a strong data analytics background within a cloud software development environment', 'Responsible for supporting rapid development and prototyping of analytical processes in support of several client initiatives', 'Responsible for assisting in the monitoring and management of data across multi-tiered efforts', 'Experience utilizing DoD financial databases and/or accounting systems', 'Working knowledge of databases (e.g. PostgreSQL, Oracle DB, or SQL)', 'Working knowledge of various methodologies for data management within cloud technologies', 'Perform Oracle and SQL database queries to deliver data-driven information to customers for decision making (e.g. IBM Cognos BI Tool)', 'Experience working in an Agile development environment']",2021-01-05 13:07:16
DATA ANALYST,Eagleforce Associates,N/A,"Herndon, VA 20171","['Find jobs', 'Company Reviews', 'Find salaries', 'Employers', 'Change country', 'Help Center', 'Develop data model, analyze, convert and integrate large and multi-dimensional data structures to support healthcare prediction systems, work using a variety of data management tools. Develop and Support NPI, NDC and ICD database architecture, improve MySQLs query performance. Work with developers to implement the interphases needed to ensure connectivity of proprietary technologies to web enabled and mobile applications suitable for the medical industry using Blockchain technology. Maintain database high availability and disaster recovery. Write test cases to test data, analyze risk identifiers and, write documentation addressing defect diagnostics and proposed solutions. Contribute to the implementation of new features and solutions for customers. Other related duties as assigned.', 'Master’s Degree or foreign equivalent in Database or Data Management, Data Analytics, Management Information Systems or any Data Science related field and 2 years of experience as a Data Analyst or any Data Analyst related position. Alternatively, employer is willing to accept a Bachelor’s degree or foreign equivalent in Database or Data Management, Data Analytics, Management Information Systems or any Data Science related field and 5 years of experience as a Data Analyst or in any Data Analyst related position. Any suitable combination of education, training and experience is acceptable.']",2021-01-05 13:07:16
Data Analyst,Signet Jewelers,2.9 out of 5 from 684 employee ratings,"New York, NY","['Find jobs', 'Company Reviews', 'Find salaries', 'Employers', 'Change country', 'Help Center', 'Job', 'Company', 'Analyze internal data architecture and data integrations to identify inefficiencies and to assist BI Manager in making best practice recommendations for modeling business data and BI solutions', 'Actively engage with the operations team to understand the data requirements, data flows, data entities and data relationships', 'Maintain existing data collection and analysis systems in support of the business', 'Develop data reports or templates for internal clients', 'Contribute to the design and implementation of analytical and data visualization tools', 'Work on special projects and assignments, as needed', 'Excellent work ethic, including a desire to learn continuously.', 'Excellent written and verbal communication skills.', 'Ability to work both independently and as part of a team in a multi-task environment with attention to detail.', 'Ability to keep many competing priorities in order and to learn quickly in a self-directed manner', 'Background in a shared services environment doing reporting and/or analytics a plus', 'Ability to proactively investigate data and troubleshoot errors autonomously', 'Python (or programming experience with the ability to learn Python quickly)', 'Query languages (SQL, GraphQL, Jaql, or equivalent) a plus', 'JavaScript, HTML a plus', 'Bachelor’s degree from an accredited college or university is preferred', 'Studies in computer science, statistics, or related fields is a plus', 'Choose your own Tech', 'Tuition reimbursement, learning groups, and training', 'Generous PTO program']",2021-01-05 13:07:16
