job_title,company,location,date_posted,applicants,job_text,seniority_level,employment_type,job_function,industries,date_scraped
Marketing Data Analyst,Uber,"San Francisco, CA",7 hours ago,Be among the first 25 applicants,"['', 'Excellent communication skills and attention to detail', 'Experience visualizing data and creating reports.', 'Expertise with SQL databases - ideally Vertica, Redshift, and/or Hadoop.', 'Analyze clickstream data to monitor advertising partner quality and improve overall ad efficiency.', 'Develop frameworks, tools and processes to ensure that analytical insights can be incorporated into key decision making.', 'Bachelor’s degree in a science or engineering field, or commensurate work experience.', 'Develop frameworks, tools and processes to ensure that analytical insights can be incorporated into key decision making.Analyze clickstream data to monitor advertising partner quality and improve overall ad efficiency.Work with data scientists and engineering team to drive the development of analytical tools and visualizations.Effectively share insights and analyses to business stakeholders to drive business decisions.Ensure that we are properly understanding the value of all of our marketing channels - on both drivers and riders for acquisition and engagement.Be a key driver of marketing strategy, by thinking beyond immediate analysis to understand long term implications of actions.', 'Bachelor’s degree in a science or engineering field, or commensurate work experience.3 years experience with with SQL databases ', ' Basic Qualifications', 'Be a key driver of marketing strategy, by thinking beyond immediate analysis to understand long term implications of actions.', '3 years experience with with SQL databases ', 'Basic Qualifications', 'Expertise with SQL databases - ideally Vertica, Redshift, and/or Hadoop.Familiarity with statistics, regression analysis, and causal analysis.Experience identifying and adapting to imperfect data.Experience with Python, R, or another scripting language.Experience visualizing data and creating reports.Ability to facilitate experimentation and conduct experiment analysis.Excellent communication skills and attention to detail', 'Effectively share insights and analyses to business stakeholders to drive business decisions.', 'Preferred Qualifications', ""What You'll Do"", 'Ensure that we are properly understanding the value of all of our marketing channels - on both drivers and riders for acquisition and engagement.', 'Work with data scientists and engineering team to drive the development of analytical tools and visualizations.', 'What The Candidate Will Need / Bonus Points', 'Ability to facilitate experimentation and conduct experiment analysis.', 'Experience with Python, R, or another scripting language.', 'Experience identifying and adapting to imperfect data.', 'Familiarity with statistics, regression analysis, and causal analysis.', 'About The Role']",Not Applicable,Full-time,Information Technology,Computer Software,2021-01-26 11:38:09
Data Analyst,Volvo Group,"Byhalia, MS",14 hours ago,33 applicants,"['', ' CUSTOMER FOCUS: Understanding and meeting the needs of customers and addressing the interests and concerns of all organization stakeholders. ', ' COMMUNICATION: Listening effectively, transmitting information accurately and understandably and actively seeking feedback non-defensively. ', ' Bachelor’s Degree in Industrial Engineering, Business Management, Information Management or Statistics ', ' Filter and “clean” data by reviewing computer reports, printouts, and performance indicators to locate and correct code problems ', ' Minimum Education and Experience ', ' Defines, develops and evaluates performance metrics to establish process success, and may participate in working with multiple stakeholders ', ' Knowledge in Lean preferred ', ' Acquire data from primary or secondary data sources and maintain databases/data systems ', ' Collect data to identify root cause of problems and develop process improvement strategies based on analyses ', ' Strong analytical skills with the ability to collect, organize, analyze, and disseminate significant amounts of information with attention to detail and accuracy ', ' Knowledge in Problem Solving Methodology preferred (5WHY, PDCA, DMAIC, …) ', ' OWNERSHIP/ACCOUNTABILITY: Taking the lead in getting the job done and accepting responsibility for personal actions, costs, and results. ', 'About Us', ' Data analyst responsibilities include develop analysis and reporting capabilities. They will also monitor performance and quality control plans to identify improvements. ', ' Develop and implement databases, data collection systems, data analytics and other strategies that optimize statistical efficiency and quality ', ' Prior experience with Warehouse Data Analytics Preferred ', 'City/Town', ' DEPENDABILITY/RELIABILITY: Following through on commitments, producing timely work to required -- or higher -- standards, and pitching in to get the job done. ', ' Bachelor’s Degree in Industrial Engineering, Business Management, Information Management or Statistics  Minimum three years data analysis experience.  Strong knowledge of statistics and experience using statistical packages for analyzing datasets (Excel, Minitab, Power BI, QlikView, etc)  Knowledge of and experience with reporting packages (Business Objects etc), databases (SQL etc), programming (XML, Javascript, or ETL frameworks)  Adept at queries, report writing and presenting findings  Knowledge in Lean preferred  Knowledge in Problem Solving Methodology preferred (5WHY, PDCA, DMAIC, …)  Knowledge of Microsoft Office  Prior experience in lean manufacturing or logistics environments preferred  Prior experience with Warehouse Data Analytics Preferred  Proven working experience as a data analyst or business data analyst  Technical expertise regarding data models, database design development, data mining and segmentation techniques ', ' INITIATIVE: Taking action in the absence of specific instructions or in the absence of a specific requirement, taking reasonable risks to achieve results, and persevering when challenged ', ' Good communication skills and ability to work under minimal amount of supervision.  Strong analytical skills with the ability to collect, organize, analyze, and disseminate significant amounts of information with attention to detail and accuracy ', 'Last application date', ' All other Duties as assigned. ', ' Help develop ideas and systems to eliminate/greatly reduce or streamline routine administrative functions. ', ' Identify, analyze, and interpret trends or patterns in complex data sets ', ' US Disclaimer text ', ' Work with management to prioritize business and information needs ', 'State / Province', 'Volvo Group Trucks Operations', 'Position Description', 'Travel Required (maximum)', 'Auto req ID', ' Design tools to help managers maintain and updates attendance logs, training logs ', ' Minimum three years data analysis experience. ', ' Data analyst responsibilities include develop analysis and reporting capabilities. They will also monitor performance and quality control plans to identify improvements.  Interpret data, analyze results using statistical techniques and provide ongoing reports  Develop and implement databases, data collection systems, data analytics and other strategies that optimize statistical efficiency and quality  Acquire data from primary or secondary data sources and maintain databases/data systems  Identify, analyze, and interpret trends or patterns in complex data sets  Filter and “clean” data by reviewing computer reports, printouts, and performance indicators to locate and correct code problems  Work with management to prioritize business and information needs  Defines, develops and evaluates performance metrics to establish process success, and may participate in working with multiple stakeholders  Collect data to identify root cause of problems and develop process improvement strategies based on analyses  Coordinate Benchmarking data and information on metrics for processes.  Assist the Regional Distribution Centers with the journey to Platinum Level designation by utilizing Lean / Continuous Improvement principles.  Develop and implement databases, data collection systems, data analytics to challenge the Idea Generation Program and the pace of Lean/Business Process Improvement  Design tools to help managers maintain and updates attendance logs, training logs  Help develop ideas and systems to eliminate/greatly reduce or streamline routine administrative functions.  All other Duties as assigned. ', 'Functional Area', ' Regular Domestic Travel ', 'Entity', 'Description/Responsibility', ' We are looking for a passionate Data Analyst. The successful candidate will turn data into information, information into insight and insight into business decisions. ', 'Travel Requirements', ' Develop and implement databases, data collection systems, data analytics to challenge the Idea Generation Program and the pace of Lean/Business Process Improvement ', ' Knowledge of Microsoft Office ', ' ATTENTION TO DETAIL: Monitoring adherence to standards and actively checking for accuracy of data received or generated before passing it on. ', 'Employment/Assignment Type', ' Adept at queries, report writing and presenting findings ', ' PLANNING & ORGANIZATION: Anticipating and drawing inferences about the future and structuring resources and actions in a logical manner. ', ' Coordinate Benchmarking data and information on metrics for processes. ', ' Competencies ', ' Good communication skills and ability to work under minimal amount of supervision. ', ' Knowledge of and experience with reporting packages (Business Objects etc), databases (SQL etc), programming (XML, Javascript, or ETL frameworks) ', ' Technical expertise regarding data models, database design development, data mining and segmentation techniques ', ' Assist the Regional Distribution Centers with the journey to Platinum Level designation by utilizing Lean / Continuous Improvement principles. ', ' INITIATIVE: Taking action in the absence of specific instructions or in the absence of a specific requirement, taking reasonable risks to achieve results, and persevering when challenged  COMMUNICATION: Listening effectively, transmitting information accurately and understandably and actively seeking feedback non-defensively.  CUSTOMER FOCUS: Understanding and meeting the needs of customers and addressing the interests and concerns of all organization stakeholders.  OWNERSHIP/ACCOUNTABILITY: Taking the lead in getting the job done and accepting responsibility for personal actions, costs, and results.  CONCEPTUAL THINKING: Understanding how elements, problems, and situations are related to each other and to the larger environment.  PLANNING & ORGANIZATION: Anticipating and drawing inferences about the future and structuring resources and actions in a logical manner.  ATTENTION TO DETAIL: Monitoring adherence to standards and actively checking for accuracy of data received or generated before passing it on.  PROBLEM SOLVING/DECISION MAKING: Taking a well-ordered approach to solving problems and acting despite obstacles or resistance.  DEPENDABILITY/RELIABILITY: Following through on commitments, producing timely work to required -- or higher -- standards, and pitching in to get the job done. ', ' Strong knowledge of statistics and experience using statistical packages for analyzing datasets (Excel, Minitab, Power BI, QlikView, etc) ', ' Prior experience in lean manufacturing or logistics environments preferred ', ' PROBLEM SOLVING/DECISION MAKING: Taking a well-ordered approach to solving problems and acting despite obstacles or resistance. ', 'Volvo Group North America is an Equal Opportunity EmployerE.O.E./M/F/Disability/VeteranWe Participate in E-verify', ' This position will be heavily focused on data analysis and reporting within the logisitics, supporting our implementation of LEAN practices. The incumbent will be required to design and produce reports that will be used to help North American leadership manage Central Distribution Center and will also perform the administrative duties associated with the operational success of the CDC. ', ' CONCEPTUAL THINKING: Understanding how elements, problems, and situations are related to each other and to the larger environment. ', ' Proven working experience as a data analyst or business data analyst ', ' Interpret data, analyze results using statistical techniques and provide ongoing reports ']",Not Applicable,Full-time,Distribution,Automotive,2021-01-26 11:38:09
Procurement Data Analyst ,Fluence,"Arlington, VA",53 minutes ago,Be among the first 25 applicants,"['', 'Agile', 'Enable the discovery, cleaning, and organizing of data to inform\xa0the\xa0procurement\xa0choices.\xa0\xa0\xa0', 'GET IN TOUCH', 'Fluence currently has more than 2.4 gigawatts of projects in operation or awarded across 24 countries and territories worldwide. We topped the Navigant Research utility-scale energy storage leaderboard in 2018 and were named one of Fast Company’s Most Innovative Companies in 2019. In 2020, our sixth-generation Tech Stack won Commercial Technology of the Year at the 22nd annual S&P Global Platts Global Energy Awards.', 'Working on transforming a fundamental part of our society is exciting and fulfilling. It requires creativity, diversity of ideas and backgrounds, and building trust to effect change and move with speed. We respect our coworkers and customers. We listen to what others have to say, and we are inclusive. ', 'Maintain ongoing assessment of sourcing risks and propose\xa0alternatives.\xa0', 'Fluence, a Siemens and AES company, is the global market leader in energy storage technology solutions and services, combining the agility of a technology company with the expertise, vision and financial backing of two well-established and respected industry giants. Building on the pioneering work of AES Energy Storage and Siemens energy storage, our goal is to create a more sustainable future by transforming the way we power our world. Providing design, delivery and integration, Fluence offers proven energy storage technology solutions that address the diverse needs and challenges of customers in a rapidly transforming energy landscape. ', 'Develop future target costs through data from market analysts, Fluence transactions and customer\xa0feedback.\xa0', 'Location: Arlington VA or continental US', 'ABOUT FLUENCE', 'Support Commodity Managers to drive cost reduction in all venues and\xa0development of\xa0commodity\xa0strategy and\xa0execution.\xa0', 'Drive and steer positioning of Fluence in alignment with the global Commodity Managers, Sales, Technology, and Product Management\xa0Enable the discovery, cleaning, and organizing of data to inform\xa0the\xa0procurement\xa0choices.\xa0\xa0\xa0Support Commodity Managers to drive cost reduction in all venues and\xa0development of\xa0commodity\xa0strategy and\xa0execution.\xa0Develop future target costs through data from market analysts, Fluence transactions and customer\xa0feedback.\xa0Support supplier selection based on Total Cost of Ownership criteria (incl. quality, reliability, delivery, transport costs, etc.)\xa0Maintain ongoing assessment of sourcing risks and propose\xa0alternatives.\xa0', 'Ability to work cross functionally and collaborate with Product Management, Sales, Services, and Technology on projects to ensure Fluence is offering the best solutions ', 'Support supplier selection based on Total Cost of Ownership criteria (incl. quality, reliability, delivery, transport costs, etc.)\xa0', 'Experience building and maintaining\xa0analytic\xa0models.\xa0\xa0Experience in R, Python, or similar (preferred)\xa0', 'Do others come to you for your subject matter expertise? Are you excited by the challenge of working in a start-up atmosphere with a purpose? ', '1-5\xa0years’ experience\xa0in energy industry\xa0and/or in a procurement role.\xa0', 'Procurement Data Analyst ', 'Responsible', 'Drive and steer positioning of Fluence in alignment with the global Commodity Managers, Sales, Technology, and Product Management\xa0', 'Fluence is seeking an energy storage\xa0Procurement Data Analyst\xa0to help us\xa0improve our supply chain, logistics and procurement.\xa0You will\xa0forecast costs of key components,\xa0drive cost reduction and efficiencies, learn about commercial and technical topics in energy storage,\xa0and support Total Cost of Ownership Analysis to ensure Fluence offers the best energy storage technology.\xa0\xa0', 'Experience building\xa0price forecasts, both from the bottom up and\xa0top\xa0down\xa0', 'We are energized by the mission to change the way we power our world and the opportunity to define and shape the products and supply chains to fulfill this mission We love to learn new things, both inside and outside our areas of expertise, and share our knowledge with others.', 'Leading ', '1-5\xa0years’ experience\xa0in energy industry\xa0and/or in a procurement role.\xa0Experience building and maintaining\xa0analytic\xa0models.\xa0\xa0Experience in R, Python, or similar (preferred)\xa0Experience building\xa0price forecasts, both from the bottom up and\xa0top\xa0down\xa0Ability to work cross functionally and collaborate with Product Management, Sales, Services, and Technology on projects to ensure Fluence is offering the best solutions Desire to work collaboratively in entrepreneurial environment and learn new things within and outside your area of experitse\xa0Track record of taking ownership over responsibilities and pursuing them diligently.\xa0', 'Please send your resume and cover letter to careers@fluenceenergy.com.', 'Fluence is defined by its unwavering commitment to safety, quality, and integrity. We take personal ownership in what we do, developing trust in our relationships with internal and external stakeholders. We firmly believe in having honest, forthcoming, and fair communications.', 'Track record of taking ownership over responsibilities and pursuing them diligently.\xa0', 'Fluence IS AN EQUAL OPPORTUNITY EMPLOYER and fully subscribes to the principles of Equal Employment Opportunity to ensure that all applicants and employees are considered for hire, promotion, and job status without regard to race, color, religion, sex, national origin, age, disability, veteran status, sexual orientation, marital or familial status.', 'Desire to work collaboratively in entrepreneurial environment and learn new things within and outside your area of experitse\xa0', 'Fun', 'Here at Fluence, we strive to continuously improve, be intellectually curious and be adaptive to our customers and employee’s needs. Collaboration is key, both in our partnerships with our customers, and with each other. Fluence prioritizes the most critical efforts that allow for the greatest impact. ']",Mid-Senior level,Full-time,Analyst,Renewables & Environment,2021-01-26 11:38:09
Data Analyst,Salesforce,"Boston, MA",19 hours ago,92 applicants,"['', 'Managing master data, including creation, updates, and deletion.', 'Excel', 'Evaluating changes and updates to source production systems.', 'Job Category', 'Salesfore.com', 'Processing confidential data and information according to guidelines.', 'Demonstrated experience in handling large data sets and relational databases.', ""Pursuing or completed Bachelor's degree (within 1 year of graduation date) in a Computer Science related field or Business with a concentration in Marketing and/or Sales"", 'Build Monthly and Quarterly Business ReviewsDevelop and maintain master dataset based on evolution of businessManage data quality to ensure consistency in reporting', 'Managing users and user roles.', 'Salesforce.com', 'Accommodations ', 'Data Analyst', 'Salesforce Reporting /Einstein AnalyticsTableauExcel', 'Managing and designing the reporting environment, including data sources, security, and metadata.', 'Salesforce Reporting /Einstein Analytics', 'Training end users on new reports and dashboards.', 'Posting Statement', 'To get the best candidate experience, please consider applying for a maximum of 3 roles within 12 months to ensure you are not duplicating efforts.', 'Build Monthly and Quarterly Business Reviews', 'Salesforce.org', 'Title: Data Analyst', 'High-level written and verbal communication skills.', 'Providing technical expertise on data storage structures, data mining, and data cleansing.', 'Managing master data, including creation, updates, and deletion.Managing users and user roles.Provide quality assurance of imported data, working with quality assurance analyst if necessary.Commissioning and decommissioning of data sets.Processing confidential data and information according to guidelines.Helping develop reports and analysis.Help design and manage capacity planning dataManaging and designing the reporting environment, including data sources, security, and metadata.Supporting the data warehouse in identifying and revising reporting requirements.Supporting initiatives for data integrity and normalization.Assessing tests and implementing new or upgraded software and assisting with strategic decisions on new systems.Generating reports from single or multiple systems.Troubleshooting the reporting database environment and reports.Evaluating changes and updates to source production systems.Training end users on new reports and dashboards.Providing technical expertise on data storage structures, data mining, and data cleansing.', 'Develop and maintain master dataset based on evolution of business', 'Job Details:', 'High-level experience in methodologies and processes for managing large scale databases.', 'Job Details', ' Skills Required: ', 'Generating reports from single or multiple systems.', 'About Customer Success Group At Salesforce', 'Tableau', 'Ability to work with stakeholders to assess potential risks.', 'Assessing tests and implementing new or upgraded software and assisting with strategic decisions on new systems.', 'Help design and manage capacity planning data', 'Ability to analyze existing tools and databases and provide software solution recommendations.', 'Responsibilities', 'Work experience as a data analyst or in related field.', 'Accommodations  - ', ""Pursuing or completed Bachelor's degree (within 1 year of graduation date) in a Computer Science related field or Business with a concentration in Marketing and/or SalesWork experience as a data analyst or in related field.Ability to work with stakeholders to assess potential risks.Ability to analyze existing tools and databases and provide software solution recommendations.Ability to translate business requirements into non-technical, lay terms.High-level experience in methodologies and processes for managing large scale databases.Demonstrated experience in handling large data sets and relational databases.Understanding of addressing and metadata standards.High-level written and verbal communication skills."", 'Ability to translate business requirements into non-technical, lay terms.', 'About The Position', 'Measure', 'Technology:', 'Helping develop reports and analysis.', 'Manage data quality to ensure consistency in reporting', 'Troubleshooting the reporting database environment and reports.', 'Commissioning and decommissioning of data sets.', 'Understanding of addressing and metadata standards.', 'Supporting initiatives for data integrity and normalization.', 'Provide quality assurance of imported data, working with quality assurance analyst if necessary.', 'Supporting the data warehouse in identifying and revising reporting requirements.']",Not Applicable,Full-time,Information Technology,Computer Software,2021-01-26 11:38:09
