job_title,company,location,date_posted,applicants,job_text,seniority_level,employment_type,job_function,industries,date_scraped
Data Analyst,IntePros Consulting,"St Louis, MO",16 hours ago,Be among the first 25 applicants,"['', 'Transforms client requests into data deliverables to include data models, charts, drill-downs, and pivotable data.', 'May perform software testing, documentation and provide training. ', 'Self-starter, quick learner, problem-solver, and someone who enjoys challenges.', 'Minimum 1 year of experience writing SQL queries.', 'Must be able to work an onsite rotation in St Louis, MO', 'Analytical, result-driven with high attention to detail.', 'Tableau/visualization tools major plus!', '1+ years using SQL to aggregate, gather, and manipulate data.', 'Must be a team player.', 'Data Analyst Job Requirements', 'Ability to gather and analyze data, reason logically, draw valid conclusions and make appropriate concise information and recommendations available in both oral and written forms', 'Proficient knowledge of Structured Query Language (SQL).1+ years using SQL to aggregate, gather, and manipulate data.Analytical skills related to the development of report specification, data reporting and data modelingTransforms client requests into data deliverables to include data models, charts, drill-downs, and pivotable data.Ability to gather and analyze data, reason logically, draw valid conclusions and make appropriate concise information and recommendations available in both oral and written formsAnalytical, result-driven with high attention to detail.Self-starter, quick learner, problem-solver, and someone who enjoys challenges.Accomplish targeted performance objectives with a positive and can-do attitude.May perform software testing, documentation and provide training. Must be a team player.Tableau/visualization tools major plus!Minimum 1 year of experience writing SQL queries.Must be able to work an onsite rotation in St Louis, MO', 'Proficient knowledge of Structured Query Language (SQL).', 'Accomplish targeted performance objectives with a positive and can-do attitude.', 'Analytical skills related to the development of report specification, data reporting and data modeling']",Entry level,Full-time,Information Technology,Information Technology and Services,2021-01-28 13:52:32
"Analyst II, SQL Reporting and Data Analysis",Frontier Airlines,"Denver, CO",15 hours ago,Be among the first 25 applicants,"['', ' Identify & quantify revenue opportunities across the organization Work with the Pricing and Revenue Management teams to identify new opportunities for generating revenue Construct statistical models Present findings to relevant stakeholders Create visualizations and dashboards to illustrate key trends and KPIs Work with a wide variety of teams with diverse technical backgrounds Enhance the Revenue Analytics infrastructure by implementing best practice coding & structure Create data pipelines to transform raw input into clean datasets for use in analysis Write clean, efficient code to automate processes Mentor more junior team members, and foster the development of their programming and analytics skills Collaborate with diverse teams across the company Conduct ad-hoc projects, reports and analyses as determined by management Set the standard for the broader team in thought processes and analytical output Achieve expert status in business and industry trends Clearly communicate the actionable business implications of complex quantitative analyses to senior management Lead change across the organization by improving directly owned processes and taking initiative to champion cross-functional opportunities ', 'Essential Functions', 'Mentor more junior team members, and foster the development of their programming and analytics skills', 'Work with the Pricing and Revenue Management teams to identify new opportunities for generating revenue', ""Work Is Why We're Here, But The Perks Are Nice Too"", 'Disclaimer: The above statements are intended only to describe the general nature and level of work required of the referenced position; they are not intended to be an exhaustive list of all responsibilities, duties, and skills required of individuals in this position. Please be advised that duties and expectations of this position may be subject to change.', 'Strong work ethic; delivers results in ambiguous, time-pressured situations', 'Advanced proficiency in Excel', "" Flight benefits for you and your family to fly on Frontier Airlines. Buddy passes for your friends so they can experience what makes us so great. Discounts throughout the travel industry on hotels, car rentals, cruises and vacation packages. Discounts on cell phone plans, movie tickets, restaurants, luggage and over 2,000 other vendors. Enjoy a ‘Dress for your Day' business casual environment. Flexible work schedules that support work/life balance. Total Rewards program including a competitive base salary, short term incentives, long-term incentives, paid holidays, 401(k) plan, vacation/sick time and medical/dental/vision insurance that begins the 1st of the month following your hire date. We play our part to make a difference. The HOPE League, Frontier Airlines' non-profit organization, is dedicated to providing employees financial assistance during catastrophic hardship. "", 'Collaborate with diverse teams across the company', 'Comfortable working self-sufficiently to creatively solve analytical challenges with limited data and imminent deadlines', 'friendly', 'Positions Supervised ', 'Conduct ad-hoc projects, reports and analyses as determined by management', 'Experience with Power BI or Tableau preferred', 'Ability to structure logical analytical approaches and to apply a range of quantitative techniques to solve business problems in an efficient, timely manner', 'Clearly communicate the actionable business implications of complex quantitative analyses to senior management', 'Work Perks', 'Frontier Airlines is a Zero Tolerance Drug-Free Workplace. All prospective employees are subject to pre-employment testing for the following drugs and their metabolites: Marijuana, Cocaine, Amphetamines, Opioids and Phencyclidine (PCP). Further, any applicant who is found to have tested positive on any required drug or alcohol test at a former employer will be considered ineligible for employment with Frontier.', ""Bachelor's Degree required; major(s) in Operations Research, Computer Science, Engineering, Mathematics, Finance, Aviation Management or related analytical field strongly preferred; combination of education and work experience considered in lieu of degree"", 'Ability to write SQL code to query against disparate data sources', 'Advanced analytical and quantitative skills; demonstrated understanding of airline commercial metrics, economics, network design and revenue management principles', 'Knowledge or interest in statistics or machine learning preferred', 'Who We Are', 'Ability to independently prioritize analyses in a fast-paced, dynamic environment', 'Achieve expert status in business and industry trends', 'Enhance the Revenue Analytics infrastructure by implementing best practice coding & structure', "" Bachelor's Degree required; major(s) in Operations Research, Computer Science, Engineering, Mathematics, Finance, Aviation Management or related analytical field strongly preferred; combination of education and work experience considered in lieu of degree 3 to 5 years of experience in data analytics, finance, pricing or revenue management required "", 'Buddy passes for your friends so they can experience what makes us so great.', 'What We Stand For', 'Other Functions', '3 to 5 years of experience in data analytics, finance, pricing or revenue management required', ""We play our part to make a difference. The HOPE League, Frontier Airlines' non-profit organization, is dedicated to providing employees financial assistance during catastrophic hardship."", 'Frontier Airlines, Inc. is an equal opportunity employer and, as such, is committed to providing equal employment opportunities to all qualified applicants without regard to race, color, religion, sex, national origin, age, marital status, veteran status, sexual orientation, gender identity or expression, disability status, pregnancy, genetic information, citizenship status or any other basis protected by federal, state, or local laws. This policy applies to all terms and conditions of employment, including recruiting, hiring, placement, promotion, termination, layoff, recall, transfer, leaves of absence, compensation and training.', 'Present findings to relevant stakeholders', 'Write clean, efficient code to automate processes', 'Qualifications', 'Physical Effort ', 'Total Rewards program including a competitive base salary, short term incentives, long-term incentives, paid holidays, 401(k) plan, vacation/sick time and medical/dental/vision insurance that begins the 1st of the month following your hire date.', 'Supervision Received ', 'Construct statistical models', 'Strong organizational skills and the ability to keep track of several projects at once', 'down-to-earth', 'Discounts on cell phone plans, movie tickets, restaurants, luggage and over 2,000 other vendors.', 'Work Environment', 'Knowledge, Skills And Abilities', 'Lead change across the organization by improving directly owned processes and taking initiative to champion cross-functional opportunities', 'Discounts throughout the travel industry on hotels, car rentals, cruises and vacation packages.', 'What Will You Be Doing?', 'Create visualizations and dashboards to illustrate key trends and KPIs', 'Identify & quantify revenue opportunities across the organization', 'care', ""Enjoy a ‘Dress for your Day' business casual environment."", 'Flexible work schedules that support work/life balance.', 'Set the standard for the broader team in thought processes and analytical output', ' Basic programming skills, with some knowledge of Python strongly preferred Ability to write SQL code to query against disparate data sources Advanced proficiency in Excel Experience with Power BI or Tableau preferred Knowledge or interest in statistics or machine learning preferred Strong organizational skills and the ability to keep track of several projects at once Advanced analytical and quantitative skills; demonstrated understanding of airline commercial metrics, economics, network design and revenue management principles Exemplary written and verbal communication and presentation skills Ability to independently prioritize analyses in a fast-paced, dynamic environment Ability to structure logical analytical approaches and to apply a range of quantitative techniques to solve business problems in an efficient, timely manner Comfortable working self-sufficiently to creatively solve analytical challenges with limited data and imminent deadlines Strong work ethic; delivers results in ambiguous, time-pressured situations Sound judgment and ability to maintain composure under pressure ', 'Equipment Operated ', 'Why Work for Frontier Airlines?', 'Flight benefits for you and your family to fly on Frontier Airlines.', 'Work with a wide variety of teams with diverse technical backgrounds', 'Basic programming skills, with some knowledge of Python strongly preferred', 'Exemplary written and verbal communication and presentation skills', 'Create data pipelines to transform raw input into clean datasets for use in analysis', 'Sound judgment and ability to maintain composure under pressure', 'Salary Range: ', 'pioneers']",Associate,Full-time,Information Technology,Construction,2021-01-28 13:52:32
Data Analyst,MediaAlpha,"Los Angeles, CA",20 hours ago,52 applicants,"['', 'Role Overview', 'Strong analytical ability and experience synthesizing large data sets.', 'Self-starter who can take initiative on projects, work to scale existing processes, and implement new ones.', 'Generous employee perks (e.g., mobile phone program, gym membership).', 'Help clients build, execute, and optimize campaigns and measure results.', 'Capacity to think critically and creatively, identify problems, and propose solutions.', ' Experience with search, display, performance, and/or direct marketing a plus. ', 'B.S. or B.A. required, preferably in a quantitative discipline (e.g., economics, business, finance, math, engineering, computer science, statistics).', 'Excellent written and verbal communication skills.', 'Compile, analyze, and interpret marketplace data to maximize revenue and profitability across business units.', '401K company contribution program (after 90 days).', 'Work with advertisers to find opportunities to expand the volume and reach.', 'Unlimited PTO.', 'Responsibilities', 'Build templates and tools to improve the efficiency and efficacy of analysis and optimizations.', "" Compile, analyze, and interpret marketplace data to maximize revenue and profitability across business units. Work with advertisers to find opportunities to expand the volume and reach. Learn MediaAlpha platform's tools and data. Help clients build, execute, and optimize campaigns and measure results. Build templates and tools to improve the efficiency and efficacy of analysis and optimizations. "", 'Highly competitive salary and bonus program participation.High-quality health and dental care plans with no employee contributions and zero deductibles (in-network). Flexible spending account.', ' Strong analytical ability and experience synthesizing large data sets. Capacity to think critically and creatively, identify problems, and propose solutions. Excellent written and verbal communication skills. Self-starter who can take initiative on projects, work to scale existing processes, and implement new ones. Strong Excel proficiency (pivot tables, vlookups, data manipulation). Experience applying statistical concepts to real-world business problems (e.g., confidence intervals). SQL and programming proficiency (Python, R, etc.) is required. B.S. or B.A. required, preferably in a quantitative discipline (e.g., economics, business, finance, math, engineering, computer science, statistics). ', 'Professional training and education reimbursements.', 'Required Qualifications', 'Compensation', 'Experience applying statistical concepts to real-world business problems (e.g., confidence intervals).', 'SQL and programming proficiency (Python, R, etc.) is required.', ""Learn MediaAlpha platform's tools and data."", 'Preferred Qualifications', 'Strong Excel proficiency (pivot tables, vlookups, data manipulation).', ' Highly competitive salary and bonus program participation.High-quality health and dental care plans with no employee contributions and zero deductibles (in-network). Flexible spending account. Unlimited PTO. 401K company contribution program (after 90 days). Professional training and education reimbursements. Generous employee perks (e.g., mobile phone program, gym membership).', 'Experience with search, display, performance, and/or direct marketing a plus.']",Entry level,Full-time,Information Technology,Computer Software,2021-01-28 13:52:32
Data Analyst,BRMi,"Vienna, VA",11 hours ago,Be among the first 25 applicants,"['', 'DAX ( Data Analysis Expressions) ', ' BRMi will not sponsor applicants for work visas for this position.**', 'MS Power BI', 'Apply experience in analytics, data visualization and modeling to find solutions for a variety of business and technical problems.', 'Strong analytical and problem-solving skills.', 'Experience eliciting and documenting requirements.', 'Querying and analyzing small and large data sets to discover patterns and deliver meaningful insights.', 'Derive insights to differentiate member and team member experiences.', '2+ years with analytical and data visualization tools and techniques (Power BI).', 'EOE/Minorities/Females/Vet/Disabled', 'Experience in effectively communicating analysis and insight to all levels of the organization.', 'Use analytics for capitalizing on the data for making decisions and achieving better outcomes for the business.Derive insights to differentiate member and team member experiences.Collaborate with cross-functional teams.Design innovating reporting capabilities that provide key insights into cloud adoption, quality metrics and business KPI’s.Assist with maintenance of existing reports and work with team members to develop new reports using MS Power BI and Excel.Apply experience in analytics, data visualization and modeling to find solutions for a variety of business and technical problems.Querying and analyzing small and large data sets to discover patterns and deliver meaningful insights.Other duties as assigned.', 'Responsibilities', ""Bachelor's degree in computer science, information systems, or other technology-related field or equivalent number of years of experience.Strong analytical and problem-solving skills.2+ years with analytical and data visualization tools and techniques (Power BI).Azure Analysis ServicesDAX ( Data Analysis Expressions) Experience in effectively communicating analysis and insight to all levels of the organization.Experience eliciting and documenting requirements.Proficiency in SQL, R or Python."", '(Power BI)', 'Proficiency in SQL, R or Python.', 'Qualifications', 'Overview', ' BRMi will not sponsor applicants for work visas for this position.**This is a W2 opportunity only**EOE/Minorities/Females/Vet/DisabledWe are an equal opportunity employer that values diversity and commitment at all levels. All individuals, regardless of personal characteristics, are encouraged to apply. Employment policies and decisions on employment and promotion are based on merit, qualifications, performance, and business needs. The decisions and criteria governing the employment relationship with all employees are made in a nondiscriminatory manner, without regard to race, religion, color, national origin, sex, age, marital status, physical or mental disability, medical condition, veteran status, or any other factor determined to be unlawful by federal, state, or local statutes.', 'This is a W2 opportunity only**EOE/Minorities/Females/Vet/DisabledWe are an equal opportunity employer that values diversity and commitment at all levels. All individuals, regardless of personal characteristics, are encouraged to apply. Employment policies and decisions on employment and promotion are based on merit, qualifications, performance, and business needs. The decisions and criteria governing the employment relationship with all employees are made in a nondiscriminatory manner, without regard to race, religion, color, national origin, sex, age, marital status, physical or mental disability, medical condition, veteran status, or any other factor determined to be unlawful by federal, state, or local statutes.', 'Collaborate with cross-functional teams.', 'Other duties as assigned.', 'Design innovating reporting capabilities that provide key insights into cloud adoption, quality metrics and business KPI’s.', 'Assist with maintenance of existing reports and work with team members to develop new reports using MS Power BI and Excel.', 'Use analytics for capitalizing on the data for making decisions and achieving better outcomes for the business.', ""Bachelor's degree in computer science, information systems, or other technology-related field or equivalent number of years of experience."", 'Azure Analysis Services']",Entry level,Full-time,Information Technology,Information Technology and Services,2021-01-28 13:52:32
Data Analyst,Chadwell Supply,"Tampa, FL",5 hours ago,Be among the first 25 applicants,"['', 'MINIMUM QUALIFICATIONS:', 'Benefits', 'Be a minimum of 18 years of age.', 'The Data Analyst provides support of the company data and reporting applications. Works directly with internal customers in order to understand the business needs. Generates or modifies existing standard or custom reports summarizing business, financial, or economic data for review by executives, managers, and other stakeholders.', 'Pay:\xa0Base Salary depending on experience\xa0', 'Have a minimum of 3 years of experience with at least one of the following: Crystal Reports, SSRS, Access, Excel, Power BI or other reporting tool.\xa0\xa0\xa0\xa0\xa0\xa0\xa0\xa0\xa0\xa0\xa0\xa0\xa0', 'Neat and professional appearance required.', 'Excellent priority and time management skills required to be able to effectively implement multiple projects.', 'Employee Discounts', 'https://chadwellsupply.com', 'Demonstrate the ability to communicate in situations requiring tact and poise as well as possess the ability to work with confidentiality and discretion.', 'Schedule:\xa0Full Time, Monday-Friday (NO WEEKENDS AND PAID HOLIDAYS OFF!).', 'Benefits:\xa0We offer\xa0medical, dental, vision, life insurance, disability, 401K, complimentary gym access, meal prep services and more!', 'OVERVIEW:', 'Visit us online:', 'Have a minimum of 3 years of experience with Microsoft SQL Server T-SQL language.\xa0\xa0', 'DUTIES AND RESPONSIBILITIES:', 'Must possess exceptional communication skills to present facts and recommendations effectively in oral and written form, to include accurate grammar and business correspondence knowledge.', 'Paid Time Off:\xa0104 hours paid time off accrual (Personal, sick, vacation, etc).', 'Ability to define and solve practical problems and deal with a variety of concrete variables, occasionally in situations where only limited standardization exists. Ability to interpret a variety of instructions furnished in written, oral, diagram, or schedule form.', 'Be a minimum of 18 years of age.Have a minimum of 3 years of experience with Microsoft SQL Server T-SQL language.\xa0\xa0Have a minimum of 3 years of experience with at least one of the following: Crystal Reports, SSRS, Access, Excel, Power BI or other reporting tool.\xa0\xa0\xa0\xa0\xa0\xa0\xa0\xa0\xa0\xa0\xa0\xa0\xa0', 'Strong interpersonal skills required in order to establish and maintain effective business relationships.', 'Paid Time Off', 'Pay', 'Pay:\xa0Base Salary depending on experience\xa0Schedule:\xa0Full Time, Monday-Friday (NO WEEKENDS AND PAID HOLIDAYS OFF!).Benefits:\xa0We offer\xa0medical, dental, vision, life insurance, disability, 401K, complimentary gym access, meal prep services and more!Paid Time Off:\xa0104 hours paid time off accrual (Personal, sick, vacation, etc).Employee Discounts:\xa0Purchase products from the warehouse at a generous discounted rate and be enrolled in a Nationwide entertainment discount program.Long-term Career Opportunities:\xa0Many of our leaders started with Chadwell looking for a job, just like you, but found long-term career opportunities at one of our 15 Branches across the Country. Our Company is growing, and we would love to have you grow with us!', 'Long-term Career Opportunities:\xa0Many of our leaders started with Chadwell looking for a job, just like you, but found long-term career opportunities at one of our 15 Branches across the Country. Our Company is growing, and we would love to have you grow with us!', 'Knowledge of logical and physical data modeling concepts.Excellent priority and time management skills required to be able to effectively implement multiple projects.Ability to define and solve practical problems and deal with a variety of concrete variables, occasionally in situations where only limited standardization exists. Ability to interpret a variety of instructions furnished in written, oral, diagram, or schedule form.Strong interpersonal skills required in order to establish and maintain effective business relationships.Demonstrate the ability to communicate in situations requiring tact and poise as well as possess the ability to work with confidentiality and discretion.Must possess exceptional communication skills to present facts and recommendations effectively in oral and written form, to include accurate grammar and business correspondence knowledge.Neat and professional appearance required.Possess a good sense of humor and belief in working as a professional cohesive team member.', 'Long-term Career Opportunities', 'Schedule', 'Employee Discounts:\xa0Purchase products from the warehouse at a generous discounted rate and be enrolled in a Nationwide entertainment discount program.', 'Possess a good sense of humor and belief in working as a professional cohesive team member.', 'We are looking for the best in the IT industry and reward our employees on various levels!! This is a great opportunity that offers competitive pay, benefits, and room for growth.\xa0', 'Knowledge of logical and physical data modeling concepts.']",Entry level,Full-time,Information Technology,Logistics and Supply Chain,2021-01-28 13:52:32
