job_title,company,location,date_posted,applicants,job_text,seniority_level,employment_type,job_function,industries,date_scraped
"Data Analyst, Marketing",Pinterest,"San Francisco, CA",10 hours ago,Be among the first 25 applicants,"['', 'Work cross-functionally to create and communicate key insights, influence key decisions and offer recommendations to marketing and company leadership ', 'BA/BS; CS and advanced degrees preferred', 'Measure impact of performance and brand marketing campaigns, including business metrics, incrementality, and revenue impact ', 'Work with engineering and Business Intelligence teams to identify gaps in logging data, and transform raw logs into metrics and actionable insights', 'Partner closely with marketing managers, product managers and engineers to provide analytics partnership to help guide growth marketing strategy and to design experiments to help quantify the impact on core growth metrics', ""What You'll Do"", 'Ability to manipulate large data sets with high dimensionality and complexity; expert in SQL, fluency in at least one scripting language', 'Experience designing experiments.', 'Experience building large scale data sets in AWS, Hadoop or similar big data environments.', '6+ years of experience analyzing data in a fast-paced, data-driven environment', ' Measure impact of performance and brand marketing campaigns, including business metrics, incrementality, and revenue impact  Perform deep dive analysis to understand drivers of marketing performance to shape ongoing and future campaigns  Partner closely with marketing managers, product managers and engineers to provide analytics partnership to help guide growth marketing strategy and to design experiments to help quantify the impact on core growth metrics Work with engineering and Business Intelligence teams to identify gaps in logging data, and transform raw logs into metrics and actionable insights Work cross-functionally to create and communicate key insights, influence key decisions and offer recommendations to marketing and company leadership  ', 'Excellent knowledge in designing tableau dashboards.', 'Attention to detail and commitment to high-quality results-oriented output', 'A team player who’s able to partner with cross-functional leadership to quickly turn insights into actions', 'About Pinterest', ' 6+ years of experience analyzing data in a fast-paced, data-driven environment Ability to manipulate large data sets with high dimensionality and complexity; expert in SQL, fluency in at least one scripting language Experience designing experiments. Excellent knowledge in designing tableau dashboards. Experience building large scale data sets in AWS, Hadoop or similar big data environments. Attention to detail and commitment to high-quality results-oriented output A team player who’s able to partner with cross-functional leadership to quickly turn insights into actions BA/BS; CS and advanced degrees preferred', 'Perform deep dive analysis to understand drivers of marketing performance to shape ongoing and future campaigns ', ""What We're Looking For""]",Mid-Senior level,Full-time,Information Technology,Internet,2021-01-26 11:38:09
Data Analyst,Insight Global,"San Antonio, TX",4 hours ago,27 applicants,"['', 'Responsibilities', 'Qualifications', 'Develop clear visualizations to convey complicated data in a straightforward fashion', ""1 - 2 years' Data Analysis experience"", ""Compile and analyze data related to business' issues"", ""Bachelor's or Master's degree in Statistics or Applied Mathematics or equivalent experience"", 'US Citizen- No subcontracting', 'The ideal candidate will use their passion for big data and analytics to provide insights to the business covering a range of topics. They will be responsible for conducting both recurring and ad hoc analysis for business users.\xa0', ""Understand the day-to-day issues that our business faces, which can be better understood with dataCompile and analyze data related to business' issuesDevelop clear visualizations to convey complicated data in a straightforward fashion"", '\xa0', ""Bachelor's or Master's degree in Statistics or Applied Mathematics or equivalent experience1 - 2 years' Data Analysis experienceProficient in SQL. R or Python Experience with Machine Learning is a plusUS Citizen- No subcontracting"", 'Understand the day-to-day issues that our business faces, which can be better understood with data', 'Experience with Machine Learning is a plus', 'Proficient in SQL. R or Python ']",Mid-Senior level,Contract,Information Technology,Staffing and Recruiting,2021-01-26 11:38:09
Music Data Analyst,Netflix,"Los Angeles, CA",16 hours ago,104 applicants,"['', 'Querying and manipulating data sets using SQL and Excel/Google Sheets and visualization tools like Tableau (or similar tools).Cultivating relationships with CMOs and administering reporting obligations.Proactively partnering with internal stakeholders and delivering on reporting requirements.Analyzing existing reporting processes and establishing new processes with a focus on enhancements and automation.Working in collaborative partnerships with teams such as Legal, Finance, Creative, Marketing, Production, Product and Engineering.Evaluating, testing, implementing and supporting technical data solutions.Collaborating in the overall strategic direction of the music data roadmap as part of the larger music strategy.Being a trusted subject matter authority.', 'Flexibility amid an ever-changing and growing environment.', 'Proactively partnering with internal stakeholders and delivering on reporting requirements.', 'Collaborating in the overall strategic direction of the music data roadmap as part of the larger music strategy.', 'Nice to have: practical knowledge of the music industry (e.g., Music Licensing and CMOs; Music Production).', 'An eagerness to give and receive constructive feedback.', 'Cultivating relationships with CMOs and administering reporting obligations.', 'Strong data analysis skills and experience working with relational database technologies.', 'Being a trusted subject matter authority.', 'A proven track record of breaking down complex processes and identifying key pain points.', 'Experience manipulating and analyzing complex data with SQL, Excel, and Google Sheets.', 'Working in collaborative partnerships with teams such as Legal, Finance, Creative, Marketing, Production, Product and Engineering.', 'The Desired Candidate Will Have', 'Experience manipulating and analyzing complex data with SQL, Excel, and Google Sheets.Strong data analysis skills and experience working with relational database technologies.Hands-on experience of data management, project management, data processing, working with engineering teams, and managing a wide variety of internal and external stakeholders.The ability to work effectively cross-functionally, think proactively, and drive results.Excellent analytical, problem-solving, oral and written communication skills.A proven track record of breaking down complex processes and identifying key pain points.The ability to work well under pressure with diligence, organization, and minimal supervision.Flexibility amid an ever-changing and growing environment.Excellent judgment, curiosity, confidence, and a sense of humor.An eagerness to give and receive constructive feedback.Nice to have: practical knowledge of the music industry (e.g., Music Licensing and CMOs; Music Production).Plus but not required: experience using Google scripts to solve problems and analyze data.Plus but not required: experience in Python and/or R.', 'Querying and manipulating data sets using SQL and Excel/Google Sheets and visualization tools like Tableau (or similar tools).', 'Plus but not required: experience in Python and/or R.', 'Excellent judgment, curiosity, confidence, and a sense of humor.', 'Analyzing existing reporting processes and establishing new processes with a focus on enhancements and automation.', 'The ability to work well under pressure with diligence, organization, and minimal supervision.', 'Plus but not required: experience using Google scripts to solve problems and analyze data.', 'Excellent analytical, problem-solving, oral and written communication skills.', 'Evaluating, testing, implementing and supporting technical data solutions.', 'Hands-on experience of data management, project management, data processing, working with engineering teams, and managing a wide variety of internal and external stakeholders.', 'The ability to work effectively cross-functionally, think proactively, and drive results.', 'The Music Data Analyst Will Be Responsible For']",Not Applicable,Full-time,Information Technology,Entertainment,2021-01-26 11:38:09
Junior Data Scientist,Analytos,"Austin, TX",16 hours ago,Be among the first 25 applicants,[],Entry level,Full-time,Engineering,Computer Software,2021-01-26 11:38:09
Associate Data Analyst,Newance ,"Milwaukee, WI",8 hours ago,Be among the first 25 applicants,[''],Associate,Full-time,Consulting,Computer Software,2021-01-26 11:38:09
"Data Scientist, Analyst - Marketing",SoFi,"San Francisco, CA",17 hours ago,45 applicants,"['', 'Proficient with SQL, R, Python, Tableau , Excel and Powerpoint', 'Tuition reimbursement on approved programs', 'Drive media channel and product marketing test initiatives and priorities', '401(k) and education on retirement planning', 'Competitive salary packages and bonuses', '3+ years of recent experience in advanced marketing/media analytics or data science/analyst role 3+ years of experience in designing and building predictive models using statistical and machine learning techniques (e.g logistic regression, linear regression, random forest, neural networks, gradient boosting)Ability to research, identify, evaluate, and implement modeling solutions for complex business problemsStrong analytical, problem solving and critical thinking skillsIntellectual curiosity and aptitude to pick up new technical skillsAbility to initiate and drive projects to completion with minimal guidanceHigh EQ with ability to influence outcomes and communicate technical content to marketingBachelor’s degree. Degree in Computer Science, Math, Physics, Engineering or quantitative fieldProficient with SQL, R, Python, Tableau , Excel and Powerpoint', 'Ability to initiate and drive projects to completion with minimal guidance', 'High EQ with ability to influence outcomes and communicate technical content to marketing', 'Monthly contribution up to $200 to help you pay off your student loans', 'Comprehensive medical, dental, vision and life insurance benefits', '3+ years of recent experience in advanced marketing/media analytics or data science/analyst role ', 'Strong analytical, problem solving and critical thinking skills', 'Build dashboards to have consolidated view for decision making and diagnostic of campaign and channel performance', 'Work with media channel and product marketing leaders to measure and analyze marketing performance. Accurately attribute and forecast performance by channel and campaign. Explain how marketing activities are impacting top of the purchase funnel KPIs and make recommendations on ways to improveDrive media channel and product marketing test initiatives and prioritiesDesign A/B experimental design to iterate, learn and optimize campaign performance and optimize each media channelBuild dashboards to have consolidated view for decision making and diagnostic of campaign and channel performanceBuild marketing mix models and marketing attribution models to inform optimal allocation by channel and by tactics within channel', 'Description', 'Design A/B experimental design to iterate, learn and optimize campaign performance and optimize each media channel', 'Build marketing mix models and marketing attribution models to inform optimal allocation by channel and by tactics within channel', 'Great health & well-being benefits including: telehealth parental support, subsidized gym program', 'Fully stocked kitchen (snacks and drinks)', 'The Role', 'Intellectual curiosity and aptitude to pick up new technical skills', ""What You'll Do"", 'Why you’ll love working here', 'Ability to research, identify, evaluate, and implement modeling solutions for complex business problems', 'Bachelor’s degree. Degree in Computer Science, Math, Physics, Engineering or quantitative field', 'Position at SoFi', 'Competitive salary packages and bonusesComprehensive medical, dental, vision and life insurance benefitsGenerous vacation and holidaysPaid parental leave for eligible employees401(k) and education on retirement planningTuition reimbursement on approved programsMonthly contribution up to $200 to help you pay off your student loansGreat health & well-being benefits including: telehealth parental support, subsidized gym programEmployer paid lunch program (except for remote employees)Fully stocked kitchen (snacks and drinks)', 'Generous vacation and holidays', 'Paid parental leave for eligible employees', 'Employer paid lunch program (except for remote employees)', '3+ years of experience in designing and building predictive models using statistical and machine learning techniques (e.g logistic regression, linear regression, random forest, neural networks, gradient boosting)', 'Work with media channel and product marketing leaders to measure and analyze marketing performance. Accurately attribute and forecast performance by channel and campaign. Explain how marketing activities are impacting top of the purchase funnel KPIs and make recommendations on ways to improve', 'Who We Are', ""What You'll Need""]",Not Applicable,Full-time,Engineering,Financial Services,2021-01-26 11:38:09
Data Analyst,Brooksource,"Denver, CO",3 hours ago,45 applicants,"['', 'Ability to grow within an industry leading Telecom company working within a media/marketing/advertising organization', 'Innovative Tech Stacks', 'Ability to prioritize and organize effectively', '2+ years’ experience writing and modifying SQL queries for custom reports.', 'Ability to make recommendations and value-added decisions', 'MINIMUM QUALIFICATIONS:', 'Denver, CO (Temporarily Remote) ', 'Additional Skills Needed:', 'Participate in Agile ceremonies with the development team', 'Data Analyst II', 'Collaborative team environment', 'Truly Agile environment', 'Excellent analytical and troubleshooting abilities', 'Opportunity to directly impact customers', 'Experience creating Tableau visualizations.', 'Eager to learn knew skills and technologies', 'Previous experience working with this client and placing both permanent employees and contractors.\xa0\xa0\xa0', 'Direct communication with the hiring manager, which allows us to have a clear understanding of the timeline and move candidates through the interview process faster.\xa0\xa0\xa0', 'Exposure to cutting edge technologies and methodologies', 'Respond to daily emails from data partners in a business professional manner', 'Extract and analyze data sets from various data sources and create data visualization reports to easily readable data', 'RESPONSIBILITIES:', 'Ability to grow within an industry leading Telecom company working within a media/marketing/advertising organizationExposure to cutting edge technologies and methodologiesOpportunity to directly impact customersCollaborative team environmentExposure to cross-functional teams and leadershipTruly Agile environmentInnovative Tech Stacks', 'Strong quantitative and analytical skills as well as data analysis and visualization.', 'BENEFITS OF WORKING WITH BROOKSOURCE:\xa0', 'Gather customer report requirements from internal and external stakeholders', 'WHAT’S IN IT FOR YOU…?', 'Ability to interface with and communicate with clients, executives, and managers in a', 'Transform and gather data into meaningful insight for internal or external stakeholders', 'As the Data Analyst II for our Fortune 100 telecommunications/advertising client, you will be responsible for developing SQL query’s in order to provide ad-hoc custom reports to internal and external clients at an enterprise level. As the Data Analyst II, you will also be responsible for creating Tableau visualizations and understanding the Alteryx galley of applications. Additionally, you will have experience with advanced excel functions and SQL querying capabilities. If you are looking to advance in your career as a Data Analyst within an enterprise organization, apply today!', 'Dedication to keep an open line of communication and provide full transparency.\xa0\xa0', 'Ability to understand an Alteryx gallery of applications.', 'Experience in an Agile, enterprise environment.', '2-3 years’ experience as a Data Analyst.2+ years’ experience writing and modifying SQL queries for custom reports.Experience creating Tableau visualizations.Ability to understand an Alteryx gallery of applications.Solid understanding of the software development lifecycles.Experience in an Agile, enterprise environment.Strong quantitative and analytical skills as well as data analysis and visualization.Ability to interface with and communicate with clients, executives, and managers in a', 'Exposure to cross-functional teams and leadership', 'Eager to learn knew skills and technologiesAbility to make recommendations and value-added decisionsAbility to prioritize and organize effectivelyExcellent analytical and troubleshooting abilities', 'On-going contract ', 'Previous experience working with this client and placing both permanent employees and contractors.\xa0\xa0\xa0Direct communication with the hiring manager, which allows us to have a clear understanding of the timeline and move candidates through the interview process faster.\xa0\xa0\xa0Dedication to keep an open line of communication and provide full transparency.\xa0\xa0', '2-3 years’ experience as a Data Analyst.', 'Gather customer report requirements from internal and external stakeholdersExtract and analyze data sets from various data sources and create data visualization reports to easily readable dataTransform and gather data into meaningful insight for internal or external stakeholdersRespond to daily emails from data partners in a business professional mannerParticipate in Agile ceremonies with the development team', '       professional manner.', 'Solid understanding of the software development lifecycles.', '\xa0']",Associate,Full-time,Information Technology,Information Technology and Services,2021-01-26 11:38:09
Data Analyst,Vimly Benefit Solutions,"Mukilteo, WA",16 hours ago,43 applicants,"['', ""Bachelor's degree in Math, Statistics, Computer Science, Finance or any related field is preferred"", 'Ability to champion quality throughout the organization', ""Enable and support other Vimly team members by developing powerful and insightful reporting that will help guide the businessIntegrate qualitative analysis of data with the quantitative method of report-buildingPlan and prioritize initiatives and best practices within the Customer Success team to ensure a high- quality reporting outputsWork closely with other members of the Vimly team to create ad-hoc reports to support timely business decisions, service evaluation, and any project workCollaborate with internal resources to gather, curate and build data sets needed to successfully execute our data analysisAbility to communicate complex quantitative analysis in a clear, precise, and actionable Excel at making complex concepts simple and easy to understand by those around youParticipate in stakeholder meetings and present data insights to users/clients/executives in a succinct and effective wayAbility to work with and lead teams of stakeholders with differing backgrounds and job functionsDemonstrate an understanding of and commitment to Vimly’s core values, continuous learning, innovation, adaptability and resilience with all members of Vimly's staff, clients and patientsAcquire\xa0data from primary or secondary data sources and create meaningful understanding for internal and external customersExtract, Transform and Load (ETL) customer dataIdentify, analyze, and interpret trends or patterns in complex data setsHighly organizedTeam player with strong interpersonal skills and ability to build effective working relationships throughout all levels of the organizationExcellent verbal and written communication skillsSolution-focusedAbility to be creative and innovative in a fast-paced environment with a lot of ambiguity and constant changeAbility to champion quality throughout the organization"", '\ufeffJob Description', ',\xa0', '4 - 5 years of experience as a Business/Financial Analyst, or Bl Analyst preferably in a Benefits Admin or Healthcare company working with large, complex data sources and data sets', 'Acquire\xa0data from primary or secondary data sources and create meaningful understanding for internal and external customers', 'Ability to be creative and innovative in a fast-paced environment with a lot of ambiguity and constant change', 'Collaborate with internal resources to gather, curate and build data sets needed to successfully execute our data analysis', '2 - 3 years demonstrated coding SQL skills', ""Bachelor's degree in Math, Statistics, Computer Science, Finance or any related field is preferred4 - 5 years of experience as a Business/Financial Analyst, or Bl Analyst preferably in a Benefits Admin or Healthcare company working with large, complex data sources and data sets2 - 3 years of Benefits Admin analytics (Eligibility, Enrollment, Benefits data) experience2 - 3 years demonstrated coding SQL skills2 - 3 years of experience building analytics using Bl tools, such as Tableau or PowerBIMastery of MS Excel, including ability to write macros, v-lookups, and pivot tables2 - 3 years of experience in Data Mining (i.e., SQL, ETL, complex data warehouses)Knowledge of statistical analysis methodsExperience working in a lean entrepreneurial environment where continuous innovation is desired, and ambiguity is the"", 'Mastery of MS Excel, including ability to write macros, v-lookups, and pivot tables', 'Knowledge of statistical analysis methods', 'At Vimly, our mission is to simplify the complexities of workforce and benefit administration for our customers and partners. That’s a tall order, and we need passionate, team-oriented staff members who want to excel, work hard and grow while having fun at the same time.', 'Integrate qualitative analysis of data with the quantitative method of report-building', 'Team player with strong interpersonal skills and ability to build effective working relationships throughout all levels of the organization', 'Work closely with other members of the Vimly team to create ad-hoc reports to support timely business decisions, service evaluation, and any project work', ' ', ""Demonstrate an understanding of and commitment to Vimly’s core values, continuous learning, innovation, adaptability and resilience with all members of Vimly's staff, clients and patients"", 'Vimly Benefit Solutions – Innovating the way to benefit life.', 'Participate in stakeholder meetings and present data insights to users/clients/executives in a succinct and effective way', ' – ', 'Qualifications:', 'Enable and support other Vimly team members by developing powerful and insightful reporting that will help guide the business', 'Innovating the way to benefit life.', 'Ability to communicate complex quantitative analysis in a clear, precise, and actionable Excel at making complex concepts simple and easy to understand by those around you', 'Excellent verbal and written communication skills', 'Highly organized', 'As a Data Analyst,\xa0you will be successful if you excel at designing and building reporting and analytic solutions from complex and dynamic benefits administration data. You will support other Technology and Product Team members, along with team members from Customer Success departments, to analyze patterns, visualize data in effective ways, and support client data requests. You have a natural curiosity to hypothesize and have the desire and ability to be a go-getter and try to look for the answers in data in different ways. You are not satisfied understanding the issues, instead preferring to take action, communicate your recommendations effectively and drive change using data. Working in a fast- paced environment, managing through uncertainty, and networking across Vimly teams to weave the right data picture are challenges that energize you. If you are drawn to the opportunity to re -imagine benefits administration and deliver innovation come join us.', 'Plan and prioritize initiatives and best practices within the Customer Success team to ensure a high- quality reporting outputs', 'Solution-focused', 'Identify, analyze, and interpret trends or patterns in complex data sets', 'Job Responsibilities:', '\xa0', '2 - 3 years of experience building analytics using Bl tools, such as Tableau or PowerBI', 'Experience working in a lean entrepreneurial environment where continuous innovation is desired, and ambiguity is the', '2 - 3 years of experience in Data Mining (i.e., SQL, ETL, complex data warehouses)', '2 - 3 years of Benefits Admin analytics (Eligibility, Enrollment, Benefits data) experience', 'Extract, Transform and Load (ETL) customer data', 'Ability to work with and lead teams of stakeholders with differing backgrounds and job functions']",Mid-Senior level,Full-time,Information Technology,Information Technology and Services,2021-01-26 11:38:09
