job_title,company,location,date_posted,applicants,job_text,seniority_level,employment_type,job_function,industries,date_scraped
Senior Software Engineer,SnapLogic,United States,17 hours ago,26 applicants,"['', ""World Class Customers: Hundreds of customers around the globe\xa0trust SnapLogic to handle their enterprise integration and automation needs. Adobe enables 800+ citizen integrators and saves millions per year. AstraZeneca enables 600+ self-service users globally on a single platform. Box connected 24+ apps in months with only 1.5 developers. Our customers come first, and we’re proud of SnapLogic's industry-leading customer retention rate of over 95%."", 'Who We Are:', '\xa0', 'The Role:', 'Research, develop and maintain Snaps - a modular collection of Java integration components for reading/writing/transforming data to/from a wide variety of application endpoints and data sources, including enterprise SaaS applications, cloud-based NoSQL data stores, Big Data systems, on-premise SQL databases, messaging systems and many more.Rapidly learn about technology platforms, protocols and standards.\xa0Design Snaps that expose the required functionality and leverage SnapLogic’s AI/ML capabilities, simplifying the complex array of configuration permutations and technical implementations into an easy-to-use visual product.\xa0Be able to quickly debug complex Snap issues and figure out the root cause, using tests (unit and integration) to validate the work.Cycle between projects in weeks rather than years continually learning about technologies, protocols and products like Snowflake, Apache Kafka, Amazon Redshift, AWS S3, Google Cloud Storage, RabbitMQ, Microsoft Azure, MQTT, OAuth, HTTP, JDBC, SOAP, TLS, Workday, Netsuite, Salesforce and many, many more.', 'Research, develop and maintain Snaps - a modular collection of Java integration components for reading/writing/transforming data to/from a wide variety of application endpoints and data sources, including enterprise SaaS applications, cloud-based NoSQL data stores, Big Data systems, on-premise SQL databases, messaging systems and many more.', 'What We’re Looking For:', 'Company Momentum', ""Bachelor's or Master’s degree in Computer Science, Computer Engineering, Electrical Engineering, or a related field with 5+ years of relevant experience."", ""Company Momentum: SnapLogic is hiring! Driven by the industry's best and brightest employees in offices across North America, EMEA, Australia, and India, plus a solid network of industry partners, SnapLogic continues to grow, helping more and more customers around the world solve their toughest integration and automation challenges. Industry experts have consistently recognized our company, products, customers, and employees as best-in-class, from our year-over-year Leadership in\xa0Gartner’s iPaaS Magic Quadrant, to our 2020 CODiE Award win, to our recognition as a\xa02020 Bay Area Top Workplace."", ""Hot Market Opportunity:\xa0Leading organizations are embracing the cloud, data, and AI to rethink and rewire their businesses. They understand that integrating disparate systems and automating core processes are critical to accelerating business growth and success. Enterprise automation makes possible what every organization wants: a single source of truth for data-rich decisions; agile innovation that delivers products and services to market faster; exceptional experiences for customers, partners, and employees; and amazing business results.\xa0According to industry analysts, the integration market alone is growing four times faster than the overall software market, approaching more than $5 billion in revenue.\xa0Innovative Product:\xa0SnapLogic is the only company to provide a single, unified platform for all of a company’s integration and automation needs: application integration, data integration, API management, B2B integration, and data engineering. We offer a simple, intuitive, self-service interface together with a powerful, scalable, enterprise-grade platform. We provide industry-leading AI capabilities to accelerate productivity and time to value. And we deliver automation capabilities that streamline end-to-end business processes — such as hire-to-retire and order-to-cash — eliminating manual, repetitive activities, and freeing up teams to focus on strategic projects.World Class Customers: Hundreds of customers around the globe\xa0trust SnapLogic to handle their enterprise integration and automation needs. Adobe enables 800+ citizen integrators and saves millions per year. AstraZeneca enables 600+ self-service users globally on a single platform. Box connected 24+ apps in months with only 1.5 developers. Our customers come first, and we’re proud of SnapLogic's industry-leading customer retention rate of over 95%.Company Momentum: SnapLogic is hiring! Driven by the industry's best and brightest employees in offices across North America, EMEA, Australia, and India, plus a solid network of industry partners, SnapLogic continues to grow, helping more and more customers around the world solve their toughest integration and automation challenges. Industry experts have consistently recognized our company, products, customers, and employees as best-in-class, from our year-over-year Leadership in\xa0Gartner’s iPaaS Magic Quadrant, to our 2020 CODiE Award win, to our recognition as a\xa02020 Bay Area Top Workplace."", 'Design Snaps that expose the required functionality and leverage SnapLogic’s AI/ML capabilities, simplifying the complex array of configuration permutations and technical implementations into an easy-to-use visual product.\xa0', 'Hot Market Opportunity', 'Cycle between projects in weeks rather than years continually learning about technologies, protocols and products like Snowflake, Apache Kafka, Amazon Redshift, AWS S3, Google Cloud Storage, RabbitMQ, Microsoft Azure, MQTT, OAuth, HTTP, JDBC, SOAP, TLS, Workday, Netsuite, Salesforce and many, many more.', 'Rapidly learn about technology platforms, protocols and standards.\xa0', 'You have extensive experience with Java, with an advanced understanding of object-oriented programming, software complexity, and efficient secure code.\xa0', 'You have excellent communication skills, are comfortable working with little supervision, and have a preference for taking the initiative.', 'World Class Customers', 'Why Join Now:', 'To all recruitment agencies: SnapLogic does not accept unsolicited agency resumes. Please do not forward resumes to SnapLogic employees or to any other company location. SnapLogic is not responsible for any fees related to unsolicited resumes and will not pay fees to any third-party agency or company that does not have a signed agreement with the company. SnapLogic provides equal employment opportunities (EEO) to all employees and applicants for employment without regard to race, color, religion, gender, sexual orientation, gender identity or expression, national origin, age, disability, genetic information, marital status, amnesty, or status as a covered veteran in accordance with applicable federal, state and local laws. SnapLogic complies with applicable state and local laws governing non-discrimination in employment in every location in which the company has facilities. This policy applies to all terms and conditions of employment, including, but not limited to, hiring, placement, promotion, termination, layoff, recall, transfer, leaves of absence, compensation, and training. SnapLogic expressly prohibits any form of unlawful employee harassment based on race, color, religion, gender, sexual orientation, gender identity or expression, national origin, age, genetic information, disability, or veteran status. Improper interference with the ability of SnapLogic employees to perform their expected job duties is absolutely not tolerated.', 'SnapLogic powers the automated enterprise. Our self-service, AI-powered integration platform helps organizations connect applications and data sources, automate common workflows and business processes, and deliver exceptional experiences for customers, partners, and employees. Thousands of enterprises around the world rely on the SnapLogic platform to integrate, automate, and transform their business.\xa0', 'Be able to quickly debug complex Snap issues and figure out the root cause, using tests (unit and integration) to validate the work.', 'You have a customer-centric view of products and processes.', 'Hot Market Opportunity:\xa0Leading organizations are embracing the cloud, data, and AI to rethink and rewire their businesses. They understand that integrating disparate systems and automating core processes are critical to accelerating business growth and success. Enterprise automation makes possible what every organization wants: a single source of truth for data-rich decisions; agile innovation that delivers products and services to market faster; exceptional experiences for customers, partners, and employees; and amazing business results.\xa0According to industry analysts, the integration market alone is growing four times faster than the overall software market, approaching more than $5 billion in revenue.\xa0', 'SnapLogic’s\xa0Intelligent Integration Platform\xa0uses AI-powered workflows to automate all stages of IT integration projects – design, development, deployment, and maintenance – whether on-premises, in the cloud, or in hybrid environments. The platform’s easy-to-use, self-service interface enables both expert and citizen integrators to manage all application integration, data integration, API management, B2B integration, and data engineering projects on a single, scalable platform.\xa0', 'Innovative Product:\xa0SnapLogic is the only company to provide a single, unified platform for all of a company’s integration and automation needs: application integration, data integration, API management, B2B integration, and data engineering. We offer a simple, intuitive, self-service interface together with a powerful, scalable, enterprise-grade platform. We provide industry-leading AI capabilities to accelerate productivity and time to value. And we deliver automation capabilities that streamline end-to-end business processes — such as hire-to-retire and order-to-cash — eliminating manual, repetitive activities, and freeing up teams to focus on strategic projects.', 'Innovative Product', 'You absolutely understand the importance of testing, tooling, and debugging to ensure market-leading code quality required for successful enterprise products and maintenance.', 'What You’ll Do:', 'Hundreds of customers across the Global 2000 – including Adobe, AstraZeneca, Box, Emirates, Schneider Electric, and Wendy’s – rely on SnapLogic to automate business processes, accelerate analytics, and drive digital transformation. SnapLogic was founded by data industry veteran Gaurav Dhillon and is backed by blue-chip investors including Andreessen Horowitz, Arrowroot Capital, Capital One, Ignition Partners, Golub Capital, Microsoft, Triangle Peak Partners, and Vitruvian Partners. Learn more at\xa0www.snaplogic.com.', 'SnapLogic is headquartered in San Mateo, CA with offices in New York, NY; London, UK; and Hyderabad, India.', 'SnapLogic is seeking a Senior Software Engineer for our Snap Development Team. As a Senior Software Engineer, you will have a prominent role within the team building Snaps, SnapLogic’s modular collection of integration components built for a wide variety of application endpoints and data sources. Our Snaps process over 1 trillion documents per month!', ""There's never been a better time to join SnapLogic. Here are a few reasons why:"", 'You recognize web, network, file (JSON/XML/Parquet), and/or messaging protocols (HTTP etc.) and have exposure to RESTful and/or SOAP APIs.\xa0', '\ufeff', ""You have extensive experience with Java, with an advanced understanding of object-oriented programming, software complexity, and efficient secure code.\xa0You absolutely understand the importance of testing, tooling, and debugging to ensure market-leading code quality required for successful enterprise products and maintenance.You recognize web, network, file (JSON/XML/Parquet), and/or messaging protocols (HTTP etc.) and have exposure to RESTful and/or SOAP APIs.\xa0You have demonstrated a history of mentoring team members, contributing to agile processes, and leading knowledge transfer sessions. You always write code with testability in mind.You have excellent communication skills, are comfortable working with little supervision, and have a preference for taking the initiative.You have a customer-centric view of products and processes.Bachelor's or Master’s degree in Computer Science, Computer Engineering, Electrical Engineering, or a related field with 5+ years of relevant experience."", 'You have demonstrated a history of mentoring team members, contributing to agile processes, and leading knowledge transfer sessions. You always write code with testability in mind.']",Mid-Senior level,Full-time,Engineering,Computer Software,2021-01-28 13:56:49
Software Engineer,ConnectYourCare,United States,5 hours ago,50 applicants,"['', '•\tReview code to determine where an issue or exception is occurring', '•\tResolve issues and perform root cause analysis', '•\tUnderstand application behavior and perform analysis on log files to troubleshoot', '•\tDrive improvements through system fixes, automation and tools\xa0', '•\tUpdate existing source code using an agile development process', '•\tSupport business with internal/external report requests', 'Applicant must be able to:', '•\t7+ years relevant experience\xa0', 'This role will be specifically focused on improving accuracy of billing to ensure that all revenue is captured from the correct billing transactions.\xa0In this capacity, the person in this role will need to work closely with the finance organization to analyze data, research gaps in billing, develop scripts and utilities to correct for the billing gaps and update the billing system to close systemic gaps in the billing logic.\xa0As such this role will have development responsibilities as well as production support responsibilities.', '•\tPerform in depth, complex data analysis and data updates using SQL', '•\tApplication/root cause analysis', '•\tAbility to collaborate with non-technical business counterparts', '•\tExperience in consumer directed healthcare and/or financial services industries', '•\tProgramming experience (Java, JSP, html) required', 'The Software/Production Support Engineer will be primarily responsible for overseeing the day to day performance and operation of ConnectYourCare’s platforms. Production Support Engineers must be familiar with analyzing logs, researching application behavior and able to perform expert level data analysis using SQL. Working in a production environment with sensitive personal, health and financial data, all Production Support engineers must possess proven experience in careful execution in a production setting and follow set change management routines. The Production Support team are subject matter experts that direct support for our internal customers and play a vital role in ensuring quick and thorough problem resolution. The Production Support team also works closely with development teams to troubleshoot, prevent the recurrence of issues and assist with determining appropriate application enhancements.', '•\tAnalytical thinking and problem solving', '•\tExpert level SQL skillset in a relevant RDMBS (Oracle, MySQL, SQL Server, Postgres, etc)', '•\tCreate and monitor internal data controls', '•\tAbility to work in a team environment', '•\tBachelor’s degree or equivalent', 'Applicant must possess the following skills/experiences:', '•\tAbility to keep sensitive information confidential\xa0', '•\tAbility to manage timelines and meet project deadlines', '•\tStrong ability to communication (written and verbal)']",Mid-Senior level,Full-time,Information Technology,Financial Services,2021-01-28 13:56:49
Senior Software Engineer-Lead ,"Stem, Inc.",Greater Seattle Area,6 hours ago,Be among the first 25 applicants,"['', 'Advanced working knowledge of SQL and experience working with relational databases, query authoring (SQL) as well as working familiarity with other types of databases, such as NoSQL or in-memory key-value stores such as Redis a plus', 'Resources', 'Automate rules-based fault identification, incident generation and remote resolution of system faults and failures', 'Facebook', 'Advanced working knowledge of AWS services such as Kinesis, Athena, S3, EKS, and other related technologies', 'Required Experience:', 'Bachelor’s degree (Masters preferred) in Computer Science, Engineering, related technical field, or equivalent practical experience', 'Expert-level knowledge of Python (and associated tooling)', 'Position:\xa0Senior Software Engineer-Lead ', 'To learn more about Stem, visit our stem.com where you’ll find information about our solutions, technology, partners, case studies, resources, latest news and more. Here are some relevant links:', 'Document Operations user/customer requirements, translate to software team deliverables and prioritize backlog in partnership with Operations and Product Engineering team members', 'Responsibilities:', 'Own the development of the Operations Center environment and tools as part of Stem’s Athena Supervisor platform', 'Working knowledge of JIRA APIs', 'Stem provides solutions that address the challenges of today’s dynamic energy market. By combining advanced energy storage solutions with Athena™, a world-class artificial intelligence (AI)-powered analytics platform, Stem enables customers and partners to optimize energy use by automatically switching between battery power, onsite generation and grid power. Stem’s solutions help enterprise customers benefit from a clean, adaptive energy infrastructure and achieve a wide variety of goals, including expense reduction, resilience, sustainability, environmental and corporate responsibility and innovation. Stem also offers full support for solar partners interested in adding storage to standalone, community or commercial solar projects – both behind and in front of the meter.', 'Stem’s culture embodies diversity & inclusion beyond the traditional facets of\xa0gender, ethnicity, age, disabilities, and sexual orientation to include experience, personality, communication, workstyles, and more. At our core, Stem is at the momentous intersection of clean energy and software technology where diverse ideas, experiences, and professional skills converge to make the inclusive culture we have today. Together, we are turning old school thoughts about software and energy into progressive, collaborative, and innovative solutions. By joining our team, you will be collaborating with data scientists, energy experts, skilled salespeople, thought-leading executives and more from a range of backgrounds. This intersection of ideas, beliefs, and skills is what makes us unique enough to lead the world’s largest network of digitally connected energy storage systems.', 'Use Stem’s UI framework to build applications for internal and external users', 'Professional experience in energy and clean technologies Operations a plus', 'Familiarity with React, single-page application (SPA) frameworks, and progressive web applications (PWAs) a plus', 'About Stem', 'Do it all within a formal develop/test/release software development environment', 'Company OverviewNewsroomResourcesCase StudiesLinkedInFacebookTwitter', 'Stem, Inc. is an equal opportunity employer committed to diversity in the workplace and does not discriminate against any employee or applicant for employment because of race, color, sex, pregnancy, religion, national origin, ethnicity, citizenship, sexual orientation, gender identity, age, marital status, disability, genetic information, military status, protected veteran status or any other factor protected by applicable federal, state or local laws.\xa0\xa0', 'Deep, applicable knowledge of computer science, algorithms, different programming paradigms, and data structures a plus', 'Enable scalable monitoring, analysis and management of Stem’s rapidly growing fleet of energy storage systems', 'Bachelor’s degree (Masters preferred) in Computer Science, Engineering, related technical field, or equivalent practical experience3+ years of experience in managing multiple full stack software engineering projects7+ years of overall software engineering experienceAdvanced working knowledge of AWS services such as Kinesis, Athena, S3, EKS, and other related technologiesAdvanced working knowledge of Docker + Kubernetes and other related container technologiesExperience working with end-to-end CI platforms and production release proceduresProfessional experience analyzing code for weaknesses and errors, and overseeing plans to improve themProfessional experience in energy and clean technologies Operations a plusExpert-level knowledge of Python (and associated tooling)Familiarity with React, single-page application (SPA) frameworks, and progressive web applications (PWAs) a plusAdvanced working knowledge of SQL and experience working with relational databases, query authoring (SQL) as well as working familiarity with other types of databases, such as NoSQL or in-memory key-value stores such as Redis a plusDeep, applicable knowledge of computer science, algorithms, different programming paradigms, and data structures a plusWorking knowledge of JIRA APIs', 'Professional experience analyzing code for weaknesses and errors, and overseeing plans to improve them', 'LinkedIn', '7+ years of overall software engineering experience', 'Travel as necessary to meet with Operations user/customer base (primarily SF Bay Area)', 'Millbrae, CA, Seattle, WA, Toronto, CAN', 'Lead cross-functional project teams and coordinate with Stem Product Engineering as they develop infrastructure necessary for delivery of Operations services', '3+ years of experience in managing multiple full stack software engineering projects', 'Millbrae, CA Seattle, WA Toronto, Canada', 'Company Overview', 'Own the development of the Operations Center environment and tools as part of Stem’s Athena Supervisor platformLead cross-functional project teams and coordinate with Stem Product Engineering as they develop infrastructure necessary for delivery of Operations servicesDocument Operations user/customer requirements, translate to software team deliverables and prioritize backlog in partnership with Operations and Product Engineering team membersEnable scalable monitoring, analysis and management of Stem’s rapidly growing fleet of energy storage systemsAutomate rules-based fault identification, incident generation and remote resolution of system faults and failuresUse Stem’s UI framework to build applications for internal and external usersDo it all within a formal develop/test/release software development environmentTravel as necessary to meet with Operations user/customer base (primarily SF Bay Area)', 'Reporting to: Vice President, Network Operations', 'Newsroom', 'Advanced working knowledge of Docker + Kubernetes and other related container technologies', 'Case Studies', 'Learn More', 'Job Location', 'Experience working with end-to-end CI platforms and production release procedures', 'What we are looking for:', 'Twitter', 'Stem is looking for a Full Stack Engineer to fill the role of Senior Software Engineer-Lead (Operations). You will be responsible for managing architecture and technical design of the Operations Center platform and for managing and contributing to implementation by a team of direct reports, internal collaborators and external contractors.']",Mid-Senior level,Full-time,Engineering,Information Technology and Services,2021-01-28 13:56:49
Senior Software Engineer,SherlockTalent,Miami-Fort Lauderdale Area,36 minutes ago,Be among the first 25 applicants,[''],Associate,Full-time,Engineering,Staffing and Recruiting,2021-01-28 13:56:49
