job_title,company,location,date_posted,applicants,job_text,seniority_level,employment_type,job_function,industries,date_scraped
Data Analyst,Pushpay,"Colorado Springs, CO",,N/A,"['', 'Capable of working closely with Product teams and inter-departmental management teams to help drive system and process improvements related to Product analysis', 'G Suite', 'Work closely with Data Engineers to identify and build scalable, supportable, and digestible datasets to measure ChMS platform usage', 'Able to work independently and collaboratively, in fast paced environment', 'Thorough understanding of business needs to translate them into operational insight & intelligence', 'Interpret data and deliver analysis that will guide Product Management and Customer Success teams’ decision making', '2+ years of Tableau Server and Desktop experience (or equivalent) - designing, building, and maintaining dashboards', 'Present findings to a range of stakeholders from subject matter experts to business leaders', 'The Data Analyst is expected to understand product and business processes and needs, build strong inter-departmental relationships, and help create effective data systems in order to harness data to solve complex business challenges, deliver actionable insights, and fuel continuous improvement across the organization.\xa0The primary focus of this role will be the ChMS platform, but will also encompass and require understanding of the business and it’s data and processes to produce valuable insights. There are opportunities to work with Product, Customer Success, Software Development, Marketing, Sales, Operations, and payment processing teams. A strong attention to detail will ensure the integrity of analysis, and empower the business to trust outputs. You will help us to define software usage and metrics and measure and report customer usage to the business so we can better understand the impact of feature releases to the business and the customers we serve.\xa0', 'Document analysis methods to ensure consistent analysis over time', 'FTE: Salary range: $65/K - $82/K (DOE)\xa0', 'An experienced analyst with a background in visualization, story telling, statistics, and product feature analysis', '3-6 years in a similar role; preferably in a SaaS organizationBachelor’s degree or equivalentTableau Desktop Certification (Associate or Professional)Knowledge of the following tools is advantageous:Salesforce.comG SuiteAtlassian (JIRA, Confluence)\xa0An experienced analyst with a background in visualization, story telling, statistics, and product feature analysis2+ years of Tableau Server and Desktop experience (or equivalent) - designing, building, and maintaining dashboards3+ years of SQL writing experience (Postgres, Redshift, or other OLAP and OLTP systems)Experienced power user of Microsoft Excel/Google SheetsExperience with modern software tracking tools and techniques (Amplitude, Pendo, Pinpoint, UserIQ, Heap, etc…)Experience defining software utilization metrics and analyzing large datasets to understand usage and provide actionable insightsKnowledge and experience with CRMs (Salesforce is our primary system of record)Knowledge and experience with Church Management Software systems a plusExperience with Jupyter, Python, and/or R is a plusExperience with and understanding of data warehousing and data pipeline concepts and purposesAn understanding of how behaviors, processes, and systems feed into each other, and ultimately into the data analysisPassion for quantitative analysis and modeling across diverse data setsA structured thinker who can find a starting point and desired outcome, and then apply a methodical approach to move from one to the otherProven ability and experience presenting analytical findings to stakeholders of varying levels and backgroundsA guide that enjoys taking people on the journey from data point to conclusion, and back againAbility to work with modern data collection, modeling, analysis, reporting, and visualization toolingCapable of working closely with Product teams and inter-departmental management teams to help drive system and process improvements related to Product analysisExperience working with Data Engineers to develop advanced datasets to solve analysis problemsStrong analytical skillsThorough understanding of business needs to translate them into operational insight & intelligenceAble to work independently and collaboratively, in fast paced environment', 'Collaborate with BI team members (Analysts, Engineers, Scientists)\xa0', '401K with match\xa0', 'Recommend improvements to data capture, warehousing, and reporting structures to serve the BI team and business in a more seamless manner', 'Atlassian (JIRA, Confluence)\xa0', '3+ years of SQL writing experience (Postgres, Redshift, or other OLAP and OLTP systems)', 'Translate business/end-user needs into technical requirements and deliverables', 'Salesforce.com', 'Strong analytical skills', 'Help BI team to create systems and processes to democratize data – making it available across the organization – to fuel data curiosity and promote data informed decision making across the company', 'Knowledge and experience with Church Management Software systems a plus', 'Scope, prioritize, and plan projects – including leading meetings, overcoming roadblocks, providing updates, and communicating results to appropriate stakeholders', 'Develop reporting, dashboards, and tools for Product team to self analyze their own feature releases', 'An understanding of how behaviors, processes, and systems feed into each other, and ultimately into the data analysis', 'Pushpay exists to bring people together by strengthening community, connection, and belonging. As the leading provider of mobile apps and giving technology to churches, schools, and nonprofits, Pushpay helps organizations and their communities stay connected anytime, anywhere.\xa0\xa0', 'Experience with and understanding of data warehousing and data pipeline concepts and purposes', 'A guide that enjoys taking people on the journey from data point to conclusion, and back again', '3-6 years in a similar role; preferably in a SaaS organization', 'Experienced power user of Microsoft Excel/Google Sheets', 'Required Qualifications:\xa0', 'Duties/Responsibilities:', 'Experience defining software utilization metrics and analyzing large datasets to understand usage and provide actionable insights', 'Play a key role in data documentation and development of core data sets - with a focus on ChMS platform data\xa0', '50% Employer paid dependent care Health Insurance Plan: Medical | Dental | Vision', 'This role reports to the Manager of Data Engineering.', 'Salary and Benefits:', 'Passion for quantitative analysis and modeling across diverse data sets', 'Proven ability and experience presenting analytical findings to stakeholders of varying levels and backgrounds', 'Experience working with Data Engineers to develop advanced datasets to solve analysis problems', 'Create standardized reports and visualizations to serve the business', 'Ability to work with modern data collection, modeling, analysis, reporting, and visualization tooling', 'THIS POSITION IS PHYSICALLY\xa0LOCATED IN COLORADO SPRINGS, CO OFFICE', 'Knowledge and experience with CRMs (Salesforce is our primary system of record)', 'Knowledge of the following tools is advantageous:', 'Experience with Jupyter, Python, and/or R is a plus', 'FTE: Salary range: $65/K - $82/K (DOE)\xa0100% Employer paid Health Insurance Plan: Medical | Dental | Vision50% Employer paid dependent care Health Insurance Plan: Medical | Dental | VisionPTO & 11 Paid Holidays401K with match\xa0', 'A structured thinker who can find a starting point and desired outcome, and then apply a methodical approach to move from one to the other', 'Create standardized methods for monitoring ChMS platform usage to allow for fast and scalable analysis that is trusted', 'Bachelor’s degree or equivalent', 'We recently announced the exciting news of Pushpay and Church Community Builder merging together to deliver a best-in-class fully integrated church management system (ChMS), custom community app, and giving solutions for organizations in the faith sector. The combination of our two companies gives us complementary world class solutions for our customers and aligns strongly with Pushpay’s core strategy of providing innovative, market-leading solutions for customers.', 'Experience with modern software tracking tools and techniques (Amplitude, Pendo, Pinpoint, UserIQ, Heap, etc…)', 'Job Summary:', '100% Employer paid Health Insurance Plan: Medical | Dental | Vision', 'Interpret data and deliver analysis that will guide Product Management and Customer Success teams’ decision makingPlay a key role in data documentation and development of core data sets - with a focus on ChMS platform data\xa0Work with Product Managers to continually define software usage, metrics, and successCreate standardized methods for monitoring ChMS platform usage to allow for fast and scalable analysis that is trustedWork closely with Data Engineers to identify and build scalable, supportable, and digestible datasets to measure ChMS platform usageCreate standardized reports and visualizations to serve the businessPresent findings to a range of stakeholders from subject matter experts to business leadersDocument analysis methods to ensure consistent analysis over timeRecommend improvements to data capture, warehousing, and reporting structures to serve the BI team and business in a more seamless mannerDevelop reporting, dashboards, and tools for Product team to self analyze their own feature releasesHelp BI team to create systems and processes to democratize data – making it available across the organization – to fuel data curiosity and promote data informed decision making across the companyTranslate business/end-user needs into technical requirements and deliverablesScope, prioritize, and plan projects – including leading meetings, overcoming roadblocks, providing updates, and communicating results to appropriate stakeholdersCollaborate with BI team members (Analysts, Engineers, Scientists)\xa0', 'Work with Product Managers to continually define software usage, metrics, and success', 'PTO & 11 Paid Holidays', 'Tableau Desktop Certification (Associate or Professional)']",Associate,Full-time,Analyst,Information Technology and Services,2021-01-26 11:38:09
Success Strategy & Data Analyst,Pluralsight,"Draper, UT",6 hours ago,Be among the first 25 applicants,"[' BA/BS degree in quantitative discipline such as Economics, Math, Statistics, Finance, Computer Science or Engineering ', ' Passionate about SaaS and fast growth tech  Proactive in seeking out new solutions and strategies ', ' MBA or equivalent a plus but not required ', 'Experience You’ll Need', ' Pathologically data-driven, relying on quantitative and qualitative data to guide decisions  Adaptable to a continually changing environment  Hyper-collaborative and able to work cross-functionally, always with a bias to action  Coachable and eager to seek out as well as provide feedback ', ' Pathologically data-driven, relying on quantitative and qualitative data to guide decisions ', ' Advanced Excel skills ', 'The Opportunity ', ' Proficient using SQL to query large data sets ', ' Experienced in developing and monitoring tools (Tableau, R, SQL, Salesforce) and metrics, dashboards and reporting tools to improve productivity and efficiency ', ' Development (in collaboration with other stakeholders) of a holistic, end-to-end approach for managing customer relationships digitally at scale ', ' We are looking for an experienced candidate who can quickly become the go-to person for actionable insights and initiative results. This role will play a huge part in supporting our SCALE strategy. You will help design, implement and measure the impact of various engagement, retention and expansion initiatives, and serve as a thought-partner to the Customer Success and Sales leaders over these accounts. As such, this role requires a strong mix of analytical and reporting skills, along with business acumen. This is a high-visibility, high-impact role within a high-focus area of our business. ', ' Adaptable to a continually changing environment ', "" 5+ years' experience working in business intelligence, analytics, data engineering, or a similarly quantitative role "", ' Creation of an escalation process when manual outreach is required to manage accounts ', ' Evaluation of all of our one-to-many campaigns designed to boost customer engagement and help our customers maximize value from their subscription ', ' Some experience managing projects and strong track record of delivering against aggressive timelines ', ' Write SQL queries to extract data and analyze performance against key metrics ', ' Comfort using Salesforce ', "" BA/BS degree in quantitative discipline such as Economics, Math, Statistics, Finance, Computer Science or Engineering  5+ years' experience working in business intelligence, analytics, data engineering, or a similarly quantitative role  Proficient using SQL to query large data sets  Advanced Excel skills  Proficient using Tableau  Experience in advanced data analysis using R, Python, other, a plus  Comfort using Salesforce  MBA or equivalent a plus but not required  Experience using Adobe Analytics and / or Google Analytics a plus but not required  Some experience managing projects and strong track record of delivering against aggressive timelines  Excellent communication / listening / presentation skills"", ' At Pluralsight, our mission is to democratize technology skills throughout the world. We are hiring a Strategy and Data Analyst to help craft, implement and monitor a digital strategy to support our SCALE customers. ', ' Evaluation of all of our one-to-many campaigns designed to boost customer engagement and help our customers maximize value from their subscription  Analysis to extract and aggregate insights tying customer experience to renewal and expansion  Write SQL queries to extract data and analyze performance against key metrics  Build/automate reports/dashboards in Tableau  Development (in collaboration with other stakeholders) of a holistic, end-to-end approach for managing customer relationships digitally at scale  Creation of an escalation process when manual outreach is required to manage accounts ', ' Excellent communication / listening / presentation skills', ' Experience using Adobe Analytics and / or Google Analytics a plus but not required ', 'What You’ll Own', ' Passionate about SaaS and fast growth tech ', ' Analysis to extract and aggregate insights tying customer experience to renewal and expansion ', ' Experience in advanced data analysis using R, Python, other, a plus ', ' Coachable and eager to seek out as well as provide feedback ', ' Proficient using Tableau ', 'Who You Are', 'Job Description', ' Hyper-collaborative and able to work cross-functionally, always with a bias to action ', ' Build/automate reports/dashboards in Tableau ', ' Proactive in seeking out new solutions and strategies ']",Entry level,Full-time,Information Technology,Information Technology and Services,2021-01-26 11:38:09
Data Analyst (Remote),Collabera Inc.,"New Castle, DE",20 hours ago,66 applicants,"['', 'Qualifications:', 'Note: ']",Associate,Full-time,Finance,Banking,2021-01-26 11:38:09
Data Analytics Analyst,Bank of the West,"California City, CA",11 hours ago,Be among the first 25 applicants,"['', "" Bachelor's Degree "", ' Performs other duties as assigned. ', 'Job Description Summary', '  Requires advanced knowledge of job area typically obtained through advanced education combined with experience.   Requires strong knowledge of data and databases.   Some exposure to programming languages (SQL, Oracle, VBA, etc).   Some experience with Commercial Loans systems and data is a plus.   May have practical knowledge of project management.   Requires 5 years minimum prior relevant experience.  ', ' Requires 5 years minimum prior relevant experience. ', ' Leads the research, design, development, testing, retrieval, and data reporting; utilizing the knowledge of various software packages. ', "" Advises in the implementation of business line's data analytics strategy. This may include recommending and developing of related programs for the business line. "", ' Good inter-personal and partnering skills to facilitate effective working relationships. ', ' Strong verbal and written communication skills. ', ' Fair knowledge of project management and Microsoft Office tools. ', ""  Bachelor's Degree  "", ' Required Experience', ' Basic understanding of commercial loans, financial industry, risk management, and/or corporate security. ', 'Job Posting', 'Essential Job Functions', '  Good management and control of work flows to produce deliverables within required timeframes and quality standards.   Good inter-personal and partnering skills to facilitate effective working relationships.   Basic understanding of commercial loans, financial industry, risk management, and/or corporate security.   Ability to problem solve and swiftly escalate issues to senior staff when needed.   Ability to adjust to rapidly changing security environment and prioritize deliverables.   Ability to condense information and transform technical data into easily understandable concepts.   Keen eye for design and understanding of layout flows and infographics.   Fair knowledge of project management and Microsoft Office tools.   Understanding of style guides and editorial process.   Strong verbal and written communication skills.   Strong leadership, and keen focus on details skills.  ', ' Requires advanced knowledge of job area typically obtained through advanced education combined with experience. ', 'Primary Location', ' Some exposure to programming languages (SQL, Oracle, VBA, etc). ', ' May have practical knowledge of project management. ', ' Education ', ' Some experience with Commercial Loans systems and data is a plus. ', ' Strong leadership, and keen focus on details skills. ', 'Job', ' Ability to problem solve and swiftly escalate issues to senior staff when needed. ', '  May participate in various special projects.   Performs other duties as assigned.  ', ' Keen eye for design and understanding of layout flows and infographics. ', ' Understanding of style guides and editorial process. ', ' Identifies business, technology, and process improvement opportunities. This may include making recommendations to business line leaders. ', ' Serves as Business Line\'s ""analytic review"" function to ensure the uniformity and quality of analytical tools and reports are delivered consistently to business partners. ', 'Other Job Duties', ' Ability to condense information and transform technical data into easily understandable concepts. ', 'Skills', ' Equal Employment Opportunity Policy ', ' Good management and control of work flows to produce deliverables within required timeframes and quality standards. ', ' Ability to adjust to rapidly changing security environment and prioritize deliverables. ', ' Requires strong knowledge of data and databases. ', '  Advises in the implementation of business line\'s data analytics strategy. This may include recommending and developing of related programs for the business line.   Leads the research, design, development, testing, retrieval, and data reporting; utilizing the knowledge of various software packages.   Advises on the resolution of complex analytical and data integrity problems while prioritizing multiple tasks.   Identifies business, technology, and process improvement opportunities. This may include making recommendations to business line leaders.   Serves as Business Line\'s ""analytic review"" function to ensure the uniformity and quality of analytical tools and reports are delivered consistently to business partners.  ', 'Other Locations', ' May participate in various special projects. ', 'Job Description', 'Job Qualifications', ' Advises on the resolution of complex analytical and data integrity problems while prioritizing multiple tasks. ']",Not Applicable,Full-time,Other,Banking,2021-01-26 11:38:09
Data Analyst,Atlas Search,"New York, NY",,N/A,"['• Identify, design, and develop, at the direction of Internal Audit Department management, data analytics extract routines to support audit activities performed by the Internal Audit team.', '', 'Responsibilities', 'Qualifications', '• Use data analysis tools to automate audit testing and develop techniques for continuous auditing and analyzing large volumes of data.', 'Experience with some of the following: Tableau, PowerBI, ACL, Idea, Altyrex', '• Assist Department management to identify appropriate data sources and data elements required for analytics, applying professional skepticism when assessing data sources, and validating the completeness and accuracy of data received.', '• Interact and collaborate with Internal Audit team members in working towards departmental goals.', '• To the extent necessary and at the direction of the Internal Audit team, assist internal audit team members in performing audit tests of controls by obtaining and analyzing audit evidence, preparing audit workpapers, evaluating test results, and presenting to Department management. With respect to this, occasional travel may be required.', '• Manage data extraction, storage, transformation, and processing through data analytics routines, and generate output for visualization/analysis by the Internal Audit team.', '\xa0', '1 - 2 years of Data Analysis Experience (any industry)Experience with some of the following: Tableau, PowerBI, ACL, Idea, Altyrex', '1 - 2 years of Data Analysis Experience (any industry)', '• Maintain all organizational and professional ethical standards and ensure all internal audit activities are carried in compliance with The Institute of Internal Auditors’ International Standards for the Professional Practice of Internal Auditing.', 'One of the largest advertising holding companies in the world is looking to add a Data Analytics Associate to their team. The primary focus of this role is conducting analyses of information/data sets, at the request of our audit team, through data analytics software/tools to enable broader coverage on sampling, and to identify variants and other observable indicators in order to target the approach and scope for audit engagements.\xa0The firm pays well (Big Base + Bonus), will allow you to work remotely, and a lot of cool exposure!']",Associate,Full-time,Information Technology,Marketing and Advertising,2021-01-26 11:38:09
Data & Reporting Analyst,L&T Technology Services Limited,"Texas, United States",10 hours ago,36 applicants,"['', 'Duties and Responsibilities', '• Minimum 5 years of experience in report writing, cost analysis, accounts payable, and reporting of key performance indicators', '• High proficiency in MS Excel, Access, PowerPoint, SQL, and dashboard creation', '• Report Generation', '• Strong math, communication, and organizational skills – must have excellent communication skills (written and verbal) – communication is KEY and candidates without this qualification will be rejected. Please properly vet candidates for this qualification.', '• Critical Thinking', '• Data Analysis', 'Education: Bachelor’s Degree in Business Analytics, Computer Science, Mathematics, Accounting, or related field (preferred)', '• Report Automation & Design', '• Excellent analytical, decision-making, and problem solving skills – looking for someone that can read #s and translate to business operations/objectives!', '• Ad-Hoc Projects', 'Years of experience: Minimum 5 years of experience in report writing, cost analysis, accounts payable, and reporting of key performance indicators', '• Identify opportunities for performance improvement', '• Experience with SAP, Tableau, QilkView, QlikSense preferred', '• High proficiency in MS Excel, Access, PowerPoint, SQL, and dashboard creation – need to have at least intermediate skills in SQL. Must have experience developing dashboards using BI Tools (Qlik Sense, Qlik View, Tableau) – Qlik Sense and Qlik View are preferred over Tableau – what the team is currently using)', '• Develop models that help with decision-making', '• Invoice Processing', '• Experience in a logistics supply chain (operations) environment preferred', '• Bachelor’s Degree in Business Analytics, Mathematics, Accounting, or related field', '• Results driven and ability to handle multiple projects', 'Top 3 must-have skills/requirements']",Mid-Senior level,Full-time,Quality Assurance,Information Technology and Services,2021-01-26 11:38:09
