job_title,company,location,date_posted,applicants,job_text,seniority_level,employment_type,job_function,industries,date_scraped
Senior Data Scientist-Consumer Safety ,Johnson & Johnson,"Fort Washington, PA",9 hours ago,Be among the first 25 applicants,"['', 'Manage relationships across IT, QA and finance functional areas; balance between business needs and IT/QA standards and strategies to guide well-informed designs and decisions.', 'Lead the safety science eﬀort to build applications and tools by applying advanced scientific algorithms and methods and translating the strategic vision of safety science into solutions and insights.', 'Willingness to work in an exploratory environment, handling non-standard tasks with minimal supervision', 'The Senior Data Scientist Will', 'Apply and leverage technology-driven analytics (e.g., natural language processing, artificial intelligence/machine learning) in advancing safety science practice.', 'Lead as a Business Analyst for moderate to large projects, programs, or initiatives of varying complexity', 'Be a member of the Safety Science and Analytics group within the Oﬀice of Consumer Medical Safety (OCMS).', 'Prior training/experience building natural language processing and machine learning solutions using common machine learning and deep learning frameworks', 'Should be passionate about working on developing cutting edge analytics/informatics solutions in the field of safety analytics and surveillance.', 'Master’s degree required in Applied Mathematics, Computer Science/Informatics, Epidemiology, Statistics or related discipline, plus 5 years of overall experience; or a PhD in the same disciplines plus 3 years of overall experience', ' Master’s degree required in Applied Mathematics, Computer Science/Informatics, Epidemiology, Statistics or related discipline, plus 5 years of overall experience; or a PhD in the same disciplines plus 3 years of overall experience Strong competency in at least one programming language commonly used in developing analytics solutions, such as R, Python, or Julia Experience with technologies used to build analytics dashboards/applications, such as RShiny, Dash, and Streamlit Working knowledge of how to build custom web applications using modern web frameworks (e.g., AngularJS, React, etc.) Experience with relational database technologies (e.g., Oracle, MySQL, PostgreSQL) Excellent written and communications skills and the ability to articulate findings in a clear, structured, and concise manner Willingness to work in an exploratory environment, handling non-standard tasks with minimal supervision ', 'Qualifications', 'Work closely with customers and stakeholders to turn data into critical information and knowledge that can be used to make evidence-based decisions.', ' Prior training/experience building natural language processing and machine learning solutions using common machine learning and deep learning frameworks Experience with spontaneous adverse events and working knowledge of safety surveillance', 'Experience with relational database technologies (e.g., Oracle, MySQL, PostgreSQL)', 'Be responsible for translating the strategic vision of safety science into solutions and insights through development of innovative methodology and applications.', 'Preferred', ' Be a member of the Safety Science and Analytics group within the Oﬀice of Consumer Medical Safety (OCMS). Be responsible for translating the strategic vision of safety science into solutions and insights through development of innovative methodology and applications. Should be passionate about working on developing cutting edge analytics/informatics solutions in the field of safety analytics and surveillance. Lead the safety science eﬀort to build applications and tools by applying advanced scientific algorithms and methods and translating the strategic vision of safety science into solutions and insights. Work closely with customers and stakeholders to turn data into critical information and knowledge that can be used to make evidence-based decisions. Manage relationships across IT, QA and finance functional areas; balance between business needs and IT/QA standards and strategies to guide well-informed designs and decisions. Apply compliance/validation requirements related to GxP-regulated applications, provides documentation as necessary, and participate in compliance/validation activities as required. Work eﬀectively as part of a team and solve complex or unusual problems in consideration of the potential impact. Lead as a Business Analyst for moderate to large projects, programs, or initiatives of varying complexity Apply and leverage technology-driven analytics (e.g., natural language processing, artificial intelligence/machine learning) in advancing safety science practice. ', 'Excellent written and communications skills and the ability to articulate findings in a clear, structured, and concise manner', 'Experience with spontaneous adverse events and working knowledge of safety surveillance', 'Working knowledge of how to build custom web applications using modern web frameworks (e.g., AngularJS, React, etc.)', 'Apply compliance/validation requirements related to GxP-regulated applications, provides documentation as necessary, and participate in compliance/validation activities as required.', 'Experience with technologies used to build analytics dashboards/applications, such as RShiny, Dash, and Streamlit', 'Work eﬀectively as part of a team and solve complex or unusual problems in consideration of the potential impact.', 'Job Description', 'Strong competency in at least one programming language commonly used in developing analytics solutions, such as R, Python, or Julia']",Not Applicable,Full-time,Other,Hospital & Health Care,2021-02-10 11:29:29
Data Scientist,Hireology,"Chicago, IL",11 hours ago,Be among the first 25 applicants,"['', 'Project Managing and Executing quantitative analyses that translate data into actionable insights that lead to innovation', 'Metrics Driven: There are a myriad of signals you’ll learn to understand and manage, ensuring our customers are happy, engaged and informed. We’re passionate about data and trends and managing to key performance indicators and you will be as passionate about our bottoms-up approach to providing insights to our clients.', 'Knowledge of programming languages like SQL, Python, R, and Scala', 'Strong mathematics skills (e.g., statistics, algebra)', 'Candidates must be authorized to work in the US.', 'Correlating similar data to find actionable results', 'Work Independently and with a Team: Some people work best individually and some as part of a team. The ideal candidate is a chameleon who can succeed both on their own and work within a team-oriented, collaborative environment.', 'Utilizing Looker or other similar tools to fulfill transactional reporting, and ad hoc analyses ', 'Metrics Driven: There are a myriad of signals you’ll learn to understand and manage, ensuring our customers are happy, engaged and informed. We’re passionate about data and trends and managing to key performance indicators and you will be as passionate about our bottoms-up approach to providing insights to our clients.Possess Integrity: Not negotiable in this or any role at Hireology. You have the highest level of integrity and discretion.Work Independently and with a Team: Some people work best individually and some as part of a team. The ideal candidate is a chameleon who can succeed both on their own and work within a team-oriented, collaborative environment.', 'Speak with a member of our senior leadership team. If you have made it this far, just be yourself, and everything will be fine.', 'Take a brief true/false survey. Be sure to check your email after you apply.', 'Work with clients and internal stakeholders to develop advanced analyses that help them solve challenging business problems ', 'We are an equal opportunity employer and prohibit discrimination/harassment without regard to race, color, religion, age, sex, national origin, disability status, genetics, protected veteran status, sexual orientation, gender identity or expression, or any other characteristic protected by federal, state or local laws.', 'Previous exposure to ETL, data model design, and data warehouse concepts is a plus', 'Ability to communicate complex data in a simple, actionable way', 'GLM, SVM and tree-based models (e.g. Boosting, Random Forest) ', 'Previous exposure to ETL, data model design, and data warehouse concepts ', 'Have a phone conversation with someone on our Recruiting team. This is a high-level conversation about you, but also a good opportunity for you to learn more about us.', 'Regression models GLM, SVM and tree-based models (e.g. Boosting, Random Forest) NLP (Natural Language Processing)Neural Networks', ""You'll have the opportunity to show off your modeling skills and how you solve business cases. This will also be an opportunity for us to get an idea of how you got to where you are, and if where you want to go lines up with where we are going."", 'Creating reports and presentations for business uses', 'Experience with common data science toolkit', 'Master’s degree or Ph.D. in a quantitative field or 2+ years professional experience working in an analytics-focused role', 'Proficiency in SQL and databases (most notably PostgreSQL) is required', 'Creating new, experimental frameworks to collect data', 'Familiarity with business intelligence tools (e.g., Tableau, Looker)', 'Possess Integrity: ', 'Metrics Driven:', 'Made a high-quality data science project available in a public forum like GitHub, Kaggle, or an analytics blog', 'Transferring data into a new format to make it more appropriate for analysisCreating new, experimental frameworks to collect dataBuilding tools to automate data collectionCreating reports and presentations for business usesCorrelating similar data to find actionable resultsUtilizing Looker or other similar tools to fulfill transactional reporting, and ad hoc analyses Works cross-functionally to define problem statements, collect data, build models, translate data to solve complex business problems and make recommendationsWorking directly with Revenue, Marketing, Engineering, Product and other business units to understand and satisfy stakeholders’ needs, while communicating and coordinating closely with business partners and leadershipProject Managing and Executing quantitative analyses that translate data into actionable insights that lead to innovationWork with clients and internal stakeholders to develop advanced analyses that help them solve challenging business problems ', 'Working directly with Revenue, Marketing, Engineering, Product and other business units to understand and satisfy stakeholders’ needs, while communicating and coordinating closely with business partners and leadership', 'NLP (Natural Language Processing)', 'Neural Networks', 'Ability to work independently and with team members from different backgrounds', 'As a Data Scientist, You’ll Be Responsible For', 'Work Independently and with a Team: ', 'Building tools to automate data collection', ""Take a brief true/false survey. Be sure to check your email after you apply.Have a phone conversation with someone on our Recruiting team. This is a high-level conversation about you, but also a good opportunity for you to learn more about us.Meet with our Revenue Operations team to talk about how you approach work technically with examples of how you have done it in the past. You'll have the opportunity to show off your modeling skills and how you solve business cases. This will also be an opportunity for us to get an idea of how you got to where you are, and if where you want to go lines up with where we are going.Provide us some references. We use our automated reference check system for this, so you just give us some names, they fill out a survey, and we are all set.Speak with a member of our senior leadership team. If you have made it this far, just be yourself, and everything will be fine."", 'Regression models ', 'Advanced ability to perform exploratory data analysis', 'Transferring data into a new format to make it more appropriate for analysis', 'Candidates must be authorized to work in the US.Master’s degree or Ph.D. in a quantitative field or 2+ years professional experience working in an analytics-focused roleAbility to write sophisticated machine learning and data analysis code in R, Matlab, or Python. This includes but is not limited to:Regression models GLM, SVM and tree-based models (e.g. Boosting, Random Forest) NLP (Natural Language Processing)Neural NetworksMade a high-quality data science project available in a public forum like GitHub, Kaggle, or an analytics blogProficiency in SQL and databases (most notably PostgreSQL) is requiredPrevious exposure to ETL, data model design, and data warehouse concepts is a plusExpertise in creating publication-quality visualizations and white papers.Knowledge of programming languages like SQL, Python, R, and ScalaPrevious exposure to ETL, data model design, and data warehouse concepts Familiarity with business intelligence tools (e.g., Tableau, Looker)Strong mathematics skills (e.g., statistics, algebra)Advanced ability to perform exploratory data analysisExperience with common data science toolkitAbility to communicate complex data in a simple, actionable wayAbility to visualize data in the most effective way possible for a given project or studyAbility to work independently and with team members from different backgrounds', 'Ability to visualize data in the most effective way possible for a given project or study', 'Meet with our Revenue Operations team to talk about how you approach work technically with examples of how you have done it in the past. ', 'Ability to write sophisticated machine learning and data analysis code in R, Matlab, or Python. This includes but is not limited to:Regression models GLM, SVM and tree-based models (e.g. Boosting, Random Forest) NLP (Natural Language Processing)Neural Networks', 'Role', 'Provide us some references. We use our automated reference check system for this, so you just give us some names, they fill out a survey, and we are all set.', 'Works cross-functionally to define problem statements, collect data, build models, translate data to solve complex business problems and make recommendations', 'Possess Integrity: Not negotiable in this or any role at Hireology. You have the highest level of integrity and discretion.', 'Expertise in creating publication-quality visualizations and white papers.']",Entry level,Full-time,Engineering,Information Technology and Services,2021-02-10 11:29:29
Principal Data Scientist (Marketing Personalization Algorithms),Udemy,"San Francisco, CA",2 hours ago,Be among the first 25 applicants,"['', 'Udemy in the News', 'Strong knowledge of statistics, machine learning, and reinforcement learning', '7+ years of hands-on data science experience building complex data productsStrong knowledge of statistics, machine learning, and reinforcement learningProficiency with SQL and 1+ programming languages (e.g., Python)Experience with the design and development of large-scale machine learning applicationsAbility to communicate effectively with non-technical stakeholdersExcellent written and oral communication skillsSelf-driven, highly motivated, and able to learn quickly', 'Self-driven, highly motivated, and able to learn quickly', 'We’re Excited About You Because You Have', 'Provide technical mentorship for other team members', 'Collaborate with product managers, marketing experts, data scientists, and engineers to scope and build data products with a focus on personalization.Perform statistical analysis, feature engineering, and model development for ML-based data products.Develop production-grade applications at scaleDesign and analyze experiments to measure the performance of data products in offline and online settings. Proactively influence product prioritization through data-driven insightsLead complex cross-organizational initiativesMaintain high-quality standards, effective team processes, and best practices.Provide technical mentorship for other team membersBuild Udemy’s technical brand through talks, blog posts, and publications', 'Great If You Have But Not Required', 'Build Udemy’s technical brand through talks, blog posts, and publications', 'Experience with the design and development of large-scale machine learning applications', '7+ years of hands-on data science experience building complex data products', 'Ability to communicate effectively with non-technical stakeholders', 'Perform statistical analysis, feature engineering, and model development for ML-based data products.', 'Maintain high-quality standards, effective team processes, and best practices.', 'Design and analyze experiments to measure the performance of data products in offline and online settings. ', 'Proactively influence product prioritization through data-driven insights', 'Collaborate with product managers, marketing experts, data scientists, and engineers to scope and build data products with a focus on personalization.', 'Excellent written and oral communication skills', 'Proficiency with SQL and 1+ programming languages (e.g., Python)', 'Here’s What You’ll Be Doing', 'Lead complex cross-organizational initiatives', 'About Udemy', 'Experience using big data technologies (e.g., Hadoop, Spark)Familiarity with software development practices', 'Familiarity with software development practices', 'Experience using big data technologies (e.g., Hadoop, Spark)', 'Develop production-grade applications at scale']",Not Applicable,Full-time,Engineering,Marketing and Advertising,2021-02-10 11:29:29
"Data Scientist, Junior",ClearedJobs.Net,"Fort Meade, MD",10 hours ago,Be among the first 25 applicants,"['', 'Job Number: R0101062', 'Nice If You Have', 'access to online and onsite training in data analysis and presentation methodologies, and tools like Hortonworks, Docker, Tableau, and Splunk', 'MA or MS degree preferred', 'Build Your Career', 'Experience with building data products using open source programming languages, including Python, R, or JavaScript', 'a chance to change the world with the Data Science Bowl—the world’s premier data science for social good competition', 'Experience with applying advanced statistics, including natural language processing and machine learning', '2+ years of experience with applying advanced statistics, including natural language processing and machine learning preferred', 'participation in partnerships with data science leaders, like our partnership with NVIDIA to deliver Deep Learning Institute (DLI) training to the federal government', 'You Have', 'Experience with scaling data products across distributed computer environments, including Hadoop', 'TS/SCI clearance with a polygraph', 'Clearance', 'The Challenge', 'BA or BS degree', 'access to online and onsite training in data analysis and presentation methodologies, and tools like Hortonworks, Docker, Tableau, and Splunka chance to change the world with the Data Science Bowl—the world’s premier data science for social good competitionparticipation in partnerships with data science leaders, like our partnership with NVIDIA to deliver Deep Learning Institute (DLI) training to the federal government']",Entry level,Full-time,Engineering,Information Technology and Services,2021-02-10 11:29:29
Data Scientist-Senior,The Bowen Center,"Washington, DC",4 hours ago,Be among the first 25 applicants,"['', 'About Perspecta', 'Full-stack development experience.', 'Thorough/Working knowledge of research designs.', ' Thorough/Working knowledge of Python and some of the following software/tools: SQL, R, Hadoop, Spark, Java, C/C++, Git Bash, Tableau, ArcGIS, Unix commands. Thorough/Working knowledge of research designs. Thorough/Working knowledge of collection methods, capabilities and tasking process. Familiarity with project management concepts and principles. Intellectual curiosity; creativity and innovation to go beyond current tools to deliver the best solution to complex problems. Strong analytical and critical thinking skills ', 'CareerBuilder TIP', 'Desired Qualifications', 'Familiarity with project management concepts and principles.', 'Current TS/SCI clearance', 'Thorough/Working knowledge of Python and some of the following software/tools: SQL, R, Hadoop, Spark, Java, C/C++, Git Bash, Tableau, ArcGIS, Unix commands.', 'Recommended Skills', 'Recommended Jobs', 'Knowledge of database tools and current data science processes.', 'Business Group Highlights ', ' Strong understanding of data engineering, structure, formatting, conditioning and analysis. Knowledge of database tools and current data science processes. Full-stack development experience. ', 'Thorough/Working knowledge of collection methods, capabilities and tasking process.', 'Qualifications', 'Report this Job', 'Intellectual curiosity; creativity and innovation to go beyond current tools to deliver the best solution to complex problems.', 'Desired Skills', 'Strong understanding of data engineering, structure, formatting, conditioning and analysis.', 'Strong analytical and critical thinking skills', 'Responsibilities', 'Pay Transparency Nondiscrimination Provision', 'Defense']",Associate,Full-time,Other,Nonprofit Organization Management,2021-02-10 11:29:29
