job_title,company,location,date_posted,applicants,job_text,seniority_level,employment_type,job_function,industries,date_scraped
Data Analyst,StevenDouglas,"Fort Lauderdale, FL",5 hours ago,Be among the first 25 applicants,"['', 'Location:\xa0Fort Lauderdale, FL', 'Elicit, understand, interpret and represent business requirements for data, information delivery and analytics, data integration, metadata, training, service levels, data quality, and performance', 'Work with architects to translate requirements into technical specifications', 'Experience working with Teradata Data Warehouse or other RDMS\xa0', 'Elicit, understand, interpret and represent business requirements for data, information delivery and analytics, data integration, metadata, training, service levels, data quality, and performanceUnderstand source systems and its data modelsWork with architects to translate requirements into technical specificationsValidate that data integration, data movement, and warehouse meets requirements and service-level agreementsDevelop source to target mappings for data lineage', 'Well versed in data management concepts, data lifecycle and methodologies', 'Work Requirements:\xa0Those authorized to work in the United States without sponsorship are encouraged to apply: Citizen, GC Holders or GC-EAD', 'Well versed in data management concepts, data lifecycle and methodologiesKnowledge of data integration and data warehousing concepts for advancing business insights and data driven decisions7+ years experience working as a data analyst leveraging BI tools in a centralized data warehouse environment5+ years hands-on experience working with SQL with an understanding of different data structures (flat files and RDMS) 3+ years experience with data modeling concepts and techniquesProven experience on projects involving data integration, data warehousing, data cleansing and data conversion process and/or toolsExperience working with Teradata Data Warehouse or other RDMS\xa0', 'Please note:\xa0This is a remote position during Covid, candidate must be local to area', '7+ years experience working as a data analyst leveraging BI tools in a centralized data warehouse environment', '5+ years hands-on experience working with SQL with an understanding of different data structures (flat files and RDMS) ', 'Knowledge of data integration and data warehousing concepts for advancing business insights and data driven decisions', '3+ years experience with data modeling concepts and techniques', 'Experience', 'This role is not open to third party vendors.', 'Understand source systems and its data models', 'Resposibilities', 'Develop source to target mappings for data lineage', 'Proven experience on projects involving data integration, data warehousing, data cleansing and data conversion process and/or tools', 'Validate that data integration, data movement, and warehouse meets requirements and service-level agreements', 'Title:\xa0Data Analyst']",Mid-Senior level,Full-time,Information Technology,Staffing and Recruiting,2020-12-30 19:32:10
Data Analyst,GEICO,"Chevy Chase, MD",21 hours ago,57 applicants,"['', 'Basic Qualifications', ""Significant experience in facilitating the discovery process with functional stakeholders to identify requirements and expected outcomes.Experience in developing test plans and scenarios to ensure the highest quality deliverablesStrong SQL, data mapping, and data profiling skillsWorking knowledge of Big Data and the Hadoop EcosystemOutstanding time management skills and attention to detailExcellent verbal/written communication skills, including communicating technical issues to non-technical audiencesStrong presentation skills. Should be comfortable with presenting to all levels of managementA Bachelor's degree in Information Technology, related field (business, finance, mathematics, computer science), or equivalent professional experience is required"", 'Preferred Qualifications', 'Experience in querying NoSQL databases', 'Premier Medical, Dental and Vision Insurance with no waiting period**', 'As a Data Analyst, You’ll Enjoy Our Total Rewards Program* To Help Secure Your Financial Future And Preserve Your Health And Well-being, Including', 'Strong presentation skills. Should be comfortable with presenting to all levels of management', 'Benefits may be different by location. Benefit eligibility requirements vary and may include length of service.', 'Significant experience in facilitating the discovery process with functional stakeholders to identify requirements and expected outcomes.', 'Experience with providing Production Support', 'Tuition Reimbursement', 'Coverage begins with the pay period after hire date. Must enroll in New Hire Benefits within 30 days of the date of hire for coverage to take effect.', ""A Bachelor's degree in Information Technology, related field (business, finance, mathematics, computer science), or equivalent professional experience is required"", 'Understanding and experience with Web Services and APIs', '401(k) Plan with Profit Sharing', 'Understanding and experience with Web Services and APIsExperience in querying NoSQL databasesKnowledge and experience working in an Agile environmentExperience with providing Production Support', 'Experience in developing test plans and scenarios to ensure the highest quality deliverables', 'Premier Medical, Dental and Vision Insurance with no waiting period**Paid Vacation, Sick and Parental Leave401(k) Plan with Profit SharingTuition ReimbursementPaid Training and Licensures', 'Strong SQL, data mapping, and data profiling skills', 'Data Analyst', 'Paid Vacation, Sick and Parental Leave', 'Knowledge and experience working in an Agile environment', 'Paid Training and Licensures', 'Excellent verbal/written communication skills, including communicating technical issues to non-technical audiences', 'Working knowledge of Big Data and the Hadoop Ecosystem', 'Outstanding time management skills and attention to detail']",Not Applicable,Full-time,Information Technology,Insurance,2020-12-30 19:32:10
Data Analyst,"Resolute Management, Inc.","Boston, MA",11 hours ago,113 applicants,"['', 'Ability to produce work in a short amount of time, if necessary.', '2-3 years experience in data analysis (statistical or financial), preferably in the insurance industry.', ""Applicants who don't complete the prescreening questions will not be considered. This is not a software engineering job."", 'Must have BS in quantitative field (Mathematics, Statistics, Economics, Finance).', 'Education', 'Forecasts impact of environmental claims (hazardous waste and asbestos) to various companies through analysis of financial and legal issues.', 'Knowledge of software development life cycle a plus.', 'Must be advanced user of Excel, intermediate knowledge of all other Microsoft Office products including Access.', 'Qualified candidates will have had wide experience developing complex analyses and detailed reports in Excel, possess strong, demonstrable problem-solving skills and enjoy working autonomously. ', 'PERFORMANCE REQUIREMENTS:', 'Ability to solve qualitative problems quantitatively and present or explain solutions to an audience with a limited math or computing background.', 'Generates ad hoc reporting for managers and clients.', 'Find creative solutions to problems when limited information is available.Capable of managing an assigned project with a wide degree of independence.Attentive to detail.Organizational and prioritizing skills.Ability to produce work in a short amount of time, if necessary.', 'Find creative solutions to problems when limited information is available.', 'Forecasts impact of environmental claims (hazardous waste and asbestos) to various companies through analysis of financial and legal issues.Works with business users to define business processes in support of business system development and performs system testing.Generates ad hoc reporting for managers and clients.Provides quantitative support to users on MS Excel.', 'Attentive to detail.', 'Knowledge, Skills & Abilities', 'Understanding of forecasting methods and how to apply them to complex scenarios incorporating a variety of issues.', 'Capable of managing an assigned project with a wide degree of independence.', 'Minimum of 2-3 years experience in data analysis. ', 'Organizational and prioritizing skills.', 'Duties', '2-3 years experience in data analysis (statistical or financial), preferably in the insurance industry.Prefer 1-2 years business analysis experience.Understanding of forecasting methods and how to apply them to complex scenarios incorporating a variety of issues.Ability to solve qualitative problems quantitatively and present or explain solutions to an audience with a limited math or computing background.Must be advanced user of Excel, intermediate knowledge of all other Microsoft Office products including Access.Knowledge of software development life cycle a plus.', 'Provides quantitative support to users on MS Excel.', 'Experience', 'Prefer 1-2 years business analysis experience.', 'Job Description', '2-3 years', 'Works with business users to define business processes in support of business system development and performs system testing.']",Entry level,Full-time,Finance,Financial Services,2020-12-30 19:32:10
Web Analyst,Kendra Scott,"Austin, Texas Metropolitan Area",6 hours ago,Be among the first 25 applicants,"['', 'A strong ability to build cross functional partnerships and work collaboratively', 'Training other team members on how to use Google Analytics to answer key business questions.', 'We have an exciting opportunity to support the rapid growth of the Ecommerce business at Kendra Scott! This high-profile position is based in our Home Office in Austin, TX and will report to our Sr. Director of Ecommerce Experience. Our Web Analyst will be responsible for identifying opportunities to improve the overall ecommerce experience and monitoring the overall performance of the business. This role combines the need to analyze data effectively with presenting findings and recommendations persuasively to key partners.', 'Responsibilities:', 'Our Ideal Candidate Will Have:', 'Developing and maintaining dashboards that allow ongoing monitoring of Ecommerce KPIs.', 'Utilizing Google Analytics and other web analytics tools to understand website performance.Identifying opportunities to improve website performance and sharing opportunities with Product Managers and UX.Partnering closely with Product Managers and UX to track KPIs before and after website changes in order to assess impact of changes. The Web Analyst will be responsible for recommending what information should be tracked for new features and working closely with Product Managers and Development to ensure that features are set-up in a way that will enable recommended tracking.Partnering with web analytics agency to ensuring that current tagging is set-up as intended.Using clickstream, user behavior, and conversion patterns to identify potential issues in near real time and aid pro-active issue resolution with tech partnersDeveloping and maintaining dashboards that allow ongoing monitoring of Ecommerce KPIs.Training other team members on how to use Google Analytics to answer key business questions.Support on-site A/B testing strategies as required.Keeping up to date with Web Analytics and Digital Measurement best practices, announcements, and industry research', '1+ years of experience working with Google Analytics preferred.', 'Position Overview:', 'Identifying opportunities to improve website performance and sharing opportunities with Product Managers and UX.', 'We are a fun, talented and driven team dedicated to providing our customers with gorgeous products and a WOW! experience. Family, fashion and philanthropy are at the core of our company and though we move at a very fast pace, we are committed to maintaining a family-oriented work environment and giving back to our community. A passion for great design, dedication to innovation and a strong social media presence are our building blocks for creating a unique and engaging lifestyle brand across all channels, including retail stores, wholesale accounts and e-commerce. Our headquarters are located in the heart of Austin, Texas, and we embrace the unique vibe and energy of our hometown as an inspiration for our brand and company culture.', 'A growth mindset: desire to learn, grow and embrace new ideas', 'Support on-site A/B testing strategies as required.', 'A shared appreciation for our 3 core values of Family, Fashion and Philanthropy', 'Bachelor’s degree or equivalent experience, preferably in Business, Marketing or a quantitative field like Economics, Mathematics or Statistics.', 'Bachelor’s degree or equivalent experience, preferably in Business, Marketing or a quantitative field like Economics, Mathematics or Statistics.3-5 years of experience working in Web Analytics for a direct-to-consumer ecommerce company.Strong understanding of how website tagging and data layer impact clickstream data available for analytics. 1+ years of experience influencing clickstream data collected required.1+ years of experience working with Google Analytics preferred.Strong point of view on what KPIs a fast-growing ecommerce business should be tracking.Proven ability to apply findings to business problems to lift revenue and profits.A proven ability to execute with consistent delivery and reprioritize based on evolving business needsA strong ability to build cross functional partnerships and work collaborativelyA growth mindset: desire to learn, grow and embrace new ideasA shared appreciation for our 3 core values of Family, Fashion and Philanthropy', 'Keeping up to date with Web Analytics and Digital Measurement best practices, announcements, and industry research', 'Utilizing Google Analytics and other web analytics tools to understand website performance.', '3-5 years of experience working in Web Analytics for a direct-to-consumer ecommerce company.', 'About Kendra Scott:', 'Strong point of view on what KPIs a fast-growing ecommerce business should be tracking.', 'Proven ability to apply findings to business problems to lift revenue and profits.', 'Partnering with web analytics agency to ensuring that current tagging is set-up as intended.', 'Partnering closely with Product Managers and UX to track KPIs before and after website changes in order to assess impact of changes. The Web Analyst will be responsible for recommending what information should be tracked for new features and working closely with Product Managers and Development to ensure that features are set-up in a way that will enable recommended tracking.', 'A proven ability to execute with consistent delivery and reprioritize based on evolving business needs', 'Strong understanding of how website tagging and data layer impact clickstream data available for analytics. 1+ years of experience influencing clickstream data collected required.', 'Using clickstream, user behavior, and conversion patterns to identify potential issues in near real time and aid pro-active issue resolution with tech partners']",Associate,Full-time,Analyst,Luxury Goods & Jewelry,2020-12-30 19:32:10
Data Analyst,Flex,"Buffalo Grove, IL",12 hours ago,55 applicants,"['', 'Data Analytics', 'Analyze reports of data duplicates or other errors to provide ongoing appropriate inter-departmental communication and monthly or daily data reports (for example, KPI, Cost Analysis, Consumption reporting)', 'Full range of medical benefits, dental, vision', 'Excellent written and oral communication skills.', 'Bachelor’s degree', 'Relentless drive to win', 'Working with the engineering team, procurement team and all teams internally.Identify problematic areas and conduct research to determine the best course of action to correct the data.Analyze and problem solve issues with planned data uploads and migration of data from one environment to another. Identify possible risk following planned data uploads and develop a mitigation plan.Analyze reports of data duplicates or other errors to provide ongoing appropriate inter-departmental communication and monthly or daily data reports (for example, KPI, Cost Analysis, Consumption reporting)Monitor for timely and accurate completion of select data uploads executed by other departments or third-party vendors.Identify, analyze, and interpret trends or patterns in complex data sets.Ability to create visualization tool or presentations to highlight trending data.Generate reports & Presentations, and present to a wide variety of stake holders', 'Life Insurance', 'Analyze and problem solve issues with planned data uploads and migration of data from one environment to another. Identify possible risk following planned data uploads and develop a mitigation plan.', '1-2 years of experience.', 'Here Are a Few Of Our Preferred Experiences', 'PTO', 'Here Is Some Of What You’ll Need (required)', 'Identify problematic areas and conduct research to determine the best course of action to correct the data.', 'Monitor for timely and accurate completion of select data uploads executed by other departments or third-party vendors.', 'BG, IL', 'Passionate customer focus', 'Analytic, motivated.', 'Intense collaborationPassionate customer focusThoughtful, fast, disciplined executionTenacious commitment to continuous improvementRelentless drive to win', 'ERP experience.', 'Strong financial modeling skills.', 'Tuition Reimbursement', 'Finance, Engineering or related.', 'Bachelor’s degree: Finance, Engineering or related.Data Analytics1-2 years of experience.Advanced Excel: macros, pivot, VLOOKUP.Proficiency in Excel, Word, and PowerPoint.Strong financial modeling skills.Excellent written and oral communication skills.Problem solver.Analytic, motivated.Demonstrated attention to detail in a fast-paced, dynamic environment.', 'Here are a few examples of what you’ll get for the great work you provide:', 'Ability to create visualization tool or presentations to highlight trending data.', 'Advanced Excel: macros, pivot, VLOOKUP.', 'Proficiency in Excel, Word, and PowerPoint.', 'Thoughtful, fast, disciplined execution', 'Working with the engineering team, procurement team and all teams internally.', 'Matching 401K', 'The Information We Collect', 'We Are Looking For Someone Who Demonstrates', 'Employee discounts at local retailers', 'Here Is a Glimpse Of What You’ll Do', 'Identify, analyze, and interpret trends or patterns in complex data sets.', 'Problem solver.', 'Demonstrated attention to detail in a fast-paced, dynamic environment.', 'Full range of medical benefits, dental, visionLife InsuranceMatching 401KPTOTuition ReimbursementEmployee discounts at local retailers', 'Data Analyst ', 'Bachelor’s degree: Finance, Engineering or related.', 'Generate reports & Presentations, and present to a wide variety of stake holders', 'Intense collaboration', 'Global Data Privacy Officer', 'Tenacious commitment to continuous improvement']",Entry level,Full-time,Manufacturing,Electrical/Electronic Manufacturing,2020-12-30 19:32:10
Data Analyst,NEXT Music,"San Francisco, CA",8 hours ago,86 applicants,"['', 'Strong affinity for building and managing systems', 'Work with data team to determine the right next questions to ask and answer using dataManage the process to collect the data, working with operations for manually input data and development for the programmatically input dataAssist in integrating data from various sources togetherWork across teams to validate data is clean and accuratePresent analyzed data conclusions with Leadership and other stakeholders', 'Good communication and presentation skills', 'Programming experienceUnderstanding of statistical modeling and programs (ie. Pandas, R)Previous experience in business operations or data analytics', 'Assist in integrating data from various sources together', 'Programming experience', 'About Next Music', 'Strong passion for music', 'Nice to Have', 'About The Job', 'BS in relevant field (Statistics, Applied Mathmatics, Economics, etc)Strong sense for business objectivesStrong affinity for building and managing systemsStrong sense of organization and work ethicStrong spreadsheet skillsIntermediate and above SQL skillsGood communication and presentation skillsStrong desire to work in a startup environmentStrong passion for music', 'Manage the process to collect the data, working with operations for manually input data and development for the programmatically input data', 'Previous experience in business operations or data analytics', 'Strong sense for business objectives', 'Strong desire to work in a startup environment', 'Strong spreadsheet skills', 'Strong sense of organization and work ethic', 'Intermediate and above SQL skills', 'Present analyzed data conclusions with Leadership and other stakeholders', 'Understanding of statistical modeling and programs (ie. Pandas, R)', 'Responsibilities', 'BS in relevant field (Statistics, Applied Mathmatics, Economics, etc)', 'Qualifications', 'Work with data team to determine the right next questions to ask and answer using data', 'Work across teams to validate data is clean and accurate']",Entry level,Full-time,Information Technology,Internet,2020-12-30 19:32:10
"Data Analyst, Business & Customer Insights - HBO Max",WarnerMedia,Utica-Rome Area,6 hours ago,26 applicants,"['', ' Rapidly deliver on concepts through prototypes that can be presented for feedback ', "" Bachelor's Degree in Computer Science, Engineer, Mathematics or similar required (masters degree is a plus) "", 'Company Overview ', "" Develop and maintain beautifully designed dashboards consumed by the HBO Max Leadership team, and build interactive dashboards to best support self-service BI to users  Work closely with key stakeholders to translate business expert analysis use cases into reporting requirements  Rapidly deliver on concepts through prototypes that can be presented for feedback  Synthesize large volumes of data and complex concepts into clear accessible learnings  Assist in building compelling presentations that communicate clear actionable insights  Act as a visualization subject matter expert providing support to team members  Develop strong cross-functional partnerships across the company (Engineering, Strategy, Marketing, Product, Operations) to drive our team's success "", ' Strong communicator, for both technical and non-technical audiences ', ' The Job ', ' Proven track record of performing comprehensive analyses independently ', ' 3+ years of relevant experience: Delivering business intelligence and data visualization dashboard solutions  Looker or Tableau data visualization design and development  Analyzing, compiling, cleansing, interpreting, joining and staging data ', ' Candidate should be a SQL expert; must be able to optimize queries and join datasets efficiently ', ' Synthesize large volumes of data and complex concepts into clear accessible learnings ', ' Act as a visualization subject matter expert providing support to team members ', ' Excited to work in the entertainment industry and, in particular, at a premiere video streaming service ', ' Delivering business intelligence and data visualization dashboard solutions  Looker or Tableau data visualization design and development  Analyzing, compiling, cleansing, interpreting, joining and staging data ', ' Work closely with key stakeholders to translate business expert analysis use cases into reporting requirements ', ' Analyzing, compiling, cleansing, interpreting, joining and staging data ', ' The Daily ', ' For Looker, must be able to configure the entire pipeline - create Views/Models/Explores ', "" Develop strong cross-functional partnerships across the company (Engineering, Strategy, Marketing, Product, Operations) to drive our team's success "", ' Assist in building compelling presentations that communicate clear actionable insights ', ' Detail oriented and cares about the quality of the input data as well as how the processed data is ultimately interpreted and used ', ' The Essentials ', ' Looker or Tableau data visualization design and development ', "" Bachelor's Degree in Computer Science, Engineer, Mathematics or similar required (masters degree is a plus)  3+ years of relevant experience: Delivering business intelligence and data visualization dashboard solutions  Looker or Tableau data visualization design and development  Analyzing, compiling, cleansing, interpreting, joining and staging data  Candidate should be a SQL expert; must be able to optimize queries and join datasets efficiently  For Looker, must be able to configure the entire pipeline - create Views/Models/Explores  Proven track record of performing comprehensive analyses independently  Strong communicator, for both technical and non-technical audiences  Detail oriented and cares about the quality of the input data as well as how the processed data is ultimately interpreted and used  High tolerance for ambiguity and fast-changing environment  Excited to work in the entertainment industry and, in particular, at a premiere video streaming service "", ' Develop and maintain beautifully designed dashboards consumed by the HBO Max Leadership team, and build interactive dashboards to best support self-service BI to users ', ' Delivering business intelligence and data visualization dashboard solutions ', ' High tolerance for ambiguity and fast-changing environment ']",Associate,Full-time,Information Technology,Consumer Goods,2020-12-30 19:32:10
