job_title,company,location,date_posted,applicants,job_text,seniority_level,employment_type,job_function,industries,date_scraped
Forecast/Data Analyst - Tableau required,"Schuback Search Associates, Ltd.","New Orleans, LA",10 hours ago,29 applicants,"[' ', '', '-The following are additional preferred criteria: SQL, MS Azure, Python, PowerBI, or other visualization software. ', 'Qualified candidates will have the following:', 'Solid experience with Tableau, statistical analysis and forecasting required.', ""Bachelor's degree in mathematics or related field and 4-5 years of related experience or equivalent. -Solid experience with Tableau, statistical analysis and forecasting required. "", '\xa0', 'SQL, MS Azure', 'This well-established company located in New Orleans is seeking to hire an experienced analyst with solid forecasting, statistical/mathematics and Tableau work experience.   The Planning/Forecast Analyst will have the following duties: ', 'This is a direct-hire, not C2C or contract role. Candidates must be US citizens or Permanent Residents and able to permanently relocate to New Orleans in the near future. ', '1. Responsible for completing the design day forecasts, normal volume requirements by month and daily forecast requirements by load study throughout the enterprise. 2. Responsible for comparing actual volumes to forecasted volumes to determine variance and further analyze variance by each component (ie resulting from weather difference, number of customers etc.) annually for peak/design day and monthly forecasts. 3. Responsible for modifying forecasts as necessary and communicating those revisions to appropriate personnel to be utilized in revising supply purchase and storage plans. 4. Provides each business division regulatory support including processing data requests preparing testimony and testifying before state commissions. 5. Evaluates transportation and storage capacity to ensure ability to meet peak days. 6. Evaluates and optimizes transportation portfolio considering alternative transportation options upstream pipeline capacity and market changes that could affect the portfolio. 7. Responsible for working with engineers and operations to evaluate local production opportunities. ', ""Qualified candidates will have the following:  -Bachelor's degree in mathematics or related field and 4-5 years of related experience or equivalent. -Solid experience with Tableau, statistical analysis and forecasting required. "", '-The following are additional preferred criteria: SQL, MS Azure, Python, PowerBI, or other visualization software.', 'This is a direct-hire, not C2C or contract role. Candidates must be US citizens or Permanent Residents and able to permanently relocate to New Orleans in the near future.']",Associate,Full-time,Information Technology,Computer Software,2020-08-29 22:25:58
Senior Big Data Engineer,Definitive Healthcare,"Framingham, MA",10 hours ago,Be among the first 25 applicants,"['', 'Business Development Manager“Great team. Amazing growth. Employees are treated very well.”', 'Industry leading products', 'Definitive Hiring Philosophy', 'Skills Required', 'Your Challenge', 'Competitive benefits package including great healthcare benefits and a 401(k) match', 'Cares deeply about quality', 'Demonstrated ability to create normalized and star-schema database designs using database modeling techniques. Superior understanding of normalization and denormalization.', 'Participates in Agile ceremonies', 'Profile AnalystIf you don’t fit all of these qualifications, but believe you’re still a great fit, feel free to apply and tell us why in your cover letter.Definitive Hiring PhilosophyDefinitive Healthcare is an equal opportunity employer that celebrates diversity and is committed to creating an inclusive workplace with equal opportunity for all applicants and teammates. Our goal is to recruit the most talented people from a diverse candidate pool regardless of race, color, religion, age, gender, gender identity, sexual orientation or any other status. If you’re interested in working in a fast growing, exciting working environment – we encourage you to apply!', 'Why we love Definitive, and why you will too!', 'Has more than 5 years of experience in a fast-paced Agile software development environment', 'Work alongside some of the most talented and dedicated teammates', ' Solid computer science fundamentals Understands deeply how to build data warehouses and data marts Advanced knowledge of Big Data PaaS components in the cloud, preferably with Azure Strong ability to design and build complex software systems in the cloud to meet any Big Data needs Demonstrated ability to create normalized and star-schema database designs using database modeling techniques. Superior understanding of normalization and denormalization. Expert-level data modeling Working knowledge of RDBMS, NoSQL and Graph databases Can deliver high-quality data solutions with minimal supervision ', 'Research Analyst“I have waited 36 years to work at a dream job for a dream company and I am so happy to have finally got there.”', 'Business Development Manager“Great team. Amazing growth. Employees are treated very well.”Research Analyst“I have waited 36 years to work at a dream job for a dream company and I am so happy to have finally got there.”Profile AnalystIf you don’t fit all of these qualifications, but believe you’re still a great fit, feel free to apply and tell us why in your cover letter.Definitive Hiring PhilosophyDefinitive Healthcare is an equal opportunity employer that celebrates diversity and is committed to creating an inclusive workplace with equal opportunity for all applicants and teammates. Our goal is to recruit the most talented people from a diverse candidate pool regardless of race, color, religion, age, gender, gender identity, sexual orientation or any other status. If you’re interested in working in a fast growing, exciting working environment – we encourage you to apply!', 'Best Places to Work', 'Advanced knowledge of Big Data PaaS components in the cloud, preferably with Azure', 'Expert-level data modeling', 'THE BEST', 'Senior Big Data Engineer ', 'Flexible and dynamic culture', 'Is always thinking of better ways to do something', 'Understands deeply how to build data warehouses and data marts', 'Contributes significantly to architectural decisions around our data', 'Isn’t afraid to fail', 'Can deliver high-quality data solutions with minimal supervision', 'Solid computer science fundamentals', 'Work hard, and have fun doing it', 'Mentors more junior members of the team', 'Incredibly fast growth means limitless opportunity', 'Ensures solutions are built, according to business and technical specifications, supporting an error-free and high-performing platform', 'Definitive Cares, our community service group, gives all of us a chance to give back', 'Strong ability to design and build complex software systems in the cloud to meet any Big Data needs', 'Performs code reviews and supports SQL optimization and tuning', ' Has more than 5 years of experience in a fast-paced Agile software development environment Ensures solutions are built, according to business and technical specifications, supporting an error-free and high-performing platform Contributes significantly to architectural decisions around our data Performs code reviews and supports SQL optimization and tuning Mentors more junior members of the team Participates in Agile ceremonies Is always thinking of better ways to do something Isn’t afraid to fail Cares deeply about quality ', 'The Senior Big Data Engineer At Definitive Healthcare', ' Industry leading products Work hard, and have fun doing it Incredibly fast growth means limitless opportunity Flexible and dynamic culture Work alongside some of the most talented and dedicated teammates Definitive Cares, our community service group, gives all of us a chance to give back Competitive benefits package including great healthcare benefits and a 401(k) match ', 'Working knowledge of RDBMS, NoSQL and Graph databases', 'Definitive Healthcare is an equal opportunity employer that celebrates diversity and is committed to creating an inclusive workplace with equal opportunity for all applicants and teammates. Our goal is to recruit the most talented people from a diverse candidate pool regardless of race, color, religion, age, gender, gender identity, sexual orientation or any other status. If you’re interested in working in a fast growing, exciting working environment – we encourage you to apply!', 'If you don’t fit all of these qualifications, but believe you’re still a great fit, feel free to apply and tell us why in your cover letter.', 'What Our Employees Are Saying About Us On Glassdoor']",Mid-Senior level,Full-time,Engineering,Marketing and Advertising,2020-08-29 22:25:58
"Engineer IV, Software - Big Data",Omnicell,"Mountain View, CA",12 hours ago,Be among the first 25 applicants,"['', ' Provide technical leadership to agile teams – onshore and offshore: Mentor junior engineers and new team members, and apply technical expertise to challenging programming and design problems ', ' Working knowledge of Databricks, Team Foundation Server, TeamCity, Octopus deploys and DataDog ', ' Master’s degree ', 'Preferred Knowledge And Skills', ' Continue to improve code quality by tracking, reducing and avoiding technical debt ', ' Experience with building stream-processing systems, using solutions such as Storm or Spark-Streaming ', 'Responsibilities', 'Basic Requirements', '  Deep development experience of distributed/scalable systems and high-volume transaction applications, participating in architecting big data projects   Hands-on programming experience in Scala, Python, and other object-oriented programming languages.   Expert in using Big data technologies like, Apache Kafka, Apache Spark, Real Time streaming, Structured Streaming, Delta lake   Excellent analytical and problem-solving skills.   Energetic, motivated self-starter that is eager to excel with excellent inter-personal skills.   Expert in knowing a balance driving the right architecture but realizing the realities of having customers and the need to ship software  ', ' Analyze and improve efficiency, scalability, and stability of various system resources once deployed ', ' Expert in knowing a balance driving the right architecture but realizing the realities of having customers and the need to ship software ', 'Software Engineer IV – Big Data', ' Translate business requirements into effective technology solutions ', ' Corporate office/lab environment. ', '  Master’s degree   Hands-on working experience in cloud infrastructure like AWS. Able to scale cade and deploy applications in the public cloud using technologies like AWS, Lambda, Docker, Kubernetes.   Experience with Big Data ML toolkits, such as Mahout, SparkML, or H2O   Experience working with healthcare specific data exchange formats including HL7 and FHIR.   Experience with building stream-processing systems, using solutions such as Storm or Spark-Streaming   Experience with various messaging systems, such as Kafka or RabbitMQ   Working knowledge of Databricks, Team Foundation Server, TeamCity, Octopus deploys and DataDog  ', '  Bachelor’s degree   8+ years’ experience in software engineering   Experience developing ETL processing flows with MapReduce technologies like Spark and Hadoop   Experience developing with ingestion and clustering frameworks such as Kafka, Zookeeper, YARN  ', ' Excellent analytical and problem-solving skills. ', ' Hands-on programming experience in Scala, Python, and other object-oriented programming languages. ', ' Help lead the design, architecture and development of the Omnicell Data Platform ', '  Corporate office/lab environment.   Ability to travel 10% of the time.  ', ' Experience working with healthcare specific data exchange formats including HL7 and FHIR. ', ' Experience with various messaging systems, such as Kafka or RabbitMQ ', ' Resolve defects/bugs during QA testing, pre-production, production, and post-release patches ', 'Required Knowledge And Skills', ' Help define the technology roadmap that will support the product development roadmap ', ' Bachelor’s degree ', ' Ability to travel 10% of the time. ', ' Conduct design and code reviews ', ' Hands-on working experience in cloud infrastructure like AWS. Able to scale cade and deploy applications in the public cloud using technologies like AWS, Lambda, Docker, Kubernetes. ', ' 8+ years’ experience in software engineering ', ' Experience developing with ingestion and clustering frameworks such as Kafka, Zookeeper, YARN ', ' Experience with Big Data ML toolkits, such as Mahout, SparkML, or H2O ', ' Energetic, motivated self-starter that is eager to excel with excellent inter-personal skills. ', ' Deep development experience of distributed/scalable systems and high-volume transaction applications, participating in architecting big data projects ', ' Experience developing ETL processing flows with MapReduce technologies like Spark and Hadoop ', '  Translate business requirements into effective technology solutions   Help lead the design, architecture and development of the Omnicell Data Platform   Conduct design and code reviews   Resolve defects/bugs during QA testing, pre-production, production, and post-release patches   Analyze and improve efficiency, scalability, and stability of various system resources once deployed   Provide technical leadership to agile teams – onshore and offshore: Mentor junior engineers and new team members, and apply technical expertise to challenging programming and design problems   Help define the technology roadmap that will support the product development roadmap   Continue to improve code quality by tracking, reducing and avoiding technical debt   Focus on always putting the customer first.  ', ' Focus on always putting the customer first. ', ' Expert in using Big data technologies like, Apache Kafka, Apache Spark, Real Time streaming, Structured Streaming, Delta lake ', 'Work Conditions']",Associate,Full-time,Engineering,Information Technology and Services,2020-08-29 22:25:58
Data Analyst Supporting the US Attorney's Office,FSA,"Roanoke, VA",20 hours ago,Be among the first 25 applicants,"['', 'Coordinates requests for additional information as needed.', 'Performs other duties as assigned.', ' Receives, gathers, analyzes, and organizes information from multiple sources. Ensures completeness of received information and reconciles inconsistencies. Accurately enters required data into one or more databases, documents, or spreadsheets. Establishes and maintains physical files. Keeps track of case file status in order to ensure compliance with established deadlines. Coordinates requests for additional information as needed. Selects relevant information from a variety of sources in order to prepare documents, reports, summaries, and replies to inquiries, ensuring accuracy and proper format of the information provided. Performs word processing relevant to case. Provides accurate and timely status updates. Performs other duties as assigned. ', 'Receives, gathers, analyzes, and organizes information from multiple sources.', 'Keeps track of case file status in order to ensure compliance with established deadlines.', 'Responsibilities', 'Ensures completeness of received information and reconciles inconsistencies.', 'Selects relevant information from a variety of sources in order to prepare documents, reports, summaries, and replies to inquiries, ensuring accuracy and proper format of the information provided.', 'Accurately enters required data into one or more databases, documents, or spreadsheets.', 'Performs word processing relevant to case.', 'Establishes and maintains physical files.', 'Provides accurate and timely status updates.']",Associate,Full-time,Information Technology,Legal Services,2020-08-29 22:25:58
Sr. Scientist (Epidemiologist or Pharmacoepidemiologist),Ascent Services Group,"Santa Clara, CA",17 hours ago,Be among the first 25 applicants,"['', 'He/she contributes to the primary strategic and operational responsibility for the design, execution, and reporting of RWD studies using a variety of available research and commercial healthcare databases.', ' Good project management skills (including ability to manage scope and effectively delegate to other functions, staff, contractors, and external vendors) ', 'NOTE: ', "" At least a Master's Degree in a data science related field (e.g. Epidemiology, Biostatistics) required, PhD preferred.  Background in biology or medicine, either through education or through professional experience. At least 5+ years (9+ years if no PhD) of relevant experience. Industry experience highly desired. Solid understanding and experience of using research and commercial RWD sources, national and regional disease data registries. China experience is highly preferred.  "", ' Excellent communication and collaborations skills (including interpersonal skills to contribute effectively in cross-functional team settings, ability to influence others without authority, ability to build strong collaborative relationships with scientific and non-scientific partners) ', 'He/She is a key contributor driverand promotes increasing adoption of and advancing the uses of RWD to supplement clinical study design and execution, and identifies opportunities where RWD could be the primary evidence generation mechanism to achieve regulatory and reimbursement objectives for IVD and CDS products being developed across Our client.', ' Working closely with clinical science and medical affairs directors across Diagnostics divisions, he/she (assists in) creates, confirms and validates disease & clinical hypotheses for RWD projects supporting commercial, market access, medical and regulatory needs. ', 'Seeking applicants past experience as an epidemiologist and/or pharmacoepidemiologist who consider themselves to be study design experts (not looking for data scientists). With an MS degree or higher!', ' Leads RWD analysis projects from start to completion, supporting execution of CDS strategy, analytical module development, and identifying opportunities for CDS implementation, and associated value messaging. ', ' Senior Quantitative Scientist is responsible for providing data science leadership for evidence generation using RWD, supporting In-Vitro Diagnostics (IVD) and CDS product portfolio at Our client. ', 'He/she is also responsible for identifying and establishing (participates in the identification, establishment of and access to) collaborations with healthcare institutes expanding sources of available RWD sources.', 'Expert knowledge of national and international coverage policies and proven experience in the use of RWD to influence reimbursement and clinical guidelines.', 'Has the ability to explain the strengths and limitations of Real-World Data such as national/regional registries, EMRs and other clinical data sources- in the context of designing RWD study designs.', 'Working closely with clinical science and medical affairs directors across Diagnostics divisions, he/she (assists in) creates, confirms and validates disease & clinical hypotheses for RWD projects supporting commercial, market access, medical and regulatory needs.', 'Strategic mindset and can-do attitude', ' He/she is also responsible for identifying and establishing (participates in the identification, establishment of and access to) collaborations with healthcare institutes expanding sources of available RWD sources. ', ' He/she contributes to the primary strategic and operational responsibility for the design, execution, and reporting of RWD studies using a variety of available research and commercial healthcare databases. ', 'Develops RWD study protocols and leads analysis projects supporting evidence needs of IVD and CDS product portfolio. Collaborates with internal and external partners (e.g., key opinion leaders, academic institutions, CROs) on the design and implementation of RWD studies.', 'Good project management skills (including ability to manage scope and effectively delegate to other functions, staff, contractors, and external vendors)', 'Solid understanding and experience of using research and commercial RWD sources, national and regional disease data registries. China experience is highly preferred. ', 'Excellent communication and collaborations skills (including interpersonal skills to contribute effectively in cross-functional team settings, ability to influence others without authority, ability to build strong collaborative relationships with scientific and non-scientific partners)', 'Senior Quantitative Scientist is responsible for providing data science leadership for evidence generation using RWD, supporting In-Vitro Diagnostics (IVD) and CDS product portfolio at Our client.', 'Title: Senior Scientist (Epidemiologist or Pharmacoepidemiologist)Location: ', 'At least 5+ years (9+ years if no PhD) of relevant experience. Industry experience highly desired.', 'Job Accountabilities / Tasks', ""At least a Master's Degree in a data science related field (e.g. Epidemiology, Biostatistics) required, PhD preferred. "", ' Expert knowledge of regulatory guidelines for Diagnostics/Pharma Expert knowledge of national and international coverage policies and proven experience in the use of RWD to influence reimbursement and clinical guidelines. ', 'Minimum Skills And Experience', ' He/She is a key contributor driverand promotes increasing adoption of and advancing the uses of RWD to supplement clinical study design and execution, and identifies opportunities where RWD could be the primary evidence generation mechanism to achieve regulatory and reimbursement objectives for IVD and CDS products being developed across Our client. ', ' Develops RWD study protocols and leads analysis projects supporting evidence needs of IVD and CDS product portfolio. Collaborates with internal and external partners (e.g., key opinion leaders, academic institutions, CROs) on the design and implementation of RWD studies. ', 'Background in biology or medicine, either through education or through professional experience.', 'Leads RWD analysis projects from start to completion, supporting execution of CDS strategy, analytical module development, and identifying opportunities for CDS implementation, and associated value messaging.', ' Proven hands-on experience in generating new hypotheses, extracting/managing big data sets, design, implementation and reporting of RWD studies, in the Diagnostics/Pharma industry ', ' Has the ability to explain the strengths and limitations of Real-World Data such as national/regional registries, EMRs and other clinical data sources- in the context of designing RWD study designs. ', 'Proven hands-on experience in generating new hypotheses, extracting/managing big data sets, design, implementation and reporting of RWD studies, in the Diagnostics/Pharma industry', 'Language: English, Mandarin highly desired', ' Ensures high quality results from analysis are published as posters, abstracts and manuscripts at a variety of external and internal events and congresses increasing scientific profile and visibility of the organization. ', 'Ensures high quality results from analysis are published as posters, abstracts and manuscripts at a variety of external and internal events and congresses increasing scientific profile and visibility of the organization.', 'Summary', ' Strategic mindset and can-do attitude Language: English, Mandarin highly desired', 'Expert knowledge of regulatory guidelines for Diagnostics/Pharma', 'Responsibilities Include']",Entry level,Full-time,Research,Pharmaceuticals,2020-08-29 22:25:58
