job_title,company,location,date_posted,applicants,job_text,seniority_level,employment_type,job_function,industries,date_scraped
Data Analyst,Bakkt,"Alpharetta, GA",11 hours ago,179 applicants,"['', 'Identify actionable insights to influence product roadmap and strategy based on behavioral/usage data, customer feedback, and external market data', 'Experience in creating reports and presentations that effectively communicate analysis, insights, and recommendations in a way that’s easy to understand', 'Responsibilities:\xa0\xa0', 'Act as an SME on Bakkt data across all products and systems', 'Work with product leads to develop measurable experiments and evaluate results', 'Responsibilities:', 'Be able to generate actionable insights from data and leverage data analysis to help the business make decisions', 'Bakkt is devoted to having diversity in its workforce and is proud to be an equal opportunity employer. Bakkt does not make any employment decisions based on race, color, religion, sex, national origin, veteran status, disability, age, sexual orientation, gender identity of any other characteristic protected by law.', 'Bakkt unlocks the $1.2+ trillion of digital assets that is currently held in cryptocurrencies, rewards and loyalty points, gaming assets and merchant stored value. We began in 2018 with the vision to bring trust and transparency to digital assets. Through the Bakkt Warehouse and Bakkt Bitcoin Futures and Options contracts, we serve institutional clients in an end-to-end regulated market with true price transparency. For consumers, Bakkt aggregates digital assets to enable instant liquidity and to empower users to trade, transfer and pay however they want. Merchants within the Bakkt ecosystem see a lower cost of payment acceptance, enhanced customer engagement, and decreased loyalty through a variety of redemption options.', 'Compile, prepare, and present findings and insights to internal and external audiences', '\xa0Identify, analyze, and interpret trends, patterns, and opportunities through analysis of complex data sets across Bakkt productsProvide strategic recommendations on how data/analytics can be leveraged to help achieve company goalsCollect requirements from stakeholders across the organization to develop and document key metrics and build and maintain dashboards for internal users to receive real-time visibility to those metricsIdentify actionable insights to influence product roadmap and strategy based on behavioral/usage data, customer feedback, and external market dataAct as an SME on Bakkt data across all products and systemsDesign and document data models and data flows between Bakkt systems and partner systemsWork with technical architects to extend the Bakkt data ecosystem as our products grow and evolveCompile, prepare, and present findings and insights to internal and external audiencesUnderstand statistical modeling, clustering, and test designSupport marketing automation processes, including customer segmentation using transactional, demographic, psychographic, and behavioral dataEnsure data collection, management, and reporting are in accordance with Bakkt security and compliance requirementsWrite requirements (e.g. to collect data for new use cases), work with engineering teams to implement those requirements, and verify the changesWork with product leads to develop measurable experiments and evaluate resultsVerify the completeness and accuracy of data in source systems, intermediary systems (e.g. data warehouse), and resulting reports and dashboards', 'Verify the completeness and accuracy of data in source systems, intermediary systems (e.g. data warehouse), and resulting reports and dashboards', 'Bachelor’s degree and seven years related experience and/or training; or equivalent combination of education and experienceProven analytic skills, including querying, mining, evaluation, analysis, and visualization using multiple data sets, technologies, and analytical techniques to identify business opportunities and shape strategyBe able to generate actionable insights from data and leverage data analysis to help the business make decisionsStrong experience and skill with query languages (e.g. SQL) and Business Intelligence tools (e.g. Tableau), with the ability to learn other toolsExperience in creating reports and presentations that effectively communicate analysis, insights, and recommendations in a way that’s easy to understand\ufeffTeam oriented and able to collaborate with other stakeholders within the company to take an idea from conception to launch.', '\xa0Identify, analyze, and interpret trends, patterns, and opportunities through analysis of complex data sets across Bakkt products', 'Data Analsyt', 'Bachelor’s degree and seven years related experience and/or training; or equivalent combination of education and experience', 'Strong experience and skill with query languages (e.g. SQL) and Business Intelligence tools (e.g. Tableau), with the ability to learn other tools', '\ufeffTeam oriented and able to collaborate with other stakeholders within the company to take an idea from conception to launch.', 'Write requirements (e.g. to collect data for new use cases), work with engineering teams to implement those requirements, and verify the changes', 'Collect requirements from stakeholders across the organization to develop and document key metrics and build and maintain dashboards for internal users to receive real-time visibility to those metrics', 'Design and document data models and data flows between Bakkt systems and partner systems', 'Provide strategic recommendations on how data/analytics can be leveraged to help achieve company goals', 'Understand statistical modeling, clustering, and test design', 'Ensure data collection, management, and reporting are in accordance with Bakkt security and compliance requirements', 'Who We Are', 'Proven analytic skills, including querying, mining, evaluation, analysis, and visualization using multiple data sets, technologies, and analytical techniques to identify business opportunities and shape strategy', 'Support marketing automation processes, including customer segmentation using transactional, demographic, psychographic, and behavioral data', 'Work with technical architects to extend the Bakkt data ecosystem as our products grow and evolve', 'For consumers like you, the Bakkt App allows you to aggregate your digital assets to track, spend, and send them in the way that best suits your lifestyle. Bakkt is the only place that puts the power in your hands by enabling all-in-one aggregation. Something like this has never been built before, and we aim to make what was previously thought impossible, possible – leveraging our values of betting big and serving as multipliers on our team. We believe we are more than the sum of our parts and we want you to bet big with us. Now, let’s get to the real reason why you’re here – how we can work together.', 'Requirements']",Mid-Senior level,Full-time,Quality Assurance,Financial Services,2020-12-30 19:32:10
Data Analyst,Biteable,United States,49 minutes ago,Be among the first 25 applicants,"['', '“The development team is a great group of people. They’re smart and interested in doing high-quality work, but foster a social and supportive atmosphere, too.”', 'Biteable is a bit of a rarity. Everyone genuinely cares about each other. When asked, team members use words like these to describe each other: rigorous, respectful, open, supportive, honest, and egoless.', ""Writing and presenting. As an informative role within a remote company, you'll need to over-communicate with confidence."", 'You know big SaaS. You’re versed in fundamental SaaS and finance metrics, with a meticulous nature for getting them right.', 'Predicting the future. Use your forecasting skills in Python or R to forecast future performance.', 'We’re growing fast and have a remote team scattered around the world. We are informal, structurally flat, and fun to work with.', 'Created a community of over 7 million usersRendered more than 12 million videosRaised $3.9 million in venture capital', ""Testing and evaluating. You'll measure the performance of new launches and features with use of A/B testing.\xa0"", 'You know big SaaS.', 'You have 5+ years of experience.', 'Hardware included.', 'You have an eye for visualization. You bring complex ideas to life in a way that’s easy to understand.', 'You like puzzles. You enjoy technical challenges and you enjoy solving them even more.', 'Based in the US or Canada. Your closest team members will be on the same or an overlapping timezone.', 'Testing and evaluating.', 'We want you to start soon. Apply via the link, on why you and Biteable are a match made in heaven.', 'All about the role', 'You seek out root causes.', 'The Biteable team is scattered around the globe from Seattle to Hobart, and lots of places in between. Our diverse backgrounds, experiences, and perspectives are the glue that binds us.', ""You're a solid communicator."", ""You're about quality. Your analysis, commentary, and documentation set the standard. When you hand someone a finding, it’s something they can trust."", 'Based in the US or Canada.', ""Lots of SQL. You'll work in Redshift and Tableau daily to build out our reporting suite.Testing and evaluating. You'll measure the performance of new launches and features with use of A/B testing.\xa0Writing and presenting. As an informative role within a remote company, you'll need to over-communicate with confidence.Predicting the future. Use your forecasting skills in Python or R to forecast future performance.Based in the US or Canada. Your closest team members will be on the same or an overlapping timezone.Hardware included. You'll get a new laptop and a budget for improving your home office."", '\ufeffHow to apply', 'We treat each other like adults, and we set our own schedules. We also recognize that families are part of our daily lives, and we like that they often turn up on our video calls.', ""You're collaborative. You enjoy working with diverse teams across multiple functions."", '“I’m thankful for the flexibility Biteable gives me around my family commitments.”', ""“Biteable's team of smart, funny, engaged, and caring people makes my work here enjoyable, every day. Being close to decisions and decision-makers helps me make an impact on our work.”"", 'All about you', 'Predicting the future.', 'You seek out root causes. Surface-level insights won’t cut it; you don’t stop searching until you find the source of a problem.', 'Created a community of over 7 million users', ""You're about quality."", ""At Biteable we're committed to the happiness of our staff. We love it when everyone feels supported, and we doubly love it when everyone feels empowered to create."", ""Don't just take our word for it, though. Here are a few quotes that we didn't make up:"", ""We’ll review your application and then set up informal interviews with a handful of candidates. We've got our fingers crossed that you're the one we're looking for."", 'Lots of SQL.', ""Lots of SQL. You'll work in Redshift and Tableau daily to build out our reporting suite."", 'You like video', ""Hello. Biteable here. Are you top notch at SQL and Python? Do you count Excel rows to help you fall asleep? We should talk. We're looking for a special someone to provide fresh insights and perspectives on our data. Read on for all the important stuff about you, us, and the role."", ""You're collaborative. You enjoy working with diverse teams across multiple functions.You know big SaaS. You’re versed in fundamental SaaS and finance metrics, with a meticulous nature for getting them right.You have an eye for visualization. You bring complex ideas to life in a way that’s easy to understand.You like puzzles. You enjoy technical challenges and you enjoy solving them even more.You seek out root causes. Surface-level insights won’t cut it; you don’t stop searching until you find the source of a problem.You're about quality. Your analysis, commentary, and documentation set the standard. When you hand someone a finding, it’s something they can trust.You like video. You watch your fair share of YouTube and you're into the way video helps people communicate.You're a solid communicator. Verbal and written communication are two things you excel at.You have 5+ years of experience."", 'Raised $3.9 million in venture capital', 'We are Biteable, a tech start-up that makes (jaw-dropping) videos possible for everyone. We stand apart in our market thanks to our dedication to studio-quality content and our passion for simplicity.', ""You like video. You watch your fair share of YouTube and you're into the way video helps people communicate."", 'Since our launch in 2014 we’ve:', 'A little about working at Biteable', 'Writing and presenting.', ""You're a solid communicator. Verbal and written communication are two things you excel at."", ""Hardware included. You'll get a new laptop and a budget for improving your home office."", 'All about us', ""You're collaborative."", 'Rendered more than 12 million videos', 'All about our culture', 'You like puzzles.', 'You have an eye for visualization.']",Mid-Senior level,Full-time,Information Technology,Computer Software,2020-12-30 19:32:10
"Business Intelligence Analyst, YouTube",YouTube,"San Bruno, CA",19 hours ago,101 applicants,"['', 'Own strategy for shared analyst infrastructure (e.g., code base, business intelligence stack), and continually innovate on infrastructure for the analyst community to utilize. As new products are launched, communicate to all relevant stakeholders; solicit, record, prioritize and incorporate relevant feedback on metrics platform.', 'Advocate technical best practices on pipelines, dashboards, code review practices, and data concepts; leads technical training for business analysts.', 'Conduct requirements gathering and project scoping sessions with subject matter experts, business users, and executive stakeholders to discover and define business reporting needs.', ""Bachelor's degree in a quantitative discipline (e.g., Statistics, Computer Science, Math, Physics, Engineering) or equivalent practical experience."", ' Lead end-to-end development and deployment of “single source of truth” centralized reports, dashboards, models and tools to analyze, report, and present partnerships and operations related data associated with YouTube Content Organization. Conduct requirements gathering and project scoping sessions with subject matter experts, business users, and executive stakeholders to discover and define business reporting needs. Use effective data visualization and analytical skills to simplify complex business flows and enable faster decision making and execution. Own strategy for shared analyst infrastructure (e.g., code base, business intelligence stack), and continually innovate on infrastructure for the analyst community to utilize. As new products are launched, communicate to all relevant stakeholders; solicit, record, prioritize and incorporate relevant feedback on metrics platform. Advocate technical best practices on pipelines, dashboards, code review practices, and data concepts; leads technical training for business analysts. ', 'About The Job', 'Use effective data visualization and analytical skills to simplify complex business flows and enable faster decision making and execution.', 'Experience with relational databases including SQL queries, database definition and schema design.', 'Experience with presenting complex technical solutions to senior stakeholders. ', "" Bachelor's degree in a quantitative discipline (e.g., Statistics, Computer Science, Math, Physics, Engineering) or equivalent practical experience. 4 years of experience in data engineering or business intelligence role. Experience with relational databases including SQL queries, database definition and schema design. Experience with one or more programming languages (Python, Java, C++, etc.). "", 'Ability to navigate ambiguity and excel in a fast paced environment. ', 'Experience with developing front-end reporting with BI suites (such as PLX, Data Studio, Tableau, Sisense, Looker, Qlikview etc.) and passionate about data visualizations and storytelling through data.', 'Experience with one or more programming languages (Python, Java, C++, etc.).', 'San Bruno, CA, USA; Los Angeles, CA, USA', 'MS, MBA, or other advanced degree in a relevant field. ', ' MS, MBA, or other advanced degree in a relevant field.  Experience writing and maintaining extract, transform, and load scripts (ETLs) which operate on a variety of structured and unstructured sources.  Experience with developing front-end reporting with BI suites (such as PLX, Data Studio, Tableau, Sisense, Looker, Qlikview etc.) and passionate about data visualizations and storytelling through data. Experience with presenting complex technical solutions to senior stakeholders.  Ability to navigate ambiguity and excel in a fast paced environment.  ', 'Experience writing and maintaining extract, transform, and load scripts (ETLs) which operate on a variety of structured and unstructured sources. ', '4 years of experience in data engineering or business intelligence role.', 'Lead end-to-end development and deployment of “single source of truth” centralized reports, dashboards, models and tools to analyze, report, and present partnerships and operations related data associated with YouTube Content Organization.', 'Responsibilities']",Not Applicable,Full-time,Business Development,Information Services,2020-12-30 19:32:10
Data Analyst II,Microsoft,"Redmond, WA",18 hours ago,112 applicants,"['', '2+ years of experience in processing and building visualizations using reporting tool as Power BI', 'Define, generate, and monitor KPI metrics for different Security, Compliance and Identity (SCI) solutions', 'Bachelors or Master’s degree in statistics, data science, applied mathematics, computer science, econometrics or a related field, or equivalent alternative education, skills, and/or practical equivalent experience', '2+ years of experience in analyzing large volumes of data, extracting insights processing large data sets using SQL or SQL-like scripting language2+ years of experience in processing and building visualizations using reporting tool as Power BIExcellent written and oral communication skills, particularly the ability to synthesize complex issues/scenarios into easy-to-understand conceptsAttention to detail with self-discipline and a drive for resultsDemonstrated ability to work in ambiguous situations and across organizational boundariesBachelors or Master’s degree in statistics, data science, applied mathematics, computer science, econometrics or a related field, or equivalent alternative education, skills, and/or practical equivalent experience', 'Responsibilities', 'Provide thought leadership on SCI marketing based on the insights / learning from analyses', '2+ years of experience in analyzing large volumes of data, extracting insights processing large data sets using SQL or SQL-like scripting language', 'Conduct data analyses deliver insights and learnings on marketing initiatives / programs (BI) for Security, Compliance and Identity (SCI) solutions', 'Inform business strategy through deep insights, cross team collaboration (with data engineering and data science) and strong storytelling', 'Present insights and learnings to key stakeholders / executives, drive actions and impact', 'Attention to detail with self-discipline and a drive for results', 'Partner with multiple marketing and engineering teams to explore data, design learning plan, and conduct analyses', 'Excellent written and oral communication skills, particularly the ability to synthesize complex issues/scenarios into easy-to-understand concepts', 'Demonstrated ability to work in ambiguous situations and across organizational boundaries', 'Qualifications', 'Conduct data analyses deliver insights and learnings on marketing initiatives / programs (BI) for Security, Compliance and Identity (SCI) solutionsDefine, generate, and monitor KPI metrics for different Security, Compliance and Identity (SCI) solutionsAutomate reporting and provide exploration capability for reporting usersPartner with multiple marketing and engineering teams to explore data, design learning plan, and conduct analysesPresent insights and learnings to key stakeholders / executives, drive actions and impactProvide thought leadership on SCI marketing based on the insights / learning from analysesInform business strategy through deep insights, cross team collaboration (with data engineering and data science) and strong storytelling', 'Automate reporting and provide exploration capability for reporting users']",Not Applicable,Full-time,Information Technology,Computer Hardware,2020-12-30 19:32:10
