job_title,company,location,date_posted,applicants,job_text,seniority_level,employment_type,job_function,industries,date_scraped
Data Analyst,MindSource,"San Francisco, CA",21 hours ago,79 applicants,"['', 'Expertise in SQL and knowledge of cloud data environments e.g. AWS', 'Hone your skills on data visualization', 'Fluent in Mandarin and EnglishExperience with scripting and analysis languages (Python, R)At least 3-5 years of experience in analytics or closely related fieldExpertise in SQL and knowledge of cloud data environments e.g. AWSFamiliarity with Excel, Tableau, Looker, or similar reporting too', 'BA/BS in Statistics, Computer Science or a related technical field or equivalent practical experience', 'At least 3-5 years of experience in analytics or closely related field', 'Expertise in SQL', 'Spearhead the development of data models, algorithms, and event triggers to drive sophisticated customer profiling, segmentation, and personalization enhancements to the consumer experienceDrive interpretation, socialization, and adoption of analytics insightsAssist in defining, and developing deep insights and root cause analysisCraft machine learning and predictive models to drive intelligent product featuresCollaborate across product, engineering, data science, product marketing, sales and our customers to continuously improve \xa0product offerings across the marketHone your skills on data visualization', 'A strong intuition for crafting raw data and analysis into well-written and persuasive content', 'Spearhead the development of data models, algorithms, and event triggers to drive sophisticated customer profiling, segmentation, and personalization enhancements to the consumer experience', 'Assist in defining, and developing deep insights and root cause analysis', 'Must Have skills: Hiring Manager Notes', 'Understanding of Chinese-Mandarin', 'Industry or educational experience in text mining, information retrieval, knowledge extraction and building knowledge graphs', 'What We Look For In You:', 'Strong interpersonal skills, with an emphasis on teamwork, initiative and integrity', 'Experience with scripting and analysis languages (Python, R)', 'Experience working in an enterprise or B2B space, as well as the consumer or B2C space', 'Drive interpretation, socialization, and adoption of analytics insights', 'Chinese-Mandarin', 'Excel, Tableau, Looker, or similar reporting tool', 'Title: Data Analyst', 'Experience with scripting and analysis languages (Python, R)Experience working in an enterprise or B2B space, as well as the consumer or B2C spaceIndustry or educational experience in text mining, information retrieval, knowledge extraction and building knowledge graphsFluent in Mandarin and English', 'BA/BS in Statistics, Computer Science or a related technical field or equivalent practical experienceAt least 3-5 years of experience in analytics or closely related fieldUnderstanding of Chinese-MandarinA strong intuition for crafting raw data and analysis into well-written and persuasive contentExpertise in SQL and knowledge of cloud data environments e.g. AWSFamiliarity with Excel, Tableau, Looker, or similar reporting toolStrong interpersonal skills, with an emphasis on teamwork, initiative and integrityComfort with working in a fast-paced environment, handling multiple priorities simultaneously', 'Fluent in Mandarin and English', 'Nice to Haves:', 'Familiarity with Excel, Tableau, Looker, or similar reporting too', ' Location: San Francisco, CA (Initially it starts as remote after pandemic you will be working onsite)', ""What You'll Be Doing:"", 'Comfort with working in a fast-paced environment, handling multiple priorities simultaneously', 'Craft machine learning and predictive models to drive intelligent product features', 'Familiarity with Excel, Tableau, Looker, or similar reporting tool', ' Duration: Fulltime ', 'Collaborate across product, engineering, data science, product marketing, sales and our customers to continuously improve \xa0product offerings across the market']",Mid-Senior level,Full-time,Information Technology,Information Technology and Services,2021-01-28 13:52:32
Data Specialist,IBM,"New York, NY",5 hours ago,Be among the first 25 applicants,"['', 'About Business Unit', 'About IBM', '5+ years experience in database management; data development, architecture, automation, analysis, transportation and transformation ', 'Experience working directly with stakeholders', 'Ability to communicate complex and detailed information in a succinct and results-oriented fashion', 'Ability to work within a cross-functional team collaboratively with result-driven mindset and ownership', 'Familiarity with data security and government', 'Location: Southbury, CT OR Raleigh, NC- relocation assistance is not available.#DWE2020 ', ""Business knowledge and work experience in IBM's talent area (e.f. performance, skills)"", '5+ years experience in database management; data development, architecture, automation, analysis, transportation and transformation Familiarity with data security and governmentAbility to communicate complex and detailed information in a succinct and results-oriented fashionAbility to work within a cross-functional team collaboratively with result-driven mindset and ownership', ""Business knowledge and work experience in IBM's talent area (e.f. performance, skills)Experience working directly with stakeholdersExperience working across multiple offerings in talent area"", 'Experience working across multiple offerings in talent area', 'Preferred Technical And Professional Expertise']",Mid-Senior level,Full-time,Information Technology,Information Technology and Services,2021-01-28 13:52:32
Data Analyst,Axos Bank,"San Diego, CA",7 hours ago,Be among the first 25 applicants,"['', ' Workflow development tools ', ' The Role ', ' We bring together human insight and digital expertise to anticipate the needs of our customers. Our team members are innovative, technologically sophisticated, and motivated to achieve. ', 'Pre-Employment Drug Test', ' Are You A Fit? ', ' The Opportunity ', ' Learn more about working here! ', ' Financial services with understanding of core banking products; familiarity with Bank Secrecy Act  Workflow development tools ', ' Partner with different GRC teams, especially Bank Secrecy Act teams, to define and implement descriptive tabular and graphical reporting and analytics, for purposes such as Data Driven Compliance (DDC) reporting, audit requests, and data collection  Analyze and leverage high-volume data to identify relationships, trends and policy exceptions  Perform risk or regulation related special projects and assignments, as directed  Identify and execute enhancement or automation opportunities for the analytics team’s processes, using tools such as Python and R  Collaborate with teams throughout the company to create or improve existing processes ', ' Financial services with understanding of core banking products; familiarity with Bank Secrecy Act ', 'Job Functions And Work Environment', "" 2+ years' of experience with SQL or demonstrably equivalent skill (specifically developing and optimizing queries, customizing to specific requirements, and analyzing data) "", ' Born digital, Axos Bank has reinvented the banking model and grown to over $12 billion in assets since our founding in 2000. With a broad and ever-growing range of financial products, Axos Bank is rated among the top 5 digital banks in the country! Axos Financial is our holding company and publicly traded on the New York Stock Exchange under the symbol ""AX (NYSE: AX). ', 'Axos ', 'Preferred', ' Partner with different GRC teams, especially Bank Secrecy Act teams, to define and implement descriptive tabular and graphical reporting and analytics, for purposes such as Data Driven Compliance (DDC) reporting, audit requests, and data collection ', ' Perform risk or regulation related special projects and assignments, as directed ', ' Collaborate with teams throughout the company to create or improve existing processes ', ' Analyze and leverage high-volume data to identify relationships, trends and policy exceptions ', ' Willingness to learn Python and/or R ', ' Bachelor’s degree ', 'Equal Employment Opportunity', ' Familiarity with data visualization tools, such as Tableau or Power BI ', ' Identify and execute enhancement or automation opportunities for the analytics team’s processes, using tools such as Python and R ', ' Apply directly for consideration as we are not using any outside agencies for any of our openings ', "" Bachelor’s degree  2+ years' of experience with SQL or demonstrably equivalent skill (specifically developing and optimizing queries, customizing to specific requirements, and analyzing data)  Familiarity with data visualization tools, such as Tableau or Power BI  Willingness to learn Python and/or R ""]",Entry level,Full-time,Information Technology,Banking,2021-01-28 13:52:32
Data Analyst,Spotlight Inc.,Denver Metropolitan Area,2 hours ago,Be among the first 25 applicants,"['', 'Spotlight is a concierge consultancy in Denver that provides a unique experience to a select group of clients and consultants in the local community. We operate between a traditional national consultancy and a staffing business. Our focus is to help our clients address their complex challenges by leveraging our network of highly experienced and uniquely qualified delivery professionals. Having worked for global, national, and regional professional services firms for the last 25+ years, we established a simple and flexible business model.', 'SQL- data migration, cleaning\xa0', 'SQL- data migration, cleaning\xa0Power BI experienceAble to work independently', 'Key Skills:', 'Power BI experience', 'Please attach a resume to your application when possible. We are unable to sponsor or transfer visas for this position; those authorized to work in the US without sponsorship are encouraged to apply. We are unable to work Corp-to-Corp.', 'Spotlight Inc. is working with a client based in North Denver on a six-month Data Analyst contract position. This group is on the front-end of a large ERP implementation and this person will help clean, map, and migrate data over from Quickbooks and Salesforce. Given the nature of this implementation, this will be an on-site role. ', 'Able to work independently']",Associate,Contract,Information Technology,Information Technology and Services,2021-01-28 13:52:32
Entry Level Business Analyst,Logical Paradigm,"Herndon, VA",19 hours ago,Be among the first 25 applicants,"['', 'Benefits', 'Strong organizational skills with the ability to multi-task while under pressure.', ""Bachelor's degree - all majors encouraged to apply, especially business and finance"", 'Virtual training', 'Citizens, Green Card holders and those who are authorized to working US are highly encouraged to apply. ', 'Conducting requirement gathering team meeting with business users and technical team and capture the requirements and use cases.Detailed documentation preparation for requirements, use cases, BRD, functional, non- functional requirements.Support in analysis, modeling, and other quantitative techniques as needed to answer business questions and evaluate business issues and objections.Identify and resolve problems.Well versed with UML modelling.User Interface prototypes development.Process flow development.Basic Project Management skills and provide project progress update to project stakeholders.Designing UI mockups.', 'Basic Project Management skills and provide project progress update to project stakeholders.', 'Responsible as Business Analyst:', ""Bachelor's degree - all majors encouraged to apply, especially business and financeStrong analytical skills, work ethic, independence, problem solving ability, effective communication skills, and overall positive attitude.Excellent oral and written communication skills.Proficiency with Microsoft ExcelStrong organizational skills with the ability to multi-task while under pressure."", 'Detailed documentation preparation for requirements, use cases, BRD, functional, non- functional requirements.', 'Job Description', 'Well versed with UML modelling.', 'Support in analysis, modeling, and other quantitative techniques as needed to answer business questions and evaluate business issues and objections.', 'Identify and resolve problems.', 'Proficiency with Microsoft Excel', 'Designing UI mockups.', 'Qualification You Need', 'Strong analytical skills, work ethic, independence, problem solving ability, effective communication skills, and overall positive attitude.', 'Relocation Assistance', 'Excellent pay', 'Relocation AssistanceExcellent payVirtual training', 'Process flow development.', 'Excellent oral and written communication skills.', ' Immigration Support ', 'Conducting requirement gathering team meeting with business users and technical team and capture the requirements and use cases.', 'User Interface prototypes development.', 'Company Description']",Entry level,Contract,Business Development,Information Technology and Services,2021-01-28 13:52:32
Data Analyst,MATRIX Resources,San Francisco Bay Area,2 hours ago,Be among the first 25 applicants,"['', 'Job Description:\xa0', '\xa0', 'Ability to work, prioritize and communicate directly with the customer regarding ad hoc requests in a timely and efficient manner', 'Make sure none of the data is loss while parsing into Tables', 'Preferred Skills:', 'Experience working in a Datawarehouse environment', 'Minimum Qualifications:', 'Ability to package and present analytical findings in an insightful and intuitive manner which explains clearly the direction and recommendation of the information', 'Strong oral and written communication skills', 'Manage Data for Fraud Risk Analyst Team', 'Internet and/or mobile fraud knowledge, especially as it relates to financial servicesDemonstrated experience with providing practical business solutions that are implementable', 'remote until SIP lifts then work in San Francisco or Fremont, CA', 'Splunk Experience', '5+ years of experience and a high level of proficiency in programming and data manipulation using SQL, Splunk, and Excel', 'Demonstrated ability to work effectively in teams, and a large complex organization', 'Internet and/or mobile fraud knowledge, especially as it relates to financial services', 'Type: Contract', 'Excellent time management skills, ability to manage multiple projects simultaneously, determine priorities, meet deadlines, and work in a fast-paced environment', 'Bachelor’s degree in a quantitative field, or equivalent experience', 'Title: Data Analyst', 'Demonstrated experience with providing practical business solutions that are implementable', 'Location: San Francisco, CA or Fremont, CA', 'This position will be responsible for performing various complex activities related to fraud risk analysis, reporting and strategy development as it relates to the various Digital Channels. The position is responsible for supporting and collaborating with the Risk Portfolio Managers within FP&A, and ensuring the most current fraud trends and fraud risks are being considered within product development plans, and product life-cycles. The position is responsible for analyzing the current performance of fraud alerting strategies, optimizing alerting strategies and recommending new or additional actions for alerting strategies. The position will communicate regularly with team members internally and outside of FP&A, and even outside the Digital Channels group in order to complete requests or analysis. The position must be able to communicate effectively and efficiently to large audiences and management.\xa0', 'Parse Data into Tables\xa0', 'Creative problem solving skills with positive, action-oriented attitude and independent thinking', 'must have Splunk and SQL experience, parsing data from database into tables (Excel)', 'Splunk Experience5+ years of experience and a high level of proficiency in programming and data manipulation using SQL, Splunk, and ExcelManage Data for Fraud Risk Analyst TeamExperience working in a Datawarehouse environmentParse Data into Tables\xa0Make sure none of the data is loss while parsing into TablesExcellent time management skills, ability to manage multiple projects simultaneously, determine priorities, meet deadlines, and work in a fast-paced environmentCreative problem solving skills with positive, action-oriented attitude and independent thinkingAbility to work, prioritize and communicate directly with the customer regarding ad hoc requests in a timely and efficient mannerAbility to package and present analytical findings in an insightful and intuitive manner which explains clearly the direction and recommendation of the informationDemonstrated ability to work effectively in teams, and a large complex organizationStrong oral and written communication skillsBachelor’s degree in a quantitative field, or equivalent experience']",Mid-Senior level,Contract,Information Technology,Banking,2021-01-28 13:52:32
Data Analyst,Ingenuity,"Chicago, IL",16 hours ago,28 applicants,[],Entry level,Full-time,Information Technology,Nonprofit Organization Management,2021-01-28 13:52:32
Data Analyst,RedZone,"Boulder, CO",24 hours ago,93 applicants,"['', 'Drive the implementation and delivery of products', 'Serve the Greater Good', '\xa0', ""RedZone allows underwriters and insurers to take smarter risks by analyzing up-to-date disaster intelligence data and alerting clients of the potential wildfire threat that a property or portfolio may face. RedZone has saved clients millions of dollars by reducing property loss claims whilst protecting the most valuable asset of all, their customers. RedZone's Alert Dashboard pushes real-time alerts to insurers and brokers as soon as a wildfire, hurricane, or earthquake threatens one of their customers."", 'Articulate and professional, enthusiastic attitude and a focus on results are required', 'PRIMARY RESPONSIBILITIES', 'ABOUT REDZONE', 'Understanding of infrastructure and cloud technologies (AWS knowledge preferred)\xa0', 'Instinctive Technologist', 'Excellent phone presence and interpersonal skills', 'Data Analyst', 'Strong verbal, written and time management skills', 'In this role, you will be working with RedZone’s leadership team to provide technical project planning, technical support, data analytics for key initiatives such as our probabilistic wildfire modeling platform, RZExposure and our natural disaster monitoring platform RZAlert. You’ll be a part of the team to ensure our customers are onboarded efficiently, receive an exceptional user experience and coordinate efforts between our development and sales teams. Your finesse with technical support will come in handy as you help the team to resolve customer related issues in a timely manner.\xa0', 'Collaborate with teammates in a agile environment', 'Can-Do Attitude', ""Bachelor's degree required"", 'QUALIFICATIONS', 'We are looking for an engaged, team member with a strong technical background. This role will be responsible for managing customer success, coordinating technical support and building new processes within the company. Ideal candidates should be eager to advance their skills and take their career to the next level!', 'CORE VALUES', 'Support and enhance existing products with thoughtful and measurable impact', 'ABOUT REDZONE\xa0', 'Absolutely Reliable', 'Experience with database management and query languages such as SQL , NoSQL; GIS applications, BI tools\xa0', 'Continuous Improvement', '1 or more years experience coding with Python', 'Minimum of two years of demonstrated success in a Data Analyst or equivalent role', 'This is a full-time salaried position in a fast-paced, dynamic environment with benefits including 100% paid health insurance, PTO, paid vacation and 401K. Compensation range of $75K-$95K per year based on a culmination of education and previous experience. RedZone is an Equal Employment Opportunity/Affirmative Action Employer. RedZone does not accept solicitations from recruiters or employment agencies.', 'Ability to handle multiple competing priorities in a fast-paced environment.', 'Love Process', 'Work directly with Customers, Tech Leads and Leadership', 'Manage customer trials, onboarding and ongoing analyticsManage the data pipeline for ingesting a wide variety of customer and natural disaster dataWork directly with Customers, Tech Leads and LeadershipSolve customer support related issues in a timely mannerDrive the implementation and delivery of productsCollaborate with teammates in a agile environmentSupport and enhance existing products with thoughtful and measurable impact', 'Manage the data pipeline for ingesting a wide variety of customer and natural disaster data', 'Instinctive TechnologistAbsolutely ReliableCan-Do AttitudeLove ProcessServe the Greater GoodContinuous Improvement', 'Solve customer support related issues in a timely manner', ""Bachelor's degree requiredMinimum of two years of demonstrated success in a Data Analyst or equivalent roleTwo or more years of demonstrated success in a post-sale customer facing role desiredUnderstanding of infrastructure and cloud technologies (AWS knowledge preferred)\xa01 or more years experience coding with PythonExperience with database management and query languages such as SQL , NoSQL; GIS applications, BI tools\xa0Ability to handle multiple competing priorities in a fast-paced environment.Articulate and professional, enthusiastic attitude and a focus on results are requiredExcellent phone presence and interpersonal skillsStrong verbal, written and time management skills"", 'Two or more years of demonstrated success in a post-sale customer facing role desired', 'We’re hiring! We’re looking for a Data Analyst to help us deliver exceptional products and services to our customers. We are a company that helps a broad customer base, including insurance, real estate and public entities,\xa0understand wildfire risk and apply that information to their business decisions. We use data, modeling, and visualization to develop software and communicate wildfire risk to our customers in a way they can use it.\xa0', 'Manage customer trials, onboarding and ongoing analytics']",Entry level,Full-time,Information Technology,Public Safety,2021-01-28 13:52:32
Junior Data Analyst,PetSmart,"Chicago, IL",13 hours ago,27 applicants,"['Full Benefits! This is a full time position for someone who is looking to grow their Data Analyst skill set with an international company in the Marketing industry. You will be able to gain experience with the newest technologies and have the opportunity to grow with a company that is expanding and looking to be industry leaders in their markets! You produce, maintain and deliver various reports with tools like Tableau and Power BI You help to troubleshoot any queriesissues with existing reports You fully understand BI tools and can produce market insight on levels ranging from the individual to the entire company You carry out on-demand data requests for your team by accessing the data warehouse You support the senior data analysts by writing queries and building reports Preferred Qualifications 1+ years of experience working with BI Tools such as, Tableau 1+ years of experience working as a Business intelligence or Business Analysis 1+ years for experience working with MS Excel and MS SQL Experience in the industry or technology based industry is a plus Benefits Opportunity to for career growth Remote Flexibility Full benefits PTO Are you looking for a rewarding career with one of the fastest growing names in the marketing industry? Candidates should value diverse projects, clients, industries and technologies. This opportunity provides an engaging office culture, with remote work availability, and a record of leadership that is sure to propel you on your professional journey. If you think you would excel in this role, please contactfor more information! Or send me an email at', 'Chicago', '45,000', 'Tableau']",Associate,Full-time,Information Technology,Information Technology and Services,2021-01-28 13:52:32
Junior Data Analyst,PetSmart,"Chicago, IL",13 hours ago,27 applicants,[],Associate,Full-time,Information Technology,Information Technology and Services,2021-01-28 13:52:32
