job_title,company,location,date_posted,applicants,job_text,seniority_level,employment_type,job_function,industries,date_scraped
Data Analyst,Envoy,"San Francisco, CA",13 hours ago,47 applicants,"['', ' Partner closely with anyone and everyone across the company to build dashboards & extract insights. The goal is to teach folks how to fish, not fish for them. That can come through building the 1st rev, helping with more advanced queries, dashboards, & views, or simply pairing & teaching. ', ' Experience with algorithms, tools, and techniques for data mining, linear regression, machine learning. ', ""  Someone with extremely high standards that obsesses over data accuracy. You’re practical and know perfect is the enemy of good, but you aspire for us to be great. You care deeply about the quality of your work and our data. You are passionate about finding the insights and “truth” that data can give.   A big picture, systems thinker. You think about how the whole is a sum of many parts and how we can properly measure them end to end such that we have the per context for insights.   An owner. You feel personally accountable and responsible and know seeing the problem is less than half of it. You look for problems and inefficiencies and find elegant solutions to them before they become major issues.   Fast-paced. You love the speed of and impact you have in startups. Conversely you never, ever want to be a tiny cog in a gigantic machine.   An open-minded learner. You live to learn new things, like staying up to date on new technologies, tools, and techniques. You are inspired by what people inside and outside Envoy know and are eager to incorporate the world's knowledge into your work.   Emotionally mature & humble. You care about being effective over being right. Ideally you’ve made major changes & decisions in your life and learned from the results.   Communicative & empathetic. You are happy when helping others succeed, particularly your team and partners across the company.  "", '  Strong proficiency with constructing efficient SQL and ideally in Python   Background and experience in data analytics and/or data science, and several years’ working experience in non-trivial data environments. Preferably folks who have at least 3-4+ years’ experience (enough to have been around a number of environments, data sets, and situations to have good breadth and depth)   Experience with algorithms, tools, and techniques for data mining, linear regression, machine learning.   Knowledge of & experience with where the data comes from and how it makes it through the pipeline into a query result or interface. You’ve worked 1st hand (or in close partnership with an engineer) with various data storage technologies, pipelines, ETL, and visualization systems at scale. We use Redshift, Looker, dbt, Stitch, Split.io.   A passion for scale, performance, and quality. You think people deserve access to their data in milliseconds and feel incorrect data is an insult. You worry about what happens when we have 100x more data & data sources, but are practical and experienced to know how to solve what we need right now.  ', ' Emotionally mature & humble. You care about being effective over being right. Ideally you’ve made major changes & decisions in your life and learned from the results. ', "" An open-minded learner. You live to learn new things, like staying up to date on new technologies, tools, and techniques. You are inspired by what people inside and outside Envoy know and are eager to incorporate the world's knowledge into your work. "", ' Strong proficiency with constructing efficient SQL and ideally in Python ', '  Experience with dbt, a framework used to build and manage complex data pipelines   Experience with Looker  ', 'You are ', ' Facilitate decisions on standards, frameworks & tools, build vs use, and best practices. We try and keep our data and tools simple, clean, readable, and consistent to maximize our time on Envoy problems. Our current tech stack: Redshift, Python, Airflow, dbt, Looker ', ' Fast-paced. You love the speed of and impact you have in startups. Conversely you never, ever want to be a tiny cog in a gigantic machine. ', ' Knowledge of & experience with where the data comes from and how it makes it through the pipeline into a query result or interface. You’ve worked 1st hand (or in close partnership with an engineer) with various data storage technologies, pipelines, ETL, and visualization systems at scale. We use Redshift, Looker, dbt, Stitch, Split.io. ', ' An owner. You feel personally accountable and responsible and know seeing the problem is less than half of it. You look for problems and inefficiencies and find elegant solutions to them before they become major issues. ', ' Learn, teach, & share. With your fellow teammates and the world (blogs, open source, etc). It’s good for you, good for Envoy, and good for the world. ', ' Drive quality into our data pipeline ,and ultimately our data, be it through good standards, in-depth & helpful code reviews, data validation methods, anomaly detection and alerting, multivariate experiments w/ proper control group(s), partnering with engineering on instrumentation, well-thought out ETL, and clearly and succinctly documenting where and how funky 3rd party data becomes our clean, gold-standard set. ', 'About Envoy', 'About The Role', 'You have ', ' Design and conduct exploratory data research projects that drive our product roadmap and business strategy ', ' A big picture, systems thinker. You think about how the whole is a sum of many parts and how we can properly measure them end to end such that we have the per context for insights. ', ' Experience with Looker ', ' Experience with dbt, a framework used to build and manage complex data pipelines ', ' A passion for scale, performance, and quality. You think people deserve access to their data in milliseconds and feel incorrect data is an insult. You worry about what happens when we have 100x more data & data sources, but are practical and experienced to know how to solve what we need right now. ', 'Bonus points', '  Partner closely with anyone and everyone across the company to build dashboards & extract insights. The goal is to teach folks how to fish, not fish for them. That can come through building the 1st rev, helping with more advanced queries, dashboards, & views, or simply pairing & teaching.   Drive quality into our data pipeline ,and ultimately our data, be it through good standards, in-depth & helpful code reviews, data validation methods, anomaly detection and alerting, multivariate experiments w/ proper control group(s), partnering with engineering on instrumentation, well-thought out ETL, and clearly and succinctly documenting where and how funky 3rd party data becomes our clean, gold-standard set.   Facilitate decisions on standards, frameworks & tools, build vs use, and best practices. We try and keep our data and tools simple, clean, readable, and consistent to maximize our time on Envoy problems. Our current tech stack: Redshift, Python, Airflow, dbt, Looker   Design and conduct exploratory data research projects that drive our product roadmap and business strategy   Learn, teach, & share. With your fellow teammates and the world (blogs, open source, etc). It’s good for you, good for Envoy, and good for the world.  ', ' Background and experience in data analytics and/or data science, and several years’ working experience in non-trivial data environments. Preferably folks who have at least 3-4+ years’ experience (enough to have been around a number of environments, data sets, and situations to have good breadth and depth) ', ' Communicative & empathetic. You are happy when helping others succeed, particularly your team and partners across the company. ', ' Someone with extremely high standards that obsesses over data accuracy. You’re practical and know perfect is the enemy of good, but you aspire for us to be great. You care deeply about the quality of your work and our data. You are passionate about finding the insights and “truth” that data can give. ', 'You will']",Entry level,Full-time,Information Technology,Information Technology and Services,2020-12-30 19:32:10
"Data Analyst, Transportation Analytics",The Home Depot,"Atlanta, GA",17 hours ago,91 applicants,"['', 'Critical thinking skills to identify the strengths and weaknesses of alternative solutions; ability to understand and foresee implications of new information for current and future problems solving.An unquenchable intellectual curiosity for getting at the underlying story being told within the data', 'Preferred Qualifications', 'NATURE AND SCOPE', 'Travel', 'Years of Relevant Work Experience: ', 'POSITION PURPOSE', 'Major Tasks, Responsibilities And Key Accountabilities', 'Work experience with SQL Server, Teradata, Oracle, or comparable database systems', '1-3 years work experience in data mining, statistical analysis, auditing, and/or forecasting.', 'An unquenchable intellectual curiosity for getting at the underlying story being told within the data', 'Minimum Qualifications', 'Environment', 'Physical Requirements: ', 'ENVIRONMENTAL JOB REQUIREMENTS', 'Prior direct experience in analyzing the relevant subject matter (e.g. Supply Chain, Merchandising, Operations, etc.)', 'Knowledge, Skills, Abilities And Competencies', 'Critical thinking skills to identify the strengths and weaknesses of alternative solutions; ability to understand and foresee implications of new information for current and future problems solving.', 'Work experience with SQL Server, Teradata, Oracle, or comparable database systems1-3 years work experience in data mining, statistical analysis, auditing, and/or forecasting.Prior direct experience in analyzing the relevant subject matter (e.g. Supply Chain, Merchandising, Operations, etc.)']",Entry level,Full-time,Information Technology,Construction,2020-12-30 19:32:10
Data Analyst – People Data Solutions,Facebook,"New York, NY",20 hours ago,56 applicants,"['', 'Create and iterate on solutions and dashboards to empower operational and exploratory analysis', 'Preferred Qualifications', 'BA/BS in a field that emphasizes data analysis and visualization (e.g., computer science, social sciences, physical sciences, math, engineering, or statistics), or equivalent work experience3+ years experience with SQL (or similar language aimed at querying relational databases)3+ years of experience working with data visualization toolsKnowledge with Excel (conditional formulas and formatting, charting, etc.)Experience with data management, specifically with validating and auditing data and reports from multiple systemsExperience manipulating large data sets through statistical software or other methodsExperience initiating and driving projects to completion with minimal guidanceExperience processing and analyzing data sets, interpreting them for making business decisionsExperience communicating the results of analyses with product and leadership teams to influence the overall strategy of the product', 'Experience manipulating large data sets through statistical software or other methods', 'Experience working with HR/organizational people data (e.g. headcount, turnover, recruiting metrics, and other people analytics)', 'Apply your technical expertise to help solve, inform, influence, support, and execute our HR business decisions for the People Analytics team and all of our clients (HR Business Partners, L&D, Diversity, People Growth, People Operations, Global Mobility, Benefits, and Equity)Use tools and programming languages like Tableau, Hive, Oracle, R, Python, Excel, Workday, Visier and many other internal tools to work efficiently at scaleMaintain code-base (SQL) used to drive self-service tools, and recommend opportunities for improvementCreate and iterate on solutions and dashboards to empower operational and exploratory analysisEnforce best practices and alignment with research, forecasting, analytics, and engineering teamsEffectively communicate with external clients and internal teams to deliver solutions in a timely fashionRespond to (or triage) any and all requests related to people data with minimal guidance or oversightDocument requirements with stakeholders, and partner with People Insights and People Analytics on broader changes to core dashboards and solutions', 'Experience initiating and driving projects to completion with minimal guidance', 'Effectively communicate with external clients and internal teams to deliver solutions in a timely fashion', 'Enforce best practices and alignment with research, forecasting, analytics, and engineering teams', 'Respond to (or triage) any and all requests related to people data with minimal guidance or oversight', 'Experience processing and analyzing data sets, interpreting them for making business decisions', 'Experience with data management, specifically with validating and auditing data and reports from multiple systems', 'Minimum Qualifications', '2+ years of experience with R, Python, or a similar scripting languageExperience working with HR/organizational people data (e.g. headcount, turnover, recruiting metrics, and other people analytics)Project management experience', 'Project management experience', 'Knowledge with Excel (conditional formulas and formatting, charting, etc.)', '3+ years experience with SQL (or similar language aimed at querying relational databases)', 'Experience communicating the results of analyses with product and leadership teams to influence the overall strategy of the product', '3+ years of experience working with data visualization tools', 'Maintain code-base (SQL) used to drive self-service tools, and recommend opportunities for improvement', 'BA/BS in a field that emphasizes data analysis and visualization (e.g., computer science, social sciences, physical sciences, math, engineering, or statistics), or equivalent work experience', 'Apply your technical expertise to help solve, inform, influence, support, and execute our HR business decisions for the People Analytics team and all of our clients (HR Business Partners, L&D, Diversity, People Growth, People Operations, Global Mobility, Benefits, and Equity)', '2+ years of experience with R, Python, or a similar scripting language', 'Use tools and programming languages like Tableau, Hive, Oracle, R, Python, Excel, Workday, Visier and many other internal tools to work efficiently at scale', 'Document requirements with stakeholders, and partner with People Insights and People Analytics on broader changes to core dashboards and solutions']",Not Applicable,Full-time,Information Technology,Internet,2020-12-30 19:32:10
Business Data Analyst,General Motors,"Detroit, MI",6 hours ago,Be among the first 25 applicants,"['', ' Strong business acumen, and the ability to translate “data” to a “business story” and effectively communicate it to business stakeholders and partners. Experience with A|B testing SME with Tableau and Alteryx Collaborative team player orientation towards work relationships, strong culture awareness Skilled in project management and oversight skills Skilled in priority setting and alignment of project priorities with business strategy Ability to break down complex problems and projects into manageable goals Ability to influence people across the organization. Ability to act as a change agent. Skilled in communicating the benefits of Data analysis to business line professionals to create a value proposition, including executive level audiences. Effectiveness in building trust, respect and cooperation among teams Experience supporting diverse and creative technical teams in a fast-paced environment', ' Data integration using SQL in Oracle or SQL Server environments Business Intelligence / Reporting Tools: Tableau, Power BI, Excel, SAS, SPSS Ability to identify useful information in data sets and suggest conclusions that support decision making Strong analytical capabilities Understanding of data gathering, inspecting, cleansing, transforming, and analyzing techniques Communication skills with the ability to distill complex subjects to a wider audience. Excellent collaboration and project management skills', ' Skilled in project management and oversight skills', ' Strong business acumen, and the ability to translate “data” to a “business story” and effectively communicate it to business stakeholders and partners.', ' Ability to identify useful information in data sets and suggest conclusions that support decision making', ' Create breakthrough solutions, performing exploratory and targeted data analyses to drive iterative learnings', ' No Degree beats proven experience!', 'Role Responsibilities', ' Strong analytical capabilities', 'Additional Job Description', ' Support diverse technical teams to ensure project deliverables fulfill business needs, are on-time, and meet business requirements Coordinate with marketing to develop data driven strategies: plan, implement and execute Contribute to the definition of an overarching big-data-driven approach to advanced analytics strategy Work with cross-functional teams to discover and develop actionable, high-impact data analytics need and data opportunity statements in a variety of core business areas Create breakthrough solutions, performing exploratory and targeted data analyses to drive iterative learnings Work with business domain, IT and data experts to identify detailed data needs, sources, and structure to support solution development Delivering ad-hoc analysis', ' Skilled in priority setting and alignment of project priorities with business strategy', ' Delivering ad-hoc analysis', 'Technical Skills', ' Data integration using SQL in Oracle or SQL Server environments', 'Required Education', 'Demonstrated Leadership And Interpersonal Skills', 'About GM', 'Required Qualifications', ' Experience with A|B testing', ' Work with business domain, IT and data experts to identify detailed data needs, sources, and structure to support solution development', ' Contribute to the definition of an overarching big-data-driven approach to advanced analytics strategy', ' Business Intelligence / Reporting Tools: Tableau, Power BI, Excel, SAS, SPSS', ' Skilled in communicating the benefits of Data analysis to business line professionals to create a value proposition, including executive level audiences.', ' Excellent collaboration and project management skills', ' Support diverse technical teams to ensure project deliverables fulfill business needs, are on-time, and meet business requirements', ' Communication skills with the ability to distill complex subjects to a wider audience.', ' Ability to influence people across the organization. Ability to act as a change agent.', ' Experience supporting diverse and creative technical teams in a fast-paced environment', ' Effectiveness in building trust, respect and cooperation among teams', ' SME with Tableau and Alteryx', ' Bachelor’s degree in mathematics, statistics, computer science, information technology, business, engineering or related field', 'Required Experience', ' Bachelor’s degree in mathematics, statistics, computer science, information technology, business, engineering or related field No Degree beats proven experience!', ' Work with cross-functional teams to discover and develop actionable, high-impact data analytics need and data opportunity statements in a variety of core business areas', ' Collaborative team player orientation towards work relationships, strong culture awareness', ' Coordinate with marketing to develop data driven strategies: plan, implement and execute', ' Ability to break down complex problems and projects into manageable goals', ' Understanding of data gathering, inspecting, cleansing, transforming, and analyzing techniques', 'Job Description']",Not Applicable,Full-time,Information Technology,Automotive,2020-12-30 19:32:10
Music Data Analyst,Netflix,"Los Angeles, CA",14 hours ago,137 applicants,"['', 'An eagerness to give and receive constructive feedback.', 'Collaborating in the overall strategic direction of the music data roadmap as part of the larger music strategy.', 'Experience manipulating and analyzing complex data with SQL, Excel, and Google Sheets.Strong data analysis skills and experience working with relational database technologies.Hands-on experience of data management, project management, data processing, working with engineering teams, and managing a wide variety of internal and external stakeholders.The ability to work effectively cross-functionally, think proactively, and drive results.Excellent analytical, problem-solving, oral and written communication skills.A proven track record of breaking down complex processes and identifying key pain points.The ability to work well under pressure with diligence, organization, and minimal supervision.Flexibility amid an ever-changing and growing environment.Excellent judgment, curiosity, confidence, and a sense of humor.An eagerness to give and receive constructive feedback.Nice to have: practical knowledge of the music industry (e.g., Music Licensing and CMOs; Music Production).Plus but not required: experience using Google scripts to solve problems and analyze data.Plus but not required: experience in Python and/or R.', 'Querying and manipulating data sets using SQL and Excel/Google Sheets and visualization tools like Tableau (or similar tools).', 'Excellent judgment, curiosity, confidence, and a sense of humor.', 'Experience manipulating and analyzing complex data with SQL, Excel, and Google Sheets.', 'The ability to work well under pressure with diligence, organization, and minimal supervision.', 'Proactively partnering with internal stakeholders and delivering on reporting requirements.', 'Evaluating, testing, implementing and supporting technical data solutions.', 'A proven track record of breaking down complex processes and identifying key pain points.', 'Cultivating relationships with CMOs and administering reporting obligations.', 'The Music Data Analyst Will Be Responsible For', 'Working in collaborative partnerships with teams such as Legal, Finance, Creative, Marketing, Production, Product and Engineering.', 'Analyzing existing reporting processes and establishing new processes with a focus on enhancements and automation.', 'Nice to have: practical knowledge of the music industry (e.g., Music Licensing and CMOs; Music Production).', 'Strong data analysis skills and experience working with relational database technologies.', 'Excellent analytical, problem-solving, oral and written communication skills.', 'Being a trusted subject matter authority.', 'Flexibility amid an ever-changing and growing environment.', 'Querying and manipulating data sets using SQL and Excel/Google Sheets and visualization tools like Tableau (or similar tools).Cultivating relationships with CMOs and administering reporting obligations.Proactively partnering with internal stakeholders and delivering on reporting requirements.Analyzing existing reporting processes and establishing new processes with a focus on enhancements and automation.Working in collaborative partnerships with teams such as Legal, Finance, Creative, Marketing, Production, Product and Engineering.Evaluating, testing, implementing and supporting technical data solutions.Collaborating in the overall strategic direction of the music data roadmap as part of the larger music strategy.Being a trusted subject matter authority.', 'The Desired Candidate Will Have', 'Plus but not required: experience using Google scripts to solve problems and analyze data.', 'Plus but not required: experience in Python and/or R.', 'The ability to work effectively cross-functionally, think proactively, and drive results.', 'Hands-on experience of data management, project management, data processing, working with engineering teams, and managing a wide variety of internal and external stakeholders.']",Not Applicable,Full-time,Information Technology,Entertainment,2020-12-30 19:32:10
