job_title,company,company_rating,location,job_text,date
Jr. Data Analyst,Quantum Technologies Inc.,N/A,"Falls Church, VA 22043","['Find jobs', 'Company Reviews', 'Find salaries', 'Employers', 'Change country', 'Help Center', ""Bachelor's (Preferred)SQL: 1 year (Preferred)"", 'Interpret data, analyze results using statistical techniques and provide ongoing reports', 'Acquire data from different data sources and correlate, and map data to develop new integrated data sets using business logic', 'Filter and “clean” data, and review reports, printouts, and performance indicators to locate and correct code problems', 'Work closely with management to prioritize business and information needs', 'Create Tableau dashboards to visualize data.', 'Must have basic SQL knowledge', ""Bachelor's degree or equivalent experience"", 'Fluency in Microsoft Office suite (Outlook, Excel, Word, PowerPoint, etc.)', 'Strong written, verbal and collaboration skills', '401(k)', '401(k) matching', 'Dental insurance', 'Disability insurance', 'Employee assistance program', 'Health insurance', 'Life insurance', 'Professional development assistance', 'Referral program', 'Relocation assistance', 'Vision insurance', 'Monday to Friday', ""Bachelor's (Preferred)"", 'SQL: 1 year (Preferred)', 'Multiple locations', 'Temporarily due to COVID-19']",2020-12-17 13:48:04
Jr. Data Analyst,Quantum Technologies Inc.,N/A,"Falls Church, VA 22043",[],2020-12-17 13:48:04
Jr. Data Analyst,Quantum Technologies Inc.,N/A,"Falls Church, VA 22043",[],2020-12-17 13:48:04
Data Analyst,"Technomics, Inc",4.7 out of 5 from 3 employee ratings,"Arlington, VA 22202","['Find jobs', 'Company Reviews', 'Find salaries', 'Employers', 'Change country', 'Help Center', 'Collect, organize, and integrate data sets from various data sources, including EVM, accounting,schedule, budget, execution, quantity, technical and programmatic data.', 'Exhibit the analytical creativity required to tie data together and develop schemes/tools to regularly update databases.', 'Develop, update and execute policy/procedures for data management and data accessibility.', 'Develop dashboards and visualizations to show data collection status and provide first-pass analysis.', 'Contribute to cost estimates for large weapons systems or facilities projects.', 'Develop knowledge and understanding of technical and programmatic requirements for a variety of systems and projects.', ""Bachelor's degree in a quantitative discipline (e.g., economics, engineering, mathematics, operations research or statistics) or a discipline that fosters problem solving, structured thought, and creativity."", 'Experience utilizing Tableau, PowerBI, and/or Oracle Data Analytics/Visualization tools', 'A strong understanding of creating SQL queries', 'Minimum of 1-3 years of quantitative analysis and problem solving experience.', 'Ability to effectively communicate technical work in writing and verbally', 'Strong Microsoft Office skills, especially Excel skills', 'Strong interest in solving government resource allocation problems', 'Ability to manage multiple deadlines and work products at the same time', 'Ability to obtain and/or maintain a minimum of a DoD Secret clearance or DHS Suitability', 'Candidates must be U.S. Citizens', 'Interest in contributing to the success of an employee-owned company that offers you a stake in the business']",2020-12-17 13:48:04
Research Data Analyst,Nueducation Inc - Technical Services,N/A,"Washington, DC","['Find jobs', 'Company Reviews', 'Find salaries', 'Employers', 'Change country', 'Help Center', 'Candidate must be data-focused and have strong attention to detail', 'Data Entry with some analytical skills', 'Have at least one-year minimum data entry experience', 'Experience with Excel, Google Drive, G Drive Office Suite, and overall Office Suite knowledge is a must', 'Must be able to follow detailed process-oriented work and have the ability to adapt to changes quickly', 'Must be capable of handling multiple tasks at any given time', 'Great communications skills and be able to reply to any inquiries quickly', 'Technical background is a plus', 'Multiple locations', 'Yes']",2020-12-17 13:48:04
Junior Data Analyst,Artlin Consulting,4 out of 5 from 4 employee ratings,"Arlington, VA","['Find jobs', 'Company Reviews', 'Find salaries', 'Employers', 'Change country', 'Help Center']",2020-12-17 13:48:04
Junior Data Analyst,Artlin Consulting,N/A,"Arlington, VA",[],2020-12-17 13:48:04
Data Analyst,Pinnacle Group,3.8 out of 5 from 39 employee ratings,"McLean, VA","['Find jobs', 'Company Reviews', 'Find salaries', 'Employers', 'Change country', 'Help Center', 'Identify and create data and business requirements for Create data hub', 'Define data quality rules', 'Test and validate data for the data migration process', 'Become proficient in use of metadata, lineage and data quality tools', 'Work closely with IT BSAs and clearly explain business intent during source to target mapping sessions', 'Analyze data quality issues and work with managing data stewards for resolution', 'Interact with technology and enterprise data teams', 'Maintain all organizational and professional ethical standards', 'Work independently under general supervision, with latitude for initiative and independent judgment.', ""Bachelor's Degree"", '3 years professional experience conducting data analysis, data validation and requirements.', 'Expert at MS Excel', 'Python and R', 'AWS', '3 to 5 years of experience with SQL and/or other data analytics or database-related programming', 'SQL (Certification preferred).', '2 years experience programming', 'Strong quantitative /analytical skills, strong innovation, problem solving and conceptual thinking abilities.', '3 to 5+ years of related analyst experience including but not limited to academia, consulting, financial services or information technology industries', 'Strong problem solving and conceptual thinking abilities', 'Strong communication, interpersonal, and leadership abilities', 'Collaborative partnership skills for working with various points of contact and teams in the department.', 'Experience and understanding of data analysis and mapping', 'Proficient in SQL, Cloud based tools, Microsoft Excel']",2020-12-17 13:48:04
DATA ANALYST,Prince William County Public Schools,4 out of 5 from 343 employee ratings,"Manassas, VA","['Find jobs', 'Company Reviews', 'Find salaries', 'Employers', 'Change country', 'Help Center', 'Ability to efficiently analyze data with computer software to ensure that accurate and complete database records are maintained in support of the Prince William County Public Schools (PWCS) Data Warehouse Data Analytics & Reporting Tool (DART).', 'Ability to attain a high degree of efficiency and to resolve problems encountered during computer and software usage.', 'Ability to recommend changes and new approaches to collecting, analyzing, or reporting data.', 'Ability to carry out complex written and oral instructions concerning statistical data.', 'Ability to use and understand the capabilities of various computer software program, such as Microsoft Office Professional (Access, Excel, Word, and PowerPoint).', 'Ability to establish and maintain effective working relationships with a wide variety of School Division personnel.', 'Ability to provide technical direction to team members as required.', 'Ability to work independently without supervision.', 'Ability to plan and manage multiple tasks in a timely manner.', 'Self-motivated and able to work in a quick-paced environment.', 'Ability to work closely with the state personnel, personnel in other school divisions, PWCS central office and school-based personnel.', 'Work collaboratively with all stakeholders in Providing a World-Class Education.', 'Collects, analyzes, verifies, and corrects school testing, program evaluation, and enrollment data for use by the School Board, Superintendent, school management and School Division departments through the PWCS Data Warehouse and other means.', 'Imports, cleans, transforms, validates, and models data with the purpose of making conclusions from the data for decision-making purposes.', 'Reviews, evaluates, and redesigns (as necessary) existing data extractions, conversion, summarization, and reporting processes. Develops rules governing database design.', 'Completes analyses for state and federal reporting requirements including: Student Record Collection, Standards of Quality, Graduation Cohorts and Civil Rights Data Collection.', 'Supports school and central office personnel with completion of improvement plans through use of current School Improvement Planning (SIP) application.', 'Completes analyses, creates reports and produces presentation media in support of local reporting requirements including: Strategic Plan Report to the School Board, School Data Profiles, and Schools of Excellence.', 'Prepares documentation on techniques used to collect, analyze, verify, and correct data.', 'Prepares ad hoc reports from information in various databases as requested.', 'Reviews the range of data available in the School Division and provides summary information on school or student performance and makes recommendations for improvement.', 'Provides professional development to central office and school-based staff in the use of data from the Data Warehouse, interpretation of data, data management, and data reporting.', 'Serves as a liaison to principals and other school staff at one or more levels (elementary, middle, high), with expertise in testing, enrollment, discipline and other data for students at those levels.', 'Complete other duties as assigned.']",2020-12-17 13:48:04
Early career data scientist / analyst / statistical geneticist,Data Tecnica,N/A,"Glen Echo, MD","['Find jobs', 'Company Reviews', 'Find salaries', 'Employers', 'Change country', 'Help Center']",2020-12-17 13:48:04
Data Analyst Supporting the DEA,Forfeiture Support Associates,3.7 out of 5 from 123 employee ratings,"Arlington, VA 22202","['Find jobs', 'Company Reviews', 'Find salaries', 'Employers', 'Change country', 'Help Center', 'Receives, gathers, analyzes, and organizes information from multiple sources.', 'Ensures completeness of received information and reconciles inconsistencies.', 'Accurately enters required data into one or more databases, documents, or spreadsheets.', 'Establishes and maintains physical files.', 'Keeps track of case file status in order to ensure compliance with established deadlines.', 'Coordinates requests for additional information as needed.', 'Selects relevant information from a variety of sources in order to prepare documents, reports, summaries, and replies to inquiries, ensuring accuracy and proper format of the information provided.', 'Performs word processing relevant to case.', 'Provides accurate and timely status updates.', 'Performs other duties as assigned.', 'High School diploma or GED, Undergraduate degree preferred', 'Ability to grasp and understand the organization and functions of the customer', 'Meticulous data entry skills', 'Excellent communication skills; oral and written', 'Competence to review, interpret, and evaluate complex legal and non-legal documents', 'Attention to detail and the ability to read and follow directions is extremely important', 'Strong organizational and prioritization skills', 'Experience with the Microsoft Office suite of applications (Excel, PowerPoint, Word) and other common software applications, to include databases, intermediate skills preferred', 'Proven commitment and competence to provide excellent customer service; positive and flexible', 'Ability to work in a team environment and maintain a professional disposition']",2020-12-17 13:48:04
Data Analyst,TechOp Solutions International,4.3 out of 5 from 4 employee ratings,"Washington, DC 20536","['Find jobs', 'Company Reviews', 'Find salaries', 'Employers', 'Change country', 'Help Center', 'Conduct data analysis and statistical reporting.', 'Prepare briefings and issue papers, studies, recommendation, responses and reports about the mission, activities, and related statistics.', 'Develop, test, and deploy new data science models according to agency needs', 'Identify new data sets which would enhance the accuracy of existing models and dashboards.', 'Analyze the impact of the effects of a regulation, policy, program, etc. and the effects of changes in budget, staffing or policy/priority changes on resources, performance, or schedule.', ""Bachelor's Degree and 0-3 years' experience"", 'Eligibility for a DHS/ICE Public Trust', 'Required - Data analysis and reporting experience', 'Desired - Experience supporting law enforcement/defense organizations; Strong written and oral communication; and SQL, MS Access, Excel, VBA, Python, R, and Business Intelligence tools such as Hyperion, OBIEE, etc.']",2020-12-17 13:48:04
Data Analyst,Entrepreneurs' Organization,3.8 out of 5 from 12 employee ratings,"Alexandria, VA 22314","['Find jobs', 'Company Reviews', 'Find salaries', 'Employers', 'Change country', 'Help Center', 'Develops statistics and key metrics from various types of raw data', 'Develops data dashboards and visualizations using a BI platform', 'Utilizes ETL and SQL to transform and visualize datasets', 'Assist in survey development and implementation of all member surveys', 'Works with communications and marketing teams to identify key metrics on social media and marketing', 'Utilizes web analytics platforms such as Sprout Social and Google Analytics to aggregate online interaction statistics and key metrics', 'Performs other duties as assigned', 'Bachelor’s degree in analytics, statistics or relevant field', 'Minimum one (1) year of work experience in a data focused role', 'Advanced Microsoft Excel skills, including pivot tables, vlookup, and macros', 'Experience in creating data visualizations', 'Experience tracking and analyzing metrics and generating reports', 'Experience with web analytics platforms such as Google Analytics and Sprout Social', 'Experience in a business information/analysis team', 'Experience working with volunteers', 'Multilingual or international experience', 'Advanced knowledge of a BI platform such as Domo, Tableau, Looker, Exago or Power BI', 'The employee is normally required to work in a high-rise building equipped with elevators in an environment where the noise level is usually moderate. May be assigned to an internal work space without windows to the outside, located in close proximity to other office personnel.', 'Professional workplace where business casual attire is required.', 'Ability to work in a fast paced and high pressure environment.', 'Reasonable accommodations may be made to enable individuals with disabilities to perform the essential duties and responsibilities of the role.']",2020-12-17 13:48:04
Entry Level Business Analyst,Dhatronictech,N/A,"Washington, DC","['Find jobs', 'Company Reviews', 'Find salaries', 'Employers', 'Change country', 'Help Center', 'Coordinates with internal project management team to perform assigned tasks and meet project deadlines', 'Participate in the analysis, design, and implementation of loan origination system', 'Prepare detailed requirement specifications, functional specifications, use stories and manage requirements throughout the project lifecycle', 'Quickly learn about the products that are changing the healthcare market', 'Write business requirements and support our best-in-class engineering team as they bring them to life', 'Prepare cost-benefit analyses as well as business impact analyses for the executive management', ""Bachelors or Master's Degree"", '0-1 years of experience', 'Strong Communication & Technical skills', 'Monday to Friday', 'One location', 'Temporarily due to COVID-19']",2020-12-17 13:48:04
Entry Level Business Analyst,Dhatronictech,N/A,"Washington, DC",[],2020-12-17 13:48:04
Entry Level Business Analyst,Dhatronictech,N/A,"Washington, DC",[],2020-12-17 13:49:20
Data Analyst Supporting the DEA,Forfeiture Support Associates,3.7 out of 5 from 123 employee ratings,"Arlington, VA 22202","['Find jobs', 'Company Reviews', 'Find salaries', 'Employers', 'Change country', 'Help Center', 'Receives, gathers, analyzes, and organizes information from multiple sources.', 'Ensures completeness of received information and reconciles inconsistencies.', 'Accurately enters required data into one or more databases, documents, or spreadsheets.', 'Establishes and maintains physical files.', 'Keeps track of case file status in order to ensure compliance with established deadlines.', 'Coordinates requests for additional information as needed.', 'Selects relevant information from a variety of sources in order to prepare documents, reports, summaries, and replies to inquiries, ensuring accuracy and proper format of the information provided.', 'Performs word processing relevant to case.', 'Provides accurate and timely status updates.', 'Performs other duties as assigned.', 'High School diploma or GED, Undergraduate degree preferred', 'Ability to grasp and understand the organization and functions of the customer', 'Meticulous data entry skills', 'Excellent communication skills; oral and written', 'Competence to review, interpret, and evaluate complex legal and non-legal documents', 'Attention to detail and the ability to read and follow directions is extremely important', 'Strong organizational and prioritization skills', 'Experience with the Microsoft Office suite of applications (Excel, PowerPoint, Word) and other common software applications, to include databases, intermediate skills preferred', 'Proven commitment and competence to provide excellent customer service; positive and flexible', 'Ability to work in a team environment and maintain a professional disposition']",2020-12-17 13:49:20
Data Analyst Supporting the DEA,Forfeiture Support Associates,N/A,"Arlington, VA 22202",[],2020-12-17 13:49:20
Data Analyst,TechOp Solutions International,4.3 out of 5 from 4 employee ratings,"Washington, DC 20536","['Find jobs', 'Company Reviews', 'Find salaries', 'Employers', 'Change country', 'Help Center', 'Conduct data analysis and statistical reporting.', 'Prepare briefings and issue papers, studies, recommendation, responses and reports about the mission, activities, and related statistics.', 'Develop, test, and deploy new data science models according to agency needs', 'Identify new data sets which would enhance the accuracy of existing models and dashboards.', 'Analyze the impact of the effects of a regulation, policy, program, etc. and the effects of changes in budget, staffing or policy/priority changes on resources, performance, or schedule.', ""Bachelor's Degree and 0-3 years' experience"", 'Eligibility for a DHS/ICE Public Trust', 'Required - Data analysis and reporting experience', 'Desired - Experience supporting law enforcement/defense organizations; Strong written and oral communication; and SQL, MS Access, Excel, VBA, Python, R, and Business Intelligence tools such as Hyperion, OBIEE, etc.']",2020-12-17 13:49:20
Data Analyst,Entrepreneurs' Organization,3.8 out of 5 from 12 employee ratings,"Alexandria, VA 22314","['Find jobs', 'Company Reviews', 'Find salaries', 'Employers', 'Change country', 'Help Center', 'Develops statistics and key metrics from various types of raw data', 'Develops data dashboards and visualizations using a BI platform', 'Utilizes ETL and SQL to transform and visualize datasets', 'Assist in survey development and implementation of all member surveys', 'Works with communications and marketing teams to identify key metrics on social media and marketing', 'Utilizes web analytics platforms such as Sprout Social and Google Analytics to aggregate online interaction statistics and key metrics', 'Performs other duties as assigned', 'Bachelor’s degree in analytics, statistics or relevant field', 'Minimum one (1) year of work experience in a data focused role', 'Advanced Microsoft Excel skills, including pivot tables, vlookup, and macros', 'Experience in creating data visualizations', 'Experience tracking and analyzing metrics and generating reports', 'Experience with web analytics platforms such as Google Analytics and Sprout Social', 'Experience in a business information/analysis team', 'Experience working with volunteers', 'Multilingual or international experience', 'Advanced knowledge of a BI platform such as Domo, Tableau, Looker, Exago or Power BI', 'The employee is normally required to work in a high-rise building equipped with elevators in an environment where the noise level is usually moderate. May be assigned to an internal work space without windows to the outside, located in close proximity to other office personnel.', 'Professional workplace where business casual attire is required.', 'Ability to work in a fast paced and high pressure environment.', 'Reasonable accommodations may be made to enable individuals with disabilities to perform the essential duties and responsibilities of the role.']",2020-12-17 13:49:20
Entry Level Business Analyst,Dhatronictech,N/A,"Washington, DC","['Find jobs', 'Company Reviews', 'Find salaries', 'Employers', 'Change country', 'Help Center', 'Coordinates with internal project management team to perform assigned tasks and meet project deadlines', 'Participate in the analysis, design, and implementation of loan origination system', 'Prepare detailed requirement specifications, functional specifications, use stories and manage requirements throughout the project lifecycle', 'Quickly learn about the products that are changing the healthcare market', 'Write business requirements and support our best-in-class engineering team as they bring them to life', 'Prepare cost-benefit analyses as well as business impact analyses for the executive management', ""Bachelors or Master's Degree"", '0-1 years of experience', 'Strong Communication & Technical skills', 'Monday to Friday', 'One location', 'Temporarily due to COVID-19']",2020-12-17 13:49:20
Entry Level Business Analyst,Dhatronictech,N/A,"Washington, DC",[],2020-12-17 13:49:20
Entry Level Business Analyst,Dhatronictech,N/A,"Washington, DC",[],2020-12-17 13:49:20
Entry Level Business Analyst,Dhatronictech,N/A,"Washington, DC",[],2020-12-17 13:49:20
Entry Level Business Analyst,Dhatronictech,N/A,"Washington, DC",[],2020-12-17 13:49:20
Entry Level Business Analyst,Dhatronictech,N/A,"Washington, DC",[],2020-12-17 13:49:20
Entry Level Business Analyst,Dhatronictech,N/A,"Washington, DC",[],2020-12-17 13:49:20
Data Analyst,Biteable,N/A,Colorado,"['Find jobs', 'Company Reviews', 'Find salaries', 'Employers', 'Change country', 'Help Center', ""You're collaborative. You enjoy working with diverse teams across multiple functions."", ""You know big SaaS. You're versed in fundamental SaaS and finance metrics, with a meticulous nature for getting them right."", ""You have an eye for visualization. You bring complex ideas to life in a way that's easy to understand."", 'You like puzzles. You enjoy technical challenges and you enjoy solving them even more.', ""You seek out root causes. Surface-level insights won't cut it; you don't stop searching until you find the source of a problem."", ""You're about quality. Your analysis, commentary, and documentation set the standard. When you hand someone a finding, it's something they can trust."", ""You like video. You watch your fair share of YouTube and you're into the way video helps people communicate."", ""You're a solid communicator. Verbal and written communication are two things you excel at."", 'You have 5+ years of experience', ""Lots of SQL. You'll work in Redshift and Tableau daily to build out our reporting suite."", ""Testing and evaluating. You'll measure the performance of new launches and features with use of A/B testing."", ""Writing and presenting. As an informative role within a remote company, you'll need to over-communicate with confidence."", 'Predicting the future. Use your forecasting skills in Python or R to forecast future performance.', 'Based in the US or Canada. Your closest team members will be on the same or an overlapping timezone.', ""Hardware included. You'll get a new laptop and a budget for improving your home office."", 'Created a community of over 7 million users', 'Rendered more than 12 million videos', 'Raised $3.9 million in venture capital']",2020-12-17 13:49:20
