job_title,company,location,date_posted,applicants,job_text,seniority_level,employment_type,job_function,industries,date_scraped
Data Scientist,Known,"Boston, MA",15 hours ago,35 applicants,"['', 'Self-motivated and exhibits initiative', 'Paid parental leave', 'Superb written and verbal communication and presentation skills', 'Collaborative attitude', 'Experience using Machine Learning', ' Responsible for the day-to-day management of the media spend you’re responsible for, including ideation on quantitative approaches for driving value, monitoring metrics, and troubleshooting issues Design and execute every technical aspect of an engagement, including machine learning, analytics, and visualization  Develop new techniques (e.g., ML models, optimization algorithms, and automation) to optimize KPIs and improve Known IP Discuss and defend your analyses and ensure that it directly meets the client’s needs.  ', ' Unlimited paid time off Equity plan with profit sharing Annual bonuses Vacation and birthday cash bonuses Generous medical plan Paid parental leave Company-paid cell phone service In-house barista plus cold brew on tap! Fully stocked kitchen Weekly company lunches', 'Key Responsibilities', 'Experience utilizing Python (or similar language) and SQL', 'Ability to articulate clearly and communicate a “data story”', 'Experience multi-tasking in a fast-paced environment', 'Company-paid cell phone service', ' A Masters or PhD from a well-regarded college or university. STEM degrees are preferred  5+ years of hands-on experience doing quantitative analysis, predictive modeling, optimization and/or statistics Some professional experience in marketing, advertising or media is a plus ', 'An ability to translate business challenges into quantitative problems, and solve them by whatever means necessary, which may not always be strict machine learning', 'A desire to work on advertising challenges that require flexibility in approach -- everything from on-the-fly analytics to statistics, big data, machine learning, and mathematical algorithms ', ' Productionalize workflows and contributing code to our Known repos (I don’t know what this means) Operate existing software infrastructure to traffic, evaluate performance, and analyze media May mentor others ', 'Annual bonuses', 'Ability to build a presentation deck', 'Equity plan with profit sharing', 'Unlimited paid time off', 'A Masters or PhD from a well-regarded college or university. STEM degrees are preferred ', 'Operate existing software infrastructure to traffic, evaluate performance, and analyze media', 'Some professional experience in marketing, advertising or media is a plus', 'Weekly company lunches', 'Ability to think strategically, analytically, and proactively about diverse business problems', 'A commitment to managing the quality & accuracy of analytics, ensuring high standards with your and others’ work', 'Desire to mentor and teach others', 'Generous medical plan', 'Responsible for the day-to-day management of the media spend you’re responsible for, including ideation on quantitative approaches for driving value, monitoring metrics, and troubleshooting issues', 'Productionalize workflows and contributing code to our Known repos (I don’t know what this means)', ' Experience utilizing Python (or similar language) and SQL Experience using Machine Learning Understanding of statistics/science/evidence/experimentation Proficient with Microsoft office suite of products (Excel, Word, PowerPoint) Ability to build and maintain external relationships (clients, vendors, etc.) Superb written and verbal communication and presentation skills Ability to articulate clearly and communicate a “data story” Ability to build a presentation deck A desire to work on advertising challenges that require flexibility in approach -- everything from on-the-fly analytics to statistics, big data, machine learning, and mathematical algorithms  An ability to translate business challenges into quantitative problems, and solve them by whatever means necessary, which may not always be strict machine learning A willingness to learn foundational knowledge and skills rapidly An ability to think strategically, analytically, and proactively about diverse business problems A commitment to managing the quality & accuracy of analytics, ensuring high standards with your and others’ work Experience multi-tasking in a fast-paced environment ', 'The Opportunity', ' Build presentations and present work to clients with the ability to articulate results ', 'A willingness to learn foundational knowledge and skills rapidly', 'Here Are Just Some Examples Of What We Offer', 'Develop new techniques (e.g., ML models, optimization algorithms, and automation) to optimize KPIs and improve Known IP', 'May mentor others', 'Discuss and defend your analyses and ensure that it directly meets the client’s needs. ', 'Willing & able to learn quickly', 'Fully stocked kitchen', 'Ability to prioritize time, work and effort while multitasking on multiple projects', 'Understanding of statistics/science/evidence/experimentation', 'An ability to think strategically, analytically, and proactively about diverse business problems', ' Ability to prioritize time, work and effort while multitasking on multiple projects Desire to mentor and teach others Ability to think strategically, analytically, and proactively about diverse business problems Collaborative attitude Self-motivated and exhibits initiative Willing & able to learn quickly Abundant intellectual curiosity and integrity Collaborative attitude ', 'Ability to build and maintain external relationships (clients, vendors, etc.)', 'Design and execute every technical aspect of an engagement, including machine learning, analytics, and visualization ', 'In-house barista plus cold brew on tap!', 'Who You Are And What You Have', 'Vacation and birthday cash bonuses', '5+ years of hands-on experience doing quantitative analysis, predictive modeling, optimization and/or statistics', 'Abundant intellectual curiosity and integrity', 'About Known', 'Competencies', 'Skills, Abilities, And Knowledge', 'Proficient with Microsoft office suite of products (Excel, Word, PowerPoint)', 'Build presentations and present work to clients with the ability to articulate results']",Entry level,Full-time,Engineering,Marketing and Advertising,2021-02-10 11:29:29
Data Engineer II - Wild Rift,Riot Games,"Los Angeles, CA",29 minutes ago,41 applicants,"['', ' You will transform raw data to datasets that end-users can easily query.', ""It’s our policy to provide equal employment opportunity for all applicants and members of Riot Games, Inc. Riot Games makes reasonable accommodations for handicapped and disabled Rioters and does not unlawfully discriminate on the basis of race, color, religion, sex, sexual orientation, gender identity or expression, national origin, age, handicap, veteran status, marital status, criminal history, or any other category protected by applicable federal and state law, including the City of Los Angeles’ Fair Chance Initiative for Hiring Ordinance relating to an applicant's criminal history (LAMC 189.00)."", '  You will partner with researchers, analysts, and advisers to ensure the time they spend transforming data to answer their questions are minimal.  You will transform raw data to datasets that end-users can easily query.  You will work with the data scientists and engineers on your team to ship data powered products to players.  You will advocate for best practices and identify opportunities for the team to improve the sustainability of our portfolio. ', ' Experience with Databricks, Spark, Airflow, Terraform, or Ansible.', 'Desired Qualifications', ' 1+ years of experience working directly with end data users and meeting their requirements.', ' Proficiency in data structures and algorithms.', ' 3+ years of programming experience in SQL and Python or Java.', ' You will advocate for best practices and identify opportunities for the team to improve the sustainability of our portfolio.', 'Our Perks', ' You will partner with researchers, analysts, and advisers to ensure the time they spend transforming data to answer their questions are minimal.', ' Experience mentoring others.', ' 1+ years of experience leading the technical direction of your projects.', ' You will work with the data scientists and engineers on your team to ship data powered products to players.', '  Experience developing an enterprise data warehouse spanning across multiple teams.  Experience working collaboratively in a team environment.  Experience mentoring others.  Experience with Databricks, Spark, Airflow, Terraform, or Ansible.  Fluency in Mandarin. ', ' 1+ years of experience with cloud service providers (AWS, GCP).', ' 3+ years of experience developing data pipelines and data modeling.', 'Responsibilities', 'Required Qualifications', ' Experience working collaboratively in a team environment.', '  3+ years of programming experience in SQL and Python or Java.  3+ years of experience developing data pipelines and data modeling.  1+ years of experience with cloud service providers (AWS, GCP).  1+ years of experience working directly with end data users and meeting their requirements.  1+ years of experience leading the technical direction of your projects.  Proficiency in data structures and algorithms. ', ' Experience developing an enterprise data warehouse spanning across multiple teams.', ' Fluency in Mandarin.']",Not Applicable,Full-time,Information Technology,Computer Games,2021-02-10 11:29:29
Senior Researcher,N/A,"Milford, MI",22 hours ago,Be among the first 25 applicants,[''],Associate,Full-time,Research,N/A,2021-02-10 11:29:29
Researcher in Physiological Modeling and Closed-Loop Medical Systems (Biomedical/Electrical/Mechanical Engineer),FDA,"Montgomery County, MD",1 hour ago,Be among the first 25 applicants,"['', 'The candidate will join a research team studying science questions to advance new patient monitoring and physiological closed-loop controlled medical devices. The candidate will work closely with other team members on a project to study and determine best practices in the design, evaluation, and use of patient-specific models (e.g., models of heart rate variability) for medical device testing. Candidates will be involved with and learn about developing computational modeling and simulation methods for testing physiological closed-loop controlled medical devices, writing and maintaining software documentation, developing scientific manuscripts, and contributing to future research study design. Strong communication and writing skills are required.', 'Desired Skills & Experience', 'Strong technical background and experience in signal processing, system identification, control system design and analysis, stochastic control of physiological variables, computational modeling and simulations of physiological and/or medical device systems;', 'PhD or MS degree in biomedical engineering, electrical engineering, mechanical engineering, or a related field with a strong interest in a biomedical research career;', 'An ORISE Research Fellow position for a biomedical / electrical / mechanical engineer is available in\xa0the Division of Biomedical Physics, Office of Science and Engineering Laboratories at the U.S. Food and Drug Administration, located in Silver Spring. MD. Funding is currently available for up to 1 year with the possibility of extension. The candidate must have received his / her most recent degree within 5 years of the start date and be eligible to work in the U.S. All candidates must meet applicable security requirements which include a background check and a minimum of 3 out of the past 5 years’ residency status in the US.', 'Job Description', 'Computational analysis of physiologic signals (e.g., ECG);', 'PhD or MS degree in biomedical engineering, electrical engineering, mechanical engineering, or a related field with a strong interest in a biomedical research career;Strong technical background and experience in signal processing, system identification, control system design and analysis, stochastic control of physiological variables, computational modeling and simulations of physiological and/or medical device systems;Experience in one or more of the following:Designing, testing and using automated measurement testing platforms including instrumentation control and data acquisition;Designing, evaluating, and implementing simulations of computational physiologic systems models;Computational analysis of physiologic signals (e.g., ECG);Excellent programming skills in high level languages (e.g., Python / Matlab) and software for system modeling, simulation, and testing (e.g., Simulink / LabView);Background or research experience in cardiovascular physiology and neural engineering.', 'Designing, evaluating, and implementing simulations of computational physiologic systems models;', 'Background or research experience in cardiovascular physiology and neural engineering.', 'Designing, testing and using automated measurement testing platforms including instrumentation control and data acquisition;', 'Experience in one or more of the following:', 'Excellent programming skills in high level languages (e.g., Python / Matlab) and software for system modeling, simulation, and testing (e.g., Simulink / LabView);']",Associate,Full-time,Research,Government Administration,2021-02-10 11:29:29
Researcher (Part Time),Stanford Center on Philanthropy and Civil Society (Stanford PACS),"Stanford, CA",15 hours ago,Be among the first 25 applicants,"['·\xa0\xa0\xa0\xa0\xa0\xa0\xa0\xa0\xa0Other tasks to further the studies', 'Candidates must have the following minimum qualifications:\xa0', '', '\xa0\xa0', '·\xa0\xa0\xa0\xa0\xa0\xa0\xa0\xa0\xa0Ability to work under\xa0deadlines with general guidance', '·\xa0\xa0\xa0\xa0\xa0\xa0\xa0\xa0\xa0Strong organizational\xa0or\xa0project/program management\xa0skills', '·\xa0\xa0\xa0\xa0\xa0\xa0\xa0\xa0\xa0Graduate degree in the social sciences, PhD preferred', 'Researcher (part-time),\xa0Effective Philanthropy Learning Initiative\xa0', '·\xa0\xa0\xa0\xa0\xa0\xa0\xa0\xa0\xa0Experience conducting qualitative social science\xa0research,\xa0and thorough understanding of scientific theory and methods', '·\xa0\xa0\xa0\xa0\xa0\xa0\xa0\xa0\xa0Code and analyze data', 'Apply at:\xa0https://form.jotform.com/91565445022151', 'Apply at:', 'Time\xa0commitment: 20 hours a week (average)', 'Candidate Criteria:\xa0', 'Application\xa0Deadline:\xa0\xa0February 24, 2021', 'About\xa0EPLI\xa0and Stanford PACS:\xa0', 'The EPLI team is seeking an experienced\xa0researcher with excellent analytical and writing capabilities. The\xa0researcher will work alongside the Associate Director of\xa0Research to develop and conduct two studies. The first will examine the ways that professional training and norms influence the experiences and philanthropic behaviors of wealthy individuals. The second will investigate the ways that donors who espouse values related to social justice incorporate those values into their philanthropic practice. Specifically, the\xa0researcher will:', '·\xa0\xa0\xa0\xa0\xa0\xa0\xa0\xa0\xa0Draft\xa0papers revealing\xa0research\xa0results', '·\xa0\xa0\xa0\xa0\xa0\xa0\xa0\xa0\xa0Conduct literature reviews', 'The\xa0Effective Philanthropy Learning Initiative\xa0(EPLI)\xa0at Stanford University’s\xa0Center on Philanthropy and Civil Society (PACS)\xa0is looking for\xa0a\xa0part-time\xa0researcher\xa0to\xa0support our\xa0research agenda, which focuses broadly\xa0on philanthropic trends and donor behavior.\xa0\xa0\xa0', '·\xa0\xa0\xa0\xa0\xa0\xa0\xa0\xa0\xa0Prepare manuscripts for publication in academic and non-academic publications\xa0', '·\xa0\xa0\xa0\xa0\xa0\xa0\xa0\xa0\xa0Perform\xa0participant outreach\xa0', '·\xa0\xa0\xa0\xa0\xa0\xa0\xa0\xa0\xa0A commitment to EPLI’s work\xa0and mission or scholarly interests in philanthropy, wealth, the social sector and/or social inequality', '·\xa0\xa0\xa0\xa0\xa0\xa0\xa0\xa0\xa0Strong\xa0writing, communication,\xa0and data analysis skills', '·\xa0\xa0\xa0\xa0\xa0\xa0\xa0\xa0\xa0Experience conducting interviews for qualitative\xa0research projects', 'Available\xa0Position:\xa0Researcher (part-time)\xa0', 'Stanford PACS is a\xa0research center for students, scholars, and practitioners to explore and share ideas that create social change. Its primary\xa0participants are Stanford faculty, visiting scholars, postdoctoral fellows, graduate and undergraduate students, and nonprofit and foundation practitioners. As publisher of Stanford Social Innovation Review (SSIR), Stanford PACS informs policy and social innovation, philanthropic investment and nonprofit practice.\xa0PACS is also home to\xa0thought leaders tackling some of the greatest challenges facing the world today through the Digital Civil Society Lab, the Program on Democracy and the Internet, and the Global Impact Innovation Lab.\xa0', 'To begin:\xa0February or March, 2021\xa0', '·\xa0\xa0\xa0\xa0\xa0\xa0\xa0\xa0\xa0General knowledge of IRB protocols', '·\xa0\xa0\xa0\xa0\xa0\xa0\xa0\xa0\xa0Assist in the determining methodological approaches to\xa0research questions', 'The\xa0Effective Philanthropy Learning Initiative\xa0(EPLI) at Stanford PACS\xa0is an interdisciplinary\xa0team\xa0working at the intersection of the social and behavioral sciences and strategic philanthropy. The lab conducts\xa0research, develops\xa0resources, and teaches with the aim of increasing donor impact.\xa0\xa0', 'Work period:\xa06-12 months, with the possibility of extension', '\xa0', '·\xa0\xa0\xa0\xa0\xa0\xa0\xa0\xa0\xa0Conduct interviews', '·\xa0\xa0\xa0\xa0\xa0\xa0\xa0\xa0\xa0Excellent organizational skills and demonstrated ability to complete detailed work accurately', '·\xa0\xa0\xa0\xa0\xa0\xa0\xa0\xa0\xa0Participate in weekly\xa0research meeting', 'https://form.jotform.com/91565445022151', '·\xa0\xa0\xa0\xa0\xa0\xa0\xa0\xa0\xa0Familiarity with qualitative coding software is a plus']",Associate,Part-time,Research,Higher Education,2021-02-10 11:29:29
Data Engineer,JBT Corporation,United States,18 minutes ago,61 applicants,"['', 'Data Engineering', 'Bachelor’s degree in Computer Science or related field', '\ufeffYou will be part of multiple teams tasked with multiple projects, designing and building strategic data solutions supporting analytical and reporting needs of the Organization. This opportunity has a global scope, collaborating with all levels of leadership within various businesses within the organization. Senior Data Engineer will support the creation and execution of data strategy at the corporate, business unit and site levels.\xa0\xa0\xa0', 'Be an evangelist to promote understanding and usage of enterprise data to fully leverage the power of data and automation', 'Load', 'Write optimized, secure and scalable code', 'Excellent interpersonal skills, relationship building, and project management skills.', 'Positions in this sub-functional area of Data, Analytics & Business Intelligence Organization are responsible for performing complex data processing, manipulating and integrating internal and external data sources. Through an Extract, Transform, and Load strategy resulting in aggregating data for insights and self-service analytics, achieving highest data quality and efficiency.', 'This area is responsible for creating a data driven culture, through the development and execution of our organizational data analytics strategy, combing people, process, and technology to deliver value from data to the organization.\xa0Enabling self-service analytics while focusing on innovations, automation, efficiency gains, promoting agility and organizational growth.', 'An understanding of coding using Python or Scala or anther high-level programming language, with an aptitude to become proficient in the near future', 'Experienced in working with ETL application, data pipelines, and Big Data', 'Write optimized, secure and scalable codeExecute a design of data ETL process (including, documentation and flow charts)Come up with creative solutions to solve technical and analytical challengesSupport efforts to develop enterprise data model and data cataloging to promote consistency and efficiencyDevelop and support needed data pipelinesPartner closely with teams across the globe to gain a full understanding of analytical and/or reporting objective to provide respective data aggregationBe comfortable communicating with non-technical audienceBe an evangelist to promote understanding and usage of enterprise data to fully leverage the power of data and automationExpected to keep up with emerging trends & technologies in big data and analytics and keep abreast of latest related researchMentor and train junior engineers and other team membersReport and monitor progress towards Data & Analytics Organizational goalsOn daily basis monitor current data extraction processes in place and address any issues that might occur', 'Support efforts to develop enterprise data model and data cataloging to promote consistency and efficiency', 'Knowledge of Hadoop related technology such as Impala, Yarn, Hive, HDFS, Oozie etc.', 'Extract', 'Knowledge of Azure Data Factory', 'Be comfortable communicating with non-technical audience', 'Data, Analytics & Business Intelligence Organization', 'This position reports to the Global Senior Manager of Data and BI Analytics.', 'Qualification:', 'Experienced in using data integrations tools, SQL and BI Tools, Tableau experience preferred', 'Partner closely with teams across the globe to gain a full understanding of analytical and/or reporting objective to provide respective data aggregation', 'Execute a design of data ETL process (including, documentation and flow charts)', '\ufeff', 'Come up with creative solutions to solve technical and analytical challenges', 'Ability to work various hours to support global organization with business hours in multiple time zones', 'Experienced in data quality issue tracking and resolution activities, end to end (impact analysis, root causes analysis, implications to reporting and data analytics, etc.)', 'As a Senior Data Engineer, you will be part of the Data, Analytics & Business Intelligence Team, working with and mentoring colleagues who will help, support, and challenge you every day.\xa0Data testing, code reviewing, creative solutions related to challenging data problems, regular check-ins with leadership, business and IT partners, for continuous integration is just a part of your day.\xa0\xa0We expect our engineers to do more than just write code, your responsibilities will include but are not limited to:', 'Report and monitor progress towards Data & Analytics Organizational goals', 'Mentor and train junior engineers and other team members', 'Develop and support needed data pipelines', '\xa0', ' Transform,', 'An understanding of Spark, experience using Spark is a plus', 'High attention to details,', 'On daily basis monitor current data extraction processes in place and address any issues that might occur', 'Expected to keep up with emerging trends & technologies in big data and analytics and keep abreast of latest related research', '5+ years of relevant experience', 'Experienced with creating data cataloging, data certifications, and full documentation spectrum related to data strategy and/or pipeline', 'Experienced in leading and coordinating multifunctional activities to support data needs between various business units across the organization', 'Bachelor’s degree in Computer Science or related field5+ years of relevant experienceExperienced in using data integrations tools, SQL and BI Tools, Tableau experience preferredExperienced in working with ETL application, data pipelines, and Big DataExperienced in data quality issue tracking and resolution activities, end to end (impact analysis, root causes analysis, implications to reporting and data analytics, etc.)Experienced working with structured and unstructured data, dispersed data with various formats, size and/or locationsExperienced in leading and coordinating multifunctional activities to support data needs between various business units across the organizationExperienced with creating data cataloging, data certifications, and full documentation spectrum related to data strategy and/or pipelineAn understanding of coding using Python or Scala or anther high-level programming language, with an aptitude to become proficient in the near futureAn understanding of Spark, experience using Spark is a plusKnowledge of Hadoop related technology such as Impala, Yarn, Hive, HDFS, Oozie etc.Knowledge of Azure Data FactoryExcellent interpersonal skills, relationship building, and project management skills.High attention to details,Ability to work various hours to support global organization with business hours in multiple time zones', 'Experienced working with structured and unstructured data, dispersed data with various formats, size and/or locations']",Mid-Senior level,Full-time,Information Technology,Business Supplies and Equipment,2021-02-10 11:29:29
