job_title,company,location,date_posted,applicants,job_text,seniority_level,employment_type,job_function,industries,date_scraped
Big Data Cloud Consultant,Amazon Web Services (AWS),"Austin, TX",15 hours ago,Be among the first 25 applicants,"['', ' Experience building sophisticated and highly automated data ingestion and analytics infrastructure.', ' Knowledge of some or all AWS Compute, Storage, Networking, Database, Management tools, Security, Identity and Compliance services', ' Demonstrates ability to invent and deliver innovative, impactful, and inspiring solutions Ability to get AWS Professional certification within three months of hire.', 'Description', 'We Are Looking For People That Have', ' AWS certification, or ability to get certified within three months of hire.', ' Demonstrates ability to be comfortable speaking with executives, IT Management, and developers.', ' Practical project delivery experience. AWS certification, or ability to get certified within three months of hire. Demonstrates experience in running complex projects. Experience building sophisticated and highly automated data ingestion and analytics infrastructure. Experience building and creating machine learning applications. High level of skill communicating effectively across internal and external organizations. Demonstrates ability to adapt to new technologies and learn quickly. Demonstrates ability to be comfortable speaking with executives, IT Management, and developers. Demonstrates ability to work in a diverse team. Demonstrates ability to invent and deliver innovative, impactful, and inspiring solutions Ability to get AWS Professional certification within three months of hire. Demonstrates ability to invent and deliver innovative, impactful, and inspiring solutions for complex projects. Experience building highly automated data ingestion and analytics infrastructure. Experience building and creating machine learning applications. High level of skill communicating effectively with internal and external executives, IT Management, and developers across organizations. Demonstrates ability to adapt to new technologies and learn quickly. Demonstrates ability to work in a diverse team.', ' High level of skill communicating effectively with internal and external executives, IT Management, and developers across organizations.', 'Preferred Qualifications', ' High level of skill communicating effectively across internal and external organizations.', ' Practical project delivery experience.', ' An understanding of enterprise software development tools and methodologies, including typical enterprise application architectures and the ability to write code.', ' A background of technical expertise supporting customers with cloud based data warehouse and big data analytics applications.', ' Demonstrates experience in running complex projects.', ' Demonstrates ability to adapt to new technologies and learn quickly.', "" 7+ year’s experience in developing secure customer facing web and/or mobile applications Knowledge of some or all AWS Compute, Storage, Networking, Database, Management tools, Security, Identity and Compliance services Management, Information Security or equivalent experience required Bachelor's Degree in Computer Science, Information Systems Management, Information Security or equivalent experience required"", ' A mix of advanced technology and strategic business acumen as well as a demonstrated ability to engage in senior level technology decision maker discussions related to the business value of AWS services and offerings.', ' Demonstrates ability to invent and deliver innovative, impactful, and inspiring solutions for complex projects.', "" Bachelor's Degree in Computer Science, Information Systems Management, Information Security or equivalent experience required"", ' A strong understanding of large scale computing solutions across the full enterprise stack. The ideal candidate will be a hands-on technical expert and have past experience working as a consultant. With AWS, you will keep your existing technical skills honed and develop new ones as you lead architecture discussions and proof of concept buildouts for customers. You will regularly take part in deep-dive education and hands-on design exercises to create world-class cloud solutions built on AWS. A background of technical expertise supporting customers with cloud based data warehouse and big data analytics applications. An understanding of enterprise software development tools and methodologies, including typical enterprise application architectures and the ability to write code. A mix of advanced technology and strategic business acumen as well as a demonstrated ability to engage in senior level technology decision maker discussions related to the business value of AWS services and offerings. Demonstrated ability to think strategically about business, product, and technical challenges.', ' Demonstrated ability to think strategically about business, product, and technical challenges.', 'Basic Qualifications', ' Demonstrates ability to work in a diverse team.', ' Experience building and creating machine learning applications.', ' 7+ year’s experience in developing secure customer facing web and/or mobile applications', ' Management, Information Security or equivalent experience required', ' A strong understanding of large scale computing solutions across the full enterprise stack. The ideal candidate will be a hands-on technical expert and have past experience working as a consultant. With AWS, you will keep your existing technical skills honed and develop new ones as you lead architecture discussions and proof of concept buildouts for customers. You will regularly take part in deep-dive education and hands-on design exercises to create world-class cloud solutions built on AWS.', 'Company', ' Experience building highly automated data ingestion and analytics infrastructure.']",Not Applicable,Full-time,Consulting,Computer Software,2020-08-29 22:25:58
Senior Data Scientist II,AF - Group,"Lansing, MI",22 hours ago,Be among the first 25 applicants,"['', 'Ability to apply the principles of independent logical thinking to define problems, collect data, establish facts, draw valid conclusions and make actionable strategic recommendations.', 'We are an Equal Opportunity Employer. Diversity is valued and we will not tolerate discrimination or harassment in any form. Candidates for the position stated above are hired on an ""at will"" basis. Nothing herein is intended to create a contract.', 'Develops custom, explainable models that enhance business processes to reflect corporate goals, experience, and current market conditions using pattern recognition, evolutionary computation, and machine learning algorithms.', 'Knowledge of insurance and underwriting techniques, agency and policyholder needs.', 'Ability to serve as a mentor to others.', 'Ability to maintain confidentiality.', 'Conducts research utilizing predictive modeling.', 'Presents findings and recommendations to appropriate groups.', 'Ability and proficiency in the use of computers and company standard software specific to position. General familiarity with the following software: SAS, R, SQL.', 'Skills/Knowledge/Abilities (ska) Required', 'Ability to comprehend consequences of various situations and make appropriate individuals aware of same for decision making.', 'Delivers conclusions.', ' Excellent interpersonal, organizational and communication skills. Ability and proficiency in the use of computers and company standard software specific to position. General familiarity with the following software: SAS, R, SQL. Strong database management skills. Ability to provide direction to other department analysts. Ability to use independent judgment and initiative and to anticipate needs of executive and department, accomplishing tasks without direction. Ability to work effectively as a member of a team. Resourceful problem solving skills and desire to succeed. Knowledge of insurance and underwriting techniques, agency and policyholder needs. Ability to establish workflows, manages multiple projects, meet necessary deadlines, and work without supervision. Exercise sufficient discretion and independent judgment with a wide degree of creativity and latitude. Ability to apply the principles of independent logical thinking to define problems, collect data, establish facts, draw valid conclusions and make actionable strategic recommendations. Ability to manage responsibilities as unexpected pressures/dilemmas arise. Ability to comprehend consequences of various situations and make appropriate individuals aware of same for decision making. Ability to maintain confidentiality. Expert knowledge of statistical modeling and data mining techniques. Expert knowledge of modeling software and data manipulation techniques. Ability to lead a project team in the full scope of project assignments. Ability to serve as a mentor to others. ', 'Participates in and is responsible for projects requiring advanced statistical analyses, innovative research, mathematical calculations, and technical skills.', ' Provides technical and quantitative analysis for predictive modeling group. Assists in statistical data mining and actuarial research by applying advanced statistical concepts. Uses computer technology, computer modeling, spreadsheet applications, software tools, and programming languages. Participates in and is responsible for projects requiring advanced statistical analyses, innovative research, mathematical calculations, and technical skills. Conducts research utilizing predictive modeling. Interprets data and identifies correlations using both univariate and multivariate analysis. Participates in and is responsible for advanced projects. Presents findings and recommendations to appropriate groups. Prepares and delivers summary reports to the relevant or affected areas within the company. Helps to determine what actionable steps can be taken based on the findings. Communicates and trains users on model results. Develops custom, explainable models that enhance business processes to reflect corporate goals, experience, and current market conditions using pattern recognition, evolutionary computation, and machine learning algorithms. Document model requirements. Examine and analyze data to determine optimal modeling approach. Identify candidate risk factors. Build models using training, test, and cross-validation data sets. Share model results. Finalize model. Delivers conclusions. Deploy and maintain models with or without the assistance of the IT department. Leads communication of predictive model results to company. Leads implementation efforts for assigned predictive model projects. Trains predictive modelers I and II in predictive modeling and other analytical tasks. Performs ad hoc analysis to identify issues with existing models. Designs and leads implementation efforts for the maintenance procedures for our models. ', 'Leads communication of predictive model results to company.', 'Prepares and delivers summary reports to the relevant or affected areas within the company. Helps to determine what actionable steps can be taken based on the findings.', 'Uses computer technology, computer modeling, spreadsheet applications, software tools, and programming languages.', 'Share model results.', 'Ability to lead a project team in the full scope of project assignments.', 'Requirements', 'Ability to use independent judgment and initiative and to anticipate needs of executive and department, accomplishing tasks without direction.', 'Expert knowledge of statistical modeling and data mining techniques.', 'Interprets data and identifies correlations using both univariate and multivariate analysis.', 'Ability to work effectively as a member of a team.', 'Ability to manage responsibilities as unexpected pressures/dilemmas arise.', 'Communicates and trains users on model results.', 'Examine and analyze data to determine optimal modeling approach.', 'Provides technical and quantitative analysis for predictive modeling group.', 'Leads implementation efforts for assigned predictive model projects.', 'Trains predictive modelers I and II in predictive modeling and other analytical tasks.', 'The qualifications listed above are intended to represent the minimum education, experience, skills, knowledge and ability levels associated with performing the duties and responsibilities contained in this job description. ', 'Excellent interpersonal, organizational and communication skills.', 'EMPLOYMENT QUALIFICATIONS:', 'Working Conditions', 'Deploy and maintain models with or without the assistance of the IT department.', 'Strong database management skills.', 'Ability to establish workflows, manages multiple projects, meet necessary deadlines, and work without supervision.', 'Education', 'Ability to provide direction to other department analysts.', 'Experience', 'Responsibilities/Tasks', 'Resourceful problem solving skills and desire to succeed.', 'Designs and leads implementation efforts for the maintenance procedures for our models.', 'Identify candidate risk factors.', 'Finalize model.', 'Build models using training, test, and cross-validation data sets.', 'Performs ad hoc analysis to identify issues with existing models.', 'Exercise sufficient discretion and independent judgment with a wide degree of creativity and latitude.', 'Summary', 'Expert knowledge of modeling software and data manipulation techniques.', 'Participates in and is responsible for advanced projects.', 'This position description identifies the responsibilities and tasks typically associated with the performance of the position. Other relevant essential functions may be required.', 'Document model requirements.', 'Assists in statistical data mining and actuarial research by applying advanced statistical concepts.']",Mid-Senior level,Full-time,Other,Information Technology and Services,2020-08-29 22:25:58
Post Doctorate RA - Visual Analytics Research Associate,Pacific Northwest National Laboratory - PNNL,"Richland, WA",21 hours ago,Be among the first 25 applicants,"['', 'In-depth knowledge in areas such as text analysis, network analysis & visualization, data science, machine learning, and optimization is highly desirable.', 'Selects and develops technical approaches on assignments with occasional oversight.', 'Skilled professional who applies a broad basis of existing theories, principles, and concepts to a specialty field.', ' Preferred academic coursework the disciplines of computer science, human computer interaction, visual analytics, human factors engineering, or related disciplines. ', ' Please be aware that the Department of Energy (DOE) prohibits DOE employees and contractors from participation in certain foreign government talent recruitment programs. If you are offered a position at PNNL and are currently a participant in a foreign government talent recruitment program you will be required to disclose this information before your first day of employment. ', 'Beginning to establish a leadership role in professional community including professional societies, other laboratories, academia, and industry.', ' Skilled professional who applies a broad basis of existing theories, principles, and concepts to a specialty field. Technical expert who selects and widely applies principles, theories and concepts in a major field of specialization. In-depth knowledge in areas such as text analysis, network analysis & visualization, data science, machine learning, and optimization is highly desirable. Experience with user experience design and evaluation methodologies (e.g, design of experiments, empirical studies, qualitative studies, statistical analysis). ', 'Equal Employment Opportunity', 'Organization and Job ID', 'Preferred Qualifications', 'Job Description', ' Establishing a local reputation with specialization in at least one S&E domain. Selects and develops technical approaches on assignments with occasional oversight. Beginning to establish a leadership role in professional community including professional societies, other laboratories, academia, and industry. ', 'Minimum Qualifications', 'Experience with user experience design and evaluation methodologies (e.g, design of experiments, empirical studies, qualitative studies, statistical analysis).', 'Preferred academic coursework the disciplines of computer science, human computer interaction, visual analytics, human factors engineering, or related disciplines.', 'Establishing a local reputation with specialization in at least one S&E domain.', 'Preferred Education', 'Technical expert who selects and widely applies principles, theories and concepts in a major field of specialization.']",Not Applicable,Full-time,Other,Information Technology and Services,2020-08-29 22:25:58
Data Analyst Intern (Fall 2020),Panasonic North America,"Newark, NJ",18 hours ago,Over 200 applicants,"['', 'No travel required', 'What We Offer', 'Competitive compensation packageComprehensive benefitsPet InsurancePaid Parental Care LeaveEmployee Referral ProgramEducational AssistanceFlexible Work ProgramVolunteer time OffCasual Dress CodeTotal Well Being Program', 'Excellent planning and time management skills', 'Detailed oriented & thorough', 'Must have BA/BS or pursuing a degree in business or marketingMust be proficient in Microsoft Office software; particularly Excel', ""Creating a corresponding rep list and map delineating each rep's territory."", 'What You’ll Bring', 'Pet Insurance', 'Total Well Being Program', 'Employee Referral Program', 'Self-motivator who will require minimal supervision', ""Master data analysis, validating and updating customer and channel partner data in SAP, making sure we have up to date and accurate contact information, addresses, email addresses etc, Including sales rep and a Panasonic salesperson assignments.Creating a corresponding rep list and map delineating each rep's territory.Validate information, policies and communications that are being distributed accordinglySupport the National Key Accounts team with other current projects."", 'Must have BA/BS or pursuing a degree in business or marketing', 'Flexible Work Program', 'Educational Assistance', 'Must be proficient in Microsoft Office software; particularly Excel', 'Support the National Key Accounts team with other current projects.', 'Paid Parental Care Leave', 'What You’ll Get To Do', 'Competencies', ' Watch this video', 'Validate information, policies and communications that are being distributed accordingly', 'Competitive compensation package', 'Comprehensive benefits', 'Other Requirements', 'Communicates with all levels of organization including executive management as well as customers and suppliers. Requires professional communications.', 'Education & Experience:', 'Volunteer time Off', 'Click here to learn more', 'should have conceptual understanding of system data, databases and data maintenance', 'Detailed oriented & thoroughExcellent planning and time management skillsAbility to prioritize work accordinglySelf-motivator who will require minimal supervisionshould have conceptual understanding of system data, databases and data maintenance', 'Communications', 'Casual Dress Code', 'Master data analysis, validating and updating customer and channel partner data in SAP, making sure we have up to date and accurate contact information, addresses, email addresses etc, Including sales rep and a Panasonic salesperson assignments.', 'Ability to prioritize work accordingly']",Internship,Full-time,Information Technology,Information Technology and Services,2020-08-29 22:25:58
Staff Tax Accountant (Master Data Analyst),"Delek US Holdings, Inc.","Brentwood, TN",22 hours ago,Be among the first 25 applicants,"['', 'Impact: Impacts quality of own work and the work of others on the team; works within guidelines and policies.', 'Required Qualifications – Education, Skills & Experience', 'Staff Tax Accounting team', ' Job Functional Knowledge: Requires expanded conceptual knowledge in own job discipline and broadens capabilities.', 'Core Values', 'Problem Solving: Solves problems in straightforward situations; analyzes possible solutions using technical experience and judgment and precedents.', 'Safety:', 'Maximizing Value:', 'Passion for Winning & Excellence:', 'Leadership: Provides informal guidance to new team members.', 'Functional Competencies', 'Assist in the development projects and technical team delivering solutions related to MDMAssist in the creation of roadmaps that helps to set and deliver technical strategy for management of master dataBuild strong partnerships and manage varying levels of business stakeholders setting expectations and gaining alignment on delivery of solutions.Work cross functionally with Data Governance team to ensure principles, best practices, guidelines, and standards for master data are appliedExpand, analyze and maintain metrics for measuring adherence and improvement; understand data quality issues and create action plans to resolve them', 'Assist in the creation of roadmaps that helps to set and deliver technical strategy for management of master data', 'Interpersonal skills: Explains complex information to others in straightforward situations.', 'Build strong partnerships and manage varying levels of business stakeholders setting expectations and gaining alignment on delivery of solutions.', ' Job Functional Knowledge: Requires expanded conceptual knowledge in own job discipline and broadens capabilities.Business Acumen: Understands key business drivers; uses this understanding to accomplish own work.Leadership: Provides informal guidance to new team members.Problem Solving: Solves problems in straightforward situations; analyzes possible solutions using technical experience and judgment and precedents.Impact: Impacts quality of own work and the work of others on the team; works within guidelines and policies.Interpersonal skills: Explains complex information to others in straightforward situations.', 'Growth Oriented:', 'Organizational Competencies', 'Expand, analyze and maintain metrics for measuring adherence and improvement; understand data quality issues and create action plans to resolve them', 'Assist in the development projects and technical team delivering solutions related to MDM', 'Master Data Analyst', 'Business Acumen: Understands key business drivers; uses this understanding to accomplish own work.', 'Job Responsibilities', 'Work cross functionally with Data Governance team to ensure principles, best practices, guidelines, and standards for master data are applied', 'Integrity:', 'Organizational Leveling']",Associate,Full-time,Accounting/Auditing,Construction,2020-08-29 22:25:58
Data Analyst,Robert Half,"New York, NY",,Be among the first 25 applicants,"['', 'Requirements', 'Description']",Entry level,Temporary,Information Technology,Staffing and Recruiting,2020-08-29 22:25:58
