job_title,company,location,date_posted,applicants,job_text,seniority_level,employment_type,job_function,industries,date_scraped
Machine Learning Engineer,N/A,"Attica, KS",5 hours ago,Be among the first 25 applicants,"['', ' The candidate will benefit from the new foreign tax residence incentive, granting an income tax exemption of 50%.', ' Develop code and documentation for a variety of difficult software projects, Design and implement bug fixes.  Design a variety of difficult software projects.  Define software specifications.  Interface with internal customers for requirements analysis and schedule.  Troubleshoot a variety of difficult software problems. Perform software tests on code and enhancements.  Work independently, with guidance in only the most complex situations and develop innovative solutions as part of proven track record of significant technology contributions.  Interface with external customers regarding software issues.  Compile data for regularly scheduled or special reports, analysis and statements.  Follow Software Management Processes (i.e. Agile, Scrum).  Impact difficult issues on the product design and address future concepts, products or technologies.', ' Experience in C/C++ programming.', ' Define software specifications.', ' Hands-on experience in Machine Learning/Deep Learning Frameworks and APIs (PyTorch, TensorFlow, Caffe2 etc.).', ' Follow Software Management Processes (i.e. Agile, Scrum).', ' Work independently, with guidance in only the most complex situations and develop innovative solutions as part of proven track record of significant technology contributions.', ' Ability to communicate difficult concepts and negotiate with others to adopt a different point of view.', ' Background in embedded system architectures.', ' We offer a very generous re-location package to help you move/return to Greece.  The candidate will benefit from the new foreign tax residence incentive, granting an income tax exemption of 50%.', ' Location: Athens, Greece ', ' Have a strong foundation and discipline in Machine Learning/Deep Learning algorithms.', ' Experience in image processing algorithms and frameworks (e.g., OpenCV).', ' Familiar with multiprocessing and multithreaded programming.', ' Machine Learning Engineer', ' Develop code and documentation for a variety of difficult software projects, Design and implement bug fixes.', ' We offer a very generous re-location package to help you move/return to Greece.', ' Ability to technically execute difficult, complex software projects.', ' Interface with internal customers for requirements analysis and schedule.', ' Proficiency in scripting languages (e.g., Python).', 'Preferred Skills', ' Interface with external customers regarding software issues.', ' Ability to technically execute difficult, complex software projects.  Have a strong foundation and discipline in Machine Learning/Deep Learning algorithms.  Hands-on experience in Machine Learning/Deep Learning Frameworks and APIs (PyTorch, TensorFlow, Caffe2 etc.).  Proficiency in scripting languages (e.g., Python).  Experience in C/C++ programming.  Experience in Computer Vision algorithms (e.g. Face Recognition, Object detection etc.).  Ability to communicate difficult concepts and negotiate with others to adopt a different point of view.', ' Troubleshoot a variety of difficult software problems. Perform software tests on code and enhancements.', ' Experience in Computer Vision algorithms (e.g. Face Recognition, Object detection etc.).', ' Background in embedded system architectures.  Linux development skills.  Experience in image processing algorithms and frameworks (e.g., OpenCV).  Familiar with multiprocessing and multithreaded programming.', ' Compile data for regularly scheduled or special reports, analysis and statements.', ' Design a variety of difficult software projects.', ' Impact difficult issues on the product design and address future concepts, products or technologies.', 'Required Skills', ' Linux development skills.', 'Key Responsibilities']",Entry level,Full-time,Engineering,Computer Hardware,2020-12-08 13:30:12
Machine Learning Engineer - IoT,Apple,"Cupertino, CA",13 hours ago,Be among the first 25 applicants,"['', 'Key Qualifications', 'Summary', 'Description', 'Education & Experience']",Not Applicable,Full-time,Engineering,Consumer Electronics,2020-12-08 13:30:12
"Senior Associate, Data Science",Wiley Job Network,"McLean, VA",16 hours ago,Be among the first 25 applicants,"['', ' Partner with a cross-functional team of data scientists, software engineers, and product managers to deliver a product customers love  Leverage a broad stack of technologies - Python, Conda, AWS, H2O, Spark, and more - to reveal the insights hidden within huge volumes of numeric and textual data  Build machine learning models through all phases of development, from design through training, evaluation, validation, and implementation  Flex your interpersonal skills to translate the complexity of your work into tangible business goals ', 'Basic Qualifications', "" Customer first. You love the process of analyzing and creating, but also share our passion to do the right thing. You know at the end of the day it's about making the right decision for our customers. "", 'In This Role, You Will', ' Master\'s Degree in ""STEM"" field (Science, Technology, Engineering, or Mathematics), or PhD in ""STEM"" field (Science, Technology, Engineering, or Mathematics)  Experience working with AWS  At least 2 years\' experience in Python, Scala, or R  At least 2 years\' experience with machine learning  At least 2 years\' experience with SQL ', ' At least 1 year of experience with relational databases ', "" Bachelor's Degree plus 2 years of experience in data analytics, or Master's Degree, or PhD "", ' Capital One will consider sponsoring a new qualified applicant for employment authorization for this position.', ' Customer first. You love the process of analyzing and creating, but also share our passion to do the right thing. You know at the end of the day it\'s about making the right decision for our customers.  Innovative. You continually research and evaluate emerging technologies. You stay current on published state-of-the-art methods, technologies, and applications and seek out opportunities to apply them.  Creative. You thrive on bringing definition to big, undefined problems. You love asking questions and pushing hard to find answers. You\'re not afraid to share a new idea.  A leader. You challenge conventional thinking and work with stakeholders to identify and improve the status quo. Your passionate about talent development for your own team and beyond.  Technical. You\'re comfortable with open-source languages and are passionate about developing further. You have hands-on experience developing data science solutions using open-source tools and cloud computing platforms.  Statistically-minded. You\'ve built models, validated them, and backtested them. You know how to interpret a confusion matrix or a ROC curve. You have experience with clustering, classification, sentiment analysis, time series, and deep learning.  A data guru. ""Big data"" doesn\'t phase you. You have the skills to retrieve, combine, and analyze data from a variety of sources and structures. You know understanding the data is often the key to great data science. ', ' Leverage a broad stack of technologies - Python, Conda, AWS, H2O, Spark, and more - to reveal the insights hidden within huge volumes of numeric and textual data ', ' At least 1 year of experience in open source programming languages for large scale data analysis ', "" At least 2 years' experience in Python, Scala, or R "", "" Bachelor's Degree plus 2 years of experience in data analytics, or Master's Degree, or PhD  At least 1 year of experience in open source programming languages for large scale data analysis  At least 1 year of experience with machine learning  At least 1 year of experience with relational databases "", ' A data guru. ""Big data"" doesn\'t phase you. You have the skills to retrieve, combine, and analyze data from a variety of sources and structures. You know understanding the data is often the key to great data science. ', ' Master\'s Degree in ""STEM"" field (Science, Technology, Engineering, or Mathematics), or PhD in ""STEM"" field (Science, Technology, Engineering, or Mathematics) ', ' At least 1 year of experience with machine learning ', "" At least 2 years' experience with SQL "", ' Build machine learning models through all phases of development, from design through training, evaluation, validation, and implementation ', "" Technical. You're comfortable with open-source languages and are passionate about developing further. You have hands-on experience developing data science solutions using open-source tools and cloud computing platforms. "", "" At least 2 years' experience with machine learning "", "" As a Data Scientist at Capital One, you'll be part of a team that's leading the next wave of disruption at a whole new scale, using the latest in computing and machine learning technologies and operating across billions of customer records to unlock the big opportunities that help everyday people save money, time and agony in their financial lives. "", 'The Ideal Candidate Is', ' A leader. You challenge conventional thinking and work with stakeholders to identify and improve the status quo. Your passionate about talent development for your own team and beyond. ', 'Preferred Qualifications', ' Innovative. You continually research and evaluate emerging technologies. You stay current on published state-of-the-art methods, technologies, and applications and seek out opportunities to apply them. ', "" Statistically-minded. You've built models, validated them, and backtested them. You know how to interpret a confusion matrix or a ROC curve. You have experience with clustering, classification, sentiment analysis, time series, and deep learning. "", ' Experience working with AWS ', ' Data is at the center of everything we do. As a startup, we disrupted the credit card industry by individually personalizing every credit card offer using statistical modeling and the relational database, cutting edge technology in 1988! Fast-forward a few years, and this little innovation and our passion for data has skyrocketed us to a Fortune 200 company and a leader in the world of data-driven decision-making. ', ' Flex your interpersonal skills to translate the complexity of your work into tangible business goals ', ' Partner with a cross-functional team of data scientists, software engineers, and product managers to deliver a product customers love ', "" Creative. You thrive on bringing definition to big, undefined problems. You love asking questions and pushing hard to find answers. You're not afraid to share a new idea. ""]",Associate,Full-time,Engineering,Information Technology and Services,2020-12-08 13:30:12
Data Scientist,ManTech,"Springfield, VA",8 hours ago,49 applicants,"['', 'Hands on experience working with data science methods such as: statistical modeling, information retrieval, graph analysis, data mining, machine learning', 'Basic Qualifications', 'Supports defining specific process improvement projects, identifies meaningful insights, interprets and communicates findings and makes recommendations including process improvement opportunities. Continual process improvement activities include data, processes, interfaces, tools and technology insertion. ', 'Secure our Nation, Ignite your Future', 'Constantly operates a computer and other office productivity machinery, such as a calculator, copy machine and computer printer.', 'Must be able to remain in a stationary position 50%.', 'Years of Experience in creating complex SQL queries and functions, data structures and strong analytical problem-solving skills.', 'Needs to occasionally move about inside the office to access file cabinets, office machinery, etc.', 'Responsibilities Include, But Are Not Limited To', 'Frequently communicates with co-workers, management and customers, which may involve delivering presentations. Must be able to exchange accurate information in these situations.', 'Works with cross-discipline teams to ensure connectivity between various databases and systems. Experience working with various self-service business intelligence and data visualization tools such as Tableau, Power BI, Business Objects, etc.', 'May develop information tools, algorithms, dashboards, and queries to monitor and improve business performance. Maintains awareness of emerging analytics and big-data technologies.', 'Requires BS and 4 - 8 years of prior relevant experience or Masters with 2 - 6 years of prior relevant experience.', 'Models complex business problems and is familiar with natural language processing, machine learning, predictive modeling, statistical analysis and hypothesis testing.', 'Must be able to remain in a stationary position 50%.Needs to occasionally move about inside the office to access file cabinets, office machinery, etc.Constantly operates a computer and other office productivity machinery, such as a calculator, copy machine and computer printer.Frequently communicates with co-workers, management and customers, which may involve delivering presentations. Must be able to exchange accurate information in these situations.', 'Capable of presenting data to vendor, customer or company to audiences of different technical levels.', 'Physical Requirements', 'Develops and uses advanced software programs, algorithms, querying and automated processes to cleanse, integrate and evaluate datasets.', 'Designs and develops methods, processes, and systems to consolidate and analyze data, both structured and unstructured, and its sources including big data.Develops and uses advanced software programs, algorithms, querying and automated processes to cleanse, integrate and evaluate datasets.Hands on experience working with data science methods such as: statistical modeling, information retrieval, graph analysis, data mining, machine learningModels complex business problems and is familiar with natural language processing, machine learning, predictive modeling, statistical analysis and hypothesis testing.May develop information tools, algorithms, dashboards, and queries to monitor and improve business performance. Maintains awareness of emerging analytics and big-data technologies.Hands-on experience working with data science methods such as statistical modeling, information retrieval, graph analysis, data minding, machine learning and data visualization.Years of Experience using Python, R, or other languages to build statistical models or analyze data. Experience with Python, SQL, Bash, Scala, Java, Hadoop, Apache, spark, Kafka or Hive.Years of Experience in creating complex SQL queries and functions, data structures and strong analytical problem-solving skills.Works with cross-discipline teams to ensure connectivity between various databases and systems. Experience working with various self-service business intelligence and data visualization tools such as Tableau, Power BI, Business Objects, etc.Capable of presenting data to vendor, customer or company to audiences of different technical levels.Supports defining specific process improvement projects, identifies meaningful insights, interprets and communicates findings and makes recommendations including process improvement opportunities. Continual process improvement activities include data, processes, interfaces, tools and technology insertion. Experience working in an Agile based environment.', 'Experience working in an Agile based environment.', 'Years of Experience using Python, R, or other languages to build statistical models or analyze data. Experience with Python, SQL, Bash, Scala, Java, Hadoop, Apache, spark, Kafka or Hive.', 'Designs and develops methods, processes, and systems to consolidate and analyze data, both structured and unstructured, and its sources including big data.', 'Requires BS and 4 - 8 years of prior relevant experience or Masters with 2 - 6 years of prior relevant experience.Bachelor’s degree or master’s degree in Computer Science, Mathematics, Information Technology or STEM related discipline', 'Hands-on experience working with data science methods such as statistical modeling, information retrieval, graph analysis, data minding, machine learning and data visualization.', 'Bachelor’s degree or master’s degree in Computer Science, Mathematics, Information Technology or STEM related discipline']",Entry level,Full-time,Engineering,Information Technology and Services,2020-12-08 13:30:12
Senior Data Analyst - Data Sciences and Advanced Analytics,VMware,"Newark, NJ",16 hours ago,Be among the first 25 applicants,"['', 'Drive strategic ownership and guidance on business intelligence and analytics across all functions including internal stakeholders like Marketing, Sales, Customer Success and Product Management teams Manage all phases of program to success, including initiation, planning, definition, design, development, testing and deployment cycles Foresee, manage, and raise appropriate visibility to risks and issues; Drive resolution of any conflicts and escalate as needed to avoid roadblocks ', 'You should have worked in a global delivery model and enable high impact business and analytics solutions ', 'Ability and motivation to work efficiently and productively in a multi-task environment daily, independently, and with minimal supervision ', 'Drive strategic ownership and guidance on business intelligence and analytics across all functions including internal stakeholders like Marketing, Sales, Customer Success and Product Management teams ', 'Technical experience in statistics, predictive modeling, and other data sciences, as well as experience in developing datasets and working with data science professionals to capture and articulate requirements in an agile fashion for project execution ', 'You would have exposure to BI, advanced analytics, and data sciences in a leading firm for at least 5 years. ', 'As a leader of project and program you should demonstrate structured thought process and problem-solving approach ', 'Work across a variety of business intelligence, advanced analytics, and data sciences projects. Exposure to operations analytics, channel sales, and/or SaaS project management is a plus ', 'Business knowledge of VMware products is added advantage Good presentation and summarization skills. As a leader of project and program you should demonstrate structured thought process and problem-solving approach You should have worked in a global delivery model and enable high impact business and analytics solutions Ability to identify and analyze problems using sound judgment and determine solutions to effectively resolve issues. ', 'Facilitate exposure to math modeling and analytical techniques for predictive analytics, classification, and segmentation desirable. ', 'Develop deep knowledge of CloudHealth’s data assets, extract and prepare data for modeling from enterprise databases, using SQL and other tools, deriving and sharing insights from visualizations, correlations and other statistics with the greater analytics team. ', 'Experience: ', ""Exposure to Project/Program management with skills to handle risk and mitigation plans Good written communication skills to facilitate effective writing of correspondence with internal and external customers. Master's degree in business analytics or MBA strongly preferred, not required. Minimum 5+ years of experience working with teams across functions required. "", 'This job requisition is not eligible for employment-based immigration sponsored by VMware.', 'Posted Date:', 'Support Revenue Team stakeholders in improving effectiveness and revenue contribution through analytic optimizations and strategic insights ', 'Ability to articulate business problems to data driven solutions ', 'Experience is consulting/business developments in analytics environment is added advantage ', 'Job Role And Responsibility', 'Facilitate internal stakeholder engagement discussions on business and data requirements, recommend solutions, and work with team members for solutioning ', 'Be a ""trusted advisor"" in the analytics and reporting space with our stakeholders across functions ', 'Subcategory: ', 'Good presentation and summarization skills. ', 'Full Time/ Part Time: ', 'Foresee, manage, and raise appropriate visibility to risks and issues; Drive resolution of any conflicts and escalate as needed to avoid roadblocks ', 'Good exposure to reporting and data visualization tools like Tableau, Einstein, etc. ', 'Business knowledge of VMware products is added advantage ', 'Perform exploratory data analysis, analytical modeling, model technique identification, and data-driven decision support Support Revenue Team stakeholders in improving effectiveness and revenue contribution through analytic optimizations and strategic insights Develop deep knowledge of CloudHealth’s data assets, extract and prepare data for modeling from enterprise databases, using SQL and other tools, deriving and sharing insights from visualizations, correlations and other statistics with the greater analytics team. Facilitate internal stakeholder engagement discussions on business and data requirements, recommend solutions, and work with team members for solutioning Work across a variety of business intelligence, advanced analytics, and data sciences projects. Exposure to operations analytics, channel sales, and/or SaaS project management is a plus ', 'Manage all phases of program to success, including initiation, planning, definition, design, development, testing and deployment cycles ', 'Required Skills', 'Business Summary', 'Can you manage senior stakeholders across teams? ', 'Ability to identify and analyze problems using sound judgment and determine solutions to effectively resolve issues. ', 'Work with analytics and business teams across geographies ', 'Exposure to Project/Program management with skills to handle risk and mitigation plans ', 'You would have exposure to BI, advanced analytics, and data sciences in a leading firm for at least 5 years. Technical experience in statistics, predictive modeling, and other data sciences, as well as experience in developing datasets and working with data science professionals to capture and articulate requirements in an agile fashion for project execution Can you manage senior stakeholders across teams? Facilitate exposure to math modeling and analytical techniques for predictive analytics, classification, and segmentation desirable. Good exposure to reporting and data visualization tools like Tableau, Einstein, etc. ', 'Good written communication skills to facilitate effective writing of correspondence with internal and external customers. ', 'Category : ', 'Perform exploratory data analysis, analytical modeling, model technique identification, and data-driven decision support ', ""Master's degree in business analytics or MBA strongly preferred, not required. Minimum 5+ years of experience working with teams across functions required. "", 'Be a ""trusted advisor"" in the analytics and reporting space with our stakeholders across functions Ability and motivation to work efficiently and productively in a multi-task environment daily, independently, and with minimal supervision Work with analytics and business teams across geographies Experience is consulting/business developments in analytics environment is added advantage Ability to articulate business problems to data driven solutions ']",Not Applicable,Full-time,Information Technology,Information Technology and Services,2020-12-08 13:30:12
