job_title,company,location,date_posted,applicants,job_text,seniority_level,employment_type,job_function,industries,date_scraped
Contact Center Data Analyst,Charles Schwab,"Westlake, TX",10 hours ago,Be among the first 25 applicants,"['', 'What You Have', 'Data prep and ETL concepts', 'Confidence to partner across lines of business and interact with all levels of leadership', 'Delivering value through insights, information, and knowledge to our business partners and leadership', 'Developing statistical models to help make more informed decisions', 'Translating complicated technical ideas for non-technical audiences', 'Self-motivationAdvanced Degree in in Mathematics, Statistics, Computer Science, or Business IntelligenceAt least 1 year of demonstrated experience withStatisticsStructured and semi structured dataHadoop ecosystem and manipulating large data setsQuery development and optimizationData prep and ETL conceptsBackground in contact center management or voice technology is a plusStrong analytical and organizational skills and attention to detailExcellent written and verbal communication skillsAbility to self-manage multiple tasks at one timeAn inquisitive mind; always seeking root causes, not just simple, superficial answersConfidence to partner across lines of business and interact with all levels of leadershipA passion for proactively seeking opportunities to make improvements, gain efficiencies and meet unknown needs', 'Establishing a network and forging strong relationships across lines of business', 'A passion for proactively seeking opportunities to make improvements, gain efficiencies and meet unknown needs', 'Background in contact center management or voice technology is a plus', 'Utilizing Business Intelligence tools to uncover insights in data coming from traditional database’s, cloud API’s, big data, streams, and machine logs', 'Statistics', 'Excellent written and verbal communication skills', 'An inquisitive mind; always seeking root causes, not just simple, superficial answers', 'Options', 'Self-motivation', 'What You Are Good At', 'Working with stakeholders to fully understand business problems before formulating creative solutions and drafting detailed requirements documentationDeveloping statistical models to help make more informed decisionsEstablishing a network and forging strong relationships across lines of businessUtilizing Business Intelligence tools to uncover insights in data coming from traditional database’s, cloud API’s, big data, streams, and machine logsDelivering value through insights, information, and knowledge to our business partners and leadershipSupporting organizational efficiency by proactively finding and automating manual tasksTranslating complicated technical ideas for non-technical audiences', 'At least 1 year of demonstrated experience withStatisticsStructured and semi structured dataHadoop ecosystem and manipulating large data setsQuery development and optimizationData prep and ETL concepts', 'Supporting organizational efficiency by proactively finding and automating manual tasks', 'Advanced Degree in in Mathematics, Statistics, Computer Science, or Business Intelligence', 'Why Schwab? ', 'Ability to self-manage multiple tasks at one time', 'StatisticsStructured and semi structured dataHadoop ecosystem and manipulating large data setsQuery development and optimizationData prep and ETL concepts', 'Your Opportunity ', 'Strong analytical and organizational skills and attention to detail', 'Query development and optimization', 'Working with stakeholders to fully understand business problems before formulating creative solutions and drafting detailed requirements documentation', 'Structured and semi structured data', 'Hadoop ecosystem and manipulating large data sets']",Entry level,Full-time,Information Technology,Information Technology and Services,2021-01-26 11:38:09
Data Scientist,PayPal,"Timonium, MD",15 hours ago,Be among the first 25 applicants,"['', 'Analyze portfolio trends and communicate concise and actionable business strategies from vast amounts of internal and external data', 'Proficiency in SAS and Unix. SQL a plus', 'Bachelor’s degree in Mathematics, Statistics, Operations Research, Finance, Economics or related quantitative discipline 2-4 years proven credit risk analytics experience or equivalentMust be an intuitive, organized analytical thinker, with the ability to perform detailed analysisStrong written, oral, and interpersonal skills a must including the ability to explain and/or present analysisMust have good business judgment with demonstrated ability to think creatively and strategicallyAptitude and willingness to roll up the sleeves and get involved in the detailsProficiency in SAS and Unix. SQL a plusExcel, Word, and PowerPoint proficiency', 'Innovative use of data and processes to improve risk management strategies and the customer experience', 'This Data Scientist will work with Synchrony Financial to conceive, design, and monitor credit risk management strategies to improve business profitability for consumer lending', 'Analyze customer level information to determine the effectiveness of credit policies and recommend necessary changes to improve profitability', '2-4 years proven credit risk analytics experience or equivalent', 'Must have good business judgment with demonstrated ability to think creatively and strategically', 'Job Description:', 'Excel, Word, and PowerPoint proficiency', 'Determine the impact of strategy changes on delinquency and credit losses', 'Bachelor’s degree in Mathematics, Statistics, Operations Research, Finance, Economics or related quantitative discipline ', 'Qualifications: ', 'Strong written, oral, and interpersonal skills a must including the ability to explain and/or present analysis', 'Present new strategy recommendations for senior management approval', 'Job Description Responsibilities:', 'Job Description Summary:', 'This Data Scientist will work with Synchrony Financial to conceive, design, and monitor credit risk management strategies to improve business profitability for consumer lendingAnalyze customer level information to determine the effectiveness of credit policies and recommend necessary changes to improve profitabilityInnovative use of data and processes to improve risk management strategies and the customer experienceDetermine the impact of strategy changes on delinquency and credit lossesAnalyze portfolio trends and communicate concise and actionable business strategies from vast amounts of internal and external dataPresent new strategy recommendations for senior management approval', 'Aptitude and willingness to roll up the sleeves and get involved in the details', 'Must be an intuitive, organized analytical thinker, with the ability to perform detailed analysis']",Not Applicable,Full-time,Engineering,Computer Software,2021-01-26 11:38:09
Data Analyst,Columbia University in the City of New York,"New York, NY",14 hours ago,Be among the first 25 applicants,"['', 'conduct statistical consultation with clinicians and researchers at Columbia University regarding study design, data analysis, and power analysis. Perform statistical programming', 'Requisition no: 510823', ""Bachelor's degree or equivalent in education and experience and at least three (3) years of data analytic and statistical analysis experience."", 'Categories: Research (Lab and Non-Lab)', 'Salary Range: commensurate with experience', 'School/Department: null', 'Hours Per Week: 35', 'Work Type: Full Time', 'Preferred Qualifications', 'Other duties as assigned.', ""Develop and implement statistical methodsconduct statistical consultation with clinicians and researchers at Columbia University regarding study design, data analysis, and power analysis. Perform statistical programmingassist in the preparation of manuscripts for publication purposes.90%Other duties as assigned.10%Minimum QualificationsBachelor's degree or equivalent in education and experience and at least three (3) years of data analytic and statistical analysis experience.Advanced education/degree may substitute for experience.Proven ability in SAS, R, or STATA, C++/RCC, Python.Data visualization skills with R-shiny, Critical thinking & problem solving. Written and oral communication. Experiences with complex data sets. Strong statistical modeling experiences with Longitudinal data.Preferred QualificationsMaster's degree in statistics or biostatistics.Equal Opportunity Employer / Disability / VeteranColumbia University is committed to the hiring of qualified local residents."", 'Develop and implement statistical methods', 'Minimum Qualifications', 'Regular/Temporary: Regular', 'Responsibilities', 'assist in the preparation of manuscripts for publication purposes.', 'Job Type: Officer of Administration', ""Master's degree in statistics or biostatistics."", 'Location: Campus|Medical Center']",Entry level,Temporary,Information Technology,Information Technology and Services,2021-01-26 11:38:09
Data Analyst,"Spark Therapeutics, Inc.","Philadelphia, PA",15 hours ago,26 applicants,"['', 'Education And Experience Requirements', '  Manage performance: know what is expected, what it takes to be successful, and self-monitor progress. Be accountable to achieve results while demonstrating the Spark Values. Periodically review individual objectives to ensure alignment to corporate and functional objectives, making adjustments if priorities have shifted.   Commit to collaborate. Be a strong team player and business partner cross functionally. Understand the development goals, strengths and motivators of your colleagues and partner to achieve mutual success and continuous improvement as well as professional development.  ', ' Supports process technology transfer with ongoing data analysis of process performance. ', ' Manage individual performance to achieve business goals and objectives, as well ongoing professional development.  Manage performance: know what is expected, what it takes to be successful, and self-monitor progress. Be accountable to achieve results while demonstrating the Spark Values. Periodically review individual objectives to ensure alignment to corporate and functional objectives, making adjustments if priorities have shifted.   Commit to collaborate. Be a strong team player and business partner cross functionally. Understand the development goals, strengths and motivators of your colleagues and partner to achieve mutual success and continuous improvement as well as professional development.   ', ' Performs data verification exercises as needed. ', ' Ability to show a track record of solving large, complex problems ', ' Identify, design, and implement internal process improvements: automating manual processes, optimizing data delivery etc. ', ' Commit to collaborate. Be a strong team player and business partner cross functionally. Understand the development goals, strengths and motivators of your colleagues and partner to achieve mutual success and continuous improvement as well as professional development. ', ' Bachelor’s degree in Engineering, , Life Sciences Information Systems, Software Engineering, Information Technology or a related field ', ' Maintain process information, documentation of process parameters, and tracking of process performance. ', ' Preferred: Experience in regulatory inspections of manufacturing facilities ', ' Strong organizational skills ', ' Preferred: Experience and knowledge of regulatory filings ', ' Analyzes and interprets results, of laboratory-based studies. ', ' Solid understanding of Good Documentation Practices (GDP) ', '  Bachelor’s degree in Engineering, , Life Sciences Information Systems, Software Engineering, Information Technology or a related field   Solid understanding of Good Documentation Practices (GDP)   Experience working in the pharmaceutical industry or other regulated industry a plus   Experience with high-volume data entry is a plus  ', ' Works with process engineers and scientists to execute data analysis and application in support of late stage process development, technical troubleshooting, process monitoring, and optimization/improvement activities for manufacturing. ', '  Proficiency in Microsoft Excel   Strong organizational skills   Strong data management skills related to working with structured/unstructured data sets   Knowledge of data management tools and statistical analysis (SAS JMP); Experience with OSI Pi a plus.   Ability to show a track record of solving large, complex problems   Ability to adapt and thrive in fast paced, changing environment   Preferred: Experimental design/QbD.   Preferred: Experience in cell and gene therapy or viral vector production   Preferred: Experience and knowledge of regulatory filings   Preferred: Experience in regulatory inspections of manufacturing facilities   Proficiency in Microsoft Excel   Strong organizational skills', ' Strong data management skills related to working with structured/unstructured data sets ', ' Ability to adapt and thrive in fast paced, changing environment ', ' Knowledge of data management tools and statistical analysis (SAS JMP); Experience with OSI Pi a plus. ', ' Experience working in the pharmaceutical industry or other regulated industry a plus ', ' Experience with high-volume data entry is a plus ', ' Strong organizational skills', ' Create data tools for analytics and metric boards to track progress ', 'Responsibilities', ' Manage performance: know what is expected, what it takes to be successful, and self-monitor progress. Be accountable to achieve results while demonstrating the Spark Values. Periodically review individual objectives to ensure alignment to corporate and functional objectives, making adjustments if priorities have shifted. ', ' Prepare detailed oral or written summaries of results with interpretation for projects/platform ', ' Preferred: Experimental design/QbD. ', 'Primary Duties Include', '  Works with process engineers and scientists to execute data analysis and application in support of late stage process development, technical troubleshooting, process monitoring, and optimization/improvement activities for manufacturing.   Supports process technology transfer with ongoing data analysis of process performance.   Executes and verifies data analysis in support of CPV type programs.   Maintain process information, documentation of process parameters, and tracking of process performance.   Analyzes and interprets results, of laboratory-based studies.   Performs data verification exercises as needed.   Prepare detailed oral or written summaries of results with interpretation for projects/platform   Identify, design, and implement internal process improvements: automating manual processes, optimizing data delivery etc.   Create data tools for analytics and metric boards to track progress   Manage individual performance to achieve business goals and objectives, as well ongoing professional development.  Manage performance: know what is expected, what it takes to be successful, and self-monitor progress. Be accountable to achieve results while demonstrating the Spark Values. Periodically review individual objectives to ensure alignment to corporate and functional objectives, making adjustments if priorities have shifted.   Commit to collaborate. Be a strong team player and business partner cross functionally. Understand the development goals, strengths and motivators of your colleagues and partner to achieve mutual success and continuous improvement as well as professional development.     Foster Spark’s Culture, Mission, Vision, and Values: Lead by example. Create an environment where team members thrive in our Culture by living our truths, always in compliance with applicable laws and regulations. Emphasize to employees that “how” they achieve performance objectives is just as important as “what” they accomplish.  ', ' Proficiency in Microsoft Excel ', ' Foster Spark’s Culture, Mission, Vision, and Values: Lead by example. Create an environment where team members thrive in our Culture by living our truths, always in compliance with applicable laws and regulations. Emphasize to employees that “how” they achieve performance objectives is just as important as “what” they accomplish. ', ' Preferred: Experience in cell and gene therapy or viral vector production ', ' Executes and verifies data analysis in support of CPV type programs. ', ' Compiling, capturing, trending, and analyzing process generated data and subsequently using these findings to drive increased process understanding and consistency, develop improvements, or identify root cause ', '  Compiling, capturing, trending, and analyzing process generated data and subsequently using these findings to drive increased process understanding and consistency, develop improvements, or identify root cause  ']",Entry level,Full-time,Information Technology,Biotechnology,2021-01-26 11:38:09
Data Analyst,ChatFunnels,"Provo, UT",16 hours ago,42 applicants,[],Entry level,Full-time,Information Technology,Marketing and Advertising,2021-01-26 11:38:09
Data Operations Analyst,TrueData,"Los Angeles, CA",14 hours ago,44 applicants,"['', 'Experience working with petabytes of data and challenges associated with it', 'Benefits', ""Stock Option Plan'"", 'Troubleshooting errors quickly and communicating to client-facing teams to work with existing partners.', 'Strong verbal and written communication skills', 'Health Care Plan (Medical, Dental, Vision)', ' Identifying KPIs, developing reports/dashboards, drawing and delivering key metrics & insights to broader teams with actionable recommendations. Running opportunistic data experiments to find accretive outcomes such as operational efficiencies, supply chain optimization, or cost savings. Analyzing data from multiple sources to ensure data quality. Independently spearheading data management, client reporting, and problem resolution through the use of dashboards and other daily, weekly, monthly reporting.  Troubleshooting errors quickly and communicating to client-facing teams to work with existing partners. Assisting in troubleshooting operational issues as they surface; proposing changes to systems and processes to fix root causes. Leveraging SQL, Python, and other visualization tools (e.g., Chartio, Looker, PowerBI, Tableau) to ensure data democratization and transparency throughout the organization from sales to marketing to executive leadership. Evaluating and implementing operational procedures and processes. Ensuring the entire “system” of data is running smoothly - from data ingested, to inside TrueData, to exporting data to clients. Preparing ad hoc analyses to evaluate business impact for changes to data volumes and to support initiatives. ', 'Excellent interpersonal skills', 'Strong experience with self-service reporting tools like Tableau and Chartio', 'Familiarity with advertising industry is a plus', 'Strong experience with Python3, scikit, pandas', 'What You’ll Do', "" Stock Option Plan' Health Care Plan (Medical, Dental, Vision) Retirement Plan (401K, IRA) No Vacation Policy (take what you need) + company-wide Public Holidays Family Leave (Maternity, Paternity) Work from Anywhere - we have concentrations of employees in LA, Chicago, SF and NYC, but feel free to work from anywhere that helps you succeed Transportation/work-from-anywhere stipend"", 'Strong AWS experience with S3, Athena, CloudFormation', 'Strong organizational skills with the ability to multitask projects from start to finish', 'Requirements', 'Work from Anywhere - we have concentrations of employees in LA, Chicago, SF and NYC, but feel free to work from anywhere that helps you succeed', 'Strong data acumen for assessing data quality', 'Assisting in troubleshooting operational issues as they surface; proposing changes to systems and processes to fix root causes.', 'Analyzing data from multiple sources to ensure data quality.', ' Bachelor’s degree or equivalent Fluent in English, both verbal and written Strong verbal and written communication skills Excellent interpersonal skills Have a professional attitude and continual willingness to go the extra mile to delight the customer (internal or external) Strong organizational skills with the ability to multitask projects from start to finish Experience working with petabytes of data and challenges associated with it Strong SQL experience Strong experience with Python3, scikit, pandas Strong AWS experience with S3, Athena, CloudFormation Familiarity with data privacy and regulatory constraints Strong experience with self-service reporting tools like Tableau and Chartio Strong data acumen for assessing data quality Familiarity with data and infrastructure monitoring and alerting tooling Familiarity with advertising industry is a plus ', 'Fluent in English, both verbal and written', 'Preparing ad hoc analyses to evaluate business impact for changes to data volumes and to support initiatives.', 'Leveraging SQL, Python, and other visualization tools (e.g., Chartio, Looker, PowerBI, Tableau) to ensure data democratization and transparency throughout the organization from sales to marketing to executive leadership.', 'Running opportunistic data experiments to find accretive outcomes such as operational efficiencies, supply chain optimization, or cost savings.', 'Retirement Plan (401K, IRA)', 'Bachelor’s degree or equivalent', 'Identifying KPIs, developing reports/dashboards, drawing and delivering key metrics & insights to broader teams with actionable recommendations.', 'Have a professional attitude and continual willingness to go the extra mile to delight the customer (internal or external)', 'Evaluating and implementing operational procedures and processes.', 'Familiarity with data and infrastructure monitoring and alerting tooling', 'Family Leave (Maternity, Paternity)', 'Ensuring the entire “system” of data is running smoothly - from data ingested, to inside TrueData, to exporting data to clients.', 'No Vacation Policy (take what you need) + company-wide Public Holidays', 'Transportation/work-from-anywhere stipend', 'Familiarity with data privacy and regulatory constraints', 'Strong SQL experience', 'Independently spearheading data management, client reporting, and problem resolution through the use of dashboards and other daily, weekly, monthly reporting. ']",Associate,Full-time,Analyst,Information Technology and Services,2021-01-26 11:38:09
