job_title,company,company_rating,location,job_text,date
Data Analyst - Remote - PT,HCI | Integrated Solutions,3 out of 5 from 46 employee ratings,"Fairfax, VA 22030","['Find jobs', 'Company Reviews', 'Find salaries', 'Employers', 'Change country', 'Help Center']",2021-01-05 13:12:17
ACCOUNTABILITY ANALYST,Government of the District of Columbia,3.6 out of 5 from 234 employee ratings,"Washington, DC 20002","['Find jobs', 'Company Reviews', 'Find salaries', 'Employers', 'Change country', 'Help Center', 'Criminal background check;', 'Traffic record check (as applicable);', 'Consumer credit check (as applicable);', 'Reasonable suspicion drug and alcohol test; and', 'Post-accident or incident drug and alcohol test.']",2021-01-05 13:12:17
PROGRAM ANALYST,US Other Agencies and Independent Organizations,3.8 out of 5 from 5 employee ratings,"Washington, DC","['Find jobs', 'Company Reviews', 'Find salaries', 'Employers', 'Change country', 'Help Center', 'Use program evaluation techniques under close supervision to collect and analyze routine information for decision makers in support of mission accomplishment.', 'Assist in the application of analytical approaches, methods, and techniques to perform segments of studies/projects to assist the organization in program planning, measurements, or evaluation.', 'Assist higher grade Program Analysts to examine current or proposed policies, laws, regulations, or administrative procedures to develop data.', 'Gather programmatic data to assist in developing recurring or special reports, preparing executive briefings and similar materials for use by management and higher graded analysts in carrying out and reporting on program accomplishments.', 'Job family (Series)0343 Management And Program AnalysisSimilar jobsAnalysts, ProgramProgram Analysts', 'Analysts, Program', 'Program Analysts', ""RequirementsRequirementsConditions of EmploymentIf you are selected, a pre-employment background check is required.You must be a U.S. citizen.You must submit a resume and required documents-see How to Apply section.If you are selected, you may be required to complete a one-year probationary period.This position is designated as Moderate Risk and requires a background investigation. Unless an appropriate background investigation is already on record with the Office of Personnel Management, you must undergo a background investigation. All conditions of the pre-employment security process must be met before an official letter of employment can be issued with a report for duty date.QualificationsYou do not need a degree to qualify for this position.We are looking for at least one year of specialized experience related to this position as described below:To qualify for the GS-07 level, you need to have at least one year of full-time experience equivalent to the GS-05 level defined as assisting in monitoring projects; preparing and/or analyzing reports;OR 1 full year of graduate level education; or superior academic achievement (Superior Academic Achievement Definition) degree in an academic discipline related to this positionOR an equivalent combination of education and experience.To qualify for the GS-09 level, you need to have at least one year of full-time experience equivalent to the GS-07 level defined as analyzing information to increase the effectiveness and efficiency of program operations; applying analytical approaches, methods, concepts, and/or techniques to assist in program planning;OR master's or equivalent graduate degree; or 2 full years of progressively higher level graduate education leading to such a degree; or LL.B. or J.D., if related; degree in an academic discipline related to this positionOR an equivalent combination of education and experience.Your answers to the online assessment will be used to evaluate your competencies in the following areas: 1. Ability to use automated reporting software and/or systems. 2. Skill in oral communication. 3. Skill in gathering administrative data. 4. Ability to work on a team. 5. Ability to analyze policies, laws, regulations, and/or procedures. 6. Knowledge of program related policies, laws, regulations, and/or procedures. 7. Skill in written communication.Experience refers to paid and unpaid experience, including volunteer work done through National Service programs (e.g., Peace Corps, AmeriCorps) and other organizations (e.g., professional, philanthropic, religious, spiritual, community, student, social). Volunteer work helps build critical competencies, knowledge, and skills and can provide valuable training and experience that translates directly to paid employment. You will receive credit for all qualifying experience, including volunteer experience.If you have part-time work experience, read this: EPA Announcement Policies and Procedures.EducationAdditional informationAre you a Displaced Federal Employee? If so, please read the Required Documents section and visit the EPA website for additional information: EPA Announcement Policies and ProceduresEPA participates in E-Verify. E-Verify is an Internet based system operated by the Department of Homeland Security (DHS) in partnership with the Social Security Administration (SSA) that enables participating employers to electronically verify the employment eligibility of their newly hired employees. For additional information: EPA Announcement Policies and Procedures.Position has portable work and selectee may be authorized to telework after meeting eligibility requirements if approved by the supervisor/manager.If you are selected, travel, transportation, and relocation expenses will not be paid by EPA. Any travel, transportation, and relocation expenses associated with reporting to work in this position will be your responsibility.This position is in the bargaining unit.Except in special circumstances, those new to the federal government will be hired at the starting salary (step 1) of the applicable grade range listed above.How You Will Be EvaluatedYou will be evaluated for this job based on how well you meet the qualifications above.We will review your resume and required documents to ensure you meet the basic qualification requirements. Your resume must address the knowledge, skills, and abilities listed in the Qualifications section. If you meet basic qualification requirements, your application will be further evaluated based on your answers to the online assessment. Your responses to the online assessment will be used to measure the degree to which your background matches the requirements for the position. You are being evaluated under the category rating method which means, if you are determined to be qualified, you will be placed into the ‘Best Qualified’, ‘Well Qualified’, or ‘Qualified’ category.We will compare your resume and supporting documentation to your responses on the assessment questionnaire. If you rate yourself higher than is supported by your application materials, your responses may be adjusted and/or you may be excluded from consideration for this job. We will evaluate your qualifications and eligibility and notify you if you meet minimum qualification requirements. If you are referred for consideration, you may be subject to additional assessments.NOTE: We do not require a separate statement responding to the competencies, also referred to as Knowledges, Skills, and Abilities (KSAs). However, your resume should clearly show possession of these competencies.To preview questions please click here.Background checks and security clearanceSecurity clearanceNot RequiredDrug test requiredNoPosition sensitivity and riskNoncritical-Sensitive (NCS)/Moderate RiskTrust determination processSuitability/Fitness"", 'If you are selected, a pre-employment background check is required.', 'You must be a U.S. citizen.', 'You must submit a resume and required documents-see How to Apply section.', 'OR 1 full year of graduate level education; or superior academic achievement (Superior Academic Achievement Definition) degree in an academic discipline related to this position', 'OR an equivalent combination of education and experience.', ""OR master's or equivalent graduate degree; or 2 full years of progressively higher level graduate education leading to such a degree; or LL.B. or J.D., if related; degree in an academic discipline related to this position"", 'OR an equivalent combination of education and experience.', ""Required DocumentsRequired DocumentsDocuments to be submitted online:NOTE: You should ensure your social security number, date of birth, and any other personal information are redacted.-Resume clearly stating your experience related to this position as described in the Duties section and Qualifications section. In describing your experience, you need to be clear and specific. We may not make assumptions regarding your experience.-Responses to the online assessment questionnaire (you must complete this online - it is not a document you need to upload).-College transcripts - if qualifying for this position based on education or a combination of experience and education, you are required to submit either unofficial transcripts or a list of courses that includes school(s) attended, school address, course title, grades earned, completion dates, department, and quarter or semester hours earned. NOTE: Official educational transcripts are not required at the time of application; however, if you are selected, you must provide official transcripts before you start work with EPA.-Veterans' Preference Documents - DD-214 Member 4 copy (or other copy indicating character of service), VA letter stating overall/combined disability rating (percentage), and SF-15, if applicable (see page 2 of the SF-15 for documents that can be submitted in lieu of the DD-214 and VA letter); active duty service members: submit certification from the armed forces documenting active duty dates, expected discharge/release date, campaign medals/badges, and character of service (a certification is any written document from the armed forces that certifies you are expected to be discharged/released from active duty service in the armed forces under honorable conditions within 120 days after you submit the certification).-Displaced Federal employees under ICTAP/CTAP: copy of your most recent performance appraisal, proof of eligibility, and your most current SF-50 noting position, grade level, tenure, and duty station.To learn more about submitting documentation, visit Uploading Documents to USAJOBS.If you are relying on your education to meet qualification requirements:Education must be accredited by an accrediting institution recognized by the U.S. Department of Education in order for it to be credited towards qualifications. Therefore, provide only the attendance and/or degrees from schools accredited by accrediting institutions recognized by the U.S. Department of Education.Failure to provide all of the required information as stated in this vacancy announcement may result in an ineligible rating or may affect the overall rating."", '-Resume clearly stating your experience related to this position as described in the Duties section and Qualifications section. In describing your experience, you need to be clear and specific. We may not make assumptions regarding your experience.', '-Displaced Federal employees under ICTAP/CTAP: copy of your most recent performance appraisal, proof of eligibility, and your most current SF-50 noting position, grade level, tenure, and duty station.', 'BenefitsBenefitsA career with the U.S. Government provides employees with a comprehensive benefits package. As a federal employee, you and your family will have access to a range of benefits that are designed to make your federal career very rewarding. Learn more about federal benefits.Join EPA in protecting human health and the environment and enjoy many work life quality options! Working for the EPA offers you a comprehensive benefits package that includes, in part, paid vacation, sick leave, holidays, life insurance, health benefits, and participation in the Federal Employees Retirement System. To learn more about us, visit Life and Careers at EPA.Review our benefitsEligibility for benefits depends on the type of position you hold and whether your position is full-time, part-time, or intermittent. Contact the hiring agency for more information on the specific benefits offered.', 'The publicU.S. citizens, nationals or those who owe allegiance to the U.S.']",2021-01-05 13:12:17
Data Analyst - Entry Level,Cobbs Creek Healthcare,N/A,"Newtown Square, PA 19073","['Find jobs', 'Company Reviews', 'Find salaries', 'Employers', 'Change country', 'Help Center', ""Bachelor's (Preferred)SQL: 1 year (Preferred)"", '401(k)', 'Dental insurance', 'Employee assistance program', 'Health insurance', 'Life insurance', 'Paid time off', 'Parental leave', 'Referral program', 'Vision insurance', 'Monday to Friday', ""Bachelor's (Preferred)"", 'SQL: 1 year (Preferred)', 'One location', 'Detail-oriented -- quality and precision-focused', 'Innovative -- innovative and risk-taking', 'Outcome-oriented -- results-focused with strong performance culture', 'Team-oriented -- cooperative and collaborative', 'https://www.cobbscreekhealthcare.com/', 'Waiting period may apply', 'Only full-time employees eligible', 'Temporarily due to COVID-19', 'Remote interview process', 'Virtual meetings']",2021-01-05 13:12:17
Business Analyst,CoStar Group,3 out of 5 from 400 employee ratings,"Washington, DC 20005","['Find jobs', 'Company Reviews', 'Find salaries', 'Employers', 'Change country', 'Help Center', 'Lead discovery sessions between product managers, technical managers, and user experience designers to gather requirements to build market-leading consumer web products.', 'Facilitate meetings with business stakeholders and product management', 'Write detailed Acceptance Criteria in the form of Behavior Driven Development scenarios for User Stories', 'Facilitate technical design meetings between different technical managers Participate in backlog grooming sessions with a scrum team to help groom user stories', 'Perform detailed end to end User Acceptance Testing including front end manual testing', 'Write your own SQL queries to ensure data driven applications are functioning up to standard.', 'Bachelor’s Degree', 'Experience with Agile systems', 'Experience with Product, Systems, or Business analysis.', 'Experience with software coding', 'Experience with scrum', 'Comprehensive healthcare coverage: Medical / Vision / Dental / Prescription Drug', 'Life, legal, and supplementary insurance', 'Commuter and parking benefits', '401(K) retirement plan with matching contributions', 'Employee stock purchase plan', 'Paid time off', 'Tuition reimbursement', 'On-site fitness center and/or reimbursed fitness center membership costs (location dependent), with yoga studio, Pelotons, personal training, group exercise classes, as well as Segways and bikes available for use during the day', 'Complimentary gourmet coffee, tea, hot chocolate, prepared foods, fresh fruit, and other healthy snacks']",2021-01-05 13:12:17
Data Analyst,"BruckEdwards, Inc",N/A,"Washington, DC 20420","['Find jobs', 'Company Reviews', 'Find salaries', 'Employers', 'Change country', 'Help Center', ""Criminal background check (Required)Bachelor's (Preferred)Microsoft Excel: 3 years (Preferred)Confidential (Preferred)"", 'Work performed on site with the clientin Washington, DC', 'Seven (7) years of progressive experience providing information technology solution analysis, development, integration and implementation.', 'Education = Bachelor’s degree in Business, Engineering, Management Sciences, Computer Science, Information Systems, Math, Social Science, Psychology or other related analytical, mathematic, scientific or technical discipline.', 'Clearance = NACI - This is a Public Trust position and requires a National Agency Check with Investigation (NACI).', 'Deliverables are Excel reports using data pulled from one or more SharePoint lists. Analyze the reports and ensure validity of the data, aggregate and correlate data to build composite data sets that are used for weekly reports. This requires excellent Excel skills including mastery of formulas as well as macros and Pivot Tables.', 'Experience in research and ability to derive conclusions from that research.', 'Experience with working groups to focus on project management support.', 'Provide support in developing and distributing agendas, coordinating working group calendars, and meeting invitations, coordinating rooms and audio/visual support for meetings, capturing meeting minutes and action items.', 'Experienced on facilitating collaboration and exchange of ideas during meetings.', 'Researching meeting discussion topics and analyzing to inform leadership', 'Creating materials for discussion and presentations based on the reports produced.', 'Assisting in the review and comments on working group project documentation.', 'A*dvanced Excel* skills including mastery of formulas as well as macros and Pivot Tables', 'Experience with reporting tools (Power BI or Tableau), Excel, and SharePoint.', 'Ability to manipulate and analyze the data to create charts and tables using Excel or other tools', 'Create executive level briefings with these charts', 'Have a basic understanding of data relationships.', 'Develop and maintain project management artifacts like action item trackers, status reports, and risk and issue trackers', 'Experience with USAccess', 'Employee focused company', 'Team building environment', 'Excellent Management Team', 'Competitive salaries', 'Performance-based bonuses', 'Professional certification bonus program', 'Anthem BCBS healthcare plan', 'Dental and Vision plans', 'Vanguard Retirement 401(k) plan', 'Employer match for 401(k)', '4 weeks paid time off, 9 paid holidays', 'Tuition assistance benefit', 'Monthly metro allowance', 'And more!', '401(k)', '401(k) matching', 'Dental insurance', 'Disability insurance', 'Flexible spending account', 'Health insurance', 'Life insurance', 'Paid time off', 'Parental leave', 'Professional development assistance', 'Referral program', 'Tuition reimbursement', 'Vision insurance', 'Monday to Friday', ""Bachelor's (Preferred)"", 'Microsoft Excel: 3 years (Preferred)', 'Confidential (Preferred)', 'One location', 'Temporarily due to COVID-19']",2021-01-05 13:12:17
Investigative Support Analyst (ISA I-D),The West River Group,N/A,"Fairfax, VA 22031","['Find jobs', 'Company Reviews', 'Find salaries', 'Employers', 'Change country', 'Help Center', ""Bachelor's (Preferred)Top Secret (Preferred)"", 'General knowledge of federal statutes;', 'Experience tracking money laundering and structuring activities of transnational criminal organizations;', 'Ability to analyze data and interpret patterns and trends;', 'Ability to perform link analysis;', 'Ability to communicate orally and in writing sufficient to express thoughts and ideas to a variety of people;', 'Proficiency conducting research on the internet and commercial as well as public databases;', 'Experience assisting in the development of civil and/or criminal cases for presentation to the appropriate prosecution authority;', 'Experience performing appropriate analytical techniques and methods during an investigation;', 'Experience supporting complex criminal and/or civil investigations;', 'Demonstrated ability to work with minimal direct supervision; and', 'Experience supporting the preparation of a final work product.', '8 hour shift', 'Monday to Friday', ""Bachelor's (Preferred)"", 'Top Secret (Preferred)', 'One location', 'jobs@westrivergroup.com', 'No']",2021-01-05 13:12:17
EEO & DIVERSITY DATA ANALYST 2,Huntington Ingalls Industries Inc.,"3.8 out of 5 from 1,935 employee ratings","Newport News, VA","['Find jobs', 'Company Reviews', 'Find salaries', 'Employers', 'Change country', 'Help Center']",2021-01-05 13:12:17
Data Analyst,Piper Companies,4.5 out of 5 from 12 employee ratings,"McLean, VA 22102","['Find jobs', 'Company Reviews', 'Find salaries', 'Employers', 'Change country', 'Help Center', 'Drive monitoring and analyses of credit risk for both organic and acquired portfolio, prepare related management reporting package and provide insights on root causes, emerging credit trends and implications on Allowance for Loan Losses.', 'Perform business line program deep dive and monitoring on credit policy change to drive credit policy optimization and risk mitigation strategies, inform corporate strategic decisions, enable better member experience and improve efficiencies.', 'Provide ongoing or ad-hoc risk analytics to support credit or new product expansion.', 'Based on guidance from team lead or manager, collaborate with modeling team to build/manage risk models using both internal and external data sources, conduct risk drivers analysis and build and implement valuations models.', 'Develop manual underwriter scorecard and statistical sampling to support judgmental decisioning review program.', 'Identify required data and work with data stewards to understand data source, ensure data quality and retrieve data on a timely basis. Contribute to credit data mart and corporate database designs.', 'Identify and communicate data anomalies and requirements to the development team and other stakeholders.', 'Based on guidance from team lead or manager, enhance portfolio reporting, improve internal efficiencies, and meet changing management and regulatory requirements.', 'Participate in external and internal audits, and regulatory examinations as needed.', 'Master Degree in Math, Statistics, Economics, Computer Science, or other quantitative field.', 'Strong skills in various data analysis and visualization tools including SQL, Tableau, Excel and PowerPoint are required. Proficiency with statistical tools (SAS, R) and analysis is preferred.', 'Curiosity, attention to details, strong critical thinking and problem solving skills.', 'Ability to work effectively in ambiguous situations, ability to multi-task.', 'Self-motivated and strong interpersonal skills in order to actively lead and implement ideas in a cross-functional team environment.']",2021-01-05 13:12:17
Data Analyst,Analytica,3.6 out of 5 from 9 employee ratings,"Washington, DC 20037","['Find jobs', 'Company Reviews', 'Find salaries', 'Employers', 'Change country', 'Help Center', 'Perform data analysis, research and data manipulation tasks', 'Perform queries and interpret business data requests to create efficient queries', 'Extract and analyze raw data', 'Organize data into presentable formats', 'Bachelors Degree', 'Experience and/or coursework with database management systems (SAP Business Objects or similar) and querying languages (SAS and/or SQL)', 'Ability to extract data, manipulate data and perform analysis', 'Ability to organize data in presentable formats for consumption by the healthcare business community', 'Experience with Military Health Systems (MHS) Data Repository (MDR) or other DHA/Defense Health Agency datastores is a plus', 'Any experience with mobile or telehealth environments is a plus', 'US Citizenship is required and the ability to pass a DoD background investigation']",2021-01-05 13:12:17
Data Analyst,"RIVA Solutions, Inc.",3.3 out of 5 from 8 employee ratings,"Washington, DC","['Find jobs', 'Company Reviews', 'Find salaries', 'Employers', 'Change country', 'Help Center', 'Under occasional supervision, responsible for data mining, data preparation, and reporting.', 'Prepare and conduct analyses and studies, needs/gaps assessments.', 'Applies knowledge to determine the accuracy and reasonableness of the data, recommendations, and solutions proposed.', 'Documents and summarizes the results and develops and recommended solutions to the customer’s problems.', 'Prepares big data, implements data models developed by others, and provides database support for customer solutions.', 'Key member of a data science project team, supporting data scientists or other consultants in the performance of assigned tasks.', 'Five (5) years relevant experience in applied data science research or big data analytics.', 'Bachelor’s Degree in Statistics, Applied Mathematics, Data Science, Computer Science, Operations Research or other closely related scientific or technical discipline A Master’s degree may be substituted for up to two (2) years of experience. A PhD may be substituted for experience.', 'Demonstrates knowledge of data mining methods, databases, data visualization and machine learning', 'Ability to communicate analysis techniques, concepts and products', 'Ability to develop data-driven analysis and reports based on data visualizations and data models']",2021-01-05 13:12:17
