job_title,company,company_rating,location,job_text,date
Data Analyst,Brightloom,N/A,"Seattle, WA","['Find jobs', 'Company Reviews', 'Find salaries', 'Employers', 'Change country', 'Help Center', 'Platform Performance, Results, and Analysis eg. Create and manage recurring data collection, analysis, and reporting used by product and marketing teams to measure, analyze, and understand areas of concern and opportunities for improvement.', 'Discovery and Insights. Eg. Partner with sales, customer success, and product teams to create and deliver ad hoc and ongoing business and customer analyses and insights using data stored on the Brightloom platform.', 'Monitoring & Mechanisms eg. Generate analyses to track and measure the actual impact from releases. Integrate these metrics into the right recurring mechanisms (eg. platform results) to ensure a) any issues are detected fast or prevented altogether, and b) the right feedback loops exist to continually improve our products', 'You are highly analytical and comfortable using data to deliver insights and support decision making.', 'You have a passion for learning and an innate curiosity that drives you to ask and answer complex questions by following an empirical approach.', 'You are storyteller who uses data and insights to communicate clearly and precisely through written documents, presentations, spreadsheets, and data visualization tools.', 'You are a collaborative self-starter who prioritizes, manages, and executes work independently.', 'You are good at balancing the need for speed against holding a high bar for the accuracy and precision of your work.', 'Your technically proficient. While this is a non-technical role, it does require a comfort level and proficiency with working with industry standard tools for data transformation, analysis, and reporting including SQL, Databricks (or similar), Tableau (or similar), and Python (desirable).', 'You think like a builder. The insights, models, and artifacts you create will be integrated into our core product offerings from time-to-time. You embrace this as an opportunity.']",2020-12-17 13:54:43
Health Data Analyst (Remote Position - Tableau experience required),AM LLC,4.8 out of 5 from 27 employee ratings,Remote,"['Find jobs', 'Company Reviews', 'Find salaries', 'Employers', 'Change country', 'Help Center', 'Become highly familiar with the collected COVID tracing data structure, data elements, and idiosyncrasies of data collection.', 'Develop full understanding of the strengths and limitations of the data and the implications for data analyses.', 'Provide consultation, as needed, regarding optimal statistical methods and analysis designs.', 'Perform required data cleaning and manipulation prior to analyses.', 'Identify and troubleshoot unanticipated problems with the analyses or results.', 'Communicate results to investigators and generate all necessary figures and tables.', ""Bachelor's degree (Master’s preferable) in biostatistics or related field (e.g., epidemiology)"", 'Use visualization best practices in Tableau to enhance business understanding through artistic, simple, and concise data storytelling.', 'High level attention to detail.', 'Minimum of 3 years of experience in medical/clinical data manipulation and analyses.', 'Strong proficiency with Tableau and Tableau Prep Builder.', 'Experience designing and conducting analyses of complex health data.', 'Strong English language communication skills.']",2020-12-17 13:54:43
Health Insurance Analyst,Government of the District of Columbia,3.6 out of 5 from 234 employee ratings,"Washington, DC 20024","['Find jobs', 'Company Reviews', 'Find salaries', 'Employers', 'Change country', 'Help Center', 'Incumbent is responsible for implementing a wide range and variety of financial support programs to include Home and Community Base Service Waiver (HCBS) programs, Medicaid Health Insurance, Social Security, Disability Benefits, Retirement and other sources of public and private health insurance, benefits and income and ensuring the Personal Funds and Contribution to Care policies are completely and appropriately followed.', 'Conducts research and analyzes of data to maintain personal funds and improve the management of personal funds.', 'Tracks, through analysis, unresolved issues of non-compliance.', 'Provides training, technical assistance, counsel and advice to Service Coordinators, program managers and service providers, families, court officials, and consumers, concerning researching, defining, and clarifying the criteria, regulations, policies and procedures regarding the proper disbursement of the consumer’s funds.', 'Remains current on all changes to benefits and eligibility and provides counseling to individuals served.', 'Conducts on-site reviews of provider records and provides technical assistance related to safeguarding personal funds.', 'Conducts research and analyzes data for the purposes of maintaining personal benefits and improving the management of personal funds.', 'Recommends corrective action initiative aimed at the reduction or elimination of specific types of errors associated with consumer finances.', 'Ensures the maintenance of up-to-date, orderly and secure personal finance records in electronic and paper format.', 'Completes financial reviews and Medicaid recertifications monthly.', 'Supports senior Health Insurance Analyst with the submission of new Medicaid applications and works collaboratively to ensure that the persons identified as over income or over resourced submit supporting documentation as in compliance with Medicaid and Social Security income guidelines.', 'Participates in DDS & Service Coordination Management training and other training activities that contribute to professional growth and development.', 'Performs other related duties as assigned.']",2020-12-17 13:54:43
Data Analyst,Luminous Analytics,N/A,"New York, NY 10016","['Find jobs', 'Company Reviews', 'Find salaries', 'Employers', 'Change country', 'Help Center', 'Data analysis: 6 years (Preferred)SAS: 3 years (Preferred)', 'Interpret data, analyze results using statistical techniques and provide ongoing reports', 'Develop and implement databases, data collection systems, data analytics and other strategies that optimize statistical efficiency and quality', 'Acquire data from primary or secondary data sources and maintain databases/data systems', 'Identify, analyze, and interpret trends or patterns in complex data sets', 'Filter and “clean” data by reviewing computer reports, printouts, and performance indicators to locate and correct code problems', 'Work with management to prioritize business and information needs', 'Locate and define new process improvement opportunities', 'Proven working experience as a data analyst or business data analyst', 'Technical expertise regarding data models, database design development, data mining and segmentation techniques', 'Strong knowledge of and experience with SAS and R, databases (SQL etc)', 'Knowledge of statistics and experience using statistical packages for analyzing datasets (Excel, SPSS, SAS etc)', 'Strong analytical skills with the ability to collect, organize, analyze, and disseminate significant amounts of information with attention to detail and accuracy', 'Adept at queries, report writing and presenting findings', 'BS in Mathematics, Economics, Computer Science, Information Management or Statistics', 'Monday to Friday', 'Data analysis: 6 years (Preferred)', 'SAS: 3 years (Preferred)', 'Yes']",2020-12-17 13:54:43
Data Analyst,Luminous Analytics,N/A,"New York, NY 10016",[],2020-12-17 13:54:43
Data Analyst,Luminous Analytics,N/A,"New York, NY 10016",[],2020-12-17 13:54:43
Operations/Data Analyst,"Eagle Technologies, Inc.",N/A,"Arlington, VA","['Find jobs', 'Company Reviews', 'Find salaries', 'Employers', 'Change country', 'Help Center', 'Compiling, analyzing, and visualizing data using data visualization tools', 'Creating business requirements from client requests and meeting notes.', 'Identifing data points for analysis and utilizing them to quality review and reporting output', 'Preparing written summaries', 'Providing ad-hoc data reporting as needed', 'Reporting and data analysis', 'User management - analysis of application roles and permissions', 'Advanced skills in Excel and using reports and extracts for reports, analysis, and data quality management', 'Exceptional analytical skills with strong attention to detail', 'Experience working across organizational teams including client and application users', 'Strong systems development life cycle (SDLC) knowledge and experience.', 'Strong written and verbal communication skills', 'Working knowledge of data visualization and reporting tools', 'Working knowledge of SQL and relational databases']",2020-12-17 13:54:43
Business Analyst,Red Cedar Consultancy LLC,N/A,"McLean, VA 22102","['Find jobs', 'Company Reviews', 'Find salaries', 'Employers', 'Change country', 'Help Center', '4+ years of related experience. Education (1 or more years of college) may be substituted for 1 year of experience. Only 1 year of experience can be substituted']",2020-12-17 13:54:43
Business Analyst,Red Cedar Consultancy LLC,N/A,"McLean, VA 22102",[],2020-12-17 13:54:43
DATA ANALYST,Eagleforce Associates,N/A,"Herndon, VA 20171","['Find jobs', 'Company Reviews', 'Find salaries', 'Employers', 'Change country', 'Help Center', 'Develop data model, analyze, convert and integrate large and multi-dimensional data structures to support healthcare prediction systems, work using a variety of data management tools. Develop and Support NPI, NDC and ICD database architecture, improve MySQLs query performance. Work with developers to implement the interphases needed to ensure connectivity of proprietary technologies to web enabled and mobile applications suitable for the medical industry using Blockchain technology. Maintain database high availability and disaster recovery. Write test cases to test data, analyze risk identifiers and, write documentation addressing defect diagnostics and proposed solutions. Contribute to the implementation of new features and solutions for customers. Other related duties as assigned.', 'Master’s Degree or foreign equivalent in Database or Data Management, Data Analytics, Management Information Systems or any Data Science related field and 2 years of experience as a Data Analyst or any Data Analyst related position. Alternatively, employer is willing to accept a Bachelor’s degree or foreign equivalent in Database or Data Management, Data Analytics, Management Information Systems or any Data Science related field and 5 years of experience as a Data Analyst or in any Data Analyst related position. Any suitable combination of education, training and experience is acceptable.']",2020-12-17 13:55:37
DATA ANALYST,Eagleforce Associates,N/A,"Herndon, VA 20171",[],2020-12-17 13:55:37
"Data Analyst, MDcentRx",MDcentRx,N/A,"New York, NY 10017","['Find jobs', 'Company Reviews', 'Find salaries', 'Employers', 'Change country', 'Help Center', 'Tableau: 1 year (Preferred)Microsoft Excel: 1 year (Preferred)US work authorization (Preferred)', '50% Client Report & Dashboard Creation – weekly, monthly reports in both Data Visualization platforms or Powerpoint', '25% Data Operational Needs – including Data Ingestion, Cleansing, QC', '25% Client Campaign Analytics – including list matching, segmentation, media effectiveness and insights', 'have 1-3 years of experience in professional data analysis', 'have least 1 year of experience working within healthcare communications/media, pharmaceutical or biotech industries or a deep', 'have experience with data visualization tools including Tableau (and/or others ie., PowerBI, Qlikview), creating custom dashboards and workflows', 'have maintained data ingestion and warehousing processes, while ensuring detailed documentation', 'have experience working with Microsoft Office (PPT, Excel, Word); Advanced Excel skills (Able to work with complex Excel formulas)', 'Understanding of and professional exposure to statistical software packages such as SQL, R and Python a PLUS', 'Deep quantitative interest, demonstrated through school coursework or professional experience', '401(k)', 'Dental insurance', 'Flexible spending account', 'Health insurance', 'Health savings account', 'Paid time off', 'Parental leave', 'Monday to Friday', 'New York, NY 10017 (Preferred)', 'Tableau: 1 year (Preferred)', 'Microsoft Excel: 1 year (Preferred)', 'Pharmaceuticals: 1 year (Preferred)', 'Temporarily due to COVID-19']",2020-12-17 13:55:37
"Data Analyst, MDcentRx",MDcentRx,N/A,"New York, NY 10017",[],2020-12-17 13:55:37
Program Analyst,U.S. Department of State,"4.2 out of 5 from 1,395 employee ratings","Washington, DC","['Find jobs', 'Company Reviews', 'Find salaries', 'Employers', 'Change country', 'Help Center']",2020-12-17 13:55:37
Data Analyst,Bizzell Group,4.5 out of 5 from 2 employee ratings,"Atlanta, GA 30345","['Find jobs', 'Company Reviews', 'Find salaries', 'Employers', 'Change country', 'Help Center', 'Candidate will manage large and complex databases including the National Health and Nutrition Examination Survey (NHANES); other data from the National Center for Health Statistics; economic and demographic data from the US Census and other sources, and prepare data for analyses.', 'Candidate must maintain detailed documentation of data sources, statistical methods, computer programs, and statistical results. The candidate will inform the project lead of important changes to the database, coding, and interpretation of results.', 'Candidate will check the quality of data from data sources in use and perform quality control checks of the data and research results throughout the course of each analysis.', 'Candidate will maintain detailed documentation of all project-related information including documentation from meeting notes and summaries.', 'Candidate will provide a detailed and comprehensive statement of the methods by which they will meet the data management needs described above to demonstrate a complete understanding of the intent and requirements of the contract. The candidate will outline potential problems that may be encountered and propose methods to resolve any problems that may arise.', 'Candidate will utilize a variety of statistical software packages (e.g. SAS, SUDAAN, others) to perform complex analyses of CVD outcomes (e.g. mortality, hospitalizations) and risk factors by race/ethnicity, gender, age, time, and other covariates.', 'Candidate will employ a variety of statistical techniques (linear regression, logistic regression, ANOVA, etc.) to the study of CVD and associated risk factors by race/ethnicity, gender, age, time, and other covariates.', 'Candidate will develop and contribute to manuscripts to be submitted for publication in professional journals, calculation of national and state-level estimates for the surveillance website, and other activities that result in the provision of data on heart disease and stroke to the public at large, as well as to public health professionals.', 'Candidate will provide progress reports every two weeks that shall include at a minimum, the current status of data management, progress on manuscripts, and any barriers encountered, and methods of resolution used to address stated barriers.', 'Candidate will provide a detailed and comprehensive statement of the methods by which they will meet the data analysis and dissemination needs described above to demonstrate a complete understanding of the intent and requirements of the contract. The candidate will outline potential problems that may be encountered and propose methods to resolve any problems that may arise.']",2020-12-17 13:55:37
Data Analyst,HCI | integrated solutions,3 out of 5 from 46 employee ratings,Virginia,"['Find jobs', 'Company Reviews', 'Find salaries', 'Employers', 'Change country', 'Help Center']",2020-12-17 13:55:37
Data Analyst,HCI | integrated solutions,N/A,Virginia,[],2020-12-17 13:55:37
Data Analyst,HCI | integrated solutions,N/A,Virginia,[],2020-12-17 13:55:37
Data Analyst,Cecil College,3.9 out of 5 from 47 employee ratings,"North East, MD 21901","['Find jobs', 'Company Reviews', 'Find salaries', 'Employers', 'Change country', 'Help Center', 'Develop appropriate graphs, reports, dashboards, and presentations of data', 'Perform basic statistical analyses for projects and reports', 'Generate routine and ad-hoc reports using SQL and other standard report writers', 'Improve data extraction and reporting processes by utilizing PL/SQL, data marts and data warehousing', 'Understanding of database queries/query languages', 'Programming skills preferred', 'Adept at queries and report writing', 'Knowledge of Power BI preferred', 'Knowledge of statistics, at least to the degree necessary in order to communicate statistical concepts', 'Ability to present complex information in an understandable and compelling manneProficiencies: Demonstrated abilities to coordinate multiple schedules, assess priorities, and meet deadlines; must exhibit excellent communication and writing/composition skills; ability to work efficiently and independently; strong interpersonal and teamwork skills and proficiency in problem-solving', 'We are committed to ensuring equal opportunity and non-discrimination in all hiring and employment practices. Cecil College will not discriminate against any individual by reason of race, color, national origin, ancestry, age, religion, disability, sex, sexual orientation, gender identity and expression, genetic status, genetic information, veteran status or any other status protected by federal, state or local law.']",2020-12-17 13:55:37
Data Analyst,Cecil College,N/A,"North East, MD 21901",[],2020-12-17 13:55:37
Data Migration Analyst,Beacon,N/A,"Pierre, SD 57501","['Find jobs', 'Company Reviews', 'Find salaries', 'Employers', 'Change country', 'Help Center', 'programming in COBOL: 1 year (Preferred)webMethods as an ETL: 1 year (Preferred)', 'Participate in requirements verification sessions and approve/accept all data conversion planning and requirements specification deliverables;', 'Participate in the design of data conversion modules and approve/accept all general and detailed data conversion design deliverables;', 'Participate in testing and approve/accept data conversion test plans and deliverables;', 'Facilitates data extract and verification processes with incumbent vendor;', 'As a member of the project’s technical team, participate in reviews of other technical deliverables.', 'Excellent communications skills;', 'Professional demeanor – represents the project to stakeholders in a friendly, unbiased and professional manner;', 'Ability to identify and communicate technical issues, both verbally and written, to project management;', 'Ability to develop recommendations and facilitate resolution of data conversion issues with project, agency IT and vendor staff;', 'Ability to maintain effective working relationships with vendor and other State technical staff;', 'Working knowledge of effective data conversion methods and approach;', 'Understanding of data conversion complexities;', 'Ability to work within a demanding project environment;', 'Bachelor’s degree plus 5+ years experience in systems development with emphasis on data conversion.', 'Knowledge of Medicaid & CHIP Eligibility System operations and data.', 'Experience in conversion of mainframe datasets (VSAM/Adabas) to modern database technologies using modern ETL and ELT tools.', 'General knowledge of how business is conducted within the State of South Dakota.', '5+ years experience programming in COBOL.', '2-3 years experience using webMethods as an ETL.', 'mainframe system to a new Medicaid & CHIP Eligibility System: 1 year (Preferred)', 'programming in COBOL: 1 year (Preferred)', 'webMethods as an ETL: 1 year (Preferred)', 'mainframe datasets to modern database technologies: 1 year (Preferred)', 'Varies', 'Yes']",2020-12-17 13:55:37
Data Migration Analyst,Beacon,N/A,"Pierre, SD 57501",[],2020-12-17 13:55:37
Data Migration Analyst,Beacon,N/A,"Pierre, SD 57501",[],2020-12-17 13:55:37
Data Migration Analyst,Beacon,N/A,"Pierre, SD 57501",[],2020-12-17 13:55:37
Data Migration Analyst,Beacon,N/A,"Pierre, SD 57501",[],2020-12-17 13:56:31
Data Migration Analyst,Beacon,N/A,"Pierre, SD 57501",[],2020-12-17 13:56:31
Data Analyst,AccessLex Institute,4 out of 5 from 2 employee ratings,"West Chester, PA 19380","['Find jobs', 'Company Reviews', 'Find salaries', 'Employers', 'Change country', 'Help Center', 'Collaborate with business and development community to elicit and understand data and project requirements.', 'Work with various customer groups to develop the business data collection and access layer across various business intelligence products.', 'Develop and implement technical designs of data reports and models in support of business requirements.', 'Develop and implement technical designs of data collection and integration processes, through the utilization of online forms.', 'Assist in gathering and defining business and technical metadata in support of projects.', 'Collect and document business requirements in support of all Business Intelligence (BI) initiatives.', 'Develop and deliver training materials in support of delivered operational reports and BI applications.', 'Educate business owners of available data as well as any limitations.', 'Continuous review, update, and adherence to data governance policies.', 'Other duties as assigned.', 'Knowledge, Skills and Abilities (KSAs) – Things a candidate should know and/or a skill or ability he or she should possess to be successful in the role.RequiredExcellent interpersonal and communications skills. Job requires the ability to work hand in hand with customers, facilitating meetings, preparing written documents and communication, and the ability to develop detailed requirements for reporting and analysis applications.Proven analytical skills with the ability to collect, organize, analyze and disseminate significant amounts of information with attention to detail and accuracy.Strong attention to data validation and data quality requirements.Ability to evaluate and gain knowledge in implementing new tools.2+ years’ experience writing TSQL, views, and stored procedures, with the ability to learn other analytic tools.Adept at report writing and presenting findings.Strong knowledge of database design and data models.Familiarity with cloud-based data platforms and tools.', 'PreferredExperience with Microsoft Business Intelligence suite of products, including Integration Services, Reporting Services and Analysis Services.Experience with dashboarding software such as Power BI or QLIKKnowledge of creating APIs.', 'BACKGROUND The following are required unless otherwise noted:BS/BA in Business Administration, Computer Science, or similar related field.Minimum 2 years of related experience in a similar role.Thorough knowledge of a broad range of business and technology issues.']",2020-12-17 13:56:31
Data Analyst,AccessLex Institute,N/A,"West Chester, PA 19380",[],2020-12-17 13:56:31
Business Intelligence Analyst,AppHarvest,N/A,"Lexington, KY","['Find jobs', 'Company Reviews', 'Find salaries', 'Employers', 'Change country', 'Help Center', 'Manage and fulfill ad hoc information requests submitted to the BI team', 'Work cross-functionally across the data stack: definition, acquisition, transformation, and visualization', 'Contribute to the development of new processes to improve efficiencies and/or data collection', 'Utilize company resources to aggregate and analyze relevant business and industry/market data, trends, and patterns', 'Coordinate with leadership to help solve/mitigate business needs', 'Perform data profiling to identify anomalies', 'Generate weekly and monthly reports with market trends past and present', 'Design new data collection models to better collect information', 'Coordinate with IT department to implement new models', 'Develop protocol on how to best filter and variance', ""Bachelor's degree in Computer Science, Engineering, Finance, Information Technology, or related field"", 'Advanced degree preferred', ""5+ years' experience in business intelligence, analytics, and/or similar role"", 'Expert knowledge of business intelligence tools (Jet Reports, Microsoft Dynamics, Power BI) - guru with Excel', 'Experience integrating new software and programs to data services', 'Capable of prioritizing multiple projects while still achieving deadlines', 'Natural leadership skills (planning, communication, relationship building)', 'Excellent analytical and forecasting ability', 'Strong written and verbal communication skills', 'General understanding of current data protection and privacy laws', '100% company paid insurance premiums (Medical, Dental and Vision Plans)', '$25,000 Company Paid Life Insurance at no cost to our employees', '401K Company Match 100% of First 3%- 50% of next 2% and is vested immediately – its automatically yours.', '9 company paid holidays', 'Generous PTO Packages starting at 15 PTO days', '2 Paid Mission Days for volunteer work', 'Company provided uniforms and shoes (for Greenhouse Employees)']",2020-12-17 13:56:31
