job_title,company,location,date_posted,applicants,job_text,seniority_level,employment_type,job_function,industries,date_scraped
Big Data Engineer (W2 OR H1b transfer only),Compunnel ,"Chicago, IL",10 hours ago,Be among the first 25 applicants,"['', ' AWS (3+ Years)', 'Immediate Interview!!', 'A strong understanding of SQL', ' SQL (5+ Years)', 'Peer review code and automated tests help team members with design and implementation challenges.', 'Leverage PySpark and AWS EMR to parallelize the process and reduce the runtime.', 'Leverage PySpark and AWS EMR to parallelize the process and reduce the runtime.Optimize the Python code to reduce the runtime.Enhance the Python process to be fault-tolerant and contain checkpoints to make rerunning a subset of the process more efficient.Write automated tests for Python code.Peer review code and automated tests help team members with design and implementation challenges.', 'Duration: 12+ Months ', 'Optimize the Python code to reduce the runtime.', 'Responsibilities', ' Spark (5+ Years)', 'A strong understanding of Pandas and PySpark', ' Python (5+ Years)', 'Qualifications', 'At least 3 years of experience developing production Python code', 'Write automated tests for Python code.', 'Location: Chicago, IL /Portland, OR /Alpharetta, GA / Knoxville TN / Franklin Lakes, NJ / McLean, VA ', 'Enhance the Python process to be fault-tolerant and contain checkpoints to make rerunning a subset of the process more efficient.', 'We accept (H1B- Transfer, H4-EAD, L2-EAD, GC, USC, TN Visa, E3). (Accepting W2)', 'Technical Must Haves', 'Position Overview', 'Python - Spark and Panda. Hands-on experience working on automated evaluation models - ideally within the mortgage industry. Preference for AWS Elastic Map Reduce.', 'Experience with SAS', 'At least 3 years of experience developing production Python codeA strong understanding of Pandas and PySparkA strong understanding of SQLExperience with SASSolid understanding of software design principles', 'Big Data Engineers ', 'Solid understanding of software design principles']",Entry level,Full-time,Engineering,Construction,2021-01-28 13:56:49
Data Engineer / Software Engineer -,Arminus,"Linthicum Heights, MD",4 hours ago,82 applicants,"['', 'Security Clearance:', 'Job Description:\xa0', 'Job title: Data Engineer / Software Engineer -', '•\tB.S. degree in Computer Science, Information Technology, Electrical Engineering, Statistics, or equivalent fields.\xa0Educational requirements may be adjusted for applicable work experience. Work experience may be adjusted for highly specialized knowledge or uniquely applicable experience.', '•\tExperience with data flow, management, and storage solutions (i.e. Kafka, NiFi, and AWS S3 and SQS solutions).', 'Location: Linthicum Heights, MD', '•\tFluency with data extraction, translation, and loading including data prep and labeling to enable data analytics.', '•\tFamiliarity with various log formats such as JSON, XML, and others.', '•\tAbility to decompose technical problems and troubleshoot system and dataflow issues.', 'Required Skills:', '•\tProficiency with acquisition and understanding of network data and the associated metadata.', '•\t5+ years of experience as a developer, analyst, or engineer.', '•\tExperience with programming languages such as Python and Java.', 'Employee Type: Full-Time', '•\tA current Secret level U.S. Government Security Clearance is required and therefore all candidates must be a U.S. Citizen.\xa0Can also consider candidates with a Top-Secret level clearance as well.']",Mid-Senior level,Full-time,Engineering,Information Technology and Services,2021-01-28 13:56:49
Senior Software Engineer/Quality Assurance Analyst,Arminus,"Springfield, VA",5 hours ago,Be among the first 25 applicants,"['', '•\xa0\xa0\xa0TS/SCI with SBI or higher clearance ', '•\xa0\xa0\xa0Five years of experience writing code to automated Quality Assurance & Quality Control (QA/QC) tests', '•\xa0\xa0\xa0Five Years of experience Performing Manual and Automated Testing', 'Qualifications', 'Job title: Senior Software Engineer/Quality Assurance Analyst', ""•\xa0\xa0\xa0Bachelor’s or master's degree in software design, engineering, or computer science"", '•\xa0\xa0\xa0Five Years of experience with SQL and scripting', '•\xa0\xa0\xa0DoD 8570.1-M IAT Level II certification', 'Job Location: Springfield, VA', '•\xa0\xa0\xa0Five Years of experience with Agile Development Process', '•\xa0\xa0\xa0Five Years of experience with Web-Based Testing Applications', '•\xa0\xa0\xa0Five Years of experience in software development and software quality assurance', 'Job Type: Direct Hire ', '•\xa0\xa0\xa0Eight years of experience in software design, writing source code, control of source code, reviewing code, configuration management, change management, program testing, integration of software, and release management process', '•\xa0\xa0\xa0Three years of experience working with Microsoft Team Foundation Server (Source Code Repository)']",Mid-Senior level,Full-time,Information Technology,Information Technology and Services,2021-01-28 13:56:49
Software Engineer,Arminus,"Fairfax, VA",5 hours ago,38 applicants,"['', 'Job Type: Direct Hire', 'Department of Defense Top Secret/SCI security clearance is required at time of hire. Applicants selected will be subject to a U.S. Government security investigation and must meet eligibility requirements for access to classified information. Due to the nature of work performed within our facilities, U.S. citizenship is required.', '•\xa0\xa0\xa0Full use and understanding of software engineering concepts, principles, and theories', '•\xa0\xa0\xa0Solid object-oriented programming and software design skills', '•\xa0\xa0\xa0User Interface development', 'Programming Skills:', '•\xa0\xa0\xa0Appreciation for user-centric design', 'Candidates should have demonstrated strengths and experience in the following areas:', '•\xa0\xa0\xa0Computer science theory (e.g., data structures, algorithms, computational complexity)', '•\xa0\xa0\xa0Web Services knowledge such as HTML, CSS, JavaScript, React, and Redux', '•\xa0\xa0\xa0Deep exposure to Unix/Linux systems as well as Windows', '•\xa0\xa0\xa0Effective communication and attention to detail', '•\xa0\xa0\xa0Strong fundamentals in data structures and algorithms', '•\xa0\xa0\xa0Strong leadership skills suitable for recruiting, leading and managing teams of engineers to solve challenging problems', 'Job Location: Fairfax, VA', 'Job Title:\xa0Principal Software Engineer', '•\xa0\xa0\xa0Proficient in one of the following: Java, C++, C, or JavaScript (using object oriented techniques)']",Mid-Senior level,Full-time,Engineering,Information Technology and Services,2021-01-28 13:56:49
Lead Software Engineer,Brooksource,"Atlanta, GA",,N/A,"['', 'Demonstrated ability to develop, test, document, and maintain computer code for deadline driven projects', 'Development tools (e.g., NetBeans, Eclipse, Visual Studio Code, etc.)', 'Demonstrated ability to participate in requirements gathering process, provide user documentation, and write clear, concise comments within programs', 'Proactively managing expectations and meeting deadlines in a fast moving, agile software development environment', 'Maintaining excellent communication with team members and developing and maintaining a strong working relationship with the client', '60% software development and 40% leading task and interacting with clients', 'The Following Requirements Must be Met to be Considered for this Position:', '6-month contract-to-hire', 'Our clients Health Analytics group is looking to hire a Software Engineer to join their growing team. The Health Analytics Division specializes in developing advanced Information Technology and Data Management solutions for our government and commercial clients. As the software developer, you will assist entry level staff as you solve technical problems. The group also is an institution resource, so in addition to your regular work you would also help support many other projects across the organization, covering a broad range of topics. Example of projects include maintaining and sharing public health data for the CDC and organizing research results for the government to better understand what studies have been done so others can use that research. If this sounds like a role you would be interested in, please keep reading!', 'Major Responsibilities:', 'What’s in it for You?', 'Web development technologies such as HTML, XML, JSON, CSS, and JavaScript and accompanying frameworks and libraries (e.g., jQuery, Bootstrap, etc.) and Experience with additional JavaScript frameworks (e.g., React, Angular, Vue)', 'Must be a US Person with the ability to obtain and maintain a government clearance', 'Interacting and communicating with clients', 'Continued job performance improvement through on-the-job training and outside study', 'Excellent written and oral communication skills', 'Demonstrated experience leading development tasks', 'Ranked in the top 500 of best employers in America by Forbes', 'One of the industry leaders in applied science and technologyExtremely interesting nature of workRanked in the top 500 of best employers in America by ForbesWork alongside a very talented group of engineers, data analysts, mathematicians and statisticians\xa0', 'Demonstrated experience in all of the following and advanced in at least one of the following', 'Interacting with teams of scientists including, but not limited to epidemiologists, mathematicians, computer scientists, statisticians, and engineers', 'Conducting and participating in assigned projects with minimum of supervision and within time and budget constraints', 'Object-oriented programming with languages such as Java/JavaEE or C#', 'Extremely interesting nature of work', 'Bachelor’s Degree in Computer Science, Computer Information Science, or Computer Engineering with at least 5 years of demonstrated work experience; OR equivalent combination of education and experience.Demonstrated experience interacting and communicating with stakeholdersDemonstrated experience leading development tasksDemonstrated experience in all of the following and advanced in at least one of the followingObject-oriented programming with languages such as Java/JavaEE or C#SQL and relational database engines such as SQL Server, MySQL, PostgreSQL, or OracleWeb development technologies such as HTML, XML, JSON, CSS, and JavaScript and accompanying frameworks and libraries (e.g., jQuery, Bootstrap, etc.) and Experience with additional JavaScript frameworks (e.g., React, Angular, Vue)Development tools (e.g., NetBeans, Eclipse, Visual Studio Code, etc.)Demonstrated experience with Agile developmentDemonstrated ability to develop, test, document, and maintain computer code for deadline driven projectsDemonstrated ability to participate in requirements gathering process, provide user documentation, and write clear, concise comments within programsExcellent written and oral communication skillsMust be a US Person with the ability to obtain and maintain a government clearance', 'Solving technical problems using computer science and systems development approaches in areas that require mathematical and/or statistical methods and knowledge', 'Eight Eleven Group provides equal employment opportunities (EEO) to all employees and applicants for employment without regard to race, color, religion, national origin, age, sex, citizenship, disability, genetic information, gender, sexual orientation, gender identity, marital status, amnesty or status as a covered veteran in accordance with applicable federal, state, and local laws.\xa0', 'Work alongside a very talented group of engineers, data analysts, mathematicians and statisticians\xa0', 'Demonstrated experience interacting and communicating with stakeholders', 'Atlanta, Georgia', 'Interacting with on-site client team members as well as geographically diverse team members daily', 'Software Engineer', 'Minimal domestic travel', '60% software development and 40% leading task and interacting with clientsSolving technical problems using computer science and systems development approaches in areas that require mathematical and/or statistical methods and knowledgeInteracting and communicating with clientsInteracting with teams of scientists including, but not limited to epidemiologists, mathematicians, computer scientists, statisticians, and engineersProactively managing expectations and meeting deadlines in a fast moving, agile software development environmentConducting and participating in assigned projects with minimum of supervision and within time and budget constraintsInteracting with on-site client team members as well as geographically diverse team members dailyMaintaining excellent communication with team members and developing and maintaining a strong working relationship with the clientContinued job performance improvement through on-the-job training and outside studyThrive in a multi-disciplinary environment solving problems in a variety of application areasMinimal domestic travel', 'One of the industry leaders in applied science and technology', 'Thrive in a multi-disciplinary environment solving problems in a variety of application areas', 'Bachelor’s Degree in Computer Science, Computer Information Science, or Computer Engineering with at least 5 years of demonstrated work experience; OR equivalent combination of education and experience.', 'Demonstrated experience with Agile development', 'SQL and relational database engines such as SQL Server, MySQL, PostgreSQL, or Oracle']",Mid-Senior level,Full-time,Engineering,Information Technology and Services,2021-01-28 13:56:49
Senior Software Engineer,Arminus,"Fairfax, VA",5 hours ago,Be among the first 25 applicants,"['', 'Candidates should have demonstrated strengths and experience in some of the following areas:', '•\xa0\xa0\xa0Effective communication and attention to detail', '•\xa0\xa0\xa0Strong fundamentals in data structures and algorithms', '•\xa0\xa0\xa0Web Services knowledge such as HTML, CSS, JavaScript, React, and Redux', '•\xa0\xa0\xa0Proficient in one of the following: Java, C++, C, or JavaScript (using object oriented techniques)', 'Job Title: Senior Software Engineer', 'Candidates should have demonstrated strengths and experience in the following areas:', '•\xa0\xa0\xa0Deep exposure to Unix/Linux systems as well as Windows', '•\xa0\xa0\xa0Web Services knowledge (HTML, CSS, JavaScript, jQuery, XML and related AJAX technologies) ', 'CLEARANCE REQUIREMENTS:', '•\xa0\xa0\xa0Solid object-oriented programming and software design skills', 'Programming Skills:', '•\xa0\xa0\xa0Computer science theory (e.g., data structures, algorithms, computational complexity)', '•\xa0\xa0\xa0Solid object oriented programming and software design skills', '===========================================================================================', 'Job Type: Direct Hire', 'Department of Defense Top Secret/SCI security clearance is required at time of hire. Applicants selected will be subject to a U.S. Government security investigation and must meet eligibility requirements for access to classified information. Due to the nature of work performed within our facilities, U.S. citizenship is required.', '•\xa0\xa0\xa0Proficient in one of the following: Java, C#, C++, or JavaScript (using object oriented techniques)', '•\xa0\xa0\xa0Full use and understanding of software engineering concepts, principles, and theories', '•\xa0\xa0\xa0User Interface development', '•\xa0\xa0\xa0Appreciation for user-centric design', '•\xa0\xa0\xa0Attention to quality', 'Job Title: Junior Software Engineer', 'Job Location: Fairfax, VA', 'Department of Defense TS/SCI security clearance is required at time of hire. Applicants selected will be subject to a U.S. Government security investigation and must meet eligibility requirements for access to classified information. Due to the nature of work performed within our facilities, U.S. citizenship is required.']",Mid-Senior level,Full-time,Engineering,Information Technology and Services,2021-01-28 13:56:49
Data Engineer,Dice,"Arlington, VA",16 hours ago,Be among the first 25 applicants,[''],Entry level,Full-time,Information Technology,Information Technology and Services,2021-01-28 13:56:49
Data Engineer,Dice,"Denver, CO",15 hours ago,Be among the first 25 applicants,[''],Entry level,Full-time,Information Technology,Information Technology and Services,2021-01-28 13:56:49
Data Automation Engineer,Exabeam,"Foster City, CA",8 hours ago,49 applicants,"['', 'Experience with Log Collection (Experience working with/within SOC teams preferred)', 'Experience with RegEx and Python (ability to know the difference between Python 2 & 3)', 'Ability to take logs from systems to translate into a format that Exabeam can ingest- such as event builders and parsers', 'Experience with Log Collection (Experience working with/within SOC teams preferred)Experience with RegEx and Python (ability to know the difference between Python 2 & 3)Experience with Linux and comfortability on the command line Prior experience with SIEM tools (Splunk, QRadar, LogRthym preferred)Scripting skills (Bash preferred)Ability to take logs from systems to translate into a format that Exabeam can ingest- such as event builders and parsersKnowledge of industry best practices, and ability to understand data pipeline and processes, data cleaning Familiarity with SOAR desirable', 'Research and understand log events of security and IT devices', 'Experience with Linux and comfortability on the command line ', 'Responsibilities', 'Qualifications', 'LinkedIn', 'Familiarity with SOAR desirable', 'Own and create the Exabeam categorization model, the incident response playbook, and the', ""Understand security regulations (e.g. PCI, ISO 27001, etc.) and suggest reports that would help customers achieve complianceBuild reports and visualizations using the Elasticsearch platformResearch and understand log events of security and IT devicesCollaborate with Professional Services Engineers and build parsers for log events according to Exabeam's data model during deployment engagementsOwn and create the Exabeam categorization model, the incident response playbook, and the"", 'Understand security regulations (e.g. PCI, ISO 27001, etc.) and suggest reports that would help customers achieve compliance', 'Position Overview', 'Knowledge of industry best practices, and ability to understand data pipeline and processes, data cleaning ', 'Code scripts in python to integrate with security and IT devices', 'Build reports and visualizations using the Elasticsearch platform', ""Collaborate with Professional Services Engineers and build parsers for log events according to Exabeam's data model during deployment engagements"", 'Prior experience with SIEM tools (Splunk, QRadar, LogRthym preferred)', 'Twitter', 'Scripting skills (Bash preferred)']",Entry level,Full-time,Engineering,Information Technology and Services,2021-01-28 13:56:49
AWS Data Engineer (Can be Remote),Element,"Alexandria, VA",19 hours ago,Be among the first 25 applicants,"['', 'About The Job ', 'Desired Skills', 'Benefits', ""You’ll get credit when things go right and we’ll have your back when things go wrong.We only take on work that is challenging and right for us. There are projects we will turn down and the team has a say.We may be a small company, but we have big company benefits meant to support the idea that we're here for the long term and happiness comes from much more than where you work. We have an extraordinary retention rate because we hire extraordinary people. We hope that’s you."", 'Familiarity with log formats from various AWS services such as S3 server access , Cloudfront distribution, Lambda execution, ELB, Container execution etc. ', 'We Invest in Each Other', 'Element 84 has had a flexible work schedule since our founding in 2010.', 'Element 84 pays well but we care more about working on projects that matter.', 'We only take on work that is challenging and right for us. There are projects we will turn down and the team has a say.', ""Familiarity with log formats from various AWS services such as S3 server access , Cloudfront distribution, Lambda execution, ELB, Container execution etc. Experience with Kibana Query Language, Lucene Query Language, and/or QuerydslDesire to become an AWS Certified architect / engineer.Bachelor's degree in a related field (preferred)"", ""Here are the guidelines we're looking at to gauge experience and skillset:"", 'A Few Other Things You Should Know', 'Our Work Benefits our World', 'Ability to administer Elasticsearch cluster including cluster/shard sizing, reindexing and debug common problems arising from running a self managed multi-tenant cluster.', 'Ability to write data pipelines to parse logs using Logstash plugins.', 'Experience with AWS services such as Cloudformation, EC2, Kinesis, Lambda, SQS, Cloudwatch and S3.', 'Ability to effectively scope work from end user’s data reporting goals. Ability to administer Elasticsearch cluster including cluster/shard sizing, reindexing and debug common problems arising from running a self managed multi-tenant cluster.Ability to write data pipelines to parse logs using Logstash plugins.Ability to create graphs and dashboards in Kibana to meet end user reporting requirements and debug problems with data visualization. Experience with AWS services such as Cloudformation, EC2, Kinesis, Lambda, SQS, Cloudwatch and S3.Experience with NodeJS.', 'Desire to become an AWS Certified architect / engineer.', 'Job Description', 'Element 84 values life outside of work. We offer parental leave for everyone and support each other through family challenges like medical problems, adoptions, and new babies.', 'Element 84 has made a commitment to diversity. We expect the entire team to share that same commitment. ', 'You’ll get credit when things go right and we’ll have your back when things go wrong.', 'We have an extraordinary retention rate because we hire extraordinary people. We hope that’s you.', 'Qualifications', 'All candidates must be able to pass a National Agency Clearance with Inquires (NACI) screening. Applicants must be currently authorized to work in the United States on a full-time basis. At this time, Element 84 will not sponsor applicants for work visas for this position.', 'Required Skills', 'We are Reliable', 'Element 84 works on meaningful projects that are challenging—from a technical, people, and team perspective. We make an impact on large projects through our leadership and expertise, both formal and informal.', 'Ability to effectively scope work from end user’s data reporting goals. ', ""Element 84's values are: We Invest in Each Other, We are Reliable, and Our Work Benefits our World.Element 84 works on meaningful projects that are challenging—from a technical, people, and team perspective. We make an impact on large projects through our leadership and expertise, both formal and informal.Element 84 pays well but we care more about working on projects that matter.Element 84 values life outside of work. We offer parental leave for everyone and support each other through family challenges like medical problems, adoptions, and new babies.Element 84 has had a flexible work schedule since our founding in 2010.Element 84 has made a commitment to diversity. We expect the entire team to share that same commitment. "", 'Experience with Kibana Query Language, Lucene Query Language, and/or Querydsl', 'Ability to create graphs and dashboards in Kibana to meet end user reporting requirements and debug problems with data visualization. ', 'Experience with NodeJS.', ""We may be a small company, but we have big company benefits meant to support the idea that we're here for the long term and happiness comes from much more than where you work. "", ""Bachelor's degree in a related field (preferred)"", 'About', 'About You', 'Element 84 is an equal opportunity employer, with a company culture that values diversity.', 'Element 84', ""Element 84's values are: We Invest in Each Other, We are Reliable, and Our Work Benefits our World."", 'Company Description']",Not Applicable,Full-time,Information Technology,Information Technology and Services,2021-01-28 13:56:49
