job_title,company,location,date_posted,applicants,job_text,seniority_level,employment_type,job_function,industries,date_scraped
Customer Reliability Engineer (Prisma Access),Palo Alto Networks,"Santa Clara, CA",14 hours ago,Be among the first 25 applicants,"['', 'Strong understanding of LAN and WAN networking protocols and technologies, including security solutions, switching, firewalls and routing.', 'Strong troubleshooting skills', 'Senior engineer (6+ years’ experience) in support or similar function with CS/EE/Networking masters or equivalent background', 'Good communicator (written and verbal)', 'In this Customer Reliability Engineer (CRE) role, you will act as a liaison between our Development Operations teams, as well as our support teams to assist in escalations. While this role is similar to a Site Reliability Engineer (SRE), you will provide more opportunities to tackle critical end user experience concerns, while improving reliability and serviceability of the product, without revenue creation distractions. We are approaching customer service in an entirely new fashion, and we are looking for talented, motivated, dedicated individuals to help us define what the future of customer support should be.', 'Your Career', 'To stay ahead of the curve, it’s critical to know where the curve is, and how to anticipate the changes we’re facing. For the fastest growing cybersecurity company, the curve is the evolution of cyberattacks, and the products and services that dedicatedly address them. Our engineering team is at the core of our products – connected directly to the mission of preventing cyberattacks. They are constantly innovating – challenging the way we, and the industry, think about cybersecurity. These engineers aren’t shy about building products to solve problems no one has pursued before. They define the industry, instead of waiting for directions. We need individuals who feel comfortable in ambiguity, excited by the prospect of a challenge, and empowered by the unknown risks facing our everyday lives that are only enabled by a secure digital environment.', 'Communicate status of the systems via automation (customers) and targeted messages (TAC)', 'Experience with Cloud services, configuration and management', 'Be an escalation point for the support team for problems found by customers', 'Being the cybersecurity partner of choice, protecting our digital way of life.', 'Your Experience', 'Triage problems to directly resolve or involve the correct resource in dev to resolve', 'Development mindset', 'Prior experience in network security is a plus', 'Familiar with common Linux Distros', 'Palo Alto Networks Cloud Security Products are the latest in our security platform that bring the power and scale of our products to our customers, and industry. It’s a groundbreaking change in the way the industry views cybersecurity as it relates to our cloud environments, one that is necessary in our mission to protect our way of life in the digital age. To support these products, we have a fast-growing team called our Engineering Technical Assistance Center (ETAC) that is empowered by our Customer Reliability Engineers (CRE). This team utilizes the experience of senior network and security engineers to build the environment where our customers and employees thrive.', 'Your Impact', 'Job Description', 'Palo Alto Networks is an equal opportunity employer. We celebrate diversity in our workplace, and all qualified applicants will receive consideration for employment without regard to age, ancestry, color, family or medical care leave, gender identity or expression, genetic information, marital status, medical condition, national origin, physical or mental disability, political affiliation, protected veteran status, race, religion, sex (including pregnancy), sexual orientation, or other legally protected characteristics. ', 'Innovate potential solutions experienced by our end users', 'Scripting and automation development experience in bash/python', 'Qualifications', 'We have the vision of a world where each day is safer and more secure than the one before. These aren’t easy goals to accomplish – but we’re not here for easy. We’re here for better. We are a company built on the foundation of challenging and disrupting the way things are done, and we’re looking for innovators who are as committed to shaping the future of cybersecurity as we are.', 'Our Commitment ', 'Identify and monitor the metrics for ongoing health of the systems and exchange points between systems and respond to potential problems', 'We’re trailblazers that dream big, take risks, and challenge cybersecurity’s status quo. It’s simple: we can’t accomplish our mission without diverse teams innovating, together. To learn more about our dedication to inclusion and innovation, visit our Life at Palo Alto Networks page and our diversity website. ', 'Work with the DevOps team to help build monitoring systems of all the SaaS systemsIdentify and monitor the metrics for ongoing health of the systems and exchange points between systems and respond to potential problemsBe an escalation point for the support team for problems found by customersTriage problems to directly resolve or involve the correct resource in dev to resolveCommunicate status of the systems via automation (customers) and targeted messages (TAC)Utilize tracking of issue resolution (post-mortem) and work with this data to provide feedback for product improvement (supportability)Training TAC on the developed tools and processes. This is an ongoing deliverableInnovate potential solutions experienced by our end users', 'The Team', 'Training TAC on the developed tools and processes. This is an ongoing deliverable', 'Our Mission', 'At Palo Alto Networks® everything starts and ends with our mission:', 'Utilize tracking of issue resolution (post-mortem) and work with this data to provide feedback for product improvement (supportability)', 'Additionally, we are committed to providing reasonable accommodations for all qualified individuals with a disability. If you require assistance or an accommodation due to a disability or special need, please contact us at [email protected]', 'Work with the DevOps team to help build monitoring systems of all the SaaS systems', 'Senior engineer (6+ years’ experience) in support or similar function with CS/EE/Networking masters or equivalent backgroundScripting and automation development experience in bash/pythonStrong understanding of LAN and WAN networking protocols and technologies, including security solutions, switching, firewalls and routing.Good communicator (written and verbal)Strong troubleshooting skillsDevelopment mindsetFamiliar with common Linux DistrosExperience with Cloud services, configuration and managementPrior experience in network security is a plus', 'Company Description', 'Our engineering team is provided with an unrivaled chance to create the products and practices that will support our company growth over the next decade, defining the cybersecurity industry as we know it. If you see the potential of how incredible people products can transform a business, this is the team for you. If you don’t wait for directions, instead, identifying new features and opportunities we must just get better, this is your new career.']",Not Applicable,Full-time,Management,Computer & Network Security,2021-01-28 13:56:49
Lead Java Software Engineer with AWS,MetaOption LLC,"Rockville, MD",2 hours ago,Be among the first 25 applicants,"['', 'Must Have: CLOUD, DEVOPS, JAVA, TECH LEAD', '100% Remote during Covid, Rockville, MD after CovidMust be a US Citizen or Green Card HolderActive Public Trust or be clearable to Public Trust', 'Long Term Contract', 'Lead Java Software Engineer with AWS']",Mid-Senior level,Full-time,Engineering,Information Technology and Services,2021-01-28 13:56:49
Data Scientist,Wipro Limited,"Tennessee, United States",2 hours ago,Over 200 applicants,"['', 'PhD candidates will be preferred', 'Major Attribute of Data Scientist (not Data Engineer) with 10+ Years of experience', 'Good communication (written and oral) and attitude to collaborate with team members across the data works organisation.', 'Major Attribute of Data Scientist (not Data Engineer) with 10+ Years of experienceSelf-Starter and ability to work with limited supervision to guide team, work with data works team to define roadmapGood communication (written and oral) and attitude to collaborate with team members across the data works organisation.PhD candidates will be preferredSupport product management team for data driven production from ideation through product delivery and management.Able to guide team for data outcomes with deep data analysis for mega platform and large data set.', 'Self-Starter and ability to work with limited supervision to guide team, work with data works team to define roadmap', 'Able to guide team for data outcomes with deep data analysis for mega platform and large data set.', 'Support product management team for data driven production from ideation through product delivery and management.', 'JOB DESCRIPTION']",Mid-Senior level,Full-time,Information Technology,Information Technology and Services,2021-01-28 13:56:49
Senior Data Engineer,Cypress HCM,"San Diego, CA",5 hours ago,119 applicants,"['Bachelor’s Degree in Computer Science or related Extensive experience working with the Apache Hadoop Ecosystem \xa0 Working experience with MS SQL Server or other RDBMS \xa0 Significant experience with Spark, Kafka, Nifi, and other streaming data tools Strong knowledge of the Hadoop Ecosystem including HDFS, MapReduce, Sqoop, Yarn, Hive, and Oozie Solid understanding of T-SQL and ETL programming including SQL Server Integration Services (SSIS) \xa0 Extensive knowledge of common data warehousing technologies and techniques', 'Process documentation and data flow diagramming \xa0 ', 'Responsibilities: ', 'Participate in the research, design, and testing of next generation data engine platforms ', 'Participate in the full software development lifecycle (requirements, design, code, unit test, deployment, sustaining) Develop and manage steaming data pipelines used for training and developing machine learning models Participate in the research, design, and testing of next generation data engine platforms Develop and guide long-term strategy for data pipelines and persistent data storage Evaluate and recommend database infrastructure and tools including cloud technologies\xa0 Build integrated and automated data pipelines using the Hadoop Ecosystem (Spark, Kafka, Hive, Yarn, Oozie) \xa0 Develop efficient and effective T-SQL to extract, transform, and load data from source systems Process documentation and data flow diagramming \xa0 Mentor and coach junior engineers, software developers, and data analysts \xa0 \xa0 \xa0 ', 'Requirements: ', 'Working experience with MS SQL Server or other RDBMS \xa0 ', 'Develop and guide long-term strategy for data pipelines and persistent data storage ', 'Responsibilities:', 'Significant experience with Spark, Kafka, Nifi, and other streaming data tools ', 'Mentor and coach junior engineers, software developers, and data analysts \xa0 \xa0 \xa0 ', 'Requirements', 'Bachelor’s Degree in Computer Science or related ', 'Strong knowledge of the Hadoop Ecosystem including HDFS, MapReduce, Sqoop, Yarn, Hive, and Oozie ', 'Develop and manage steaming data pipelines used for training and developing machine learning models ', 'Develop efficient and effective T-SQL to extract, transform, and load data from source systems ', 'Evaluate and recommend database infrastructure and tools including cloud technologies\xa0 ', 'Extensive experience working with the Apache Hadoop Ecosystem \xa0 ', 'Extensive knowledge of common data warehousing technologies and techniques', 'Build integrated and automated data pipelines using the Hadoop Ecosystem (Spark, Kafka, Hive, Yarn, Oozie) \xa0 ', 'Solid understanding of T-SQL and ETL programming including SQL Server Integration Services (SSIS) \xa0 ', ' ', 'Participate in the full software development lifecycle (requirements, design, code, unit test, deployment, sustaining) ']",Mid-Senior level,Full-time,Engineering,Computer Software,2021-01-28 13:56:49
Data Engineer,JLL,"Chicago, IL",1 hour ago,Be among the first 25 applicants,"['', ' Good analytical and problem-solving skills. ', ' Understanding of data structures, data modeling and software architecture. ', 'As a Data Engineer at JLL Technologies, you will- ', ' Develop good understanding of how data will flow & stored through an organization across multiple applications such as CRM, Broker & Sales, Finance, HR, MDM, ODS & EDW ', ' Independent and able to manage and prioritize workload. ', ' Intermediate/advanced experience programming in Python and intermediate SQL ', ' Develop solutions leveraging cloud big data technology to ingest, process and analyze large, disparate data sets to exceed business requirements ', ' Develop good understanding of how data will flow & stored through an organization across multiple applications such as CRM, Broker & Sales, Finance, HR, MDM, ODS & EDW  Develop data solutions that enable non-technical staff to make data-driven decisions  Develop data management and data persistence solutions for application use cases leveraging relational, non-relational databases and enhancing our data processing capabilities  Develop POCs to influence platform architects, product managers and software engineers to validate solution proposals and migrate  Support users by developing documentation and responding to inquiries ', ' Ability to quickly and positively adapt to change ', ' Knowledge on Data Pipelines in Cloud and CICD tools like git/bitbucket, Jenkins/octopus etc.  Good analytical and problem-solving skills.  Team player, Reliable, self-motivated, and self-disciplined individual capable of executing on multiple projects simultaneously within a fast-paced environment working with cross functional teams.  Independent and able to manage and prioritize workload. ', ' Interact with internal colleagues and external professionals to determine requirements, anticipate future needs, and identify areas of opportunity to drive data development ', ' Support users by developing documentation and responding to inquiries ', ' Bachelor’s degree in Information Science, Computer Science, Mathematics, Statistics or a quantitative discipline in science, business, or social science.\u202f  Intermediate/advanced experience programming in Python and intermediate SQL  Understanding of data structures, data modeling and software architecture.  1 or more years of work experience and foundational knowledge on Big Data (Spark) and Cloud (AWS/Azure) technologies . ', ' Team player, Reliable, self-motivated, and self-disciplined individual capable of executing on multiple projects simultaneously within a fast-paced environment working with cross functional teams. ', ' Develop data management and data persistence solutions for application use cases leveraging relational, non-relational databases and enhancing our data processing capabilities ', ' JLL Privacy Notice ', 'What We Are Looking For-', ' Apply today! ', ' Bachelor’s degree in Information Science, Computer Science, Mathematics, Statistics or a quantitative discipline in science, business, or social science.\u202f ', ' 1 or more years of work experience and foundational knowledge on Big Data (Spark) and Cloud (AWS/Azure) technologies . ', ' Develop POCs to influence platform architects, product managers and software engineers to validate solution proposals and migrate ', ' Develop data solutions that enable non-technical staff to make data-driven decisions ', 'What You Can Expect From Us-', ' Develop solutions leveraging cloud big data technology to ingest, process and analyze large, disparate data sets to exceed business requirements  Interact with internal colleagues and external professionals to determine requirements, anticipate future needs, and identify areas of opportunity to drive data development ', ' Knowledge on Data Pipelines in Cloud and CICD tools like git/bitbucket, Jenkins/octopus etc. ']",Entry level,Full-time,Information Technology,Construction,2021-01-28 13:56:49
Data Scientist,Tech Mahindra,"St Louis, MO",6 hours ago,Over 200 applicants,"['', 'Apache Spark', 'The Data Scientist will participate on data management aspects of client engagements to deliver Test & Learn solutions, as well as contribute to and foster a high performance collaborative workplace. A Data Engineer Will Independently executes projects through design, implementation, automation, and maintenance of large scale enterprise ETL processes for a global client base. Platform Teams provides cloud-based analytic software tools that enable large, consumer-focused businesses to seize the Big Data analytics opportunity by triangulating between business strategy, algorithmic math, and large databases to improve decisions.', '\xa0', 'Identify relevant data sources and automate collection processes', 'Able to process structured and unstructured data', 'Roles and Responsibilities:', 'Apache Kafka', 'Preferred Skills', 'Data Mining (Mandatory)Correlation and probability analyticsRegular expressionsApache Spark', 'Data processing – Not mandatory, good to have', 'Collaborate with engineering and product development teams', 'Build predictive models and machine-learning algorithms', 'CSV files', 'Hadoop (NoSQL)', 'Data Mining (Mandatory)', 'SQL – Primary', 'Oracle (relational)', 'Identify relevant data sources and automate collection processesAble to process structured and unstructured dataAble to analyze large amounts of information and discover trends and patternsBuild predictive models and machine-learning algorithmsPresent information using data visualization techniquesCollaborate with engineering and product development teams', 'Apache NifiApache KafkaETL', '·\xa0\xa0\xa0\xa0\xa0\xa0\xa0\xa0Excellent experience with Data science workbench', 'Query/programming languages:', 'Duration: Long Term Contract', 'ETL', 'Python – PrimarySQL – PrimaryScala or any other – Not mandatory, good to have', 'Role: Data', 'Location: St. Louis, MO', 'Regular expressions', 'Python – Primary', 'Required Skills:', 'Mongo (Object Storage)', 'Scientist', 'Role: Data Scientist', 'Present information using data visualization techniques', 'Tech Mahindra represents the connected world, offering innovative and customer-centric information technology experiences, enabling Enterprises, Associates and the Society to Rise™. We are a USD 4.9 billion company with 121,840+ professionals across 90 countries, helping over 935 global customers including Fortune 500 companies. Our convergent, digital, design experiences, innovation platforms and reusable assets connect across a number of technologies to deliver tangible business value and experiences to our stakeholders. Tech Mahindra is the highest ranked Non-U.S. company in the Forbes Global Digital 100 list (2018) and in the Forbes Fab 50 companies in Asia (2018).', 'About Tech Mahindra :', 'Project Scope: ', ' We are part of the USD 21 billion Mahindra Group that employs more than 200,000 people in over 100 countries. The Group operates in the key industries that drive economic growth, enjoying a leadership position in tractors, utility vehicles, after-market, and information technology and vacation ownership.\xa0', 'Correlation and probability analytics', 'Database platforms to access, query information from – Any of the following is Ok', 'Job description:', 'Able to analyze large amounts of information and discover trends and patterns', 'Database platforms to access, query information from – Any of the following is OkOracle (relational)Hadoop (NoSQL)Mongo (Object Storage)CSV files', 'Apache Nifi', 'Scala or any other – Not mandatory, good to have', 'OR']",Mid-Senior level,Full-time,Engineering,Information Technology and Services,2021-01-28 13:56:49
System Engineer,Computer Solutions LLC,"St Paul, MN",23 hours ago,Be among the first 25 applicants,"['Careers@ComputerSolutions.com', '', 'LabVIEW', 'Biomedical device or biotechnology experience', 'TestStand', 'MS or Ph.D. in an engineering discipline or Physics', 'LabVIEW Systems Engineer', 'Experience with Compact-RIO', 'We currently have openings for systems engineers as described below for qualified professionals. While some engagements are at customer sites, typically in the Twin Cities metro of Minnesota, telecommuting is also frequent. Our selection process is very vigorous, but the rewards of being part of a highly select team are worth it. To obtain enough talent, despite our stringent selection process, we cast a wide net. In some cases, we offer some relocation assistance and provide visa sponsorship. (However, to successfully interact with our clients and your co-workers, fluency in reading, writing, speaking, and hearing English is required.) In our process, we will be vetting for the minimum requirements, as well as other criteria. If you do not meet the minimum requirements, please do not apply. Also, we are entertaining only applications directly from candidates. No third-party bids, please.', 'The position involves requirements gathering, sizing, design, development, integration, verification, documentation, and support of LabVIEW-based systems for automated test, measurement, and control. While the candidate will have no sales responsibility, engaging successfully with clients is always essential.', 'Interested and qualified candidates should send a CV via email to the following:', 'Certified LabVIEW Architect (CLA)', 'Questions also can be submitted to that address. Any candidate meeting the minimum requirements for careers at Computer Solutions will get a response. No phone calls, please.', 'MS or Ph.D. in an engineering discipline or PhysicsCertified LabVIEW Architect (CLA)Biomedical device or biotechnology experienceExperience with Compact-RIOTestStand', 'Minimum requirements: BS in an engineering discipline or Physics. At least six months of full-time experience with\xa0LabVIEW, or equivalent. NI certification preferred. If none, the candidate must be willing and able to get certified immediately. Pluses include:']",Entry level,Full-time,Information Technology,Computer Software,2021-01-28 13:56:49
Data Engineer,Dice,"New York, NY",16 hours ago,Be among the first 25 applicants,[''],Entry level,Full-time,Information Technology,Information Technology and Services,2021-01-28 13:56:49
