job_title,company,location,date_posted,applicants,job_text,seniority_level,employment_type,job_function,industries,date_scraped
Data Analyst,AmerisourceBergen,"Lockbourne, OH",19 hours ago,47 applicants,"['', '6301 LaSalle > NDC', ' Retirement benefits and more…', 'Schedule', 'Primary Location', 'Able     to handle multiple tasks and adapt to unique situations and challenges', 'Good     analytical and problem-solving skills to evaluate business problems and     apply applications knowledge to identify appropriate solutions', 'What your background should look like (minimum qualifications)', 'What AmerisourceBergen offers', ' Pet insurance', '  We offer competitive total rewards compensation. Our commitment to our associates includes benefit programs that are comprehensive, diverse and designed to meet the various needs across our associate population.  ', 'Works     with other reporting team members along with Operations to analyze data,     identify and articulate trends, outliers, quality issues, data structure,     report validity, etc. within the reporting and data environments', 'Strong     knowledge of key business processes and drivers', ' Paid time off, including vacations and holidays', 'Able     to handle pressure situations ', 'Ability     to prioritize workload and consistently meet deadlines', 'About AmerisourceBergen', ' Life insurance and disability protection', 'Collaborates     and communicates effectively and in a timely manner with other ABC teams     and individuals to communicate requirements and ensure the delivery of     quality reporting solutions.', 'May     participate in technical documentation reviews as needed. ', 'Background     in report development standards and methodologies.', 'Information Technology Jobs', 'Are you looking to make a difference in a patient’s life?\xa0 At AmerisourceBergen, you will find an innovative culture that is patient focused and dedicated to making a difference.\xa0 As an organization, we are united in our responsibility to create healthier futures.  ', 'Expertise     with reporting tools and capabilities', '3+ years’     experience in reporting, metrics development, and/or analytics required', 'May     make recommendations for process improvement throughout the development     lifecycle, on both the operations business side and the technical delivery     side.', 'Organization', ' Paid volunteer time off', 'Able     to learn quickly ', '3+ years’     experience in reporting, metrics development, and/or analytics requiredMust     possess exceptional technical skill utilizing SQL programming and     analytical skill to produce accurate, timely, meaningful, and reliable     reporting prototype solutions without clearly documented requirements.Good     analytical and problem-solving skills to evaluate business problems and     apply applications knowledge to identify appropriate solutionsAble     to review and translate requirement concepts between business and     technical personnelMay     require strong knowledge of reimbursement and PAP operational programs     and/or pharmaceutical sales and marketing business disciplinesBackground     in report development standards and methodologies.Strong     knowledge of key business processes and driversExpertise     with reporting tools and capabilitiesFamiliarity     with a variety of related technologies Able     to handle multiple tasks and adapt to unique situations and challengesAble     to handle pressure situations Able     to learn quickly Excellent     time management skillsStrong     organizational skills; attention to detailAbility     to prioritize workload and consistently meet deadlinesStrong     organizational skills; attention to detail', 'Requires some training in fields such as computer sciences, informationsystems, business administration, healthcare, accountancy, and/or similarvocations generally obtained through completion of a four year bachelor’s degreeprogram, technical vocational training, or equivalent combination of experienceand education. Normally requires a minimum of three (3) years directly relatedand progressively responsible experience; strong analysis or reportingexperience (as a provider or consumer).', 'DS East', ' Employee Stock Purchase Program', 'Job', 'Produces     and delivers quickly, detailed data sets to be used in prototyping     deliverables for Operations and/or clients.', 'Familiarity     with a variety of related technologies ', 'Works     with other reporting team members along with Operations to analyze data,     identify and articulate trends, outliers, quality issues, data structure,     report validity, etc. within the reporting and data environmentsProduces     and delivers quickly, detailed data sets to be used in prototyping     deliverables for Operations and/or clients.Serves     as the key resource for interpreting data and information; communicates     results to Operations and/or clients and makes recommendations.Helps     to design and provide recommendations for enhanced reporting solution     using business and technical knowledge May     make recommendations for process improvement throughout the development     lifecycle, on both the operations business side and the technical delivery     side.Collaborates     and communicates effectively and in a timely manner with other ABC teams     and individuals to communicate requirements and ensure the delivery of     quality reporting solutions.Participate     in meetings with 3rd party vendors and internal operations as needed.May     participate in technical documentation reviews as needed. Performs     related duties as assigned.Ability     to accommodate occasional travel', 'Participate     in meetings with 3rd party vendors and internal operations as needed.', '  Throughout our global footprint and various business units, we take a balanced approach to the benefits we offer. Many benefits are company-paid, while others are available through associate contributions.\xa0Specific benefit offerings may vary by location, position and/or business unit. ', 'Equal Opportunity Employer/Minority/Female/Disability/Veteran', 'Strong     organizational skills; attention to detail', 'Performs     related duties as assigned.', 'Excellent     time management skills', 'Serves     as the key resource for interpreting data and information; communicates     results to Operations and/or clients and makes recommendations.', 'What you will be doing', 'United States-Ohio-Lockbourne', 'Ability     to accommodate occasional travel', '  Healthcare for associates and eligible dependents, same-sex and domestic partners Paid time off, including vacations and holidays Paid volunteer time off Life insurance and disability protection Pet insurance Employee Stock Purchase Program Retirement benefits and more…', 'Helps     to design and provide recommendations for enhanced reporting solution     using business and technical knowledge ', 'Able     to review and translate requirement concepts between business and     technical personnel', 'May     require strong knowledge of reimbursement and PAP operational programs     and/or pharmaceutical sales and marketing business disciplines', 'Must     possess exceptional technical skill utilizing SQL programming and     analytical skill to produce accurate, timely, meaningful, and reliable     reporting prototype solutions without clearly documented requirements.', ' Healthcare for associates and eligible dependents, same-sex and domestic partners', 'Full-time', ""  AmerisourceBergen is a publicly traded Fortune 10 global healthcare solutions company and is one of the world's largest pharmaceutical services companies. Powered by our associates around the world, we provide pharmaceutical products and business solutions that improve access to care.\xa0 We operate the backbone of the healthcare supply chain. We drive the future of local care delivery.\xa0 We guide medical innovations to market. \xa0We create healthier futures.  ""]",Entry level,Full-time,Information Technology,Information Technology and Services,2020-12-30 19:32:10
Data Analyst,NYU Langone Health,"New York, NY",24 hours ago,38 applicants,"['', 'For more information, go to ', 'Glassdoor', 'med.nyu.edu', 'Facebook', 'Documenting work flows and methodological challenges to generating municipal level estimates', 'Other analytic or research tasks as necessary', ',', 'Twitter', ', ', 'Job Responsibilities', 'Retrieving and evaluating federal, city, and commercial data for use in the City Health Dashboard with attention to issues of sample size, bias, and timeliness', ' Retrieving and evaluating federal, city, and commercial data for use in the City Health Dashboard with attention to issues of sample size, bias, and timeliness Assist in the development, calculation, and validation of new health metrics Documenting work flows and methodological challenges to generating municipal level estimates Assisting in preparing journal articles, reports, and policy briefs Other analytic or research tasks as necessary ', 'NYU Grossman School of Medicine', ', and interact with us on ', 'Additional Position Specific Responsibilities', 'LinkedIn', 'Minimum Qualifications', ' and ', 'Instagram', '.', 'Qualified candidates must be able to effectively communicate with all levels of the organization.', 'Position Summary', 'Assist in the development, calculation, and validation of new health metrics', 'Assisting in preparing journal articles, reports, and policy briefs', 'Indeed']",Entry level,Full-time,Information Technology,Information Technology and Services,2020-12-30 19:32:10
Data Analyst,PRI Global,"St Louis, MO",13 hours ago,48 applicants,"['', 'Qualifications:', 'Deep experience with Kimball approaches and BI installation/configuration approaches', 'Responsibilities:', 'Participates in quality assurance and develops test application code in client server environment', 'Experience:\xa0Eight (8) years of relevant technical or business work experience', 'Deep experience in database report writing', 'Provides expertise in devising, negotiating and defending the tables and fields provided in the database', 'Evaluates and installs database management systems. Codes complex programs and derives logical processes on technical platforms. Builds windows, screens and reports. Assists in the design of user interface and business application prototypes', 'Experience:\xa0', 'Education:\xa0', 'Establishes database management systems, standards, guidelines and quality assurance for database deliverables, such as conceptual design, logical database, capacity planning, external data interface specification, data loading plan, data maintenance plan and security policy. Documents and communicates database design', '\xa0', 'Advanced experience with BI/DW products including ETL tools, BI products, and relational databases', ""Education:\xa0Bachelor's degree in related field, specialized training, or equivalent work experience."", 'Additional Requirements', 'Qualifications', 'Licensure:', 'Adapts business requirements, developed by modeling/development staff and systems engineers, and develops the data, database specifications, and table and element attributes for an application']",Mid-Senior level,Contract,Information Technology,Information Technology and Services,2020-12-30 19:32:10
Senior Data Analyst,Robinhood,"Menlo Park, CA",20 hours ago,57 applicants,"['', 'Solid understanding of statistical analysis', ' Developing and sharing insights around the key metrics that drive the company and your particular product Working with partners to identify the key metrics their product should track and developing and sharing analysis, guidance, reports, and dashboards to successfully track and move these metrics Powering quick decisions by answering business questions by querying our vast datasets Actively suggesting changes to help our customers and business based on a deep understanding of how people engage in our app. Adapting quantitative techniques to solve problems surfaced by multiple perspectives Mentoring others as needed to democratize the use of data within the company ', 'A CNBC Disruptor 50 in 2019 and 2020', 'The ability to use data to inform, persuade, and lead', 'Powering quick decisions by answering business questions by querying our vast datasets', 'About You', 'Passion for working and learning in a fast-growing company', 'BA/BS in behavioral science (economics, psychology, etc) with strong statistical chops or a BA/BS in a quantitative field such as mathematics, statistics, engineering, or natural sciences (or equivalent experience) with a strong curiosity about human behavior', ' Passion for working and learning in a fast-growing company Strong customer empathy Intense sense of curiosity ', 'Experience communicating data driven insights', 'About The Role', 'Excellent programming skills, including expert level familiarity with either Python (numpy, scipy, pandas) or R programming languages', 'Developing and sharing insights around the key metrics that drive the company and your particular product', 'Working with partners to identify the key metrics their product should track and developing and sharing analysis, guidance, reports, and dashboards to successfully track and move these metrics', 'Join a leading fintech company that’s democratizing finance for all. ', 'A Great Place to Work', 'A LinkedIn Top Startup in 2017, 2018, 2019 and 2020', 'Bonus Points', 'We Are Proud Of The World Class Products And Company Culture We Continue To Build And Have Been Recognized As', 'Adapting quantitative techniques to solve problems surfaced by multiple perspectives', 'Mentoring others as needed to democratize the use of data within the company', 'Minimum 4+ years of experience working in product analytics or product data science acting as the analytics voice in consumer product pods', 'Actively suggesting changes to help our customers and business based on a deep understanding of how people engage in our app.', 'Intense sense of curiosity', ' Minimum 4+ years of experience working in product analytics or product data science acting as the analytics voice in consumer product pods BA/BS in behavioral science (economics, psychology, etc) with strong statistical chops or a BA/BS in a quantitative field such as mathematics, statistics, engineering, or natural sciences (or equivalent experience) with a strong curiosity about human behavior Excellent programming skills, including expert level familiarity with either Python (numpy, scipy, pandas) or R programming languages Expert level SQL skills Solid understanding of statistical analysis Experience communicating data driven insights The ability to use data to inform, persuade, and lead ', 'Your Day-to-day Will Involve', 'Strong customer empathy', ' A Great Place to Work A CNBC Disruptor 50 in 2019 and 2020 A LinkedIn Top Startup in 2017, 2018, 2019 and 2020 ', 'Expert level SQL skills']",Associate,Full-time,Information Technology,Information Technology and Services,2020-12-30 19:32:10
Business Data Analyst,"Infomatics, Inc","Broomfield, CO",5 hours ago,Be among the first 25 applicants,"['', 'Infomatics is a Inc 500/5000 corporation for the last 7 years in a row. We have urgent need for\xa0a Business Data Analyst position with one of our clients located in Broomfield, CO. Please find the job details below.', 'Direct : 248-537-0709 | Off : 248-865-0300 x 119', 'Business Data Analyst', 'Perform detailed process research to understand data sources and data flowComplete analysis to identify data quality issuesAnalyze the business drivers/root causeCleanse dataIdentify solutions to improve go forward processes and the resulting dataWork with functional and business teams to resolve issues, including the development or implementation of business intelligence', 'Email: sravan@infomatinc.com', 'Sravan\xa0', 'Perform detailed process research to understand data sources and data flow', 'If you have the above skills/experience, please share resume in confidence to:', 'Description: ', 'Phone no:\xa0248-537-0709', 'Position will be complete end to end analysis of current business process(es) with the intention of identifying and delivering an improved process(es). ', 'Thanks and Regards', 'Infomatics Inc.,', 'Broomfield, CO.', 'Duration:\xa0\xa0\xa0\xa0\xa0\xa0\xa0\xa0\xa0\xa012+ Months Contract ', 'Location:\xa0\xa0\xa0\xa0\xa0\xa0\xa0\xa0\xa0\xa0\xa0\xa0\xa0Broomfield, CO', 'Email: sravan@infomatinc.com | Web: www.infomatinc.com', 'Cleanse data', 'Identify solutions to improve go forward processes and the resulting data', 'Recruiter name: Sravan\xa0', 'Work with functional and business teams to resolve issues, including the development or implementation of business intelligence', 'Responsibilities include:', '\xa0', 'Sr Recruiter', 'AN INC 500|5000 COMPANY', 'Analyze the business drivers/root cause', 'Title:\xa0\xa0\xa0\xa0\xa0\xa0\xa0\xa0\xa0\xa0\xa0\xa0\xa0\xa0\xa0\xa0\xa0\xa0\xa0\xa0Business Data Analyst', '31313, Northwestern Hwy, Suite 219, Farmington Hills, MI - 48334', 'Additionally, will require reporting operational data, creation and monitoring business metrics, trend and root cause analysis, error resolution, managing dashboards, and communicating results to stakeholders. Will be called upon to problem solve and provide guidance to other internal groups. Must be able to complete responsibilities with limited supervision. Requires 2-4 years of similar experience.', 'Complete analysis to identify data quality issues']",Mid-Senior level,Contract,Information Technology,Information Technology and Services,2020-12-30 19:32:10
Entry Level Business Analyst,HYDE,"Los Angeles, CA",22 hours ago,59 applicants,"['', 'The Role', 'Analytical ability, commercial instinct and a good grasp of the ""big picture""', 'WeWork Access Around the Globe', 'The Reward', 'Competitive Remuneration Package', '401(k)', ' Gather and analyse requirements and break down complex problems into coherent features, products and projects and liaise with the global tech team for implementation/resolution Facilitate product testing/analysis of defects and new features as they rollout and recommend appropriate solutions Assist in identifying pain-points, unearth root causes and help to deliver effective solutions Gain an understanding of the imperatives of each commercial activity and uncover actionable opportunities to generate incremental commercial value Proactively seek out opportunities to improve business performance, fix issues and make recommendations to management On an adhoc basis identify and document existing processes across a wide range of business functions On a project basis examine existing initiatives or scope out new initiatives, leading projects from scoping to implementation as required ', 'On an adhoc basis identify and document existing processes across a wide range of business functions', 'Exposure to a broad range of commercial functions, such as Finance, Sales, Operations and Marketing', 'Tasks', 'Proactively seek out opportunities to improve business performance, fix issues and make recommendations to management', 'Assist in identifying pain-points, unearth root causes and help to deliver effective solutions', 'How To Apply', 'Gain an understanding of the imperatives of each commercial activity and uncover actionable opportunities to generate incremental commercial value', 'Benefits', 'Exceptional stakeholder and relationship management skills; experience successfully working with a wide range of stakeholders - local and international - with the the flexibility to accommodate international time zones', 'Facilitate product testing/analysis of defects and new features as they rollout and recommend appropriate solutions', 'On a project basis examine existing initiatives or scope out new initiatives, leading projects from scoping to implementation as required', ' Analytical ability, commercial instinct and a good grasp of the ""big picture"" Exposure to a broad range of commercial functions, such as Finance, Sales, Operations and Marketing Exceptional stakeholder and relationship management skills; experience successfully working with a wide range of stakeholders - local and international - with the the flexibility to accommodate international time zones Outstanding communication skills with the ability to clearly articulate and document concepts, processes and ideas to the widest possible audience ', 'Wellness Programs', 'Gather and analyse requirements and break down complex problems into coherent features, products and projects and liaise with the global tech team for implementation/resolution', 'Health Care and Insurance Plans', 'Outstanding communication skills with the ability to clearly articulate and document concepts, processes and ideas to the widest possible audience', ' Competitive Remuneration Package 401(k) Health Care and Insurance Plans Wellness Programs WeWork Access Around the Globe Family Care ', 'Family Care', 'The Essentials', 'Requirements', 'In light of COVID-19, we are frequently reviewing our recruitment processes. Right now, we are conducting all interviews virtually. This is a fluid situation and we will adapt our processes as we need to with any government guidelines or regulations.', 'Key Responsibilities']",Associate,Full-time,Information Technology,Management Consulting,2020-12-30 19:32:10
