job_title,company,location,date_posted,applicants,job_text,seniority_level,employment_type,job_function,industries,date_scraped
Data Scientist - Load Forecasting,ISO New England Inc.,"Holyoke, MA",2 hours ago,Be among the first 25 applicants,"['', ' Lead the development of novel data pipelines, reusable software packages and visualization tools ', ' High proficiency in at least one advanced programming language (e.g., Python, R, MATLAB, SAS); familiarity with MATLAB is a plus ', ""ISO New England reserves the right to review the candidate's postings on any social networking site accessible in the public domain as part of the candidate assessment process. "", ' Passionate and innovative thinker who is excited about the latest scientific programming and machine learning trends ', ' Present complex and technical content to a diverse audience through written reports and presentations ', '  Master’s degree in Mathematics, Engineering, Computer Science, Information Systems, Business Administration or other applicable discipline   3 – 5 years of project development experience in the design, development, testing, and implementation of software solutions   High proficiency in at least one advanced programming language (e.g., Python, R, MATLAB, SAS); familiarity with MATLAB is a plus   Passionate and innovative thinker who is excited about the latest scientific programming and machine learning trends   Proficiency with peer code review, coding standards and version control practices   A self-motivated, detail-oriented, analytical problem solver   Ability to work in a team and individually  ', ' We maintain a drug-free workplace and perform pre-employment substance abuse testing. ', ' Drug Free Environment ', ' Master’s degree in Mathematics, Engineering, Computer Science, Information Systems, Business Administration or other applicable discipline ', '  Work closely with the forecasting team and other departments to facilitate the streamlining and enhancement of existing forecasting applications   Lead the development of novel data pipelines, reusable software packages and visualization tools   Research advances in machine learning tools and practices and help ensure the forecasting group remains at the forefront of emerging information technology   Present complex and technical content to a diverse audience through written reports and presentations  ', 'How You Will Make An Impact', ' Work closely with the forecasting team and other departments to facilitate the streamlining and enhancement of existing forecasting applications ', ' We are proud to be an EEO/AA employer. Applicants for employment are considered without regard to race, creed, color, citizenship, religion, sex, sexual orientation, marital status, national origin, age, disability, status as a veteran, Vietnam Era Veteran, or being a member of the Reserves or National Guard. ', 'What We Are Looking For', ' Equal Opportunity ', ' A self-motivated, detail-oriented, analytical problem solver ', ' 3 – 5 years of project development experience in the design, development, testing, and implementation of software solutions ', ' Social Networking Notice ', ' Proficiency with peer code review, coding standards and version control practices ', ' Ability to work in a team and individually ', ' Research advances in machine learning tools and practices and help ensure the forecasting group remains at the forefront of emerging information technology ']",Entry level,Full-time,Engineering,Utilities,2021-02-10 11:29:29
Aure Data Engineer,"Next Level Business Services, Inc.","Shelton, CT",2 hours ago,Be among the first 25 applicants,"['', '• Evaluate and define functional requirements for BI and DW solutions', '• 2-3 years of experience working on JAVA or other object oriented programming (Preferred).', '• 2-3 years of experience working on Power BI, Azure Analysis Services and leading other Busines Analytics tools', '• Good understanding of data oriented projects for integration and analytics is must.', '• Extensive experience working on Big data technologies such has Hive, Pig and Map Reduce are preferred.', '• Identify avenues on cost savings either by using in-house Cognizant accelerators or by building re-usable frameworks across the projects.', '• 2-3 Experience on understanding the frameworks & the data pipelines. (Mandatory)', '• Provide Business Intelligence and Data Warehousing solutions and support by leveraging project standards and leading analytics platform.', '• Analyze the data quality, data governance, compliance and other legal requirements on data storage; address all the required non-business but operational requirements during the design and build of data pipelines.', '• Build conceptual and logical models based on the functional flow of business in a scalable mode.', 'Qualifications', '• 2-3 years of experience working on Python or R. (Mandatory)', 'Job Descriptions', '• Work directly with Business leadership and Application SMEs to understand the requirement and analyzing the source to fulfill the requirement.', '• Must have experience working with Onshore / Offshore model. (Mandatory)', '• 2-3 years of experience on requirement gathering, designing dashboards, analytical use cases, reports, personalization models etc., on Azure.', '• Experience work with structured and unstructured data are must.', '• Must have experience on reading the data streams between Event Hub and Azure Service Bus with other integration systems such as Azure Data Factory etc., (Mandatory)', '• Domain: Retail/Supply chain/Pharmacy (Preferred)', '• Interpret data by building the models, charts and tables on reporting platform towards business intelligence requirements.', '• Propose and develop data solutions to enable effective decision-making, driving business objects or addressing the enterprise integration requirements.', '• 2-3 years of experience working on Spark SQL, Hive SQL, USQL. (Mandatory).', '• Expert and Key point of contact between the data analyst, data scientists, and the business/application teams.']",Mid-Senior level,Full-time,Engineering,Telecommunications,2021-02-10 11:29:29
Senior Data Engineer,meshify,"Austin, Texas Metropolitan Area",16 hours ago,66 applicants,"['', 'Expert in SQL\xa0', 'The Senior Data Engineer will be responsible for the following: ', 'Data reporting ', 'BS Computer Science or equivalent experience ', ' ', 'Preferred experience with NoSQL (Cassandra) ', 'PostgreSQL database administration Data reporting Aurora / RDS / AWS infrastructure Data pipelines and ETLs Preferred experience with NoSQL (Cassandra) ', 'The Senior Data Engineer will be held accountable for overall coordination, status, reporting and stability of Meshify data efforts of various sizes and complexity to support the software groups. Works closely with developers, DBAs, and data analysts to drive business value through a deeper understanding of data and optimizations. Utilizes accepted database processes and methodologies to ensure minimal downtime, high availability, and timely reporting of data assets. Partners with technology groups to ensure ongoing operational support for business applications. Additional responsibilities include maintaining known SQL libraries, working with business units to determine and document data decisions, and reporting and analyzing data. ', 'Educaction: ', 'Experience: ', 'Data pipelines and ETLs ', 'PostgreSQL database administration ', '5-10 years experience with PostgreSQL or similar RDMS ', 'Aurora / RDS / AWS infrastructure ', '5-10 years experience with PostgreSQL or similar RDMS Expert in SQL\xa0']",Mid-Senior level,Full-time,Engineering,Computer Software,2021-02-10 11:29:29
Data Scientist,thredUP,"Remote, OR",3 hours ago,Be among the first 25 applicants,"['', 'Create mathematical representations of the flow of items into and out of our marketplace', 'Uncover insights in our vast repository of raw data, and provide tactical guidance on how to achieve an assortment that maximizes growth and value for all marketplace participants', ""What You'll Do"", 'About ThredUP', 'Implement algorithmic solutions to drive decisions around item acceptance, item pricing, and discounting and clearance strategies for 3.5M unique items in inventory and 1.5M new items every month', '3 years of full time, professional experience', 'Well-rounded skill set in statistics, machine learning, software development, and project management', 'Advanced knowledge of SQL and Python, and experience writing code in a collaborative environment', ' The opportunity to make a massive impact & influence outcomes for our business and customers alongside passionate coworkers', 'Requirements', ' Autonomy. The ability to make, own, and carry out decisions', 'Prior experience working with marketplaces and/or a relevant background in economics or operations research is a plus', 'Innate curiosity and drive to find insights that unlock new growth or efficiency - you can’t help but dig in and seek the truth', 'We believe diversity, inclusion and belonging is key for our team.', 'Drive the strategy for promotions, merchandising campaigns, and sales, and investigate their effect on inventory and buyer mix', 'Implement algorithmic solutions to drive decisions around item acceptance, item pricing, and discounting and clearance strategies for 3.5M unique items in inventory and 1.5M new items every monthUncover insights in our vast repository of raw data, and provide tactical guidance on how to achieve an assortment that maximizes growth and value for all marketplace participantsDevelop the algorithms and data strategy that power search and discovery, allowing buyers to seamlessly find items they love in our vast assortmentDevelop rigorous forecasting systems to bring predictability to our planning around inventory growth and economicsCreate mathematical representations of the flow of items into and out of our marketplaceDrive the strategy for promotions, merchandising campaigns, and sales, and investigate their effect on inventory and buyer mixParticipate in our knowledge-sharing culture by spreading best practices and learnings from prior experiences, helping the entire team level up', 'At least 3 years of full time, professional experience in data analytics, data science, or software engineering roles', 'What We Offer', ' Flexible PTO', ' Competitive salary, equity and full benefits (health/dental/vision insurance & 401k)', 'Develop rigorous forecasting systems to bring predictability to our planning around inventory growth and economics', 'Ability to effectively work with business leads; strong cross-functional communication skills that help push projects forward and encourage the development of new collaborations', 'At least 3 years of full time, professional experience in data analytics, data science, or software engineering rolesAbility to effectively work with business leads; strong cross-functional communication skills that help push projects forward and encourage the development of new collaborationsInnate curiosity and drive to find insights that unlock new growth or efficiency - you can’t help but dig in and seek the truthWell-rounded skill set in statistics, machine learning, software development, and project managementAdvanced knowledge of SQL and Python, and experience writing code in a collaborative environmentPrior experience working with marketplaces and/or a relevant background in economics or operations research is a plus', 'Participate in our knowledge-sharing culture by spreading best practices and learnings from prior experiences, helping the entire team level up', 'Develop the algorithms and data strategy that power search and discovery, allowing buyers to seamlessly find items they love in our vast assortment']",Entry level,Full-time,Engineering,Marketing and Advertising,2021-02-10 11:29:29
Sr Data Engineer (201707),Bull City Talent Group,"Memphis, TN",,N/A,"['Strong programming skills in R / Python or equivalent tools for exploratory and predictive analytics', 'The Senior Data Engineer will create and implement strategies directed at acquiring data from new and existing sources, build a modern data platform and promote the development of insights and data driven decisions using our Operational, Sales and Marketing data to improve Business Process efficiency and Product quality. Must have Oracle DW, Teradata, and/or Netezza experience and migrated to redshift or snowflake.', 'Ability to devise and deliver persuasive presentations, based on data-driven insights and facts, to gain support for business strategies and/or initiatives', 'Design and implement predictive & prescriptive data models', 'Applicants must be authorized to work in the United States on a full-time basis', 'Solution-oriented with an ability to identify and assess risk and prioritize competing demands', 'Identify, design, and implement internal process improvements: automating manual processes, optimizing data delivery, re-designing data infrastructure for greater scalability', ""Bachelor's degree from an accredited four-year college or university in related field4+ years working on Data Platforms2+ years on a Modern Data Platform. (AWS, Azure, Snowflake etc.)Experience in evaluating, designing, and implementing data platforms and data pipelines to scale and automate extraction of data from multiple internal and external sourcesExperience articulating business questions and using quantitative techniques and driving insights for businessSolution-oriented with an ability to identify and assess risk and prioritize competing demandsStrong storytelling skills to help decision-makers see the big picture and act on the results of analysisAbility to devise and deliver persuasive presentations, based on data-driven insights and facts, to gain support for business strategies and/or initiativesCurious, independent mindset and attitude – you explore new technological & methodical options independentlyKnowledge of professional software engineering practices and best practices for the full software development life cycle (Waterfall and Agile), including coding standards, code reviews, source control management, build processes, testing, and operationsStrong programming skills in R / Python or equivalent tools for exploratory and predictive analyticsProficiency in data transformations, handling missing data, feature engineering, regression, classification, and clustering analysisDeep technical understanding of machine learning (linear models, decision trees, boosting, random forest, k-means, ensemble models etc.)Experience in relational databases such as Oracle and proficiency with SQLExperience working with structured, semi structured (JSON, XML) & unstructured data types (text, files etc.)Familiarity with Git, NoSql databases, Spark, TensorFlowApplicants must be authorized to work in the United States on a full-time basis"", 'Troubleshoot data quality issues - identifying root cause/system & documentation/communication of resolution', 'Strong storytelling skills to help decision-makers see the big picture and act on the results of analysis', 'BCTG’s direct client is looking for a permanent Senior Data Engineer. This position can be in Memphis, TN, Chambersburg, PA, Bend Or, New York, NY, Marlborough, MA, Irvine, CA , or El Paso, TX. Client will sponsor for the right candidate.', 'Build strong relationships with the different departments, teams, and support functions to understand the business needs.', 'Translate business questions and concerns into specific quantitative questions that can be answered with available data using sound methodologies.', 'Develops and implements effective/strategic business solutions through research and analysis of data and business processes', ""Bachelor's degree from an accredited four-year college or university in related field"", 'Collaborate and knowledge share with internal stakeholders to ensure single source of truth for all data', 'Explore/Analyze Company’s Operational data and find correlation between different business process to improve and/or recommend changes to Business Processes', 'Experience in evaluating, designing, and implementing data platforms and data pipelines to scale and automate extraction of data from multiple internal and external sources', 'Deep technical understanding of machine learning (linear models, decision trees, boosting, random forest, k-means, ensemble models etc.)', 'Deliver value-add solutions at the speed of business', 'Familiarity with Git, NoSql databases, Spark, TensorFlow', ' Responsibilities ', 'requirements for consideration', 'Ensure the effective collection, organization and distribution of data, from a variety of data sources', 'Experience articulating business questions and using quantitative techniques and driving insights for business', 'Create and maintain excellent data documentation that allows the data to be understood (Metadata) and leveraged for additional use.', 'Knowledge of professional software engineering practices and best practices for the full software development life cycle (Waterfall and Agile), including coding standards, code reviews, source control management, build processes, testing, and operations', 'Retrieve, synthesize, and present critical data in a format that is immediately useful to answering specific questions.', 'Determines business information needs, identifies system requirements, KPIs, and methods for the data warehouse to assist with operational and strategic planning.', 'Gather business needs and translating into analytical problems', '2+ years on a Modern Data Platform. (AWS, Azure, Snowflake etc.)', 'Design and Develop Data platforms and pipelinesEvaluate gaps in existing data platform and aid the implementation of a modern data platformIdentify, design, and implement internal process improvements: automating manual processes, optimizing data delivery, re-designing data infrastructure for greater scalabilityEnsure the effective collection, organization and distribution of data, from a variety of data sourcesBuild processes supporting data transformation, data structures, metadata, dependency and workload managementGather business needs and translating into analytical problemsTranslate business questions and concerns into specific quantitative questions that can be answered with available data using sound methodologies.Create and maintain excellent data documentation that allows the data to be understood (Metadata) and leveraged for additional use.Retrieve, synthesize, and present critical data in a format that is immediately useful to answering specific questions.Design and implement predictive & prescriptive data modelsAnalyze data to find actionable insights and “tell the story” of our business as well as help deliver solutions to any business needs using machine learning, text-mining/NLP to extract insights from structured and unstructured data to assist in new product development, improving the quality of the products, improving customer service experienceExplore/Analyze Company’s Operational data and find correlation between different business process to improve and/or recommend changes to Business ProcessesDevelop programs to assist business in improving Marketing strategy, Product Pricing and customer retentionCreate and implement customer centric solutionsBuild strong relationships with the different departments, teams, and support functions to understand the business needs.Collaborate and knowledge share with internal stakeholders to ensure single source of truth for all dataConduct written and verbal presentations to share insights and recommendations to audiences of varying levels of technical sophisticationDetermines business information needs, identifies system requirements, KPIs, and methods for the data warehouse to assist with operational and strategic planning.Develops and implements effective/strategic business solutions through research and analysis of data and business processesTroubleshoot data quality issues - identifying root cause/system & documentation/communication of resolutionDeliver value-add solutions at the speed of business', 'Develop programs to assist business in improving Marketing strategy, Product Pricing and customer retention', '4+ years working on Data Platforms', 'Experience working with structured, semi structured (JSON, XML) & unstructured data types (text, files etc.)', 'Curious, independent mindset and attitude – you explore new technological & methodical options independently', 'Experience in relational databases such as Oracle and proficiency with SQL', '*This position is temporarily eligible for Work from Home until our offices reopen. Once offices reopen, this position is not eligible to be Work from Home, and you will be required to report to the office Monday-Friday.', 'Proficiency in data transformations, handling missing data, feature engineering, regression, classification, and clustering analysis', 'Design and Develop Data platforms and pipelines', 'Create and implement customer centric solutions', 'Build processes supporting data transformation, data structures, metadata, dependency and workload management', 'Analyze data to find actionable insights and “tell the story” of our business as well as help deliver solutions to any business needs using machine learning, text-mining/NLP to extract insights from structured and unstructured data to assist in new product development, improving the quality of the products, improving customer service experience', 'Conduct written and verbal presentations to share insights and recommendations to audiences of varying levels of technical sophistication', 'Evaluate gaps in existing data platform and aid the implementation of a modern data platform']",Mid-Senior level,Full-time,Information Technology,Information Technology and Services,2021-02-10 11:29:29
