job_title,company,company_rating,location,job_text,date
Manager of Financial Planning and Analysis 1115840,Pathways,3.1 out of 5,"Fredericksburg, VA 22408","['Bachelor’s Degree', '3-5 years of experience in Accounting, Finance, Revenue Cycle, or healthcare analytics', '3-5 years of experience in Lead/Supervisor/Manager role', 'Advanced knowledge of MS Excel, Macros, and VBA', 'Experience with Microsoft PowerPoint', 'Strong communication and presentation skills. Must be comfortable presenting findings and offering recommendations to senior management and executive leadership.', 'Advanced Degree (MBA or similar) preferred', 'Strong understanding of healthcare financial, operational, revenue cycle, and quality data.', 'Strong written and oral communication skills', 'Strong relationship building skills', 'Client focused with strong business acumen', 'Self-starter with the ability to work under pressure independently and as part of a team', 'Ability to think strategically and act proactively to create strong trust and confidence with business units', 'Strong innovative problem-solving capabilities', 'Experience with Accounting and BI software such as Sage Intaact, Solver, Tableau/Domo/Power BI', 'Advanced Excel and/or SQL skills preferred', 'Compile and analyze financial and clinical information to assist in operations and reconciliation, including but not limited to, analysis and reconciliation of enrollment, state & member funding, claims payments and other key data points', 'Prepare integrated financial projections, analysis and reports to be delivered to senior management on a timely and accurate basis, including trend identification', 'Prepare, with operations and financial senior leadership, standardized monthly, quarterly and annual cycles around budgeting, forecasting and reporting', 'Advise senior management of expected outcomes, and synthesize recommendations for improvement', 'Analyze, evaluate and interpret appropriate financial, clinical and statistical data', 'Develop and/or document business policies', 'Build and maintain revenue and expense models for company', 'Conduct presentation to all levels of management in order to provide a summary of analysis regarding financial results and trends', 'Communicate with management as to project status and completion deadlines', 'Provide reasoning for variances and make recommendations relative to the accounting of reserves, assets, and expenditures', 'Serve as a project lead for special finance related projects and coordinate activities to ensure the project is advancing properly and to ensure the project is completed within the timeframes established', 'Collaborate with other financial departments for process enhancement review & recommendations', 'Develop and analyze large, complex data sets and convert into actionable insights', 'Help manage and evolve month-end reporting processes', 'Supervise staff of financial/data analysts – demonstrating effective leadership and management skills', 'Support accounting team on audit requests, and reporting enhancement based on audit recommendations', 'Manage and continue to facilitate development of FP&A structure & process, supporting Director and CFO', 'Assist in the implementation of new financial and BI software systems', 'Assist Director in the management and improvement of annual budget process', 'Build, analyze, and provide regular and ad hoc reporting around financial analytics: revenue, cash receipts, productivity, staffing, forecasting, variance analysis, budget', 'Works with finance teams to enhance current reporting capabilities, drive continuous improvement in business analytics, continuously improve the accuracy of the data, and create standardized processes', 'Works as an intercompany liaison to enhance cross-departmental reporting and to advise on special projects in a finance/BI capacity', 'Other duties as assigned', 'Competitive Salary', 'Paid Vacation Days', 'Paid Sick Days', 'Holidays', 'Medical, Dental, Vision including a Health Savings Account', 'Health, Dependent and Transportation Flexible Spending Accounts', 'Basic and Optional Life Insurance for Employee, Spouse and/or Dependents', '401 K plan', 'Mileage & Cell Phone Reimbursement', 'Training, Development and Continuing Education Credits for licensure requirements', 'Opportunities for advancement! As we grow, you grow with us!']",2020-07-27 17:23:37
Workday People Technical Lead,TripAdvisor,4 out of 5,"Needham, MA","['Accountable for maintenance and enhancement of inbound and outbound integrations to HR systems & tools', 'Project management, design and delivery for assigned projects', 'Leverages mastery-level knowledge of Workday, and other systems as assigned, to lead in the configuration/development and deployment of new modules / functionality', 'Lead initiatives that integrate Workday with other systems and help define technical requirements with the HR users and vendors', 'Owns functional configuration and manages roadmap for assigned areas', 'Support and, or leads system upgrades/updates, including regression testing', 'Evaluate, communicate and coordinate the technical impacts of Workday configuration decisions', 'Educate users on the use and features of Workday', 'Track issues and risks, communicate status and escalate concerns to management', 'Assist and provide tier 2 support on HR production issues', 'Other duties as assigned', '12+ Years business experience, preferably in the HR domain', '5+ Years Workday experience, preferably as a Workday consultant certified in one or more of the following areasWorkday Studio/Advanced IntegrationsWorkday Core and Advanced CompensationWorkday Core HR (Masterly-Level)', 'Superior analytical skills including problem solving, attention to detail and clear communication of complex results', 'Excellent business analysis skills: timeline planning, requirements definition, documentation, test planning, and deployment approaches', 'Technical knowledge withEclipse / Workday StudioXML and XSLTJavaHadoopSOAPRESTWSDLData encryption (SFTP, SSH, PGP)HTML', 'Exceptional written and verbal communication capabilities', 'Ability to communicate effectively and influence at all levels within the organization', 'Superior detail orientation, organization, and analytical skills', 'Outstanding Excel skills and knowledge of MS Project or other Cloud based Project management tools (JIRA)', 'Ability to operate effectively in a dynamic, growing environment with minimal supervision', 'Leads in the delivery of HRIS strategies and goals that align with company objectives', 'Works hard, but can laugh and have fun in the process', 'A. / B.S. with Masters preferred', 'Experience with Business Intelligence software including Tableau or DOMO a plus', 'Experience with portal and website design/Architecture, including Joomla!', 'Experience with change management methods and programs a plus', 'Knowledge of or experience with Agile methodologies', 'Knowledge of or experience with Design Thinking methodology and/or journey mapping']",2020-07-27 17:23:37
"Training Manager (Lehi, UT)",SimplyInsured,N/A,"Lehi, UT","['Undergraduate degree in any relevant field (STEM, business, economics)', '5+ years of experience in training roles in technology companies', 'Skilled in innovative training techniques to drive comprehension and retention', 'Experience designing training curriculums for operations and support teams', 'Strong written, visual, and verbal communication skills', 'Skilled with word processing and presentation tools (e.g. PowerPoint, Google Slides, Prezi)', 'Familiarity with CRM and support ticketing tools is preferred', 'Problem-solving skills to navigate complicated issues', 'High attention to detail and orientation toward building repeatable processes', 'Prior experience health insurance or a regulated industry (e.g. finance, insurance, real estate) is a plus', 'Passion for helping people - especially when it comes to their health', 'Competitive compensation and generous stock option packages', 'Lunch and Dinner every day (along with snacks and drinks)', 'Offsite retreats every 6 months - we have the ability and drive to iterate quickly and this helps us all stay on the same page and develop new ideas', '100% Medical, Dental, and Vision Insurance coverage', 'A values-based culture that invests in employee success']",2020-07-27 17:23:37
Data Scientist,"Domo, Inc.",3.7 out of 5,"American Fork, UT 84003","['Work – Are you someone who has ideas and will stop at nothing until those ideas are made a reality?', 'Fight – Domo looks for individuals who can drive their own ideas forward and who can also support the initiatives within their team.', 'Innovate – Are you someone that can’t stand the status-quo? Do you improve upon the ideas of others?', 'Create – Like to build? Do you have a creative drive? Domo has a culture that embraces creativity.', 'Serve – We’re all about the customer. We expect you to be relentless in your defense of the customer experience. We’ll do the same.', 'Understand existing business flow and website features, dive into the underlying data, apply relevant Data Mining techniques and/or Machine Learning algorithms and propose data analytic product to improve the website intelligence', 'Implement the applicable Machine Learning or statistics-based algorithm for prediction and optimization and deliver the trained model to production', 'Create and implement algorithms in relevant statistical inference, graph, and network analysis, natural language processing with open source tools and libraries.', 'Design, build and support algorithms of data transformation, conversion, computation on Hadoop, Spark and other distributed Big Data Systems', 'Design and support efficient storage and retrieval of Big Data', 'Bachelor’s Degree. (Preferred Masters Degree or above in Data Science, Statistics, Computer Science, Math, or similar quantitative field) or equivalent work experience', '5+ years of professional experience with machine learning, statistical analysis, predictive modeling, and time series analysis.', 'Strong data discovery, visualization, and analysis skills.', 'Experience with big data using technologies like Spark, Hadoop, Pig, and Hive.', 'Previous hands-on exposure to statistical software packages like R, SciPy, Matlab, SPSS, SAS).', 'Experience with a variety of relevant data manipulation languages (Python, Java, SQL)', 'Comfort with working in a Linux environment.', 'A genuine desire to organize data and make it accessible with the technical skills to bring your ideas to reality', 'An enjoyment in working with teammates to produce quality outcomes.']",2020-07-27 17:23:37
Customer Planner,"Bentley Laboratories, LLC",4 out of 5,"Edison, NJ 08837","['The role: The position of Planner is responsible for planning, and managing all components (raw materials & packaging) to ensure on time order delivery. Proactively identifies and pursues opportunities to reduce cost and drive revenue. Develops strong relationships with customers and works closely with all internal departments.', 'The details:', 'Responsible for the day-to-day management and execution of the customer care and production planning function', 'Take ownership of the process from order receipt through shipment and proactively manage the details to ensure the production timeline is maintained', 'Data entry of purchase orders into 4th Shift and order acknowledgements are emailed back to the customer for confirmation', 'Utilize 4th Shift MRP reports (POAN/COAN/MOAN) in conjunction with access databases/reports to ensure all customer supplied components, fragrances, blends, and raw materials are requested and delivered on time to meet the established production schedule', 'Create no charge purchase orders into 4th shift for all components, fragrance oils and or raw material shortages from the customer', 'Serve as primary point of contact to the customer and organization regarding all production orders', 'Manage new projects from sales in Deacom as they become firm purchase orders to enter into 4th Shift including: tracking new and final components for both prelim/final fill assessments and prelim/final tool checks', 'Establish strong working relationship with each customer based on trust in execution', 'Proactively manage and deliver on special projects as assigned by management', 'Ensure all customer expectations are proactively managed and that issues and concerns are addressed timely', 'Proactively manage open orders based on customer deliverable timelines and adjust delivery dates as required', 'Release, issue, and manage production work orders ensuring inventory availability and accuracy', 'Efficiently and effectively communicate and interact with all levels of the organization', 'The must-have’s:', 'BA or BS degree, with 3-5 years in similar position (preferably in a contract manufacturing environment in the personal care, cosmetic, or medical industry)', 'Proficiency in Computer skills and Microsoft products', 'Superior verbal and written communication skills', 'Strong organizational, problem-solving, and analytical skills', 'Ability to manage priorities and workflow', 'Versatility, flexibility, and a willingness to work within constantly changing priorities with enthusiasm', 'Proficient on DOMO data analytics program']",2020-07-27 17:23:37
Business Intelligence Analyst,Harvest Group,3 out of 5,"Rogers, AR 72758","['Form clear actions and deliver appropriate solutions from unstructured user feedback', 'Troubleshoot issues with visualizations & data accuracy', 'Assist with development & launch of new BI solutions such as: Data pipeline creation/management, Visualization development, Dashboard design, Testing/QA', 'Educate client services teams on BI solution best practices', 'Engage with 3rd party BI technical/consulting support teams', 'Work to understand client services process & needs', 'Understand the context and use case of the solutions they are developing/maintaining', 'Bring platform expertise/knowledge and an informed technical viewpoint to the table when helping users develop new solutions', 'Willing and eager to help others solve problems', '1-3 years of BI platform development experience with Domo, Power BI, Tableau, or other data manipulation/transformation and data visualization & dashboard design', '1-3 years of retail analytics experience in brick & mortar sales support, dotcom, or replenishment', 'Familiarity with querying/building SQL databases', 'Retail syndicated data experience with either Nielsen or IRI', 'Strong written & verbal communication skills', 'Desire to improve the day-to-day work life of others in the organization through process improvement and technology']",2020-07-27 17:23:37
Database Developer,AIDS Healthcare Foundation,3.6 out of 5,"Los Angeles, CA 90018","['401(k)', 'Dental Insurance', 'Flexible Schedule', 'Health Insurance', 'Paid Time Off', 'Referral Program', 'Retirement Plan', 'Vision Insurance', 'Monday to Friday', 'Database Development: 3 years (Required)', 'JavaScript : 3 years (Required)', 'Relational Database Management Systems : 3 years (Required)', 'Saleforce.com : 2 years (Preferred)', 'HTML: 3 years (Required)', 'T-SQL : 3 years (Required)', 'No']",2020-07-27 17:23:37
Business Analytics Developer I,AccruePartners,3.8 out of 5,"Reston, VA","['Fortune 500 Company', 'World leader in commercial data and insight', 'Constantly expanding the size and improving the quality of their global database; currently exceeding 280 million businesses worldwide', 'Focus on valuable relationships allowing customers to succeed', 'Culture: Energetic, forward thinking individuals, passionate about compliance, risk assessment and management', 'Growth: Partake in a learning program with robust curriculum that will enhance the value you bring to your team and the company', 'Opportunity: Extensive international network with offices on five continents', 'Stability: A storied and commanding brand with almost two centuries of experience', 'Reston, VA', 'A Business analytics developer designs and implements analytics and reporting solutions with the aid of business intelligence tools including but not limited to Tableau, Spotfire, Micro strategy, Business Objects, Domo, Pentaho, SAP, Oracle and Qlikview', 'Should be able to work well independently and be able to complete moderately complex systems development projects including: gathering and defining user requirements, report design, programming, testing, implementation and follow up.', 'This job requires excellent analytical, technical and communication skills.', 'Programming knowledge is essential for some projects.', 'Expected to understand projects from both the business and technical perspectives.', 'Must possess good communication skills to be able to work with clients to understand their business problems and translate that knowledge into a technical solution.']",2020-07-27 17:23:37
Business Intelligence Program Manager (2020-9067),Fisher Investments,3.6 out of 5,"Camas, WA 98607","['Partner with RevOps Architecture and Tools to influence the design, alignment, and implementation of technical standards needed to support volumes of data across multiple systems', 'Answer key business questions using SQL, Excel, and other data manipulation languages', 'Guide discussions on operational analysis and gap reporting to identify defects, opportunities, and efficiencies across teams', 'Identify, develop and execute data analyses to monitor operational performance and customer trends to uncover areas of opportunity', 'Report key insight trends, using statistical rigor to simplify and inform the larger team of noteworthy story lines', 'Set expectations and SLAs on data availability and own communication around SLA performance', 'Bachelor’s degree or equivalent combination of education and experience required', '3+ years of experience in process execution, business intelligence, dashboarding, reporting, or data visualization and analysis', 'Familiarity with data structures that ease the generation of reliable data', 'Proficiency with data tools, e.g. Tableau, Domo, SQL, Power BI, ETL tools etc.', 'Ability to display complex quantitative data in a simple, intuitive format to present findings in a clear manner', '100% coverage of premiums for health, vision and dental insurance', 'A 50% 401(k) match, up to the IRS maximum', '20 days of PTO*, plus 9 paid holidays', '8 week paid Primary Caregiver Parental Leave', 'And much, much more', 'California employees accrue up to 17 days of PTO and 3 days of sick time per year.']",2020-07-27 17:23:37
Business Intelligence Developer,"Southern Auto Finance Company, LLC",N/A,"Fort Lauderdale, FL 33309","['Support, design, and develop dashboards and reports of medium complexity.', 'Support, design, and develop interfaces between source systems and third-party programs (both internal and external).', 'Support, design, and develop data mappings and ETL scripts.', 'Prepare low level technical documentation.', 'Work in teams using various development methodologies – agile (SCRUM), waterfall.', 'Support testing activities (functional and non-functional tests in all relevant project phases).', 'Investigate and fix defects and incidents during development and application lifecycle.', 'Ensure compliance with SAFCO policies and procedures.', 'Perform other duties as assigned.', '401(k)', 'Dental Insurance', 'Disability Insurance', 'Employee Assistance Program', 'Flexible Spending Account', 'Health Insurance', 'Life Insurance', 'Paid Time Off', 'Professional Development Assistance', 'Retirement Plan', 'Tuition Reimbursement', 'Vision Insurance', 'Monday to Friday', 'Linux and Windows: 2 years (Required)', 'MySQL or MSSQL: 1 year (Required)', 'BI tool (Looker, DOMO, YellowFin): 2 years (Required)', 'agile (SCRUM): 1 year (Required)', 'SQL: 3 years (Required)', 'Report writing (Crysal or SSRS): 2 years (Required)', ""Bachelor's (Required)"", 'United States (Required)', 'One location', 'www.gosafco.com', 'Waiting period may apply', 'No']",2020-07-27 17:23:37
Business Data Engineer,ConvergeMarketing,N/A,"Mount Kisco, NY 10549","['analytics: 5 years (Preferred)', 'data engineering: 5 years (Preferred)', 'SQL, SPSS, AWS, Java, Python/R: 5 years (Preferred)', 'One location', 'Health insurance', 'Dental insurance', 'Vision insurance', 'Retirement plan', 'Paid time off', 'Parental leave', 'Monday to Friday', 'Temporarily due to COVID-19']",2020-07-27 17:23:37
Financial Accountant,"Domo Engineering Plastics US, LLC",N/A,"Buford, GA 30518","['Monday to Friday', 'SAP Accounting Software: 3 years (Required)', 'Financial Accounting: 5 years (Required)', ""Bachelor's (Preferred)"", 'Are you willing to undergo a drug screening and background check in accordance with local laws and regulations?', 'No', 'One location', 'https://www.domochemicals.com', 'No']",2020-07-27 17:23:37
Data Scientist,Clicktripz,N/A,"Manhattan Beach, CA","['Collaborate with the Clicktripz product and engineering groups to deploy, monitor, and maintain production machine learning systems', 'Use machine learning capabilities to guide feature development and identify new business opportunities', 'Generating client-facing reports of product performance and impact to assist business groups in selling the benefits of the Clicktripz platform', 'Enable others in the organization to utilize your work by creating internal tools and dashboards', ""Bachelor's Degree in computer science, machine learning, statistics, econometrics or related field. Masters, Ph.D. or equivalent experience preferred"", '2+ years of experience in applied machine learning, predictive modeling, and statistical analysis', 'A solid foundation in modern machine learning algorithms', 'Experience using R, Matlab, Jupyter or other statistical software', 'Fluency in Python', 'Experience working with containerized applications and orchestrations systems e.g. Docker, Kubernetes', 'Excellent communication skills - while the Data Science group is currently located in Los Angeles, we are a global company with clients and employees all around the world', 'Familiarity with a BI Platform like Tableau or DOMO', 'Working experience as a software engineer, familiar with the software development lifecycle and pushing code to production', 'Experience with deploying or maintaining highly reliable web applications']",2020-07-27 17:24:15
BI Analyst,Blue Moon Digital,N/A,"Denver, CO 80202","['You enjoy working in a data driven, collaborative, and results-oriented environment', 'You have advanced domain knowledge in one or more vertical industries (Finance, Retail, Media & Entertainment)', 'You have the ability to demonstrate sustained exceptional performance, innovation, creativity, insight, and good judgment', 'You enjoy communicating with people', 'Lead discovery sessions with customers, end-users, technical architects, and application designers to define the data requirements and structure to answer key business questions and solve complex business problems', 'Write functional and technical specifications and communicate technical requirements', 'Discuss customer data maturity and strategy, and drive adoption of recommended solutions', 'Develop engaging and compelling data visualizations', 'Manage end to end relationships with BMDi customers, from scoping through to delivery', 'College degree in related field and/or equivalent experience and education', 'Minimum of 2 years BI Experience in a related field', 'Experience working with business users to gather requirements, writing functional and technical specifications and communicating technical requirements', 'Demonstrated excellence at presenting complex development topics to both executive and technical personnel', 'Working knowledge of specialized BI and data visualization tools like Domo, Tableau, PowerBI, Qlikview, Sisense, Datorama, etc…', 'Strong knowledge and application of data literacy', 'Experience with a wide variety of business data (Marketing, Sales, Finance, Operations, etc…)', 'Ability to work independently and manage multiple task assignments', 'Strong problem solving and troubleshooting skills with the ability to exercise mature judgment', 'Experience in recognizing business problems and recommending/developing solutions', 'Ability to effectively manage customer expectations and project deliverables', 'Great Company Culture: We focus on Achievement, Innovation, Courage, Integrity, Growth, and Teamwork. We are recognized by BuiltIn Colorado and the Denver Business Journal for our great workplace culture!', 'Health Benefits: Variety of medical options along with dental and vision benefits', 'Prepare for the Future: 401(k) with a company match', 'Growth: Growth is one of our company’s core values. We provide a variety of opportunities for growth!', 'Rest and Relaxation. Unlimited PTO, more than 10 paid holidays.', 'Work/Life Balance: Blue Moon Digital encourages you to volunteer and provides health and wellness support', 'Casual Workplace: Casual dress code, ping-pong table, open kitchen', 'Meaningful Work: All employees have a big impact at BMDi!', 'Blue Moon Digital is an employee-owned company']",2020-07-27 17:24:15
