job_title,company,company_rating,location,job_text,date
Software Automation Developer,CFGI,3.3 out of 5,United States,"['Independent: Must have the ability to succeed alone while developing automation solutions and prioritize and reorganize projects as required.', 'Collaborative: Persistent and personable in gathering needed requirements and feedback from stakeholders for automated solutions, scheduling meetings, and demonstrating progress or products.', 'Detail-Oriented: Exceptional process documentation, adheres to best practices in the Software Development Lifecycle (SDLC), and continuously improves on current and past projects.', 'Organized: Able to keep any scripts, workflows, and systems organized in a way that other developers can quickly and fluidly understand.', 'Leadership: Capable of running user acceptance testing, demonstrations, and go-live ceremonies for deployments.', 'Participate in the development of Process Maps and Process Definition Document (PDD), including “As-Is” and “To-Be” process flows', 'Explore systems and tools to assess feasibility and simpler ways to automate a process.', 'Review the PDD and Process Maps, making any design changes as necessary.', 'Design the automation solution, detailing the systems, platforms, and tools that will be used; create Solution Design Document (SDD)', 'Utilize automation platforms and tools to develop automated process in an AGILE methodology, following the PDD and SDD.', 'Work closely and coordinate with other developers and automation team members, utilizing source and version control platforms to merge and pull commits.', 'Create documentation of the solution to detail the requirements, dependencies, and process.', 'Incorporate feedback and changes from testers and stakeholders.', 'Test source code within a UAT environment, documenting inconsistencies and uncaught exceptions.', 'Understand the entire system that source code is being tested on, with the ability to describe that system to other developers and key client stakeholders.', 'Conduct performance testing and automate generation of data for testing', 'Identify the requirements to move source code from UAT to production.', 'Schedule meetings with stakeholders and process owners to implement the automation solution.', 'Implement the solution and provide troubleshooting solutions.', 'Provide necessary documentation and instructions to process owners to run the automation solution.', 'Provide Administration of automated solution when necessary.', 'Add new users, remove users, and manage permissions for platforms hosting an automated solution.', 'Receive and manage helpdesk tickets submitted for the automated solution.', 'Communicate updates and changes to the automated solution or systems as required.', 'Lead routine maintenance meetings.', 'Bachelor’s degree in Information Systems or Computer Science, or the equivalent combination of education, training, or work-related experience', '3+ years’ experience developing automation and business intelligence solutions using ETL and RPA tools', 'Advanced Proficiency Software Development LifeCycle (SDLC)', 'Advanced Proficiency in the .NET Framework, Visual Basic (VB), Java, or C# languages', 'Advanced Developer Proficiency in one or more of the RPA Platforms: UiPath, Automation Anywhere, Blue Prism', 'Intermediate Proficiency in Microsoft Office 365 (Word)', 'Intermediate Proficiency in database design and management', 'Intermediate Proficiency in data analytical skills', 'Knowledge of multiple RPA solutions a plus', 'Experience automating Oracle and SAP a plus', 'Experience with data analytics platforms such as Tableau, Domo, or Alteryx a plus', 'Experience with cloud platforms and service like Salesforce, Azure, Jira, and GitHub a plus']",2020-07-27 17:27:18
BI Architect w/ Azure,Nucleusteq,N/A,"Phoenix, AZ","['Intermediate knowledge of Dimensional Data Structures (Star and Snowflake)', 'Intermediate knowledge of ETL Frameworks and Metadata driven ETL', 'Knowledge on storing and consuming time-variant data.', 'Prefer ETL experience with a tool other than SSIS. Talend first, then Informatica and datastage.', 'Working and recent knowledge with multiple BI tools (Tableau, Domo, Power BI, Click, Sisense, SAS)Leadership skills.', 'Document as-is current state of ETL Processes, technology, frameworks and architecture', 'Collect feedback from developers and solution architects to inform for the creation of the To-Be of our processes, technology, frameworks and architecture', 'Gap Analysis between as-is and to-be', 'Work with existing teams to understand their current state and needs.', 'Well documented and confirmed as-is state of ETL for each team. Each team should be able to leverage this for onboarding new ETL Developers', 'Educate the teams on the to-be be state and develop a plan to address the gap for each team', 'Identify under-utilized capabilities in Talend or SSIS', 'Provide code-review comments and feedback to developers.']",2020-07-27 17:27:18
FP&A Analyst,"RICHEY MAY & CO., LLP",N/A,"Englewood, CO 80112","['Adheres to the highest degree of professional standards and strict client confidentiality.', 'Works with clients to understand their reporting needs and to ensure they have access to the data and reporting they need to run their businesses efficiently and profitably. Employs data analysis and modeling tools and is comfortable working with large datasets and using SQL best practices for query optimization.', 'Continually helps to uncover audience insights by mining large data sets.', 'Works with our professional services and client support teams to ensure clients’ experience from purchase to production, including managing the implementation process, are smooth and well managed.', 'Monitors clients’ ongoing technological health, adoption and use of the Richey May solutions, and establishes a cadence for client interactions that ensures each client is fully optimized and that they are comfortably using the solutions deployed within their organizations.', 'Helps clients create reporting that meets their needs and objectives, mindful to uncover what matters most and communicate that story with associated implications.', 'Ensures that all client projects are delivered on time and on budget.', 'Manages ongoing client needs effectively to drive high client retention and loyalty.', 'Develops and adheres to detailed project plans to monitor and track progress.', 'Helps clients create driver-based models to generate budgets for future periods and to predict future outcomes.', 'Drives adoption within client organizations and encourages their use of available knowledge base and online support tools.', 'Builds, automates, maintains and reports on client metrics.', 'Demonstrates advanced insights and understanding of clients’ businesses/industries.', 'Supports clients with strategic analytics for decision making.', 'Manages client data tables to ensure accuracy of data.', 'Assists in the development of presentation materials to be used by clients and a broad range of audiences.', 'Develops and delivers “success plans” to key clients identifying stakeholders, milestones, metrics, and risks.', 'Practices regular and predictable attendance.', 'Performs other duties as assigned.', 'Ability to follow all Richey May & Co policies, procedures, standards, specifications, guidelines, actively participates in and attends employee meetings and complete required training programs on a timely basis.', 'Ability to promote, work, and act in a manner consistent with the mission of Richey May & Co.', 'Ability to communicate and collaborate with team members to ensure superior results and team success.', 'Displays comfort interacting with and serving clients, uncovering their needs and goals related to budgeting and forecasting, and delivering solutions in a timely manner.', 'Intermediate to advanced skills with SQL and Excel.', 'Strong verbal and written communication skills.', 'Strong organizational and follow-up skills.', 'Demonstrated project management skills and experience, with an ability to manage proactive and reactive tasks effectively, for multiple clients concurrently.', 'Experience delivering and driving software implementation and adoption best practices.', 'Proven ability to collaborate and build strong relationships with senior-level executives across corporate functions within client organizations.', 'High technical aptitude to learn client use cases and architectural requirements for data analytics solutions.', 'A Bachelor’s degree in Accounting, Finance, Computer Science or Information Technology is required.', 'A minimum of one (1) year of client- or customer-facing experience in a Client Success, Sales, Account Management, Data Analytics, Customer Support, Project Management, or Customer Service role is required.', 'Experience with Domo, Tableau, Power BI, Motivity, Adaptive Insights, Anaplan, Riivos or similar solutions is preferred.', 'A solid understanding of application-programming interface (API) functionality is preferred.', 'An equivalent combination of education and experience may be substituted on a year to year basis.', 'Possession of, or ability to obtain, a valid Driver’s License is required within two weeks of employment.', 'Must have reliable transportation.', 'Candidates must pass a criminal background check', 'The employee must regularly lift and/or move up to 10 pounds, frequently lift and/or move up to 25 pounds.', 'Specific vision abilities required by this job include Close vision, Distance vision, Peripheral vision, Depth perception and ability to adjust focus.', 'While performing the duties of this Job, the employee is regularly required to sit and talk or hear. The employee is frequently required to stand; walk; use hands to finger, handle, or feel and reach with hands and arms. The employee is occasionally required to climb or balance; stoop, kneel, crouch, or crawl.', 'Associates or better in Computer Science or related field', 'Bachelors or better in Finance or related field']",2020-07-27 17:27:18
Technical Program Manager,"Amazon Web Services, Inc.",3.6 out of 5,"Seattle, WA","['5+ years of relevant work experience in internet-related technical program management in a software applications environment.', '5+ years of leading large cross-functional projects with large groups of technical and business stakeholders.', '5+ experience managing projects across cross functional teams, building sustainable processes and coordinating release schedules.', '3+ years of experience working with BI platforms such as Tableau/Domo etc.', '3+ years of experience data warehousing technologies such as MySQL', '5+ years of experience with agile or other program management methodologies', '3+ years of experience working as a Business Intelligence Engineer to ensure high technical proficiency', 'Experience solving challenging engineering problems with multiple constraints', 'Experience managing the lifecycle of a complex cross-functional program with considerable impact', 'Experience driving overall strategy and teams across organizations', 'Experience working independently to design, plan, and execute technical projects; able to distill data and articulate rationale for making difficult trade-offs', 'Excellent written and oral communication skills', 'Proven track record of taking ownership and delivering results', 'Ability to multitask and manage multiple projects - work prioritization, planning and task delegation', 'Ability and willingness to ‘get your hands dirty’ and get the work done', 'Ability to communicate concepts across technical and non-technical teams']",2020-07-27 17:27:18
Marketing Manager,Filtration Group Corp,N/A,"Buffalo, NY 14224","['Assure direct reports meet performance expectations and develop within the business', 'Instruct and collaborate with subordinate employees', 'Work in partnership with the creative team, develop creative briefs and guide creative direction to meet objectives for all advertising and public-facing communications, including print, digital, and video assets', 'Present ideas and final deliverables to internal and external teams, and communicate with senior leaders about marketing programs, strategies, and budgets', 'Manage a small group of talented marketers', 'Improve lead generation using digital inbound channels', 'Support the sales organization with collateral, presentations, and messaging', 'Manage daily tasks in Salesforce.com and build reporting dashboards for KPIs', 'Manage SEO and SEM', 'Bring new ideas to the leadership team on improving customer relations', 'Assist in the management of the company brand and values', 'Perform self-guided analysis of corporate sales and marketing functions', 'Create and distribute internal communications for employees', 'Identify effectiveness and impact of current marketing initiatives with tracking and analysis, and optimize accordingly', 'Collaborate with multiple functions and build relationships and credibility across functions and levels within the business units', 'Bachelor’s degree in Marketing, Business Administration, or equivalent', 'At least 7-10 years of progressive experience in marketing, ideally in a technical environment', 'Previous leadership experience is required', 'Salesforce and Salesforce Reporting/Dashboard Tools', 'Microsoft Office, particularly expert level Excel experience', 'Preferred experience with Domo/Tableau or other data aggregators', 'Wordpress CMS', 'Video recording and editing software', 'Strong business acumen', 'Strong networking, presentation, and communication skills', 'Exceptional organizational skills. Ability to prioritize initiatives and actions']",2020-07-27 17:27:18
Data Architect,Inspire11,N/A,"Atlanta, GA","[""Growth opportunity: We are always learning new technologies and educating our clients on what's available in the data space. You also will have the opportunity to engage in growing the team and there are ample opportunities to take ownership"", ""Work life balance: We are respectful of people's boundaries and have unlimited time off so that our team has time to recharge and do their best work"", 'Flexible hours: We understand that our team members have different needs and do our best to work with their schedules while accommodating client needs', 'Inclusive environment: We are committed to building an inclusive environment where all teammates feel comfortable and supported', 'Fun! We love to keep things fun, both within our client work and at company wide events', 'Demonstrate technical expertise in enterprise level cloud data architecture, data visualization and advance analytic solutions', 'Define conceptual, logical, and physical architectures for cloud-based data solutions', 'Design End-to-end cloud data solutions including Architecture, Infrastructure, Storage, Data Model, ETL/ELT, and Consumption', 'Lead the technical design and solutioning of migrating on-premise legacy data solutions to cloud-based data platforms', 'Define scope of technical implementation, translate requirements into design specs, and calculate/estimate TOC for proposed solution', 'Define best practices, pros and cons, and frameworks for capabilities across the data and analytics landscape', 'Define solution standards and best practices while providing hands-on oversight of technical delivery', 'Work with the client and consulting team to help gather requirements and understand different processes as it relates to different parts of the business and where there is overlap', 'Expected to be familiar with or expert in the following technologies:', 'Cloud Platforms: AWS, Azure or Google Cloud Platform', 'Database Platforms (DBaaS): Snowflake, RedShift, Azure SQL DW, Azure SQL DB', 'Traditional RDBMS: SQL Server, Oracle, MySQL, Postgres', 'ETL/ELT: SSIS, Azure Data Factory, Matillion, Alooma, Talend', 'Big Data: Azure HDInsight, Amazon Elastic Map Reduce (EMR), AWS Athena, Apache Spark, Hadoop, Hive', 'Data Visualization: Tableau, PowerBI, QlikView, Domo', 'Advance Analytics: DataRobot, Azure DataBricks, R Studio, Python', '8+ years of experience in Data Platforms, Data Warehousing and/or Business Intelligence', 'Have successfully led the technical strategy, design, development and implementation of Enterprise Data Solutions', 'Versed in either the Kimball and/or Inmon methodology, or have been exposed to Data Vault principles', 'Experience in Software Development Lifecycle (SDLC) utilizing the Agile approach', 'Experience guiding/mentoring developers with lesser experience', 'Organized, detailed oriented, and can manage multiple projects at the same time', 'Excellent communication skills', 'Comfortable working in fast paced environments, are able to wear many hats, and have a general fear of being bored']",2020-07-27 17:27:18
Content Strategy Specialist,Hunter Fan Company,4 out of 5,"Nashville, TN 37214","['Ecommerce Revenue', 'Ecommerce Site Traffic', 'Improving Conversion Rate', 'Lead our content efforts, managing our content marketing calendar and coordinating advanced delivery with marketing team members, ensuring on-time execution, proper audience segmentation, and regular analysis of results.', 'Understands and constantly evaluates the customer interaction with content to solidify brand relevancy and builds effective customer-first content', 'Establish efficient and collaborative working relationships with key internal partners (Creative, Brand, Sales, Product, and Channel) in order to align on content strategy at the monthly, weekly and daily level across all channels', 'Manages creative development process for ecommerce content and develops content strategy briefs that serve as the key document for cross-functional alignment', ""Develop a strong merchandising /product knowledge base for each season's assortment in order to translate those into the content planning process"", 'Update and maintain site content to ensure all SEO best practices are in place.', 'Assist in writing various content pieces, which includes but not limited to metadata descriptions, blog posts, Ad copy, and email blasts', 'Assist in writing various content pieces, which includes but not limited to metadata descriptions, blog posts, Ad copy, and email blasts', 'Monitor, analyze and report on performance through test strategies (A/B testing, multi-variant) by coordinating efforts across the marketing team', 'Manage email campaigns on the ESP platform to include; setup, testing, deployment, trouble-shooting, and reporting', 'Leverages analysis of campaign performance and makes use of customer data to inform future campaign requirements and improvements', 'Build and manage automations and drip campaigns inside the email platform', 'Consistently improve deliverability, in-boxing, email open, and click rates', 'Leverage demographic, behavioral and purchase information and develop targeted and segmented campaign', 'Bachelor’s degree in marketing, business, communications, journalism, advertising or a related field', '1 -3 years digital experience', 'Strong understanding of and experience with SEO, SEM and PPC campaign management and execution', 'Fluent in data/analytics strategies and execution (Google Analytics, A/B Testing, Google Tag Manager, Social Analytics etc.)', 'In-depth experience with website analytics tools (e.g, Google Analytics, NetInsight, Omniture, WebTrends, DOMO)', 'Knowledge of current digital media trends and best practices for effective online communications', 'Self-starter with strong organization skills; ability to manage requests and questions with positive attituded', 'Solid understanding of performance marketing, conversion, and online customer acquisition', 'Excellent writing and editing skills and a portfolio of work that demonstrates them.', 'HTML and Photoshop experience', 'Strong analytical skills and acute attention to details', 'Able to function effectively in a fast paced, multi-task team environment', 'Highly organized with proven project management skills', 'Experience working with multiple cross functional teams', 'Explicit attention to detail; creativity & resourcefulness', 'Once saved to your computer, you can open it with Adobe Reader to view and fill out the form electronically.', 'Once you have filled out the form completely, save the file and email the completed version to HR@hunterfan.com', 'Once saved to your computer, you can open it with Adobe Reader to view and fill out the form electronically.', 'Once you have filled out the form completely, save the file and email the completed version to HR@hunterfan.com']",2020-07-27 17:27:18
Financial Accountant,"Domo Engineering Plastics US, LLC",N/A,"Buford, GA 30518","['Monday to Friday', 'SAP Accounting Software: 3 years (Required)', 'Financial Accounting: 5 years (Required)', ""Bachelor's (Preferred)"", 'Are you willing to undergo a drug screening and background check in accordance with local laws and regulations?', 'No', 'One location', 'https://www.domochemicals.com', 'No']",2020-07-27 17:27:56
Database Developer,AIDS Healthcare Foundation,3.6 out of 5,"Los Angeles, CA 90018","['Job', 'Company', '401(k)', 'Dental Insurance', 'Flexible Schedule', 'Health Insurance', 'Paid Time Off', 'Referral Program', 'Retirement Plan', 'Vision Insurance', 'Monday to Friday', 'Database Development: 3 years (Required)', 'JavaScript : 3 years (Required)', 'Relational Database Management Systems : 3 years (Required)', 'Saleforce.com : 2 years (Preferred)', 'HTML: 3 years (Required)', 'T-SQL : 3 years (Required)', 'No']",2020-07-27 17:27:56
Business Intelligence Developer,"Southern Auto Finance Company, LLC",N/A,"Fort Lauderdale, FL 33309","['Support, design, and develop dashboards and reports of medium complexity.', 'Support, design, and develop interfaces between source systems and third-party programs (both internal and external).', 'Support, design, and develop data mappings and ETL scripts.', 'Prepare low level technical documentation.', 'Work in teams using various development methodologies – agile (SCRUM), waterfall.', 'Support testing activities (functional and non-functional tests in all relevant project phases).', 'Investigate and fix defects and incidents during development and application lifecycle.', 'Ensure compliance with SAFCO policies and procedures.', 'Perform other duties as assigned.', '401(k)', 'Dental Insurance', 'Disability Insurance', 'Employee Assistance Program', 'Flexible Spending Account', 'Health Insurance', 'Life Insurance', 'Paid Time Off', 'Professional Development Assistance', 'Retirement Plan', 'Tuition Reimbursement', 'Vision Insurance', 'Monday to Friday', 'Linux and Windows: 2 years (Required)', 'MySQL or MSSQL: 1 year (Required)', 'BI tool (Looker, DOMO, YellowFin): 2 years (Required)', 'agile (SCRUM): 1 year (Required)', 'SQL: 3 years (Required)', 'Report writing (Crysal or SSRS): 2 years (Required)', ""Bachelor's (Required)"", 'United States (Required)', 'One location', 'www.gosafco.com', 'Waiting period may apply', 'No']",2020-07-27 17:27:56
Omni Channel Campaign Manager,Conversant Media,3.7 out of 5,"Westminster, CO 80020","['strategically develop and execute multi-touch, innovative and results-focused omnichannel campaigns that are compelling, relevant and tailored to a specific audience/market', 'grow Eloqua and Salesforce.com knowledge and expertise. Such as University classes and Masters Certification', 'partner and influence cross-functional teams', 'communicate campaign results effective with fellow marketers and sales stakeholders', ""Bachelor's degree in Mktg, Business, Communications"", '5+ years of digital marketing experience in either B2B or B2C environments', 'Proficiency with marketing automation tools and processes – Eloqua, Marketo, Hubspot, or similar', 'Proficiency with Salesforce.com (SFDC)', 'Proficiency with Marketing Performance Reporting platforms, such as InsightSquared, Domo, Microstrategy or similar', 'Experience driving digital and offline strategies and campaigns that generate measurable demand', 'MarTech / AdTech industry experience beneficial']",2020-07-27 17:27:56
