job_title,company,company_rating,location,job_text,date
Business Intelligence Program Manager (2020-9067),Fisher Investments,3.6 out of 5,"Camas, WA 98607","['Partner with RevOps Architecture and Tools to influence the design, alignment, and implementation of technical standards needed to support volumes of data across multiple systems', 'Answer key business questions using SQL, Excel, and other data manipulation languages', 'Guide discussions on operational analysis and gap reporting to identify defects, opportunities, and efficiencies across teams', 'Identify, develop and execute data analyses to monitor operational performance and customer trends to uncover areas of opportunity', 'Report key insight trends, using statistical rigor to simplify and inform the larger team of noteworthy story lines', 'Set expectations and SLAs on data availability and own communication around SLA performance', 'Bachelor’s degree or equivalent combination of education and experience required', '3+ years of experience in process execution, business intelligence, dashboarding, reporting, or data visualization and analysis', 'Familiarity with data structures that ease the generation of reliable data', 'Proficiency with data tools, e.g. Tableau, Domo, SQL, Power BI, ETL tools etc.', 'Ability to display complex quantitative data in a simple, intuitive format to present findings in a clear manner', '100% coverage of premiums for health, vision and dental insurance', 'A 50% 401(k) match, up to the IRS maximum', '20 days of PTO*, plus 9 paid holidays', '8 week paid Primary Caregiver Parental Leave', 'And much, much more', 'California employees accrue up to 17 days of PTO and 3 days of sick time per year.']",2020-07-27 17:19:55
Database Developer,AIDS Healthcare Foundation,3.6 out of 5,"Los Angeles, CA 90018","['401(k)', 'Dental Insurance', 'Flexible Schedule', 'Health Insurance', 'Paid Time Off', 'Referral Program', 'Retirement Plan', 'Vision Insurance', 'Monday to Friday', 'Database Development: 3 years (Required)', 'JavaScript : 3 years (Required)', 'Relational Database Management Systems : 3 years (Required)', 'Saleforce.com : 2 years (Preferred)', 'HTML: 3 years (Required)', 'T-SQL : 3 years (Required)', 'No']",2020-07-27 17:19:55
Business Intelligence Developer,"Southern Auto Finance Company, LLC",N/A,"Fort Lauderdale, FL 33309","['Support, design, and develop dashboards and reports of medium complexity.', 'Support, design, and develop interfaces between source systems and third-party programs (both internal and external).', 'Support, design, and develop data mappings and ETL scripts.', 'Prepare low level technical documentation.', 'Work in teams using various development methodologies – agile (SCRUM), waterfall.', 'Support testing activities (functional and non-functional tests in all relevant project phases).', 'Investigate and fix defects and incidents during development and application lifecycle.', 'Ensure compliance with SAFCO policies and procedures.', 'Perform other duties as assigned.', '401(k)', 'Dental Insurance', 'Disability Insurance', 'Employee Assistance Program', 'Flexible Spending Account', 'Health Insurance', 'Life Insurance', 'Paid Time Off', 'Professional Development Assistance', 'Retirement Plan', 'Tuition Reimbursement', 'Vision Insurance', 'Monday to Friday', 'Linux and Windows: 2 years (Required)', 'MySQL or MSSQL: 1 year (Required)', 'BI tool (Looker, DOMO, YellowFin): 2 years (Required)', 'agile (SCRUM): 1 year (Required)', 'SQL: 3 years (Required)', 'Report writing (Crysal or SSRS): 2 years (Required)', ""Bachelor's (Required)"", 'United States (Required)', 'One location', 'www.gosafco.com', 'Waiting period may apply', 'No']",2020-07-27 17:19:55
Business Data Engineer,ConvergeMarketing,N/A,"Mount Kisco, NY 10549","['analytics: 5 years (Preferred)', 'data engineering: 5 years (Preferred)', 'SQL, SPSS, AWS, Java, Python/R: 5 years (Preferred)', 'One location', 'Health insurance', 'Dental insurance', 'Vision insurance', 'Retirement plan', 'Paid time off', 'Parental leave', 'Monday to Friday', 'Temporarily due to COVID-19']",2020-07-27 17:19:55
Financial Accountant,"Domo Engineering Plastics US, LLC",N/A,"Buford, GA 30518","['Monday to Friday', 'SAP Accounting Software: 3 years (Required)', 'Financial Accounting: 5 years (Required)', ""Bachelor's (Preferred)"", 'Are you willing to undergo a drug screening and background check in accordance with local laws and regulations?', 'No', 'One location', 'https://www.domochemicals.com', 'No']",2020-07-27 17:19:55
Business Analytics Developer I,AccruePartners,3.8 out of 5,"Reston, VA","['Fortune 500 Company', 'World leader in commercial data and insight', 'Constantly expanding the size and improving the quality of their global database; currently exceeding 280 million businesses worldwide', 'Focus on valuable relationships allowing customers to succeed', 'Culture: Energetic, forward thinking individuals, passionate about compliance, risk assessment and management', 'Growth: Partake in a learning program with robust curriculum that will enhance the value you bring to your team and the company', 'Opportunity: Extensive international network with offices on five continents', 'Stability: A storied and commanding brand with almost two centuries of experience', 'Reston, VA', 'A Business analytics developer designs and implements analytics and reporting solutions with the aid of business intelligence tools including but not limited to Tableau, Spotfire, Micro strategy, Business Objects, Domo, Pentaho, SAP, Oracle and Qlikview', 'Should be able to work well independently and be able to complete moderately complex systems development projects including: gathering and defining user requirements, report design, programming, testing, implementation and follow up.', 'This job requires excellent analytical, technical and communication skills.', 'Programming knowledge is essential for some projects.', 'Expected to understand projects from both the business and technical perspectives.', 'Must possess good communication skills to be able to work with clients to understand their business problems and translate that knowledge into a technical solution.']",2020-07-27 17:19:55
Marketing Data Analyst,Curriculum Associates,4.3 out of 5,"North Billerica, MA 01862","['Manage list segmentation for communications and demand generation programs, including nurture emails and Account-Based Marketing (ABM) initiatives.', 'Analyze, measure, and report on key performance indicators that tie to marketing and business objectives.', 'Help brainstorm and recommend actionable improvements to marketing campaigns based on data insights from web traffic data and content consumption patterns.', 'Manage contact tracking of our customer advocates across product development, marketing, and research – who they are and how they are engaging with us.', 'Work with stakeholders to ideate, create, and manage marketing and business line reports, analyses, and dashboards, using our BI tool', '3-5 years’ experience in marketing or related disciplines.', 'BS/BA required', 'A degree in Business, Mathematics/Data Analytics, Computer Science or Managing Information Systems preferred', 'Proficiency with presentation tools such as Microsoft PowerPoint', 'Intermediate skills working with spreadsheet tools such as Microsoft Excel', 'Familiar with SQL', 'Strong oral and written communication skills.', 'Familiarity with web analytics platforms such as Google Analytics', 'Experience with Search Engine Optimization best practices', 'Experience using CRM, marketing automation, and ABM platforms such as Salesforce, Eloqua, Pardot, RollWorks, etc.', 'Experience using DOMO (business intelligence visualization)']",2020-07-27 17:20:33
Supply Chain Analyst,Philz Coffee,4.2 out of 5,"Oakland, CA 94621","['Customer-first focus and a passion for Bettering People’s Days', '0-2 years relevant experience; Food or Retail industry experience is preferred', 'BA/BS preferably with an analytical focus (Business, Economics, Accounting, Supply Chain, etc)', 'Support timely and/or urgent data requests; ability to track and understand relevant metrics across Supply Chain and Retail functions, with a particular focus on food product assortment and sourcing, and coffee production analysis.', 'Experience with inventory modules and/or ERP Systems; Netsuite experience is preferred', 'Experience with analytics and data visualization platforms (DOMO, Tableau, Qlik, etc)', 'Strong quantitative skills. A Demonstrated data-driven approach to solving problems.', 'Knowledgeable to expert skills in Excel and PowerPoint']",2020-07-27 17:20:33
Content Insights & Delivery Analyst (CNN Digital),Turner,4 out of 5,"Atlanta, GA 30319","['Track the progress of sponsored digital campaigns, in terms of page views / video plays and other campaign KPI’s, and report these figures to key stakeholders and clients as needed.', 'Analyze campaigns to really understand what content is working and who is consuming it around the world, to ensure our content creators have the information they need, and campaigns are optimized for maximum engagement.', 'Compile and curate benchmarks of performance to help inform new sponsorship proposals.', 'Evaluate existing and develop new metrics, reports, and dashboards for internal audiences; apply both quantitative disciplines and creativity to translate data into actionable insights through data visualization', 'Perform analytic studies on published content, especially around featured content and sponsorships', 'Develop, manage and communicate findings via insights feedback loop', 'Identify new areas of opportunities in our content development/creation and growth areas with critical partnerships and sponsorships (in partnership with Sales Support, Editorial Leaders, Audience Development, Content Partnerships, etc.)', 'Review metrics and performance and apply those measurements to decisions for future content development', 'Evaluate critical areas for improvement, including revenue optimization, platform compliance, strategic alignment with channels and internal studies and branding', 'Provide a campaign wrap-up report, coordinating with Account Services and Ad Operations to gather all relevant data', '2-5 years of business of experience working in a data analysis, business operations, ad operations or related field (digital media experience preferred)', 'Advanced Excel reporting, analysis and data modeling skills', 'Business intelligence and analytics platform experience (e.g. Adobe Analytics, Looker, Tableau, Domo, Qlik, etc.)', 'Experience with ad systems and measurement vendors (e.g. Google Ad Manager, OperativeOne, FreeWheel, MOAT, Integral Ad Science, etc.)', 'A self-starter who is passionate about getting data, using data, making sense of data, and helping others benefit from making analytics driven decisions', 'Excellent strategic and analytical skills and the ability to think critically and deliver recommendations based on data and analysis', 'Effective communicator and collaborator', 'Strong data visualization skills', 'Excellent attention to detail, analytical capacity/problem solving and communication skills', 'Paid time off every year to volunteer', 'Access to well-being tools, resources, and freebies', '2018 Best Company for Working Mothers', '2018 Best Company for Dads', 'An in-house learning and development team to help shape and grow your career', 'Part of the WarnerMedia family of powerhouse brands']",2020-07-27 17:20:33
Reporting Solutions Manager,Electronic Arts,3.8 out of 5,"Los Angeles, CA",[],2020-07-27 17:20:33
"Manager, Programming Research",Univision communications inc,3.9 out of 5,"Miami, FL","['Compile, analyze and interpret Nielsen ratings data for recurring and ad hoc requests', 'Manage high-level and detailed analyses, reports and presentations covering Univision and competitors', 'Synthesize ratings data from multiple sources to build a richer, more complete perspective of the issue or opportunity, and related implications', 'Position data in a creative and concise manner to communicate and make insights real for internal clients', 'Present content-based learnings to the production teams and partner with them as their audience experts', 'Contribute to roundtable discussions with key stakeholders', 'Utilize critical thinking skills to analyze industry dynamics in order to formulate robust and timely strategic research projects', 'Contribute to the design and execution of primary research studies, such as focus groups and surveys, to garner viewer feedback for current and upcoming programs', ""Bachelor's degree and 3+ years of work experience in TV Research (Master’s degree is a plus)"", 'Strong analytical skills', 'Outstanding writing and presentation skills', 'Bilingual - Proficient in both English and Spanish (spoken and written)', 'Strong interpersonal skills', 'Highly organized and detail-oriented, with the ability to work well under pressure, handle multiple projects and meet tight deadlines', 'Demonstrated project management skills – understanding priorities and scheduling resource', 'Proficiency in analysis of Nielsen data and use of software such as NNTV and NPower', 'Well versed in Microsoft Office applications with significant experience working with Excel and PowerPoint; prior experience with any of the following tools is a plus: Tableau, R, SPSS, SAS, DOMO', 'Fluent in Spanish (read and write)', 'Is fascinated by digging into lots of data to uncover critical insights', 'Understands strategic needs with a consultative mindset, with the ability to design and deliver the right research approach', 'Can translate data into narratives and tailor presentations and recommendations to the audience function and level to meet their needs', 'Has the ability to tailor reporting and data analysis to clients’ needs and objectives, including requests of an ad-hoc nature', 'Is a skilled collaborator who can build successful relationships with cross-functional internal teams and clients', 'Is passionate about television, both happenings in the industry and TV shows themselves', 'Can identify opportunities for automation and create efficiencies in reporting so we can focus more time on developing insights and internal partnerships', 'Must be willing to work from office in Doral, FL', 'Employment/education will be verified', 'Applicants must be currently authorized to work in the United States on a full-time basis', 'Ability to stand, walk, bend, type, and sit for up to (8) hours', 'Must be capable of working long hours on computer-based equipment', 'This position supports a 24 hour 7 days a week news/weather environment, candidates must have flexibility to work days, nights, overnights and weekends as needed without advance notice']",2020-07-27 17:20:33
Vice President Analytics,Porter Novelli,3.3 out of 5,"Boston, MA 02110","['Serve as a strategic advisor to a diverse set of clients on cross-platform analytics and measurement needs', 'Manage global measurement programs, leading innovation and the development of new processes, as well as ongoing deliverables from multiple local partner agencies', 'Lead design, tracking, analysis and reporting for client marketing and PESO activities to answer key business questions. This includes:KPI, dashboard and scorecard developmentSocial and traditional media conversation analysisWebsite, campaign and multichannel reportingInfluencer and stakeholder identificationAd-hoc analytic requests', 'Analyze external and internal client data using database queries, spreadsheets, web analytics tools, data visualization tools and social media monitoring or digital tools', 'Provide an informed and objective perspective as a subject matter expert to business-critical requests for consumer, media and channel insights', 'Create reports, presentations and visualizations to advise and provide business strategy and insights to other marketing functions', 'Develop strong working relationships, positioning yourself as a trusted partner and go-to expert', 'Contribute to new business opportunities and RFPs', 'Create budgets, scopes of work, staffing models and workplans for client projects', 'Provide junior analysts with guidance on methodology and approach', 'Establish and manage relationships with external vendors and partners', 'Liaise and manage relationship with Omnicom analytics & intelligence lead to advance Porter Novelli’s resources and talent', '10+ years of prior job-related experience required', 'Experience managing cross-functional agency teams and large-scale global measurement and analytics programs across verticals is a must', 'First-had knowledge and in-depth experience with traditional media and social listening content analysis tools such as TalkWalker, Brandwatch, Crimson Hexagon, Khoros, Meltwater, Cision, Quid or similar', 'Experience with web analytics packages such as Google Analytics, Adobe Analytics or similar', 'Skilled user of tools such as Excel and data visualization software such as Tableau, Domo, Power BI or similar', 'Experience with programming language (SQL, R, Python) a plus', 'Detail oriented with strong problem-solving skills', 'Skilled project manager', 'Ability to work both independently and within a team', 'Ability to present complicated analytical material in a concise and compelling manner', 'Strong organizational and time management skills', 'Strong writing and presentation skills', 'Agency experience a plus']",2020-07-27 17:20:33
SOC Engineer,"Domo, Inc.",3.7 out of 5,"American Fork, UT 84003","['Evaluate the effectiveness of existing tools supporting Domo’s Security Operations Team.', 'Advise SOC and Information Security leadership of security risks or opportunities and make recommendations.', 'Monitor, support, evaluate existing security controls, and make recommendations to enhance security', 'Implement new information security tools, systems, scripting, and automation in support of SOC needs.', 'Interface with technical and business personnel on other teams as required', 'Document and conform to processes related to security monitoring', 'Participate in knowledge sharing with other analysts and develop solutions efficiently', 'BS degree, or industry equivalent', 'At least 5+ years in a hands-on security role, with a strong background in security tools', 'Strong experience with Security Information and Event Management (SIEM) tools such as ArcSight, QRadar, Splunk, Logrythm, etc.', 'Strong experience with Firewall, IDS/IPS, and Anti-Malware technologies', 'Experience in supporting incident response activities', 'Experience participating in or supporting SOC activities', 'Experience with vulnerability scanners like Nessus, Qualys, Nexpose, etc.', 'Familiarity with security testing and forensics tools such as KALI', 'Programming and/or scripting skills (e.g. python, java, perl, etc)', 'Knowledge of cloud and containerization']",2020-07-27 17:20:33
"Director, Retention Marketing - Equinox Media",EQUINOX,3.6 out of 5,"New York, NY","['An insights-driven marketer who makes decisions at the intersection of quant and qual', 'A thoughtful analyst who can spot patterns and identify opportunities in data, while also understanding its limitations', 'A logical thinker who can map out detailed customer journeys and retention plans', 'A cross-functional connector who can work across the org to drive results (including Data Science, Product, Analytics, Brand Marketing, Creative and Content)', 'A tech junkie who enjoys digging under the hood and working with a variety of data sets and marketing technologies', 'A natural communicator who can simplify complex ideas into plain English and present them confidently to senior leaders', 'Create an end-to-end customer lifecycle program from the ground up, using trigger-based messaging (email / push / in-app) to increase lifetime value / LTV and reduce churn', 'Develop one-time messaging strategies targeted at specific cohorts within the marketing funnel, focusing on new customers, infrequents & occasionals and inactives', 'Build cohort models and analyze their performance by fitness hardware, fitness modality, geography, marketing channel and other variables', 'Partner with Product to identify retention-driving behaviors in our app (e.g. taking certain number of classes in a time period) and Product Marketing to drive those behaviors', 'Own all engagement and retention analytics for the subscription-based business, using a custom reporting dashboard developed with the Analytics team', 'Collaborate with Data Science and Product team to build and implement personalized communications roadmap using rich behavioral data', 'Actively test and deploy various hypotheses, from simple email subject lines to new platform features developed with the Product team; evangelize and build a test + learn culture', 'Proactively identify customers who are not actively using their subscription, to better understand why and to test re-engagement strategies long before they can churn', '8+ years experience in a data-oriented marketing role in a fast-paced startup environment, ideally a B2C subscription-based content business', 'Ability to operate as both a strategist / leader and roll up your sleeves to execute', 'Excellent analytical and data manipulation skills, using BI platforms (Looker, Tableau, Domo), spreadsheets (Excel, Google Sheets, Airtable) or SQL', 'Strong expertise in modern multi-channel messaging platforms (Braze, Iterable) with a focus on email and push notifications', 'Knowledge of mobile app marketing using modern link tracking / link redirect / deep linking platforms (Branch, AppsFlyer, Adjust)', 'Ability to move quickly and drive collaborative teams to a solution, including finding alternatives to projects that require heavy involvement from Engineering', 'Excellent project management and organizational skills, with strong attention to detail', 'Advanced data modeling and technical skills a plus']",2020-07-27 17:20:33
Lead Data Engineer,Guru,N/A,"Gaithersburg, MD 20878",[],2020-07-27 17:20:33
Payment & Client Services - Technology - Last Mile Delivery,Point Pickup,N/A,"Greenwich, CT 06830","['Help create efficient processes to address common driver inquiries including referrals, tips, on-boarding, tech issues etc.', 'Cross functional technology focus. Leveraging these tools to create efficient processes to identify and resolve key operational issues.', 'Critical role to assist in scaling and implementing solutions.', 'Team building and training: assist in oversight and build out of payments team.', 'Maintaining high response and high level of satisfaction from our drivers and customers.', 'Sharp strategic mind. Excellent problem solving skills.', 'Quick learner. Ability to adapt to new environments.', 'Good collaboration skills. It is a team environment and requires strong communication skills.', 'Professional written and verbal abilities. There will be many interactions per day with our delivery partners and you will be representing the Point Pickup brand.', 'Overall ease with various tech platforms/tools including - Zendesk, Slack, Discord, DOMO etc.', 'Experience with process improvement and data analytics']",2020-07-27 17:20:33
Senior Business Intelligence Analyst - Equinox Media,EQUINOX,3.6 out of 5,"New York, NY","['Deliver insights and recommendations to help stakeholders better understand business performance, customer behavior and support strategic and tactical decisions to improve outcomes.', 'Deliver and automate daily, weekly, and monthly reporting; design and build visually engaging and informative dashboards.', 'Present analyses and findings to stakeholders; ‘telling the story’ and identifying drivers and opportunities of business performance.', 'Partner with cross-functional stakeholders to define key performance indicators, set targets, measure and monitor performance, and provide insights and analyses.', 'Conduct insightful, ad hoc analyses to investigate ongoing or one-time issues.', 'Actively participate in implementation and measurement of recommendations to monitor performance and impact.', 'Partner with the Data Engineering team to build data and analytics capabilities to support ongoing business needs.', 'Define and document measurement requirements for analytics projects, identifying project deliverables and milestones required to support stakeholders.', 'Work with stakeholders to define strategic and tactical roadmaps while supporting data and analytics needs.', 'Bachelor’s degree, preferably in business, analytics, math, statistics or related field.', '4+ years experience in a business intelligence or analytics role (Marketing Analytics Preferred) with a strong focus on delivering insights and recommendations, creating engaging data visualizations and building analytics capabilities to support business needs.', '2+ years experience working with SQL and other programming languages (R, Python) to analyze, explore, and mine large data sets to support reporting, dashboard building, and ad-hoc analysis.', 'Proven experience building compelling and engaging data visualization and presentation.', 'Proven experience creating and automating reports and dashboards and working with enterprise data visualization tools (Domo, Looker, Tableau).', 'Competency in Microsoft Excel or Google Sheets.', 'Exceptional verbal, written and communication skills.', 'Excellent planning, organizational, and time-management skills.', 'Collaborative and exceptional problem solving and critical thinking skills. Entrepreneurial and results-oriented. Strong work ethic. Does what it takes to get the job done and naturally goes the extra mile.']",2020-07-27 17:20:33
