job_title,company,company_rating,location,job_text,date
Business Data Engineer,ConvergeMarketing,N/A,"Mount Kisco, NY 10549","['analytics: 5 years (Preferred)', 'data engineering: 5 years (Preferred)', 'SQL, SPSS, AWS, Java, Python/R: 5 years (Preferred)', 'One location', 'Health insurance', 'Dental insurance', 'Vision insurance', 'Retirement plan', 'Paid time off', 'Parental leave', 'Monday to Friday', 'Temporarily due to COVID-19']",2020-07-27 17:16:17
Business Analytics Developer I,AccruePartners,3.8 out of 5,"Reston, VA","['Fortune 500 Company', 'World leader in commercial data and insight', 'Constantly expanding the size and improving the quality of their global database; currently exceeding 280 million businesses worldwide', 'Focus on valuable relationships allowing customers to succeed', 'Culture: Energetic, forward thinking individuals, passionate about compliance, risk assessment and management', 'Growth: Partake in a learning program with robust curriculum that will enhance the value you bring to your team and the company', 'Opportunity: Extensive international network with offices on five continents', 'Stability: A storied and commanding brand with almost two centuries of experience', 'Reston, VA', 'A Business analytics developer designs and implements analytics and reporting solutions with the aid of business intelligence tools including but not limited to Tableau, Spotfire, Micro strategy, Business Objects, Domo, Pentaho, SAP, Oracle and Qlikview', 'Should be able to work well independently and be able to complete moderately complex systems development projects including: gathering and defining user requirements, report design, programming, testing, implementation and follow up.', 'This job requires excellent analytical, technical and communication skills.', 'Programming knowledge is essential for some projects.', 'Expected to understand projects from both the business and technical perspectives.', 'Must possess good communication skills to be able to work with clients to understand their business problems and translate that knowledge into a technical solution.']",2020-07-27 17:16:17
Business Intelligence Program Manager (2020-9067),Fisher Investments,3.6 out of 5,"Camas, WA 98607","['Partner with RevOps Architecture and Tools to influence the design, alignment, and implementation of technical standards needed to support volumes of data across multiple systems', 'Answer key business questions using SQL, Excel, and other data manipulation languages', 'Guide discussions on operational analysis and gap reporting to identify defects, opportunities, and efficiencies across teams', 'Identify, develop and execute data analyses to monitor operational performance and customer trends to uncover areas of opportunity', 'Report key insight trends, using statistical rigor to simplify and inform the larger team of noteworthy story lines', 'Set expectations and SLAs on data availability and own communication around SLA performance', 'Bachelor’s degree or equivalent combination of education and experience required', '3+ years of experience in process execution, business intelligence, dashboarding, reporting, or data visualization and analysis', 'Familiarity with data structures that ease the generation of reliable data', 'Proficiency with data tools, e.g. Tableau, Domo, SQL, Power BI, ETL tools etc.', 'Ability to display complex quantitative data in a simple, intuitive format to present findings in a clear manner', '100% coverage of premiums for health, vision and dental insurance', 'A 50% 401(k) match, up to the IRS maximum', '20 days of PTO*, plus 9 paid holidays', '8 week paid Primary Caregiver Parental Leave', 'And much, much more', 'California employees accrue up to 17 days of PTO and 3 days of sick time per year.']",2020-07-27 17:16:17
Data Analyst,TotalMed Staffing,3.5 out of 5,"Minnetonka, MN","['401(k)', 'Dental Insurance', 'Health Insurance', 'Vision Insurance', '8 Hour Shift', 'Day shift', 'Monday to Friday', 'VBA (Visual Basic for Applications): 3 years (Required)', 'advanced Excel including Vlookups, pivot tables, macros: 3 years (Required)', 'No']",2020-07-27 17:16:17
Member Data Associate,NACD (National Association of Corporate Directors),N/A,"Arlington, VA 22201","['Processes all new member applications and membership renewals within two business days of receiptEnsures data integrity for member profiles (to include join dates, paid through dates, corporate experience, board roles, etc.)', 'Performs all necessary actions needed to activate membership for all online joins on same day basisEnsures join date is assigned and member portal/online login capability is enabledEnsures all INDs meet the minimum requirements needed for IND membership', 'Researches new and renewing members board history to expand upon logged corporate experience information; updates all current board and committee roles for all boards serving on, as well as any current executive roles', 'Uses Salesforce and Domo reporting to routinely comb through owned portfolio of accounts to ensure all membership data is accurate across the board', 'Merges all duplicate records that impact member data, to include both contacts and accounts', 'Maintains full understanding of and strict adherence to all data entry standards', 'Maintains archival system for all full board applications', 'Assists with data validation projects as required', 'Performs other duties as assigned']",2020-07-27 17:16:17
House/Estate Manager & Major Domo,Regal Domestics,N/A,"Rockville, MD 20852",[],2020-07-27 17:16:17
Customer Success Manager,The Media Trust,3 out of 5,"McLean, VA 22102","['Grow assigned accounts by ensuring The Media Trust is essential to their business', 'Partner with sales on account retention and growth', 'Act as the lead point of contact for all matters specific to assigned clients', 'Ensure timely and successful delivery of our solutions according to client needs and objectives', 'Develop a trusted advisor relationship with key client stakeholders', 'Communicate clearly the progress of monthly/quarterly initiatives to internal and external stakeholders', 'Use Salesforce to manage client outreach and account coverage', 'Use Domo and in-house reporting tools to track and analyze client performance trends', 'Assist with critical requests or issue escalations as needed', 'Be the liaison between customers and different parts of the company such as digital security, product, and operations.', 'Minimum 1-3 years’ total experience; minimum 1 year of experience in a client-facing role', 'Strong knowledge of the programmatic advertising ecosystem a must', 'Demonstrated ability to effectively communicate, present, and advise clients at different functional and/or hierarchical levels.', 'Self-starter with the proven ability to engage customers and find solutions to meet customer needs', 'Excellent organizational skills, with a proven track record of successfully managing projects and solving problems', 'Strong analytical skills, with the ability to identify business questions, analyze data, draw conclusions, and develop actionable recommendations', 'Demonstrated success in creatively addressing client problems and proactively finding solutions to problems before clients are aware', 'A proven track record of forward and innovative thinking for driving business results', 'Knowledge and experience with Salesforce, Microsoft Office required', 'Bachelor’s degree required', 'Experience with Google Ad Manager and Domo preferred', '401(k)', '401(k) Matching', 'Dental Insurance', 'Disability Insurance', 'Employee Assistance Program', 'Flexible Spending Account', 'Health Insurance', 'Life Insurance', 'Paid Time Off', 'Referral Program', 'Vision Insurance', 'Monday to Friday', 'Bonus Pay', 'United States (Required)', 'Innovative -- innovative and risk-taking', 'Outcome-oriented -- results-focused with strong performance culture', 'Team-oriented -- cooperative and collaborative', 'https://www.themediatrust.com/', 'Only full-time employees eligible', 'Temporarily due to COVID-19']",2020-07-27 17:16:17
Entry Level - Mortgage Industry Professional,McLean Mortgage Corporation,2.8 out of 5,"Fairfax, VA","['Perform assigned tasks to support the loan flow/process.', 'Order, review, and process the necessary information to complete a mortgage loan file.', 'Establish appointments with clients and manage the home closing calendar.', 'Learn and identify mortgage trends and regulations.', 'Work directly with our loan origination system (Encompass).', 'Providing excellent customer service skills with clients and applicants to ensure client retention.', 'Learn and work with industry-related software such as Blend, Optimal Blue, and DOMO.', 'Works closely with the settlement agencies, investors in ensuring the mortgage loan documents.', 'Collaborate on various accounting, technology, and insuring assignments.', 'Complete special departmental projects, as necessary.', 'Proficient computer skills.', 'Proficient with Microsoft Office Suite.', 'Excellent verbal and written communication skills.', 'Excellent time management skills.', 'Trustworthiness and the ability to act with integrity.', 'Exceptional organizational skills and attention to detail.', 'Ability to work as a team as well as independently.', 'Detail-oriented, with the ability to produce high-quality work in a deadline-oriented environment and an ability to multi-task.', 'High school diploma required, Associates degree or higher preferred.', 'Previous customer experience preferred.', 'One year of experience in a related field preferred']",2020-07-27 17:16:17
Customer Success Manager,TMT Digital,N/A,"McLean, VA 22102","['Grow assigned accounts by ensuring The Media Trust is essential to their business', 'Partner with sales on account retention and growth', 'Act as the lead point of contact for all matters specific to assigned clients', 'Ensure timely and successful delivery of our solutions according to client needs and objectives', 'Develop a trusted advisor relationship with key client stakeholders', 'Communicate clearly the progress of monthly/quarterly initiatives to internal and external stakeholders', 'Use Salesforce to manage client outreach and account coverage', 'Use Domo and in-house reporting tools to track and analyze client performance trends', 'Assist with critical requests or issue escalations as needed', 'Be the liaison between customers and different parts of the company such as digital security, product, and operations.', 'Minimum 1-3 years’ total experience; minimum 1 year of experience in a client-facing role', 'Strong knowledge of the programmatic advertising ecosystem a must', 'Demonstrated ability to effectively communicate, present, and advise clients at different functional and/or hierarchical levels.', 'Self-starter with the proven ability to engage customers and find solutions to meet customer needs', 'Excellent organizational skills, with a proven track record of successfully managing projects and solving problems', 'Strong analytical skills, with the ability to identify business questions, analyze data, draw conclusions, and develop actionable recommendations', 'Demonstrated success in creatively addressing client problems and proactively finding solutions to problems before clients are aware', 'A proven track record of forward and innovative thinking for driving business results', 'Knowledge and experience with Salesforce, Microsoft Office required', 'Bachelors Degree in related field']",2020-07-27 17:16:17
Call Center Analyst,Frontpoint Security Solutions LLC,N/A,"Vienna, VA 22182","['Detecting trends in large sets of call center data to improve call center performance', 'Building tools to help data consumers self-service', 'Applying statistical analysis to data for forecasting and anomaly detection', 'Prioritizing various time-sensitive projects on a regular basis', 'Communicating data with actionable insights to executive leaders', 'Bachelor’s Degree in Business Analytics or a related field', '4-6 years of experience working intimately with call center operational data', 'A strong sense of urgency and a desire to deliver great results while hitting deadlines', 'Fluent with MS Office: High proficiency with Excel is required as we work with large data sets', 'Proficiency in Microsoft Power Point is required as well since you will be putting together presentations based of your analysis', 'Proficiency with business intelligence tools (i.e. DOMO)', 'Proficiency utilizing SQL to maintain large data sets']",2020-07-27 17:16:17
Data Management Associate,NACD (National Association of Corporate Directors),N/A,"Arlington, VA 22201","['Understands the organization’s data goals and partners with Manager, Data Integrity on setting project roadmaps.For various projects and initiatives, outlines roadmaps and ensures team meets the associated targets throughout the year', 'Works with regular Salesforce Users across the organization to help (1) monitor their data needs and (2) develop, implement, and refine data management best practices for smooth and effective business operations.Develop and maintain FAQs, process guides, and other collateral as necessary to keep staff informed of policies and procedures relevant to day-to-day office operations.', 'Collaborates with Data Analytics Team to identify and remedy any roadblocks to smooth back-end data updating.', 'Actively seeks out new technology and innovative data solutions to improve team efficiency, data quality, and data comprehensiveness.Takes initiative to work with relevant stakeholders on implementing new technologies and solutions', 'Monitors BoardEx Integration error logs and associated datasets and assigns issues to team members as appropriate.', 'Collects, transforms, and uploads large sets of data using a variety of software, including DemandTools, Domo, WinPure and Data Loader.', 'Maintains a healthy bucket of Salesforce account records, to include updated contact and account information, additional board information, executive experiences, account industry, revenue, market cap, stock exchange, etc.', 'Follows processes laid out by Manager, Data Integrity to ensure reconciliation of data cleansing and inputs.', 'Using matching software, searches for and merges duplicate records on a weekly or daily basis.', 'Assists Manager, Data Integrity in leading implementation of various data acquisition resources.', 'Assists in checking for and merging duplicate records on a daily basis.', 'Assists with and leads various projects as needed and assigned.', 'Performs other duties as assigned.']",2020-07-27 17:16:17
Business Intelligence Intern (Fall 2020),Pittsburgh Penguins,4.3 out of 5,"Pittsburgh, PA","['Work in a collaborative and project-based environment supporting Business Intelligence initiatives', 'Use technical and statistical methods to develop key insights and processes to support decision making across different business units including ticket sales, CRM, sponsorship, digital and marketing', 'Utilize Tableau for analysis and to create dashboards', 'Analyze fan related data as it relates to demographics, psychographics, behavior and historical trends', 'Develop and apply statistical models to business processes', 'Create automated custom reports as needed', 'Assist in data acquisition and data cleansingCandidates should possess the following qualifications:', 'Pursuing a degree in an analytical, mathematical, technical or business related field', 'Required: Must have completed sophomore year in an undergraduate program', 'Required Technical Skills: Programming experience (SQL, R, Python)', 'Preferred Technical Skills: Familiarity with business intelligence platforms (e.g. Tableau, Looker, Domo)']",2020-07-27 17:16:17
Social Listening & Digital Intelligence Analyst,Purple Strategies,N/A,"Alexandria, VA 22314","['Integrate social media, earned media and opinion data and other information into a comprehensive insights framework', 'Gather social insights and develop reporting for a portfolio of client engagements, business development and firm marketing', 'Work as part of our integrated client teams to deliver integrated insights that help achieve key client goals', '4-10 years of experience within the fields of digital analytics and social media listening', 'Experience with social media listening platforms, such as NetBase, Sprinklr, Brandwatch or Crimson Hexagon', 'Proficiency with network analysis and influencer identification systems, such as Traackr, Little Bird, and Pathar', 'Knowledge of best practices in sentiment analysis', 'Proficiency with statistical software such as R or SPSS, as well as business intelligence and visualization tools like Domo or Tableau are a plus', 'Understanding of the social data ecosystem, including an understanding of how analytics platforms utilize and contract with social APIs', 'Strong organizational, communication and time management skills', 'Ability to prioritize own work effectively']",2020-07-27 17:16:17
"VP, Business Intelligence",Shutterstock,3.2 out of 5,"New York, NY","['Contribute to meaningful revenue growth and margin improvement by generating business-focused, actionable insights by synthesizing data and obtaining organizational buy-in through effective communication', 'Responsible for being an executive business leader for key business intelligence and executive-level reporting of business health', 'Act as the primary data liaison between Marketing, Product, Finance, and other departments - drive cross-functional alignment and interface directly with leadership to elevate transparency across the organizations and to define and build data-informed business strategy and roadmaps', 'Lead the Business Intelligence team and collaborate with the Data Science and Analytics team on evolving the data infrastructure, implementing reporting solutions, and running data projects', 'Partner with business operations leads to identify areas of improvement, bottlenecks, possible solutions, and determine business requirements', 'Solve complex business problems; communicate complex solutions through storytelling', 'Work very closely with the Data Science and Analytics team to develop data governance, aligning the business on metrics definition and maintaining the quality frameworks', 'Prioritize a pipeline of data requirements (e.g. support requests, ad-hoc analysis, and data projects), perform prioritization, establish timelines, and execute the projects', 'Champion efforts across the company to collect, manage, and use internal and external data to drive better decision making', 'Minimum 8+ years of experience managing teams and successfully delivering analytic solutions, ideally in an eCommerce environment and/or a global technology company', 'Strong analytical background with business acumen, and heavy experience in business and analytical consulting', 'Possess a commanding knowledge of business intelligence for both B2B and B2C business models', 'Strong statistical knowledge, ability to manipulate data and draw insights from large data sets, and proficiency in SQL and data visualization tools such as Looker, Tableau, DOMO, etc., a must', 'Robust understanding of online measurement and analytics, with the ability to provide meaningful and actionable insights and analysis. Digital attribution experience strongly preferred', 'Expert level communication skills with a track record in relating technical issues to both technical and non-technical audiences', 'Extensive experience attracting, managing, coaching, and retaining high-performing team', 'Bachelors degree in computer science, MIS, mathematics, finance, statistics, or 10 years Business Intelligence experience required']",2020-07-27 17:16:17
Database Developer,AIDS Healthcare Foundation,3.6 out of 5,"Los Angeles, CA 90018","['401(k)', 'Dental Insurance', 'Flexible Schedule', 'Health Insurance', 'Paid Time Off', 'Referral Program', 'Retirement Plan', 'Vision Insurance', 'Monday to Friday', 'Database Development: 3 years (Required)', 'JavaScript : 3 years (Required)', 'Relational Database Management Systems : 3 years (Required)', 'Saleforce.com : 2 years (Preferred)', 'HTML: 3 years (Required)', 'T-SQL : 3 years (Required)', 'No']",2020-07-27 17:16:17
Financial Accountant,"Domo Engineering Plastics US, LLC",N/A,"Buford, GA 30518","['Monday to Friday', 'SAP Accounting Software: 3 years (Required)', 'Financial Accounting: 5 years (Required)', ""Bachelor's (Preferred)"", 'Are you willing to undergo a drug screening and background check in accordance with local laws and regulations?', 'No', 'One location', 'https://www.domochemicals.com', 'No']",2020-07-27 17:16:53
Business Analytics Developer I,AccruePartners,3.8 out of 5,"Reston, VA","['Fortune 500 Company', 'World leader in commercial data and insight', 'Constantly expanding the size and improving the quality of their global database; currently exceeding 280 million businesses worldwide', 'Focus on valuable relationships allowing customers to succeed', 'Culture: Energetic, forward thinking individuals, passionate about compliance, risk assessment and management', 'Growth: Partake in a learning program with robust curriculum that will enhance the value you bring to your team and the company', 'Opportunity: Extensive international network with offices on five continents', 'Stability: A storied and commanding brand with almost two centuries of experience', 'Reston, VA', 'A Business analytics developer designs and implements analytics and reporting solutions with the aid of business intelligence tools including but not limited to Tableau, Spotfire, Micro strategy, Business Objects, Domo, Pentaho, SAP, Oracle and Qlikview', 'Should be able to work well independently and be able to complete moderately complex systems development projects including: gathering and defining user requirements, report design, programming, testing, implementation and follow up.', 'This job requires excellent analytical, technical and communication skills.', 'Programming knowledge is essential for some projects.', 'Expected to understand projects from both the business and technical perspectives.', 'Must possess good communication skills to be able to work with clients to understand their business problems and translate that knowledge into a technical solution.']",2020-07-27 17:16:53
BI Analyst/Developer Domo & PowerBi,Ace-stack LLC,N/A,"Carlsbad, CA",[],2020-07-27 17:16:53
BI Analyst/BI developer,Digital dhara,N/A,Remote,"['Partnering with the user community to create new business intelligence, reporting and data analysis solutions.', 'Maintaining existing software systems related to business intelligence, reporting and data analysis.', 'Identify improvements to existing business intelligence, reporting and data analysis.', 'Capture, develop, and document data definitions, business rules, and data quality requirements.', 'Build and maintain ETL (Extract, Transform, Load) and integration processes.', 'Validate data delivered to user community.', 'Ensure compliance with Company data and software policies and procedures.', 'Monitor software systems to ensure reliability and accuracy of information loaded into the databases.', 'Maintain all documentation related to database objects, source systems, and operations.', 'Conduct complex, important work under minimal supervision and with wide latitude for independent judgment.', '6+ years of experience working in software engineering', 'Experience with Microsoft SQL Server', 'Experience with Domo', 'Experience with PowerBI', 'Experience with Microsoft SQL Server Reporting Service (SSRS)', 'Ability to work on multiple project concurrently', 'Ability to manage time effectively', 'Strong written and verbal communication skills', 'Ability to work effectively in a fast paced, collaborative environment', ""Bachelor's Degree in Computer Science, Software Engineering, or related field"", 'Previous leadership experience preferred', 'Knowledge of document databases including Raven', 'Previous experience with Microsoft Dynamics AX', 'Previous experience with Salesforce', 'Software development in a continuous integration and continuous deployment environment.', 'power bi : 3 years (Required)', 'DOMO : 4 years (Required)', ""Bachelor's (Required)""]",2020-07-27 17:16:53
Customer Service Representative (Lehi),SimplyInsured,N/A,"Lehi, UT","['REQUIRED - Undergraduate degree in any relevant field (healthcare, business, psychology)', '1-4 years of experience in customer support or sales role', 'Positive and optimistic personality - you help others see the positive in any situation', 'Passion for helping people - especially when it comes to their health', 'Problem solving skills to navigate complicated issues', 'Work hard - play hard, strong desire to help businesses maximize their health care', 'Starting hourly rate of $17/hr + performance bonus, with a clear career progression ladder based on metrics & licensing', '100% Medical, Dental, and Vision Insurance monthly premium coverage', 'Generous stock option packages', 'Offsite retreats every 6 months - we have the ability and drive to iterate quickly and this helps us all stay on the same page and develop new ideas', 'A values-based culture that invests in employee success']",2020-07-27 17:16:53
