job_title,company,company_rating,location,job_text,date
Google Adwords & SEO Specialist,Telquest International,4 out of 5,"Wayne, NJ 07470","['Manage Ecommerce Team', 'Thorough knowledge of search engine ranking factors and current SEO best practices.', 'Experience with SEO tools like Google Keyword Planner, Search Console, Moz, Ahrefs, SEMrush, Screaming Frog, etc.', 'Create and maintain Ad Word Ads, Ability to recognize negative keywords and utilize them with campaigns- Test and implement different ads by creating unique headlines, optimize tag manager, and ad copy', 'Maximize search presence and rankings across all customers and AZ site.', 'Proficiency analyzing websites using BI Tools- Google Analytics, SAS, SPSS, Sisense, Tableau a plus.', 'Own the e-commerce network, including management of assortment, content strategy, analytics, reporting and marketing', 'Monitor and provide recommendations for optimizing Ecommerce Fundamental Goals (KPI-Share of Search, Availability, Content, Ratings & Reviews etc.), collaborate on forecasts, and work across multiple enterprise platforms to drive seamless execution and deliver results.', 'Own new item launches and corresponding marketing/merchandising initiatives, ensuring methodical plan & clear execution', 'Own Consumer Reviews tools, and coordination with Reputation Management', 'Oversee assortment pricing and monitoring, and coordinate with inventory management as needed', 'Ensure optimization of all internal initiatives on direct-to-consumer branded sites', 'Partner cross-functionally with digital marketing, copy, creative, brand marketing, inventory management, forecasting, sales, reputation management, and other teams to provide visibility, transparency and efficiency with project work', ""Bachelor's or master's degree required"", '5+ years of experience of web development or digital management', 'Previous supervisory experience required leading eCommerce design, strategy, and managing a budget', ""Strong Excel skills with experience using advanced formulas, pivot tables, and VLOOKUP's."", 'Experience with HTML and WordPress web development. (Shopify, Wix, & Squarespace)', 'Manage E-commerce Team', 'Thorough knowledge of search engine ranking factors and current SEO best practices.', 'Experience with SEO tools like Google Keyword Planner, Search Console, Moz, Ahrefs, SEMrush, Screaming Frog, etc.', 'Create and maintain Ad Word Ads, Ability to recognize negative keywords and utilize them with campaigns- Test and implement different ads by creating unique headlines, optimize tag manager, and ad copy', 'Maximize search presence and rankings across all customers and AZ site.', 'Proficiency analyzing websites using BI Tools- Google Analytics, SAS, SPSS, Sisense, Tableau a plus.', 'Own the e-commerce network, including management of assortment, content strategy, analytics, reporting and marketing', 'Monitor and provide recommendations for optimizing Ecommerce Fundamental Goals (KPI-Share of Search, Availability, Content, Ratings & Reviews etc.), collaborate on forecasts, and work across multiple enterprise platforms to drive seamless execution and deliver results.', 'Own new item launches and corresponding marketing/merchandising initiatives, ensuring methodical plan & clear execution', 'Own Consumer Reviews tools, and coordination with Reputation Management', 'Oversee assortment pricing and monitoring, and coordinate with inventory management as needed', 'Ensure optimization of all internal initiatives on direct-to-consumer branded sites', 'Partner cross-functionally with digital marketing, copy, creative, brand marketing, inventory management, forecasting, sales, reputation management, and other teams to provide visibility, transparency and efficiency with project work', ""Bachelor's or master's degree required"", '5+ years of experience of web development or digital management', 'Previous supervisory experience required leading eCommerce design, strategy, and managing a budget', ""Strong Excel skills with experience using advanced formulas, pivot tables, and VLOOKUP's."", 'Experience with HTML and WordPress web development. (Shopify, Wix, & Squarespace)']",2020-07-27 17:14:27
Manager of Data Science/Analytics,Production Resource Group Llc,3.5 out of 5,"New Windsor, NY 12553","['Responsible for prototype solutions, mathematical models, algorithms, machine learning techniques, and robust analytics to provide insights and development of data products', 'Through the insights and visualization of complex data sets, the individual will contribute significantly to the strategy across various aspects of audience planning, set-up, optimization and insights', 'Use a Bayesian dynamic time series model to estimate causal impact of an advertising campaign or a time series model to forecast future sales', 'Model the effects of environmental changes on promotion effectiveness with multiple regression', 'This person will develop a deep understanding of the analytical need and leverage knowledge of PRG data assets, big data technologies to develop and deploy testing hypotheses, use cases, and analyze test results', 'Understanding business issues and translating it into data mining problems and providing necessary analytical objectivity to ensure data quality, consistency, repeatability and accuracy of insights', 'Participate in planning, roadmap, and architecture discussions to help evolve our data science into revenue-generating insights', 'Lead and execute activities to support the use of Big Data tools such as SQL, R, SAS, Python, Julia etc. and SiSense', 'Ensure proper use of PRG data assets by working closely with data governance and compliance professionals', 'Reach, Frequency and Overlap Analysis, Path-To-Conversion Analysis and Attribution Analysis', 'Identify measurement and reporting needs and implement across all channels (programmatic and non-programmatic)', 'Stay current with rapidly developing Big Data technologies landscape and share knowledge with internally and with customers. Prototype and integrate tools into Ignite environment and lead adoption of tools through Data and Analytics.', 'Ensure proper use of PRG data assets by working closely with data governance and compliance professionals', 'Implement and evaluate business metrics, suggest new metrics as needed.', 'Utilize Big Data analytical tools and packages to build highly scalable analytical models.', 'Work with data and data engineers to operationalize analytical solutions and create analytical/business intelligence dashboards', 'Manage, Mentor, train, and provide guidance to Data Engineering Team.', 'Facilitate operationalization and adoption of analytical platform across PRG Business Unit', ""Bachelor's or master’s degree in Computer Science, Statistics, Engineering, Mathematics or equivalent quantitative field with heavy emphasis on programming required"", 'Excellent written skills, able to create clear, efficient, well-structured documentation', 'Strong data analysis skills including skills to rapidly learn new data assets', 'Must have 4+ years in a data science or similar role in the finance, or technology fields required', 'Must have a minimum of 4 years of hands on experience in data sciences, statistical modeling, data management, keying and linking, data handling and data wrangling', 'Must have a minimum of 4 years’ hands on experience with Database and Data Analysis required: Advanced SQL, Advanced Excel, SAS, R, Python, SQL, Javascript or related technologies', 'Experience and knowledge of Data Visualization concepts and at least 4 yrs. of experience with tools such as Tableau, SiSense', 'Must have 2 + years supervisory and people manager experience', 'Strong MS PowerPoint skills and ability to present to technical, business, and Sr. Executive audiences', 'Ability to work in matrix environment and to serve as individual and team contributor, leading projects and initiatives', 'Experience managing both internal and external partner relationships with strong influence management skills', 'Exceptional interpersonal, written/oral/listening communications and presentation/persuasion skills along with proactive approach to sharing knowledge with peers and cross functional teams', 'Highly organized and detail oriented', 'Travel as needed to PRG Locations']",2020-07-27 17:14:27
Senior Associate - Financial Forensics and Dispute Advisory Services,RSM US LLP,3.6 out of 5,"Boston, MA 02129","['Conducting investigations related to embezzlement, whistleblower, financial reporting fraud, foreign corrupt practices act, loan fraud, fidelity claims, claw back litigation, construction fraud, Ponzi schemes, health care fraud, fraudulent conveyance, purchase price disputes, royalty audit, related party transactions, billing disputes, bankruptcy fraud, securities fraud, anti-money laundering, and other matters', 'Assisting with litigation discovery on document requests and preparation of interrogatories; analyzing documents and assisting with preparing questions for witnesses', 'Analyzing and reconstructing fraudulent transactions, complex transactions, funds tracing, financial statements, etc.', 'Preparation of damage calculations', 'Data mining and analysis, including database construction of financial records, accounting data, database extracts, etc.', 'Performing electronic reviews of evidence', 'Assisting with discovery on document requests and interrogatories', 'Assisting with the preparation of questions for witnesses', 'Preparing market and competitive assessments', 'Preparing industry and market research', 'Assisting with the preparation of Rule 26 expert and other reports, affidavits, and other client deliverables (rebuttal reports, demonstrative tables, exhibits and charts)', 'Compiling organized working papers', 'Supervising staff and project teams', 'Contributing to proposals and assisting with business development activities to grow our practice (including CLE presentations, webinars, attending industry conferences, authorship of white papers, etc.)', 'Cultivating and maintaining positive, productive, and professional relationships with colleagues and clients', ""Minimum B.S. / B.A. degree or equivalent in Accounting, Finance or Economics from an accredited university. Master's degree a plus."", 'Minimum 3.0 GPA overall and in major', '2+ years of experience providing litigation support, investigation, and forensic accounting services; ""Big 4"" or national consulting firm experience a plus.', 'Attained or progress towards attaining CPA, CFE, CFF, ABV, AM, CFA or CLP certifications', 'Database experience with IDEA or Access software programs', 'Proficiency with Microsoft Excel, Word, and PowerPoint', 'Flexibility to travel to clients and other RSM offices', 'Ability to work long hours and have flexibility to meet client deadlines', 'Demonstrated ability to work independently to gather facts, organize data, analyze financial statements and other financial data, and identify relevant issues', 'Strong verbal and writing and communication skills and ability to communicate complex information in a clear and concise manner', 'Strong organizational and time management skills', 'Ability to balance multiple priorities', 'Self-starter who can work independently with minimal supervision', 'Eagerness and willingness to work in a fast-paced, team-oriented environment and understand your role on the team', 'Driven to exceed client expectations', 'Natural aptitude for solving problems', 'Desire to learn and develop', 'Experience working with data blending, cleansing, and analytic tools such as Alteryx, IDEA, ACL, and Sisense', 'Experience working with data visualization tools such as Tableau, Qlik, PowerBI, and Visio.', 'Experience querying and/or coding in relational databases using software such as Microsoft SQL Server, and Microsoft Access', 'Knowledge and / or experience coding using R, Python, and SAS']",2020-07-27 17:14:27
Senior SQL Database Developer,LBA Ware,N/A,"Macon, GA 31201","['Participate in an Agile environment with scrum, planning, demos, continuous integration and production releases', 'Write forward-thinking, well-designed code', 'Program software applications using the latest tools', 'Create relational database stored procedures, functions, packages', 'Collaborate with our team of developers and analysts', 'Check code in and out of source control', 'Continually collaborate with team members to enhance our SaaS applications', 'Communicate technical frameworks, requirements, and issues to non-technical audiences including clients and prospects', 'Partner with the team throughout various stages of the design, development, and implementation of our solutions as well as provide ongoing support', 'A bachelor’s degree (or equivalent experience) in computer science or software engineering', '5+ years of experience in technology', 'Professional proficiency with SQL Server and database management tools', 'Strong systems/process orientation with demonstrated analytical thinking', 'Organization and problem-solving skills', 'Advanced understanding of systems development methodology and systems development life cycle, structured system analysis, design, coding and testing techniques', 'Analytical capacity to measure the impact of system changes on existing processes and to design and implement modifications without the disruption to existing workflow', 'Ability to interact effectively with team members and peers in order to exchange information and develop appropriate strategies to solve problems and meet client needs', 'Demonstrated organizational, communication, and interpersonal skills and the ability to prioritize and communicate conflicting demands', ""SQL Server database design and implementation - strong skills with 5+ years' experience"", 'Advanced proficiency with T-SQL (complex scripts, analytical functions, regular expressions, table partitioning, materialized views, distributed transactions, indexing)', 'Index plan strategy and administration', 'Working knowledge of XML, CSV, JSON parsing and interfacing with T-SQL', 'SQL Server Integration Services (SSIS)', 'Experience working with large volumes of data', 'Experience with PowerShell', 'C# skills', '5+ years of related work required. To work remote, 2+ years of mortgage banking experience is required.', 'Familiarity with OLTP and OLAP data models', 'Azure or similar cloud technologies', 'Familiarity with BI tools (e.g. Power BI, Tableau, Microstrategy, Sisense)', 'Angular or similar JavaScript framework', 'Writing and consuming REST Services', 'Agile Development', 'Knowledge of the Mortgage Industry is a big plus', '401(k)', '401(k) Matching', 'Dental Insurance', 'Flexible Spending Account', 'Health Insurance', 'Paid Time Off', 'Vision Insurance', 'Monday to Friday', 'Technology: 5 years (Required)', 'SQL Development: 5 years (Required)', 'Financial Technology: 2 years (Required)', 'Macon, GA 31201 (Required)', 'United States (Required)', 'One location', 'No: Not providing sponsorship for this job', 'No']",2020-07-27 17:14:55
Marketing Data Analyst,Scale Media,3.8 out of 5,"Sherman Oaks, CA 91423","['Create and manage the company’s online BI tool, including dashboard planning and creation, using data from different data sources, such as our data warehouse and different API’s', 'Support all departments and teams in dashboard requests based on their business requirements and analytics needs', 'Conduct in-depth evaluation and analysis of different marketing efforts to help derive insights and recommendations', 'Analyze and aggregate the effectiveness of customer acquisition campaigns and retention efforts using a variety of sources', 'Gather information and examine web traffic, social media metrics, marketing campaigns and other activities that will design and create reports for a variety of stakeholders', 'Present monthly, quarterly and yearly results to the executive team, as well as provide business insights and assist with strategic planning', 'Support the company’s key projects and initiatives including data planning and KPI tracking.', 'Collaborate with media teams to provide data insights and recommendations for optimization towards marketing goals, campaign ad spend, and campaign funnels across digital channels', 'Assist the analytics and development team with new KPIs tracking, API connections, data structure for key projects and database optimization', 'Develop predictive models and customers’ segmentation based on the business needs', 'Bachelor’s degree in business, statistics, math, IT or a related field', 'Min. 3 years’ experience in a related field such as eCommerce, Digital Marketing or CPG', 'Excellent SQL and Excel knowledge and experience', 'Developed knowledged around Digital Marketing', 'Demonstrated experience with BI tools (Tableau, Sisense ,Qlik and etc) for both dashboard design and data architecture', 'Demonstrated experience with statistical software would be an advantage', 'Competitive Salary', 'Medical, dental, vision and life insurance', '401(k)', 'Paid parental leave', 'Gym membership', 'Generous paid time off (PTO)', 'Access to our “Scaling Wellness” program - mental health days, yoga sessions, daily meditation, fresh fruits and company provided snacks', 'Fun work culture - monthly and quarterly staff events', 'Casual Dress', 'An amazing team to work alongside !']",2020-07-27 17:14:55
Senior Business Intelligence Developer,Kajabi,N/A,"Irvine, CA","['Own all aspects of business intelligence, including building from the ground up', 'Plan, strategize, and execute on high-level BI outcomes.', 'Deliver better conversion and campaign information to our Marketing and Partner teams.', 'Start the process of democratization of data inside Kajabi', 'Get employees more up to speed on consuming, understanding, and using data for better decision making', 'Helping departments get lift by building dashboards and reporting for them, as well as training them how to do so themselves', 'Aggregate our data into centralized full stack locations, such as Amplitude, SiSense or Tableau', 'Allow our Data Science team to focus on the ""Science"" by taking BI responsibilities off their plates', 'Provide insight which can turn into higher revenue and retention for the company', ""You've worked with high level BI solutions such as Amplitude, Tableau, Looker, or SiSense"", 'You have understanding of Stripe billing in a SaaS environment', 'You understand how to connect data sources together and aggregate them in single platforms for analysis', 'You are competent and comfortable with both low level analysis in SQL, and high level dashboard building', ""You've got 5+ years of experience in the field, especially working with SaaS subscription companies"", 'You understand data warehousing and lake implementations, and can build or provide technical insight into their implementation', 'You are comfortable working with medium to large scale production datasets without excess guidance', 'You are highly self-managed and motivated to drive project work', 'Experience with lower level aggregation platforms a plus, such as tying together AWS services such as S3, Athena, Redshift, and Glue', 'You are able to converse and collaborate effectively with our Data Science team', 'You can handle direct planning and conversations with other business units, such as Marketing and Finance, to help them gain data insight and achieve their goals', 'You exhibit a willingness to draw outside the lines of narrower BI Developer goals, to help connect data across different systems and sets in the company, including some loading and ETL tasks', 'Experience with languages such as Ruby or Python a plus', 'Fully paid health insurance and dental insurance for self and family.', 'Fitness Incentives Package', 'Company 401k matching up to federal maximum', 'Company Funded Headspace Account', 'Company Funded Audible Account', 'Funded HSA account', 'Duck Dining (office food, beverages, and the ability to request items) - Priceless', 'Casual Dress', 'Links - Send along any links that best showcase your experience, i.e. your portfolio, Github profile, LinkedIn, blog posts or other writing samples.', ""Cover Letter - Please provide a cover letter that aligns directly to this role. Introduce yourself as a part of our team and tell us why you're interested in Kajabi! Show us how you could make an impact in Kajabi's future as well as how Kajabi can influence yours. Feel free to get creative! We are committed to providing our undivided attention to you!""]",2020-07-27 17:14:55
USDA School Nutritional Program Software Developer,Colyar Technology Solutions,N/A,"Scottsdale, AZ 85260",[],2020-07-27 17:14:55
Programmer/Software Development Engineer,Core Spaces,3.8 out of 5,"Chicago, IL 60625",[],2020-07-27 17:14:55
Business Intelligence Specialist - Intermediate,IPKeys Technologies,4.3 out of 5,"Norfolk, VA","['Analysis and Reporting Development and Support: Develop new enterprise business intelligence (BI) service offerings, content creation, and value propositions to support and improve Government business processes. Perform the following tasks:', 'Collaborate with end users to identify needs and opportunities for improved data management and delivery.', 'Provide ongoing development and maintenance of an operational data store and enterprise data warehouse using BI best practices, relational structures, dimensional data modeling, structured query language skills, data warehouse and reporting techniques.', 'Improve and streamline processes regarding data flow and data quality to improve data accuracy, viability and value.', 'Provide ongoing development and maintenance of a BI architecture that enables fact‐based decision making and ad-hoc analysis and insight generation.', 'Provide interactive real-time dashboards and key performance indicators using Microsoft Power BI, SQL Server Reporting Services, Tableau, Sisense, SAP Crystal Reports, IBM Cognos, Qlik, or newly identified BI tools.', 'Provide end-user support and encourage user adoption. Act as Tier 1 support for end-users of BI tools. Train end-users on basic functionality. Direct users to training material and available resources.', 'Ability to convert business requirements and high-level data collection needs into well-specified analyses, reporting and visualizations.', 'Gathers BI requirements, design solutions and works with developers on their delivery.', 'Utilize selected platforms – including SQL Server, Microsoft Dynamics CRM, Power BI, along with SSRS, to successfully deploy business intelligence solutions to satisfy information requirements.', 'Strong verbal, written communications and interpersonal skills', 'Combination of 5+ years of relevant experience/education in Business Intelligence, Computer Science, Data Analytics', 'BA/BS Degree in Business Intelligence, Computer Science, Data Analytics (Desired but not required)', 'Must possess an active DoD Top Secret clearance.']",2020-07-27 17:14:55
Sales Operations Manager,Bynder,3.5 out of 5,"Boston, MA","['Implement scalable repeatable data driven Sales processes based on best practices.', 'Build and scale a team of best-in-class Sales Operations talent, including ownership of the forecast, order management, deal desk, deal support, sales compensation, field readiness.', 'Partner with senior sales leadership to identify opportunities to simplify the sales process through optimization and automation. Facilitate successful implementation and adoption of new processes within the Field Operations organization. Foster an organization of continuous process improvement.', 'Work with stakeholders to drive the Lead to Order and Order to Cash strategies from a technology/tools standpoint while also working in a hands on capacity to make configurations and customization to Salesforce.', 'Design, implement and manage sales forecasting processes that provide accurate prediction into future revenue performance. Ensure forecasting efforts are appropriately integrated with other planning processes within the company.', 'Manage and work with Sales tooling such as Salesloft, DiscoverOrg, Salesforce, DocuSign and Sisense.', 'Strategic business planning with regional sales management teams to determine appropriate partnerships that will realize business objectives on market segmentation issues.', 'Identify areas for improvement and cost savings as well as risks to meeting planned forecasts in revenues or expenses.', 'Provide information and resources for development of business plans and analysis of sales department trends and activities.', '5+ years of experience in Revenue, Sales or Business Operations, experience in the SaaS industry a bonus.', 'University degree in a related field.', 'Good communication and interpersonal skills as well as strong time management and organizational skills.', 'Must be numerate, analytical and process minded.', 'Experience leading cross-functional initiatives, hitting goals and succeeding in a fast moving environment.', 'Advanced use of Salesforce reporting and Microsoft Excel.', 'Knowledge of Sales processes, strategy and automation as well as Business Intelligence tooling a plus.', 'Competitive salary and 401(k) - dollar for dollar match up to 6%', 'Company paid medical and dental coverage', 'Unlimited vacation policy', 'Room to advance in a high-growth tech company', 'Office in Fort Point, near the burgeoning Seaport District', 'A light-hearted and fun work environment']",2020-07-27 17:14:55
