job_title,company,company_rating,location,job_text,date
IT Help Desk Support,Saltzer Health,N/A,"Nampa, ID 83686","['Answer user inquiries regarding computer software or hardware operation to resolve problems.', 'Oversee the daily performance of computer systems.', 'Enter commands and observe system functioning to verify correct operations and detect errors.', 'Install and perform minor repairs to hardware, software, or peripheral equipment, following design or installation specifications.', 'Monitor the system for equipment failure or errors in performance.', 'Answer telephone calls to assist computer users encountering problems.', 'Read job set-up instructions to determine equipment to be used, order of use, material such as disks and paper to be loaded, and control settings.', 'Manage backup, security and user help systems.', 'Provide users with technical support for computer problems.', '3 years’ experience in Information Technology', 'Bachelor’s degree preferred', 'Familiarity with Electronic Medical Records software', 'Experience with HIPPA compliance in a Healthcare IT environment', 'Experience with Data Analytics Programs such as Tableau, Sisense, Dundas, or Looker', 'Coursework in information security, computer programming or other related areas preferred']",2020-07-27 17:11:30
Voice of the Customer Program Director,Bottomline Technologies,3.3 out of 5,"Portsmouth, NH 03801","[""Design, develop, and analyze Bottomline's customer feedback mechanism"", 'Work closely with IT to manage integrations of feedback collection mechanisms into our online applications for consumption across a number of stakeholders', 'Test different methodologies and designs to ensure our feedback process is optimized', 'Align diverse stakeholder groups with project objectives', 'Engage stakeholders to ensure customer feedback is utilized in process and system design', 'Help manage the data and reporting of customer feedback in business intelligence environments', 'Respond to unique business opportunities by analyzing existing feedback or developing new feedback sources', 'Conduct third-party research to identify and apply best practices to survey methodology and analysis', 'Communicate research findings to the organization through presentations, newsletters, dashboards, and executive summaries', 'Present analysis to stakeholders, including regional audiences', 'Assess the performance of, and identify discrepancies within, complex survey processes to ensure continuity in feedback collection', 'Develop and execute a Customer Advocacy program in partnership with Marketing and Customer Success teams', 'Strong skills in data management, analysis, and problem-solving', 'Experience designing and analyzing complex business processes', 'Experience conducting and analyzing customer insight and satisfaction data and knowledge of survey methodology', 'Familiarity with SQL and Excel', 'Designing reports using BI platforms', ""Bachelor's degree or equivalent experience preferred"", 'Use of best in class surveying tools', 'Knowledge of Gainsight, SiSense, Salesforce a plus']",2020-07-27 17:11:30
Lending Intelligence Analyst,"Fidelity Bank, NA",N/A,"Wichita, KS",[],2020-07-27 17:11:30
Sales Operations Analyst,Veeam,3.5 out of 5,Georgia,"['Business partner to Regional Management of Americas Sales Ops', 'Drive standardization of reports across all segments and sales teams to ensure consistency in analysis approach', 'Drive adoption of KPI dashboards and tools across the Americas leadership team, deliver on-demand trainings on behalf sales operations in the region', 'Develop and execute business analysis and reporting activities that are aligned with Veeam sales strategies', 'Quarterly statistics', 'Weekly/monthly business trending', 'Performance analysis to identify areas of concern and best practices. Use this analysis to provide feedback and areas of focus to improve performance', 'Track and report on operational metrics that impact sales and customer experience', 'Develop new KPIs based on business needs', 'Ah-hoc business analysis to support decision on strategic initiatives (promos, GTM, etc.)', 'Guide reporting automation projects', 'Partner to prepare business analysis for QBRs, Summits, All Hands', 'Subject Matter Expert for SalesForce.com and all sales related tools', 'Marshal a consistent, timely manner, E2E forecast cadence in the regions', 'Bachelor’s Degree required (preferably in Economics or/ Marketing/or Business Administration)', 'Preference for candidates who have completed a relevant experience in business analysis at a technology company', 'Fluent English, additional languages is a plus but not required', 'Effective interpersonal and communication skills (written and verbal)', 'Advanced skills in MS Excel and SalesForce.com', 'MS Access or other database skills are a strong plus', 'Expertise using BI applications (like Sisense, Tableau)']",2020-07-27 17:11:30
"Sr. Analyst, Business Intelligence & Analytics",garten,3.9 out of 5,"Burlingame, CA","['Lead efforts in providing business performance insights to enable data-driven decision making and drive business results.', 'Participate in designing and building robust data warehouse/data lake and business intelligence platform', 'Utilize various tools to extract, transform and analyze data from a variety of data sources to help answer business questions, identify potential opportunities.', 'Collaborate with business stakeholders to understand business goals, reporting/data needs and build scalable analytical solutions.', 'Apply statistical analysis, quantitative analysis and predictive modeling techniques to identify trends and patterns.', 'Ability to quickly prioritize and execute multiple competing projects based on business case and expected impact.', 'Mentor other analysts in the team.', 'Bachelor’s degree in Information Systems, Computer Science, Data Science, Math, Engineering or similar quantitative field.', '4 - 6 years of experience in analytics, business intelligence, or similar roles.', 'Experience in leading a small team of analysts.', 'Excellent verbal and written communication skills with an ability to express ideas and effective story-telling through data, reports and dashboards.', 'Strong analytical and problem solving skills with high attention to detail and accuracy.', 'Proficient with Looker, Tableau, Sisense or similar business intelligence and analytics tools.', 'Write efficient SQL queries against large, complex data sets. Experience with scripting languages like Python is a plus.', 'Experience with modern data warehouse platforms such as BigQuery, Snowflake, RedShift is a plus.', 'Experience working in a startup environment is a plus.']",2020-07-27 17:11:30
"Sr. Product Manager, Data Platform",Sourceability,5 out of 5,United States,"['401(k)', '401(k) Matching', 'Dental Insurance', 'Flexible Schedule', 'Health Insurance', 'Paid Time Off', 'Vision Insurance', 'Monday to Friday', 'Product Management: 5 years (Preferred)', 'Fully Remote', 'No: Not providing sponsorship for this job']",2020-07-27 17:11:30
Data Reporting Analyst,Vantage Bank Texas,3.9 out of 5,"San Antonio, TX 78216",[],2020-07-27 17:11:30
Data Engineer,Fayetteville Public Works Commission,4.3 out of 5,"Fayetteville, NC 28301","['Thorough knowledge of ingestion, processing frameworks and storage engines', 'Thorough knowledge architecting distributed systems, creating reliable pipelines, combining data sources, architecting data stores', 'Thorough knowledge of batch and stream processing', 'Thorough knowledge of Linux and command line tools such as grep, awk, etc.', 'Thorough knowledge of SQL and programming such as Java, Python, Scala, R, etc.', 'Thorough knowledge and holistic understanding of data as an asset', 'Thorough knowledge of safety rules/regulations/procedures, as applicable', 'Thorough knowledge in operating computers and applicable software including Microsoft Office tools', 'Ability to design and implement data models', 'Ability to unlock additional value from data through completion of feasibility studies for assigned use cases', 'Ability to use SQL for queries and report building', 'Ability to translate logical models into physical models, adding appropriate physical objects to create the objects within the data store (e.g., indexes, sequences, etc.)', 'Ability to interpret complex business requirements and create data models across multiple applications that support business goals', 'Ability to solve problems independently and provide recommendations for continuous improvement', 'Ability to ensure quality control in all work products/outputs', 'Thorough knowledge of math concepts and formulas required for data analysis and reporting', 'Ability to work as part of a cross functional team', 'Ability to use strong analytics skills in interpreting and visualizing data', 'Ability to create and maintain reports/records, spreadsheets, documents, tables, etc.', 'Ability to organize/prioritize work and provide excellent customer service', 'Ability to maintain knowledge on current and emerging technologies and evaluate the impact of new applications and technologies on data structures', 'Ability to work with staff across all divisions to maintain data models and processes that are scalable, adaptable, and in synchronization with ever-changing business needs', 'Ability to perform troubleshooting/root cause analysis to pinpoint issues and devise resolutions for data/reporting issues', 'Ability to share information and insight on source data structures in order to support decision-making for technical and functional modifications to enterprise software applications', '401(k)', 'Dental Insurance', 'Disability Insurance', 'Employee Assistance Program', 'Flexible Spending Account', 'Health Insurance', 'Life Insurance', 'Paid Time Off', 'Professional Development Assistance', 'Retirement Plan', 'Tuition Reimbursement', 'Vision Insurance', '8 Hour Shift', 'Monday to Friday', 'Data Management: 5 years (Preferred)', 'Associate (Preferred)', 'United States (Preferred)', 'www.faypwc.com', 'https://www.facebook.com/faypwc', 'Only full-time employees eligible', 'Temporarily due to COVID-19']",2020-07-27 17:12:06
Natural Language Processing (NLP) Data Scientist,Amplity Health,3.8 out of 5,"Yardley, PA","['Work with business stakeholders to translate business goals into technical solutions; propose and implement appropriate data science approaches to deliver insights and/or models using NLP.', 'Text mine a database of 50M+ unstructured text records using NLP and machine learning tools to generate datasets to be used for subsequent analytical processes.', 'Develop, test, measure, and implement models for Named Entity Recognition (NER), sentiment analysis, text classification, topic modeling, clustering, etc.', 'Build a deep understanding of the Company’s products, services, data, and customers to facilitate the development of customized data solutions for our clients and stakeholders.', 'Dives into machine learning engineering and researching topics including ML algorithms, feature engineering, analysis, modeling, and production deployment.', 'Develops training and cross-validation data sets for machine learning algorithms.', 'Demonstrated background in NER, Entity Relationship, Topic Modeling, Sentiment analysis, and other machine learning capabilities using unstructured text datasets.', 'Experience using NLP toolkits like SpaCy, Gensim, NLTK, CoreNLP, OpenNLP, LingPipe, Mallet, etc.', 'Proficiency with visualization tools (D3, Highcharts, ggplot, matplotlab, seaborn, Sisense, Tableau, etc.)', 'Degree in data science, computer science, computational linguistics, information retrieval, statistics, applied math, or other quantitative field preferred.', 'Has demonstrated experience working with large data sets in MongoDB, Hadoop/spark/etc, traditional SQL databases , and is familiar with pros/cons of different data solutions.', 'Experience with implementation/deployment of NLP pipeline from end to end.', 'Strong programming skills in Python, SQL, R. (.NET, C# a strong plus)', 'Knowledge of various machine learning models (HMMs, CRFs, SVMs, LDA, LSI, MRFs, etc) and pros/con, trade-offs, and best applications for each.', 'Self-motivated, ability to work independently with a ‘sense of urgency’ in order to deliver high-quality/error-free output while meeting critical deadlines in ambiguous situations.', 'Ability to quickly prototype ideas and solve complex problems by adapting creative approaches.', 'Detail oriented with strong investigative and problem-solving skills.', 'Strong communication skills, both verbal and written.', 'Ability to proactively engage in a teamwork culture.']",2020-07-27 17:12:06
IT Help Desk Support,Saltzer Health,N/A,"Nampa, ID 83686","['Answer user inquiries regarding computer software or hardware operation to resolve problems.', 'Oversee the daily performance of computer systems.', 'Enter commands and observe system functioning to verify correct operations and detect errors.', 'Install and perform minor repairs to hardware, software, or peripheral equipment, following design or installation specifications.', 'Monitor the system for equipment failure or errors in performance.', 'Answer telephone calls to assist computer users encountering problems.', 'Read job set-up instructions to determine equipment to be used, order of use, material such as disks and paper to be loaded, and control settings.', 'Manage backup, security and user help systems.', 'Provide users with technical support for computer problems.', '3 years’ experience in Information Technology', 'Bachelor’s degree preferred', 'Familiarity with Electronic Medical Records software', 'Experience with HIPPA compliance in a Healthcare IT environment', 'Experience with Data Analytics Programs such as Tableau, Sisense, Dundas, or Looker', 'Coursework in information security, computer programming or other related areas preferred']",2020-07-27 17:12:06
Voice of the Customer Program Director,Bottomline Technologies,3.3 out of 5,"Portsmouth, NH 03801","[""Design, develop, and analyze Bottomline's customer feedback mechanism"", 'Work closely with IT to manage integrations of feedback collection mechanisms into our online applications for consumption across a number of stakeholders', 'Test different methodologies and designs to ensure our feedback process is optimized', 'Align diverse stakeholder groups with project objectives', 'Engage stakeholders to ensure customer feedback is utilized in process and system design', 'Help manage the data and reporting of customer feedback in business intelligence environments', 'Respond to unique business opportunities by analyzing existing feedback or developing new feedback sources', 'Conduct third-party research to identify and apply best practices to survey methodology and analysis', 'Communicate research findings to the organization through presentations, newsletters, dashboards, and executive summaries', 'Present analysis to stakeholders, including regional audiences', 'Assess the performance of, and identify discrepancies within, complex survey processes to ensure continuity in feedback collection', 'Develop and execute a Customer Advocacy program in partnership with Marketing and Customer Success teams', 'Strong skills in data management, analysis, and problem-solving', 'Experience designing and analyzing complex business processes', 'Experience conducting and analyzing customer insight and satisfaction data and knowledge of survey methodology', 'Familiarity with SQL and Excel', 'Designing reports using BI platforms', ""Bachelor's degree or equivalent experience preferred"", 'Use of best in class surveying tools', 'Knowledge of Gainsight, SiSense, Salesforce a plus']",2020-07-27 17:12:06
Lending Intelligence Analyst,"Fidelity Bank, NA",N/A,"Wichita, KS",[],2020-07-27 17:12:06
Sales Operations Analyst,Veeam,3.5 out of 5,Georgia,"['Business partner to Regional Management of Americas Sales Ops', 'Drive standardization of reports across all segments and sales teams to ensure consistency in analysis approach', 'Drive adoption of KPI dashboards and tools across the Americas leadership team, deliver on-demand trainings on behalf sales operations in the region', 'Develop and execute business analysis and reporting activities that are aligned with Veeam sales strategies', 'Quarterly statistics', 'Weekly/monthly business trending', 'Performance analysis to identify areas of concern and best practices. Use this analysis to provide feedback and areas of focus to improve performance', 'Track and report on operational metrics that impact sales and customer experience', 'Develop new KPIs based on business needs', 'Ah-hoc business analysis to support decision on strategic initiatives (promos, GTM, etc.)', 'Guide reporting automation projects', 'Partner to prepare business analysis for QBRs, Summits, All Hands', 'Subject Matter Expert for SalesForce.com and all sales related tools', 'Marshal a consistent, timely manner, E2E forecast cadence in the regions', 'Bachelor’s Degree required (preferably in Economics or/ Marketing/or Business Administration)', 'Preference for candidates who have completed a relevant experience in business analysis at a technology company', 'Fluent English, additional languages is a plus but not required', 'Effective interpersonal and communication skills (written and verbal)', 'Advanced skills in MS Excel and SalesForce.com', 'MS Access or other database skills are a strong plus', 'Expertise using BI applications (like Sisense, Tableau)']",2020-07-27 17:12:06
"Sr. Analyst, Business Intelligence & Analytics",garten,3.9 out of 5,"Burlingame, CA","['Lead efforts in providing business performance insights to enable data-driven decision making and drive business results.', 'Participate in designing and building robust data warehouse/data lake and business intelligence platform', 'Utilize various tools to extract, transform and analyze data from a variety of data sources to help answer business questions, identify potential opportunities.', 'Collaborate with business stakeholders to understand business goals, reporting/data needs and build scalable analytical solutions.', 'Apply statistical analysis, quantitative analysis and predictive modeling techniques to identify trends and patterns.', 'Ability to quickly prioritize and execute multiple competing projects based on business case and expected impact.', 'Mentor other analysts in the team.', 'Bachelor’s degree in Information Systems, Computer Science, Data Science, Math, Engineering or similar quantitative field.', '4 - 6 years of experience in analytics, business intelligence, or similar roles.', 'Experience in leading a small team of analysts.', 'Excellent verbal and written communication skills with an ability to express ideas and effective story-telling through data, reports and dashboards.', 'Strong analytical and problem solving skills with high attention to detail and accuracy.', 'Proficient with Looker, Tableau, Sisense or similar business intelligence and analytics tools.', 'Write efficient SQL queries against large, complex data sets. Experience with scripting languages like Python is a plus.', 'Experience with modern data warehouse platforms such as BigQuery, Snowflake, RedShift is a plus.', 'Experience working in a startup environment is a plus.']",2020-07-27 17:12:06
Data Reporting Analyst,Vantage Bank Texas,3.9 out of 5,"San Antonio, TX 78216",[],2020-07-27 17:12:06
Senior Engineer for Healthcare Analytics,HHS Technology Group,N/A,"Seattle, WA","['Seven (7) years’ technical experience supporting database and architecture', 'Three (3) years’ Healthcare industry experience', 'Proactively monitor systems health and perform routine product/systems maintenance tasks as required, utilizing automation wherever possible.', 'Develop and apply a structured architectural approach and methodology that aligns with the key strategies of the organization to support BI and data science.', 'Develop and maintain data integration solutions (including ETL design and architecture), semantic layer objects, presentation objects, reports, and dashboards for delivery of BI and data science solutions.', 'Utilize and contribute to refinements of the BI and data science solution development methodology based on industry best practices.', 'Document technology specifications and ensure that any new technology solutions are optimal for meeting needs; leverage existing technologies when possible.', 'Apply architectural and engineering concepts to implement a solution that meets operational requirements while maintaining sustainability objectives, including: scalability, maintainability, security, reliability, extensibility, flexibility, availability, and manageability.', 'Lead and mentor other developers.', 'Participate in research and development efforts (proof of concept, prototype) as a subject matter expert when introducing new technologies.', 'Ensure technology solutions are production ready and meet the defined specifications and that the solution can be maintained via production support methodologies and resources.', 'Provide ongoing support and maintenance of deployed BI and data science solutions.', ""Bachelor's degree (Master's preferred) in Computer Science, Data Science, Engineering, Information Systems, Mathematics, Statistics, or related field. Equivalent experience will be considered in lieu of a degree."", '8+ years of related technical experience.', '5+ years of experience in a technical role supporting BI and data science efforts. This should include application of knowledge in statistics, data wrangling, and data visualization & communication.', '5+ years of experience in database development and tools. Ideally this includes: ETL, data modeling, complex queries, performance tuning, and stored procedures/functions.', '3+ years of designing BI and data science solutions, preferably in the healthcare industry.', '2+ years of experience Alteryx or Sisense (or a similar ETL tool).', '2+ years of application presentation layer experience, including data visualization and communication.', 'Expert data skills, including complex queries, performance tuning, expertise in a variety of approaches (e.g., relational, dimensional, unstructured).', 'Proven track record of successfully delivering large data-centric projects', 'Strong relationship management skills; able to interface effectively with all organizational levels: users, team members, and management.', 'The ability to apply architectural principles to business solutions.', 'A broad, enterprise-wide view of the business, with understanding of the roles of strategy, processes and capabilities, enabling technologies, and governance.', 'Extensive experience planning and deploying either business or technical initiatives (preference for both).', 'Experience with a statistical language (e.g., R) is beneficial.', 'Strong skills in design and implementation of logical and physical approaches to managing and analyzing large volumes of data, with knowledge of best practices.', 'Excellent development and testing skills (including test planning and execution).', 'Ability to produce high quality documentation of business and system requirements, system design, data architecture, and training materials.', 'Exceptional communication skills and the demonstrable ability to communicate appropriately at all levels of the organization; this includes written and verbal communications as well as visualizations.', 'Fully paid dental, vision, life insurance, and disability insurance.', 'Generous 401k matching program fully vested from beginning.', 'Generously sponsored Medical Insurance through Cigna (PPO or HSA – with company match)']",2020-07-27 17:12:06
