job_title,company,company_rating,location,job_text,date
Sr. CRM Analyst,Scale Media,3.8 out of 5,"Sherman Oaks, CA 91423","['Performs customer segmentation based on purchase data (RFM), browse data and other customer engagement data to drive more targeted, personalized and relevant communications.', 'Analyze data to identify opportunities for upsell, cross-sell, and loyalty programs to increase customer’s engagement and repeat purchases.', 'Responsible for daily-weekly-monthly email, SMS and web push reporting, including customer engagement metrics, trends, test results and campaign performance and Identify ways and opportunities to optimize marketing customer contacts', 'This position will ensure the use of best practices across all communication channels with the goal of maximizing effectiveness and ROI of these marketing channels. Additionally, this role will partner with our in-house analytics team for measurement and insights of communications, including KPI analysis and testing Strategies.', 'Drive campaign performance through results insights, customer analyses and marketing strategy. The candidate will help define audience targeting strategy, testing methodology, and measurement of email, SMS and web push.', 'Support, inform and guide Customer Marketing strategies with ad-hoc and automated reporting and analysis, and identify key metrics and benchmarks.', 'Minimum of 7 years of work experience in email, SMS, web-push, ecommerce marketing and analytics.', 'Strong analytical background with past experience in analyzing email retention efforts and optimization of customers’ LTV.', 'Demonstrated experience with measuring email metrics and KPIs, email campaign creation, optimization and customer segmentation.', 'Experience with ESP (Iterable), web analytics platforms such as Google Analytics and analytical BI tools (Tableau/Sisense/Qlik/Power BI) to generate insights and recommendations .', 'Advanced Excel and Google sheets experience with ability to create and maintain very large spreadsheets and datasets.', 'Experience with SQL/mySQL database', 'Experience with A/B tests - planning, execution and methodologies.', 'Past experience with different ESP systems (Iterable/Active campaign/MailChimp)', 'Competitive Salary - $DOE', 'Medical, dental, vision and life insurance', '401(k)', 'Paid parental leave', 'Gym membership', 'Generous paid time off (PTO)', 'Access to our ""Scaling Wellness"" program - mental health days, yoga sessions, daily meditation, fresh fruits and company provided snacks', 'Fun Work Culture - Monthly and Quarterly staff events']",2020-07-27 17:13:16
Channel Sales Manager,Sisense,N/A,"Scottsdale, AZ 85251","[""You'll conduct 1:1 meetings with each of your key partner stakeholders. You'll learn about our partner programs and processes, and understand the needs of the sales channel manager."", 'You will learn about the Sisense product and partner programs.', 'You will have built relationships with people in the Strategic Partner group, the people in the Sales org, and the relevant people at the Customer Success Partner group.', ""You will have a strong understanding of the business needs and you'll create a plan to recruit the right partners based on those needs."", 'You will work cross-functionally with the sales organization and other alliance teams to recruit local SI and start the on-boarding new partners.', 'You will introduce the SI to the relevant people with the relevant Sisense sales leadership.', 'You will start to land the SI partnership with the sales team in targeted geographies.', ""You have closed some sales, you have a healthy pipeline generated, and you're consistently following up on leads coming from SI and cloud alliances."", 'You will create a case study for the sales team on working with SI.', 'You will work with the EMEA channel manager to land and expand the partnership.', ""You've managed to learn about Sisense Business and Ecosystem and present our value proposition."", 'You know how to best work with the sales team and have a clear plan to motivate a team of driven salespeople to partner with our SI network.', 'Proven track record of meeting goals and deadlines, inclusive of customer-retention or relationship management metric', 'You have a proven SI recruit and work plan - with Targets, KPI agreeable with the Sales leadership.', ""You have countless examples of leading our sales in a better way with partners and you've measured them."", 'You excel at developing relationships with and becoming a trusted resource for prospective technical partners.', 'You enjoy working hard to strategically build partnerships and have no problem being a self-starter.', 'You thrive in a high-growth environment and embrace process evolutions.', ""You've demonstrated the ability to leverage deep and creative sales hunter skills.""]",2020-07-27 17:13:16
Business Intelligence-Mid Level w/Secret Clearance,Axiologic Solutions,4.4 out of 5,"Dam Neck, VA","['Develop new enterprise business intelligence (BI) service offerings, content creation, and value propositions to support and improve Government business processes.', 'Collaborate with end users to identify needs and opportunities for improved data management and delivery.', 'Provide ongoing development and maintenance of an operational data store and enterprise data warehouse using BI best practices, relational structures, dimensional data modeling, structured query language skills, data warehouse and reporting techniques.', 'Improve and streamline processes regarding data flow and data quality to improve data accuracy, viability and value.', 'Provide ongoing development and maintenance of a BI architecture that enables fact‐based decision making and ad-hoc analysis and insight generation.', 'Provide interactive real-time dashboards and key performance indicators using Microsoft Power BI, SQL Server Reporting Services, Tableau, Sisense, SAP Crystal Reports, IBM Cognos, Qlik, or newly identified BI tools.', 'Provide end-user support and encourage user adoption. Act as Tier 1 support for end-users of BI tools. Train end-users on basic functionality. Direct users to training material and available resources.', 'BA/BS Degree and/or 5+ years of relevant experience.', 'If degreed Bachelors Degree in Business Intelligence, Computer Science, Data Analytics preferred.']",2020-07-27 17:13:16
Software Developer,Expression Networks,N/A,"Fort Wayne, IN","['US Citizenship and eligibility to obtain US DoD security clearance', 'Strong understanding of Object Oriented Programming (OOP) principals', 'Knowledge of HTML, CSS, HTTP request lifecycle, JavaScript frameworks, back-end languages, structured and unstructured databases, and database query languages', 'Experience working with ASP.NET, C#, VB.NET, Java, JavaScript, or MEAN/MERN stacks', 'Experience working with SiSense, Kibana, or Alfresco', 'Experience working with MongoDB, SQL, MS Access, or Oracle databases', '401k matching', 'PPO and HDHP medical/dental/vision insurance', 'Education reimbursement', 'Complimentary life insurance', 'Generous PTO and holiday leave']",2020-07-27 17:13:16
"Manager, Research & Analytics",BraunAbility,3.7 out of 5,"Carmel, IN","['Develop scalable and flexible reporting using MS Office and Sisense or related BI/data visualization tools to inform business decisions for marketing campaigns;', 'Consolidate campaign and channel tracking to enable analysis of marketing performance using CRM data processing and reporting, marketing automation tools (Pardot, MailChimp, or related software), and call tracking tools;', 'Use a data-driven approach via web analytics for monitoring and reporting of online performance using web analytics software and search engine optimization tools (Conductor, Moz, or similar tool);', 'Perform research to identify customers’ needs and wants, product potentials, as well as new market opportunities using online survey platforms; and', 'Design, implement, and test custom programs in business information systems as well as integrate the systems with marketing technologies using programming tools, CRM (Salesforce), Content Management System (Word Press or Adobe AEM), digital ad platforms (Google, Bing, or Facebook), and system connectors (Zapier or PieSync).']",2020-07-27 17:13:16
"Senior Consultant, Solutions Architect Business Intelligence",Northern Trust Corp.,3.9 out of 5,"Chicago, IL","['The Senior Analytics Architect is a highly performant engineer responsible for delivering scalable BI, analytics and reporting solutions', 'Hands on delivery of data capture, curation and consumption. Ability to build data and analytics solutions and provide domain perspective on storage, data platforms and services, data virtualization, data cataloging, RDBMS, DW/DM, NoSQL, MPP databases and security.', 'Participate in deep architectural discussions to build confidence and ensure success when building new solutions', 'Build full technology of services required including PaaS (Platform as-a-service), IaaS (Infrastructure as-a-service), SaaS (software as-a-service), operations, management and automation', 'Lead efforts to introduce, re-engineer and optimize processes and systems by assessing business needs and architecting, proposing and implementing data management solutions', 'Develop and design of models for complex analytical and data warehouse systems including performing tasks related to database design, data analysis, data quality, metadata management and support', 'Collaborate with business process leaders to introduce and maintain data platforms, governance and security capabilities and roadmap', 'Ensure designs follow the prescribed reference architecture and frameworks; Ensure designs reflects appropriate business rules, and facilitates data integration, data conformity and data integrity', 'Work on project teams to translate business requirements into system qualities that lead to repeatable and executable design strategies and patterns.', 'Implement large data warehouse solutions utilizing cluster, parallel RDBMS, MPP and NoSQL architectures.', 'Develop architecture supporting end to end Data integration process using ETL/ ELT techniques for structured, semi-structured and un-structured data', '7+ years of overall industry experience', '3+ years of recent Cognos Analytics and Power BI experience', 'Deep understanding of database and analytical and technologies in the industry including, SQL, BI tools, RDBMS, Columnar, MPP, NoSQL, Data Virtualization and Bigdata', 'Understanding of data structures, data modeling and software architecture', 'Recent hands-on experience of Cognos Analytics and Power BI', 'Ability but to build complete analytics solutions in Cognos Analytics and Power BI.', 'Experience with Agile and DevOps', 'Ability to work with cross functional team in a fast-paced environment and turn ideas into working solutions with ownership and urgency', 'Must have deep curiosity to keep abreast of developments in the field and demonstrated ability to craft innovative solutions', 'Bachelor’s degree in computer science or a related discipline', 'Knowledge of Sisense, Incorta, Alteryx and other leading BI, analytics and data tools considered a plus']",2020-07-27 17:13:16
"Manager, Business Intelligence","BioTelemetry, Inc.",2.8 out of 5,United States,"['Maintain a positive, results-oriented work environment by building partnerships, modeling teamwork and communicating in an open, balanced and objective manner', 'Design and maintain a business intelligence strategy aligned to the data acquisition strategies of Geneva.', 'Manage assigned BI team members’ project workloads, performance and priorities', 'Work with various data owners to develop and implement data analytics strategy, dashboards & reporting on Geneva’s BI platform.', 'Ensure BI team is in compliance with SOPs and other company policies', 'Provide strategic and tactical management and leadership to ensure deliverables proceed on schedule', 'Consistently evaluate to ensure the proper tools are provided to the DA team and that they are being used effectively; identify obstacles and make corrective actions/recommendations as necessary', 'Represent Business Intelligence at Business Development meetings, audits, etc.', 'Providing detailed operational input into project planning, focusing on data specifications and data management concerns', 'Working directly with customers on definition and/or review of data specifications through test data transfer and approval', 'Monitoring and mentoring database set-up and providing metrics associated with setups', 'Coordinating all processes required to produce accurate, confidential and retrievable clinical data, including dataset preparation, quality control review of output, and resolution of queries from dataset recipients', 'Supporting implementation of technology-enabled processes, working in partnership with other internal groups', 'Other duties as assigned', 'The physical demands are representative of those an employee encounters while performing the essential functions of this job', 'BA/BS degree in a technical, business or scientific discipline, or equivalent business experience in a regulated environment', 'Minimum 5 years of experience in data analytics, project management or operations in a healthcare related organization, preferably in the field of cardiac monitoring, billing or operations, or equivalent business experience in a regulated environment.', 'Minimum 3 years of experience using SiSense data analytics platform including design, architecture & deployment strategy.', 'Minimum 3 years of experience architecting and deploying Business Intelligence strategies across multiple data streams.', 'Minimum 3 years of experience working with databases such as Microsoft SQL, PostGres.', 'Minimum 3 years of experience working with AWS or other cloud environments.', 'Minimum 5 years of experience in managing operations and teams in a healthcare setting.', 'Experience in EMR integrations and pulling data from multiple sources such as EMR’s, API driven applications.', 'Demonstrable experience in effective verbal and written communications and interaction with internal and external customers', 'Experience in application of knowledge and skills in a highly organized fashion while adhering to regulatory guidelines, Standard Operating Procedures and customer expectations', 'Sound understanding of clinical data management processes through all phases of the clinical trial life cycle', 'Ability to be a “hands on” manager', 'Ability to establish and maintain effective working relationships with coworkers, managers and clients', 'Excellent organization, analytical, attention to detail, multi-tasking and problem-solving skills', 'Proficient in the use of computer systems, including Microsoft Office applications (i.e. Excel)', 'Experience with SiSense data analytics tool', 'Exposure to data and file structures, database design and output options', 'Ability to set and meet, for self and team, timelines or be able to recognize and schedule changes in response to project demands', 'Ability to recognize, evaluate and develop plans to mitigate project related risk', 'Strong written and verbal communication skills', 'Ability to identify potential out of scope activities to management', 'Customer Service: WECARE – BioTelemetry based customer centric program', 'Customer management skills']",2020-07-27 17:13:16
Corporate Data Engineer (DBA),American Addiction Centers,N/A,"Brentwood, TN 37027","['Create and Maintain data pipelines between core data systems', 'Help define metrics and best practices around data definitions and data governance', 'Assist the larger analytics team around maximizing usage and value of data', 'Document current data systems', 'Help prioritize business intelligence efforts', 'Maintain relationships across multiple teams to ensure alignment on definitions and access', 'Bachelor’s Degree', 'Strong SQL knowledge required (SQL Server Preferred)', 'Python ETL Skills (familiarity with requests and pandas package preferred, REST APIs)', 'Minimum two (2) years working with data systems or API data connections', 'Strong knowledge of current BI market place and technologies (PowerBI, Sisense, Tableau)', 'AWS knowledge and working knowledge of ETL platforms recommended', 'Able to work quickly and independently', 'Flexibility to deal with constantly changing needs', 'Ability to own and lead the technical side of the BI/Analytics process', 'A team player who understands how to make others around them better', 'A desire to learn and get better', 'Data Warehousing concepts and data modeling skills', 'SSIS ETL Skills', 'Familiarity with Salesforce CRM', '401(k) Matching', 'Dental Insurance', 'Employee Assistance Program', 'Health Insurance', 'Paid Time Off', 'Referral Program', 'Vision Insurance', 'United States (Required)', 'Outcome-oriented -- results-focused with strong performance culture', 'Monday to Friday', 'Only full-time employees eligible', 'No']",2020-07-27 17:13:16
Business Analytics Operations Manager,Bass Pro Shops,3.6 out of 5,"Springfield, MO","['Providing analytics insights responsibility. 55%', 'Root causing and troubleshooting business trends responsibility. 25%', 'Providing leadership to other analysts on the team 20 %', 'ALL OTHER DUTIES AS ASSIGNED', 'Advanced SQL and familiarity with statistical concepts', 'Retail industry experience is preferred', 'Demonstrates situational leadership, emotional intelligence, and a motivated sense of urgency', 'Working knowledge of business intelligence applications and/or cloud services (e.g., Domo, Looker, PowerBI, Qlik, Tableau, SiSense), and ability to leverage the reporting capabilities of existing ERP, CRM and/or database software vendors (e.g., Oracle BI, Salesforce, SAP Business Objects, Pentaho, SSRS)', 'Ability to effectively interpret complex business requests and translate them into relevant and actionable insights', 'Strong oral, written and interpersonal skills for interacting and collaborating with business partners throughout the organization']",2020-07-27 17:13:16
Marketing Data Analyst,Scale Media,3.8 out of 5,"Sherman Oaks, CA 91423","['Create and manage the company’s online BI tool, including dashboard planning and creation, using data from different data sources, such as our data warehouse and different API’s', 'Support all departments and teams in dashboard requests based on their business requirements and analytics needs', 'Conduct in-depth evaluation and analysis of different marketing efforts to help derive insights and recommendations', 'Analyze and aggregate the effectiveness of customer acquisition campaigns and retention efforts using a variety of sources', 'Gather information and examine web traffic, social media metrics, marketing campaigns and other activities that will design and create reports for a variety of stakeholders', 'Present monthly, quarterly and yearly results to the executive team, as well as provide business insights and assist with strategic planning', 'Support the company’s key projects and initiatives including data planning and KPI tracking.', 'Collaborate with media teams to provide data insights and recommendations for optimization towards marketing goals, campaign ad spend, and campaign funnels across digital channels', 'Assist the analytics and development team with new KPIs tracking, API connections, data structure for key projects and database optimization', 'Develop predictive models and customers’ segmentation based on the business needs', 'Bachelor’s degree in business, statistics, math, IT or a related field', 'Min. 3 years’ experience in a related field such as eCommerce, Digital Marketing or CPG', 'Excellent SQL and Excel knowledge and experience', 'Developed knowledged around Digital Marketing', 'Demonstrated experience with BI tools (Tableau, Sisense ,Qlik and etc) for both dashboard design and data architecture', 'Demonstrated experience with statistical software would be an advantage', 'Competitive Salary', 'Medical, dental, vision and life insurance', '401(k)', 'Paid parental leave', 'Gym membership', 'Generous paid time off (PTO)', 'Access to our “Scaling Wellness” program - mental health days, yoga sessions, daily meditation, fresh fruits and company provided snacks', 'Fun work culture - monthly and quarterly staff events', 'Casual Dress', 'An amazing team to work alongside !']",2020-07-27 17:13:16
Senior Business Intelligence Developer,Kajabi,N/A,"Irvine, CA","['Own all aspects of business intelligence, including building from the ground up', 'Plan, strategize, and execute on high-level BI outcomes.', 'Deliver better conversion and campaign information to our Marketing and Partner teams.', 'Start the process of democratization of data inside Kajabi', 'Get employees more up to speed on consuming, understanding, and using data for better decision making', 'Helping departments get lift by building dashboards and reporting for them, as well as training them how to do so themselves', 'Aggregate our data into centralized full stack locations, such as Amplitude, SiSense or Tableau', 'Allow our Data Science team to focus on the ""Science"" by taking BI responsibilities off their plates', 'Provide insight which can turn into higher revenue and retention for the company', ""You've worked with high level BI solutions such as Amplitude, Tableau, Looker, or SiSense"", 'You have understanding of Stripe billing in a SaaS environment', 'You understand how to connect data sources together and aggregate them in single platforms for analysis', 'You are competent and comfortable with both low level analysis in SQL, and high level dashboard building', ""You've got 5+ years of experience in the field, especially working with SaaS subscription companies"", 'You understand data warehousing and lake implementations, and can build or provide technical insight into their implementation', 'You are comfortable working with medium to large scale production datasets without excess guidance', 'You are highly self-managed and motivated to drive project work', 'Experience with lower level aggregation platforms a plus, such as tying together AWS services such as S3, Athena, Redshift, and Glue', 'You are able to converse and collaborate effectively with our Data Science team', 'You can handle direct planning and conversations with other business units, such as Marketing and Finance, to help them gain data insight and achieve their goals', 'You exhibit a willingness to draw outside the lines of narrower BI Developer goals, to help connect data across different systems and sets in the company, including some loading and ETL tasks', 'Experience with languages such as Ruby or Python a plus', 'Fully paid health insurance and dental insurance for self and family.', 'Fitness Incentives Package', 'Company 401k matching up to federal maximum', 'Company Funded Headspace Account', 'Company Funded Audible Account', 'Funded HSA account', 'Duck Dining (office food, beverages, and the ability to request items) - Priceless', 'Casual Dress', 'Links - Send along any links that best showcase your experience, i.e. your portfolio, Github profile, LinkedIn, blog posts or other writing samples.', ""Cover Letter - Please provide a cover letter that aligns directly to this role. Introduce yourself as a part of our team and tell us why you're interested in Kajabi! Show us how you could make an impact in Kajabi's future as well as how Kajabi can influence yours. Feel free to get creative! We are committed to providing our undivided attention to you!""]",2020-07-27 17:13:16
"Sr. Product Manager, Data Platform",Sourceability,5 out of 5,United States,"['401(k)', '401(k) Matching', 'Dental Insurance', 'Flexible Schedule', 'Health Insurance', 'Paid Time Off', 'Vision Insurance', 'Monday to Friday', 'Product Management: 5 years (Preferred)', 'Fully Remote', 'No: Not providing sponsorship for this job']",2020-07-27 17:13:16
USDA School Nutritional Program Software Developer,Colyar Technology Solutions,N/A,"Scottsdale, AZ 85260",[],2020-07-27 17:13:16
Programmer/Software Development Engineer,Core Spaces,3.8 out of 5,"Chicago, IL 60625",[],2020-07-27 17:13:16
