job_title,company,company_rating,location,job_text,date
"Project Consultant - Business Platform, Manager Market Performance",Highmark Inc,3.2 out of 5,"Pittsburgh, PA 15222","[""Strategy. Mobilize strategy for strategic initiative (STI) planning, execution, and deployment. This is both for long range STI's and short term projects, as well as foundational investments. For an assigned functional area (e.g,. Sales), contribute and govern the portfolio of HMHS work including proposal development, customer communications, work estimates analysis/evaluation, and regular engagement with HMHS staff and business leadership around deliverables and statements of work. Foster and maintain integrated partnerships with HMHS (IT) and Consulting services counterparts and leadership as well as Health Plan executives and directors."", 'Leadership. Define structured professional development including mentorship, formal training, templates, and best practices in the area of project management and consulting. In managing complex projects and initiatives on behalf of the Health Plan for a department or functional area, build, share, and maintain expertise in both IT components as well as the business environment and external marketplace. Regularly interface with business leaders, Operational, and Product leaders, alongside HMHS senior consulting staff peers to help HMHS deliver on customer commitments. Collaborate with business leadership team on the strategic alignment of how HMHS affects operational and business (customer) needs. Lead cross functional teams to deliver on complex capabilities that the marketplace demands, owning bottom line accountability for business engagement with new/fixed/enhanced capabilities.', 'Operations. Work with HMHS practice and delivery leads to write the business requirements to be translated into technical requirements. Identify process improvement opportunities from technical issues that arise. Work with business leadership to address root causes, driving and overseeing recommended changes and process improvements. Collaborate with business leadership on the development of business cases, with aligned ROI, for future STI funded work that is over 500 hours. Ability to ""roll up sleeves"" and actively deliver and troubleshoot HMHS engagement opportunities, develop executive level communication strategies on high complex and escalated issues. Direct HMHS project teams in their interactions with business leaders and external clients, including matrixed/cross-functional teams.', 'Communications. Communicate with HMHS peers as enhancements/projects are scoped, developed, and delivered to ensure that HMHS teams have clear direction and proper inputs required to deliver solutions for the Health Plan. Communicate with HMHS senior consultants and solutioning and delivery leads to ensure that technical issues are properly defined as enhancements, defects, routine maintenance, etc. in order to drive timely resolution in a cost-effective manner. Provide regular status reporting on all tickets to business leadership, identifying tickets which require executive leadership influence to affect outcomes. Strategically plan communications to Health Plan business stakeholders on new initiatives and capabilities to ensure proper engagement and adoption.', 'Project Management. Regularly monitor the volume, duration, and severity of tickets submitted by assigned department / functional area, collaborating with HMHS peer senior consultants and escalating where needed. Work with business leaders (Director, VP and SVP) to appropriately analyze and prioritize/rank enhancements for approval. Communicate and escalate enhancements requiring VP level approval. Monitor and maintain enhancement hours and budget. Monitor and manage service level performance between HMHS and Health Plan business area.', 'Other duties as assigned.', ""Bachelor's Degree in Business Administration/Management or General Studies"", '6 years of experience in consulting and/or relevant business experience in the fields of IT, health insurance, Sales and/or Operations in lieu of degree', ""Master's Degree in Business Administration/Management"", '5 - 7 years in Communications, in a Business Analyst role or in the Health Insurance Industry', '3 - 5 years in Consulting', '1 - 3 years in IS/IT', '1 - 3 years in Operational Excellence', '0 - 1 years in Sales Account Management', '0 - 1 years in Sales Support', '0 - 1 years in Leadership', 'Prior Managed Care, Medicare, Healthcare Systems Microsoft Dynamics, Zoho or AgentCubed', 'Experience developing integrated system architectures comprising of CRM, web portals, telephony and associated sub-systems', 'Excellent functional and user acceptance testing experience', 'Experience developing sales process workflows and business rules', 'None', ""Producer's License - Accident & Health"", 'Analysis of business problems/needs', 'Analytical and Logical Reasoning/Thinking', 'Strategic Thinking', 'Health Insurance', 'Communication Skills', 'IT Industry', 'Operations', 'Leadership', 'Creativity Skills', 'Sales']",2020-07-27 17:06:04
CRM Marketing Manager,Company Confidential,N/A,"Newark, DE 19702","['Manage our CRM (Salesforce/Zoho and its integration with Shopify)', 'Nurture customer reviews and testimonials', 'Develop and implement email marketing campaigns', 'Track and report on engagement metrics', 'Manage list segmentation to deliver more targeted marketing', 'Design and improve the customer experience to increase conversions and customer retention', '3+ years B2C direct to consumer e-commerce marketing', 'Expertise in Salesforce', 'Demonstrated success building and implementing lead generating email campaigns', 'Experience in healthcare, beauty and wellness industries with a focus on exceptional customer service is strongly desired', 'Monday to Friday', 'Marketing: 3 years (Required)', 'No']",2020-07-27 17:06:04
Certified Public Accountant,ATG Accountants & Advisors,N/A,"Charlotte, NC 28204","['Organize and update financial records as needed (digital and physical)', 'Analyze transactions and prepare reports', 'Perform regular, detailed audits to ensure accuracy in financial documents, expenditures and investments', 'Forecast revenue and analyze profit margins', 'Oversee ledger reconciliation and manage accounts payable/receivable', 'Participate in budgeting processes', 'Brief senior managers regularly on the company’s financial status', 'Liaise with Tax Accountants to track tax payments and returns', 'Monitor bookkeeping activities regularly', 'Keep company financial information confidential', 'Establish accounting policies and procedures', 'Stay informed on industry developments and changes in regulations', 'Proven work experience as a Certified Public Accountant or Senior Accountant', 'Thorough knowledge of accounting and financial procedures', 'Understanding of Generally Accepted Accounting Principles (GAAP)', 'Experience with accounting software, like FreshBooks and Zoho', 'Advanced MS Excel knowledge (familiarity with formulas, VLOOKUPs and pivot tables)', 'Excellent analytical skills with an attention to detail', 'Integrity, with an ability to handle confidential information', 'BSc degree in Accounting or Finance and a CPA certification']",2020-07-27 17:06:04
Account Executive- Industrial/Municipal Wastewater Applications,Flo Trend LLC,N/A,"Houston, TX 77076","['Create and maintain outstanding professional business relationships with key executive level decision-making contacts within current and prospective wastewater accounts.', 'Develop, update, maintain and execute an approved sales plan that includes developing target account prospects. More specifically tailored around their upcoming project dates.', 'Utilize consultative selling skills to learn about the prospect’s business and the existing industrial or municipal wastewater needs of the customer. Understanding and the decision maker’s individual and/or departmental needs so that they can develop additional applications for current or future Flo Trend products and services, and to motivate and move the decision makers to sales close.', 'Prepare and present Flo Trend wastewater management equipment proposals, presentations, price quotes, and RFP responses that demonstrate an understanding of the prospect’s needs, illustrating Flo Trend products and services as an answer to the prospect needs.', 'Penetrate current accounts for the solicitation of new customers to propose and sell new Flo Trend products and services.', 'Must ensure that all sales calls, emails and customer contact information are logged into Zoho CRM.', 'Work closely with Industrial/Municipal reps on certain sales deals.', 'Conversational approach with prospects and customers.', 'Proficiency in the use of all Microsoft Office tools.', 'Must have the ability to complete start-ups at the customer jobsite to ensure Flo Trend equipment is installed properly, and the customers’ employees are adequately trained on how to operate the equipment.', 'Bachelor’s degree, preferably in chemistry or environmental sciences.', 'Three years outside business to business sales experience specifically in the waste water industry.', 'Must be able to demonstrate a consistent history of attaining monthly, quarterly and annual revenue plans/goals. Must have had, and attained actual annual, quarterly and monthly revenue plans/goals.', 'Experience in a defined geographic sales territory demonstrating strong time and territory planning skills.', 'Experience in the creation and execution of annual, quarterly, monthly and weekly sales territory plans.', 'Significant experience working via appointments and demonstrated success in getting appointments via the telephone, and making in person cold calls.', 'Experience and comfort with, and an ability to utilize consultative sales skills.', 'A strong understanding of the differences in the sales cycle and contacts of small, mid and large accounts.', 'Experience in prospect identification and development, and in keeping the suspect/prospect funnel full.', 'Experience and success in account penetration sales (departments/locations/divisions, and products/services).', 'Experience in creating and leading successful account growth and management strategies/plans including account penetration, service, maintenance and retention, as well as being the primary manager of the business relationship with the contact(s) and customer.', 'Demonstrated successes in short, medium and long business service sales cycles.', 'Thorough understanding of, and previous formal classroom environment training in, Consultative Selling Skills, Professional Selling Skills, Strategic Selling Skills, Tactical Selling Skills, Account Management and/or any other formal business to business sales skills (not product) training (must be able to name them).', 'Experience achieving weekly sales activities guidelines (number of sales calls, proposals etc).', 'Exceptional listening skills.', 'Strong proposal, presentation development, and delivery skills.', 'Strong written and oral communications skills.', 'Professional appearance and demeanor.', 'A strong preference will be given to candidates that have a background in selling waste management services, and even more specifically, grit and industrial wastewater sales experience in the Houston marketplace.', 'A background in chemistry, or an understanding of the profiling of non hazardous industrial waste.', 'Dental Insurance', 'Disability Insurance', 'Health Insurance', 'Life Insurance', 'Paid Time Off', 'Vision Insurance', 'Monday to Friday', 'Commission Pay', 'sales: 3 years (Required)', 'Wastewater Management: 1 year (Required)', ""Bachelor's (Required)"", 'Yes', 'Key Leader', 'Outcome-oriented -- results-focused with strong performance culture', 'flotrendllc.com', 'Waiting period may apply', 'No']",2020-07-27 17:06:04
Sales Account Executive North Region,Expedition Communications,N/A,"Dorado Municipio, PR","['401(k)', '401(k) Matching', 'Dental Insurance', 'Health Insurance', 'Paid Time Off', 'Monday to Friday', 'On Call', 'Overtime', 'Bonus Pay', 'Commission Pay', 'B2B Sales: 2 years (Required)', 'Internet Service, IT Systems and Solution Selling: 3 years (Preferred)', ""Bachelor's (Preferred)"", 'Dorado, PR (Required)', ""Driver's License (Required)"", 'English and Spanish (Required)', 'One location', 'Multiple locations', 'Fully Remote', 'On the road', '8AM', '5PM', 'www.expeditioncommunications.com', 'https://www.facebook.com/ExpCommPuertoRico/', 'Waiting period may apply', 'Only full-time employees eligible', 'Yes']",2020-07-27 17:06:04
Residential Project Manager,Green Power Systems,4 out of 5,"La Mirada, CA","['Building trust and rapport with prospective customers, demonstrating uncompromising customer service', 'Conducting 10+ In-Home Solar Consultations per calendar week (Road Warrior … 75% Travel)', 'Delivering outstanding presentations, accurate in-home needs assessments, and corresponding analysis … that create a high sense of urgency to act now', 'Work with GPS engineers and finance teams to identify the most appropriate technical, material, and financial solutions to optimize system competitiveness and be able to clearly present combined technical and financial solution to clients', 'Developing projects from inception to executed contract … generate leads/opportunities primarily through independent activities including account profiling, cold calls, business networking, and other market penetration strategies', 'Close residential sales orders for solar projects between 3 -and- 21 kW', 'Meet or exceed annual sales targets >$960k/yr (3-4 deals/month)', 'Following-up, customer service, and post-sale logistics', 'Participating in ongoing training, development, and departmental meetings as directed', 'Represent GPS at marketing events such as trade shows and industry events', 'Maintain activity pipeline tracking and deal performance reporting (Zoho and/or Salesforce experience preferred)', 'Minimum of 1-3 years of business-to-consumer residential solar sales experience, preferred', 'Successful track record closing deals in a consultative residential in-home sales environment, preferred', 'Self-motivated, independent professional with excellent communication skills, strong technical aptitude and the ability to thrive under pressure', 'Fundamental understanding of finance / business concepts (NPV, ROI, IRR, TCO, etc)', 'Professional appearance and effective interpersonal skills', 'Excellent written and oral communication skills', 'Basic knowledge of Microsoft Office applications including Word, Outlook, and Excel', 'Ability to work a variety of hours, including nights and weekends', 'Reliable vehicle and insurance … This position involves a large amount of travel so a valid driver’s license IS REQUIRED.', 'Must pass a background check and driving record check', 'Competitive Base Salary', 'Competitive Commission Plan', 'Paid Health Insurance', 'Paid Vacation, Sick, and Holidays', 'Self managed flexible work schedules and time off policies']",2020-07-27 17:06:04
Sales Engineer,MarketMuse,N/A,"Boston, MA","['3-4 years of experience in sales engineering', 'Strong understanding of digital marketing, content publishing and technical SEO', 'Excellent written and verbal communication skills', 'Impeccable grammar, proofreading and editing skills', 'Ability to organize, multitask and execute tasks in a high-paced environment', 'Ability to effectively collaborate with multiple stakeholders, in-person and remote, within MarketMuse, multiple departments of client organizations and third-party partners', 'Being honest, open and empathetic with other team members, clients and partners', 'Fluent in office software like MS Office, G Suite, etc.', 'Expertise with collaboration tools like Slack, Confluence, Box, etc.', 'Expertise with project management tools like Asana, Basecamp, Trello, Zoho, etc.', 'Familiarity with CRM platforms like Salesforce, HubSpot CRM, etc.', 'Experience working in a start-up preferred', 'Experience in agency sales preferred but not required', 'Experience with brand strategy, e-commerce, publishing, social media, UX/UI, product marketing, information architecture and analytics preferred but not required', 'Consult with SEO professionals, content strategists and Marketing decision makers (CMO, VP of Marketing)', 'Own the technology evaluation stage of the sales process with our prospects of various technical levels.', 'Creatively solve technical implementation issues in a variety of technical environments.', ""Collaborate with Sales to create data-driven proposals targeted to specific audiences, intents or other criteria specific to a client's needs"", 'Conduct market research and competitive intelligence', 'Partner with Product team to provide ""voice of the customer"" insight into end user needs and demands', 'Be the MarketMuse Suite Subject Matter Expert', 'Collaborate with Sales & Customer Success to effectively transition new clients into onboarding', 'All other duties as assigned', 'Leverage in-house developed training materials to ensure that you develop and sustain the product and market expertise required to be a consultative resource to your clients and prospects.', 'Conduct yourself in a professional matter at all times, and treat your colleagues, partners, clients, and potential clients with respect and courtesy in every business and social interaction.']",2020-07-27 17:06:41
Internet Marketing Sales Directors,The Search Market Firm,N/A,"Lake Oswego, OR","['Sell websites to real estate agents and companies across the United States', 'Sell websites and marketing services to any vertical', 'Sell social media marketing packages', 'Sell digital marketing service- Google Adwords, Bing marketing, SEO services', 'Sell our new custom real estate CRM (it really sells itself)', 'Sell Ring Central phone systems', 'Consult with prospective clients to sell Internet marketing products and services', 'Up-sale and cross sell existing clients and database', 'Analysis client’s current marketing strategies and telecommunication strategies to find gaps and potential sales opportunities', 'Assist clients with initial setups, order taking, and customer service', 'Arranging consultations for higher level accounts to senior management', 'At least 2 years of solid sales experience', 'Be a driven and motivated sales individual (we cant teach motivation)', 'Web marketing basic knowledge', 'Strong proactive communication skills', 'Ability to maintain professionalism at all times', 'Ability to work on your own with minimal supervision', 'SEO experience', 'Marketing degree graduates', 'Google Adwords skills', 'Telecommunication sales skills', 'Cloud technologies and network skills', 'Bing marketing skills', 'Facebook marketing and targeting', 'Blogging experience', 'Real estate experience', 'Real estate marketing', 'Salesforce experience', 'Zoho CRM experience', 'WordPress, Drupal, CSS, HTML, MYSQL, JAVA, Bootstrap, etc.', 'Google Apps development']",2020-07-27 17:06:41
Loan Officer,LoanBox Mortgage,N/A,"Costa Mesa, CA 92626","['Loan Origination: 2 years (Required)', 'NMLS (Preferred)', 'Adaptable/flexible -- enjoys doing work that requires frequent shifts in direction', 'High stress tolerance -- thrives in a high-pressure environment', 'www.loanboxmortgage.com/apply', 'Yes']",2020-07-27 17:06:41
Administrative Support Specialist,"World of Awnings and Canopies, Inc.",N/A,"Los Angeles, CA 91352","['Deal directly with customers either by telephone, electronically or face to face', 'Ensures appropriate follow-through steps are completed for each call', 'Maintains complete and accurate records of all call activity as required', 'Assist salespersons with different types of office duties', 'Respond promptly to customer inquiries', 'Handle and resolve customer complaints', 'Obtain and evaluate all relevant information to handle product and service inquiries', 'Provide pricing and delivery information', 'Perform customer verifications', 'Set up new customer accounts', 'Process orders, forms, applications and requests', 'Organize workflow to meet customer timeframes', 'Direct requests and unresolved issues to the designated resource', ""Manage customers' accounts"", 'Keep records of customer interactions and transactions', 'Record details of inquiries, comments and complaints', 'Record details of actions taken', 'Prepare and distribute customer activity reports', 'Maintain customer databases', 'Manage administration', 'Communicate and coordinate with internal departments', 'Follow up on customer interactions', 'Provide feedback on the efficiency of the customer service process', 'High School Degree or equivalent experience, Associates Degree preferred', 'Draft designs with AutoCAD', 'CRM Experience (Hubspot, Zoho, etc.)', '3+ years of professional work experience', 'Advanced in Microsoft Office Suite (Word, Excel, Powerpoint, etc.)', 'Knowledge of customer service principles and practices', 'Knowledge of relevant computer applications', 'Ability to type; data entry', 'Knowledge of administrative procedures', 'Interpersonal skills', 'Communication skills - verbal and written', 'Computer skills', 'Listening skills', 'Problem analysis and problem-solving', 'Attention to detail and accuracy', 'Data collection and ordering', 'Customer service orientation', 'Adaptability', 'Customer Service: 3 years (Preferred)', 'Associate (Preferred)', 'One location', '8AM', '5PM', 'Monday to Friday', '8 hour shift', 'www.aworldofawnings.com', 'No']",2020-07-27 17:06:41
Salesperson,AKCP,N/A,"Arundel, ME 04046","['401(k)', 'Dental Insurance', 'Health Insurance', 'Paid Time Off', 'Vision Insurance', '8 Hour Shift', 'Day shift', 'Holidays', 'Weekends', 'Bonus Pay', 'One location', 'Health insurance', 'Dental insurance', 'Cape Arundel Cottage Preserve', 'Cape Arundel Cottage Preserve']",2020-07-27 17:06:41
"Sales Ambassador, Pacific Northwest",Enviral Tech,N/A,"Eugene, OR","['Calling on prospective Enviral Tech Long Term care accounts to grow new customer sales.', 'Conduct business reviews and ensure customer satisfaction with individual facilities and regional offices.', 'Implement new sales programs with assistance from Enviral Tech Executive Team.', 'Conduct in-service training programs for new accounts.', 'Consult with Enviral Tech Long Term Care accounts, to ensure efficient usage of Enviral Tech’s products, upsell services and coordinate any necessary corrective actions.', 'Bachelor’s degree', 'Strong written and verbal communication skills', '2-5 years sales experience within the long term care setting (must disclose documented prior sales goals, performance, and earnings during interviewing process)', 'Track record of winning projects, opening new accounts and consistently exceeding sales quotas.', 'Strong knowledge of CRM software (Zoho preferred) and lead generation tools and techniques.', 'Excellent verbal and written skills.', 'Self-motivated and independent', 'Some scientific background a plus.']",2020-07-27 17:06:41
Sales & Marketing Support,Manquen Vance,N/A,"Troy, MI 48084","['New Business Onboarding/Tracking-RDS', 'Public sector consortium', 'New Pharmacy program', 'Prepare for prospect meetings', 'Support and organize presentations for new initiatives', 'Manage the CRM (Zoho) for new leads; and follow up efforts', 'Coordinate Events and Speaking Opportunities', 'Eventually Be Able to Speak High-Level around Business Initiatives', 'Prepare RFP responses', 'Excellent relationship building and prospecting skills', 'Ability to support appointment setting', 'Assist with market analysis and identifying top prospects for sales and marketing actions', 'Experience in the Group Health Insurance market or PBM industry.', 'Strong Oral and written communication', 'Very organized', 'Professional Presence', 'Time management', 'Listening skills', 'MS Office (Word, Excel, PowerPoint, Outlook): Proficient', 'Familiar with CRM systems (Zoho CRM, Hubspot CRM)', 'Bachelor’s degree in business administration or marketing', '5+ years of sales experience', '3+ years of sales experience in group health insurance, ancillary group insurance products or PBM industry', 'Experience in sales support/marketing within a group broker agency (group health insurance)', 'Knowledge of group health and welfare benefits, wellness programs, self -funding techniques, and pharmacy programs']",2020-07-27 17:06:41
