job_title,company,company_rating,location,job_text,date
Account Manager,TK-Chain LLC,N/A,"Township of Franklin, NJ","['Serve as the lead point of contact for all customer account management matters', 'Build and maintain strong, long-lasting client relationships', 'Negotiate contracts and close agreements to maximize profits', 'Develop trusted advisor relationships with key accounts, customer stakeholders and executive sponsors', 'Ensure the timely and successful delivery of our solutions according to customer needs and objectives', 'Clearly communicate the progress of monthly/quarterly initiatives to internal and external stakeholders', 'Develop new business with existing clients and/or identify areas of improvement to meet sales quotas', 'Forecast and track key account metrics (e.g. quarterly sales results and annual forecasts)', 'Prepare reports on account status', 'Collaborate with sales team to identify and grow opportunities within territory', 'Assist with challenging client requests or issue escalations as needed', 'Proven work experience as an Account Manager, Key Account Manager, Sales Account Manager, Junior Account Manager or relevant role', 'Demonstrable ability to communicate, present and influence key stakeholders at all levels of an organization, including executive and C-level', 'Solid experience with CRM software (e.g. Salesforce, Zoho CRM or HubSpot) and MS Office (particularly MS Excel)', 'Experience delivering client-focused solutions to customer needs', 'Proven ability to juggle multiple account management projects at a time, while maintaining sharp attention to detail', 'Excellent listening, negotiation and presentation abilities', 'Strong verbal and written communication skills', 'BA/BS degree in Business Administration, Sales or relevant field', 'Health Insurance', 'Paid Time Off', 'Monday to Friday', 'Staffing: 3 years (Preferred)', 'sales: 3 years (Preferred)', ""driver's license (Preferred)"", 'Commission', 'Multiple locations', 'Fully Remote', 'No', 'Key Leader', 'Manage multiple accounts, ensuring that a high level of customer retention and satisfaction is maintained', 'Meet monthly quotas', 'Engage with multiple customers on a daily basis by reaching out to new clients, and by developing campaigns for maintaining customer loyalty', 'Implement strategies for retaining customers requesting to terminate or downgrade their account', 'Record changes to customer accounts, updating service packages, adding accounts, and removing accounts as needed', 'Detail-oriented -- quality and precision-focused', 'Innovative -- innovative and risk-taking', 'Aggressive -- competitive and growth-oriented', 'Outcome-oriented -- results-focused with strong performance culture', 'Stable -- traditional, stable, strong processes', 'People-oriented -- supportive and fairness-focused', 'Team-oriented -- cooperative and collaborative', 'https://tk-chain.com/', 'https://www.facebook.com/tkchain', 'Waiting period may apply', 'Temporarily due to COVID-19']",2020-07-27 17:01:37
"Director, Business Development, Non Clinical, Toxicology Services-MA",Frontage Labs,2.5 out of 5,"Painesville, OH","['Meet or exceed revenue objectives for assigned region', 'Solicit and develop new business opportunities through direct calling efforts, referral sources, industry trade shows and conferences, and meetings; as well as any other appropriate means', 'Visit existing and former customers periodically to reaffirm satisfaction and identify new and expanding opportunities for deeper client engagement.', 'Develop new business plans for existing customers as well as potential new customersRespond to new business development leads promptly and coordinate / follow up with internal support team to ensure same', 'Qualify, pursue, and close new opportunities.Identify decision-makers and areas of need.Negotiate and close', 'Keep accurate records of calls, meetings and other activities (call reports) in CRM', 'Maintain an up to date pipeline of new business opportunities', 'Assist with preparing proposals, quotes, and customer contracts', 'Develop a comprehensive understanding of all services offered', 'Other duties as assigned by management.', 'Minimum of five years of demonstrated success in outside sales / business development in a scientific field.', 'Proven sales experience with a history of sustainable growth is a must.', 'Familiarity with GLP regulatory process. Prior experience in a GLP CRO is a plus.', 'Familiarity with drug development biology to include toxicology, metabolism, and pharmacokinetics.', 'Excellent organizational and planning skills', 'Ability to operate in an independent, self-directed manner', 'Good communication skills, including persuasive interpersonal communication and sales techniques to include presentation skills, sales interview skills, and closing skills.', 'Working knowledge of business office software (Word, Excel, PowerPoint, Outlook)', 'Working knowledge of CRM (Salesforce, Microsoft Dynamics, Zoho, or other)', 'BS required – biology, chemistry, or related', 'Must have a valid driver license.', 'Must have a functional home office setup.']",2020-07-27 17:01:37
COORDINATOR,Education Development Center,4.2 out of 5,"Waltham, MA 02453","['communicate clearly, courteously, and professionally with internal EDC staff and external clients', 'develop and maintain positive relationships with clients, consultants, collaborators, co-workers, field sites, and funders', 'work respectfully with EDC colleagues', 'Coordinates and processes contracts, invoices, and deliverables for various ZSI and AMSR projects', 'Maintains organization of general email inquiries, ensuring seamless customer service', 'Negotiate contracts with external clients based on ZSI protocol and policy; including abiding by EDC policy.', 'Coordinate contract deliverables and operations with ZSI staff, primary with ZSI Project Leads, ZSI Business Associate and Administrative Coordinator team.', 'Utilizes various technology platforms to assist in the management, delivery, and facilitation of ZSI operations and servicecs (ie: WebEx, Adobe Connect, Zoom, RingCentral, SalesForce, Zoho CRM, EventSquid, Basecamp)', 'Associate’s degree with 3–5 years related administrative coordination experience or Bachelor’s degree in related field', 'Communications: Strong written and verbal communication skills. Able to communicate effectively with colleagues, project partners, and funders, especially at conferences about . Experience developing and reviewing written materials for outside audiences.', 'Collaboration: Ability to work both independently without close oversight, but also a team player who will productively engage with others across the team and the larger project. Confident but asks for help as tasks become more complex. Experience working with diverse audiences a plus. Some experience planning and executing meeting logistics.', 'Relationship Building: Demonstrated ability to develop collaborative relationships with colleagues, partners, and funders over long distances and virtually.', 'Technology: Applicant embraces technology and uses it to increase efficiency. Knowledge of administrative techniques and systems.', 'Personal Qualities: A professional who excels in a mission-driven, rapidly evolving environment. Someone who exhibits flexibility, enthusiasm, responsiveness, aptitude for details, a positive attitude, creativity, strategic and analytical thinking, self-motivation, attentiveness to cultural differences, and problem solving skills, as well as the ability to be proactive and to produce quality work under tight deadlines.', 'Strong organizational, communication, ability to take initiative and customer service skills required.', 'Strong technical skills and ability to adapt and/or learn quickly and independently required.', 'Strong commitment to client success and customer service experience required.']",2020-07-27 17:01:37
Sales Support Specialist,"Vervent, Inc",N/A,"San Diego, CA 92121","['Provide administrative support for Sales and Marketing by scheduling sales appointments, managing calendars, and by answering and responding to all sales phone line inquiries.', 'Oversee mailing correspondence, while following up on day-to-day deliverables as assigned to include sending client letters, notes, and any welcome gifts as needed.', 'Under supervisor direction; follow up and oversee department supplies, business card orders, and ensuring accurate coordination of internal travel arrangements.', 'Monitor, plan and prepare Sales and Marketing department events.', 'Have working knowledge of Zoho CRM & Lead Management.', 'Utilize time strategically to provide updates and logging data, as well as data management, task assignment, tracking, and reporting.', 'Must be able to provide sales process support, backup servicing synchronization, while maintaining due diligence and follow up for seamless coordination of such tasks.', 'Collaborate with team to ensure lead flow and tracking are up-to-date and accurate.', 'Help establish, maintain and communicate brand standards via all communication channels.', '4-7 years of executive admin or sales support experience.', 'Highly skilled with MS Office suite.', 'Excellent communication skills – written and verbal.', 'Multi-tasker, deadline driven, and a solid team player.', 'High attention to detail, excellent organizational abilities and time management skills.', 'Success-driven; with a proactive nature to complete tasks in a group environment.', 'Ability to work independently and easily by following specified instructions.', 'Bachelor’s degree in Marketing, Business or related field.']",2020-07-27 17:01:37
Sales Development Representative,Contour Data Solutions,2.6 out of 5,"Salt Lake City, UT","['Prospect to find new opportunities', 'Identify, qualify, and set appointments for sales counterparts', 'Deep understanding and research of key accounts • Help progress opportunities as needed and directed', 'Qualify and respond to daily inbound marketing leads', 'Occasionally attend regional trade shows to meet with prospects face-to-face', 'Work closely with team lead to identify sales targets, initiatives, penetrate new accounts', 'Work closely with channel partners when necessary to do call blitz sessions and maximize the relationships we have built over the years', 'Continually keep up with industry trends and competitive information', 'Experience with Salesforce.com is a huge plus and will be a daily requirement, use of other sales enablement tools will be required as well', 'Reside in local sales area', 'BS/BA degree or equivalent', 'Excellent communication, presentation, problem-solving and time management skills', 'Experience working with Salesforce / Zoho CRM', 'Strong phone presence and experience dialing dozens of calls per day', 'Ability to multi-task, prioritize, and manage time effectively', 'Committed to continuous education through workshops, seminars and conferences', 'Demonstrated ability to communicate, present and influence credibility and effectively at all levels of the organization']",2020-07-27 17:01:37
Regional Sales Representative,FDS AVIONICS,2.8 out of 5,"Alpharetta, GA 30005","['Source new sales opportunities through inbound telephone and email lead follow-up', 'Conduct outbound telephone and email prospecting in assigned geographic territory', 'Analyze customer needs and recommends products and solutions that best meet the customer requirements (driving to sales closure)', 'Quote accurate and timely pricing and lead times for all prospective opportunities', 'Remain knowledgeable and current on the features and benefits for all relevant FDS products', 'Provide presentations to customers, representing FDS Avionics products and solutions, tailored to customer requirements.', 'Develop key initiatives to increase customer awareness of FDS and our products', 'Build and manage the new business opportunity pipeline, measured by number of opportunities and dollar value of opportunities', 'Achieve quarterly quotas as assigned by Management', 'Maintain and expand CRM & Pipeline data base in assigned territory', 'Perform effective product demonstrations to prospective customers and dealers', 'Work closely with external dealers and partners to ensure that these channel partners are successful', 'Develop and maintain strong awareness of industry trends and competitors', 'Brief management regularly and clearly about ongoing activities and the status of new business pursuits in your assigned territory', 'Meet with customers occasionally, as required, to develop opportunities and capture new orders', 'This is an inside position and expected travel is <10%', '2-5 years of proven technical sales experience, preferably in the aerospace segment', 'Prior experience selling technical products, business to business, is required', 'An understanding of aviation products is preferred', 'Track record of consistent overachievement of sales quotas', 'Outgoing, friendly personality with a competitive spirit', 'Strong telephone skills and etiquette with excellent verbal communication skills', 'Proficient with high tech/corporate capabilities presentations', 'Strong technical aptitude and interest in aviation', 'Experience working with Zoho, Salesforce.com, or similar CRM', 'Excellent written communication skills, including customer proposal preparation capabilities', 'Proven ability to work in a team-based, entrepreneurial, cross-functional environment and achieve results', 'Strong listening, questioning, and presentation skills', 'Ability to prioritize and manage time effectively', 'Self-starter, motivated to succeed', 'Customer-centric mindset capable of working through difficult situations in order to achieve success', 'BA/BS degree or equivalent, preferably in a technical discipline', 'Pilot’s license is a plus', 'Proficiency with MS Office Suite (Word, Excel, PowerPoint)', 'Proficiency in Microsoft Office Suite; basic understanding of Adobe Suite, Photoshop, coding experience is a plus, but not required.', 'Knowledgeable in the use of MRP/ERP systems with experience in SYSPRO strongly preferred.', '', 'a vendor agreement is already in place, and', 'the agency has received a formal instruction from a member of the Talent Acquisition team to submit candidates to a vacancy.']",2020-07-27 17:01:37
Retail Sales Associate,SugarHouse Awning Industries,5 out of 5,"Midvale, UT","['801-563-9600', 'DIRECTIONS', 'FOLLOW US!', 'AwningsCommercial AwningsRestaurant SolutionsResidential AwningsPatio & DeckWindowDrop ShadesCare & Operation', 'Boat CoversOverviewBoat Tops & BiminisSnap-On CoversTie-Down CoversCinch CoversBoat EnclosuresMarine UpholsteryMarine CarpetBoat AccessoriesCare & CleaningBoat & RV Storage', 'Other ProductsHealthcareA/C CoversUTV Tops & EnclosuresCustom Canvas ProductsGeneral Use TarpsSnow TarpsUpholstery & FurnitureRV Trailer Skirting', 'Print SolutionsOverviewMarketing ServicesLarge Format PrintingQuick Turn PrintEventsFleet GraphicsWarehouse & Fulfillment', 'ServicesRepairCleaningInstallationWelding ServicesTake Down & Put UpBoat & RV Storage', 'Gallery', 'Blog', 'CompanyAboutCustomer ReviewsDiscounts & SpecialsRequest an EstimateEmploymentSupport CenterContact Us', 'Greet customer, responding to questions and provide outstanding customer service', 'Direct customers to merchandise within the store', 'Introduce promotions and opportunities to customers', 'Source sales opportunities through inbound lead follow-up', 'Operate cash registers, managing financial transactions', 'Maintain an orderly appearance throughout the sales floor', 'Superior product knowledge', 'Educate customer on the proper care and use of canvas products', 'Quote customers on the cost of repairs and new custom products', 'Respond to live chat and email inquiries', 'Achieve established team sales goals', 'Educate customers about all SugarHouse products and services', 'Proven retail sales experience', 'Excellent customer service skills', 'Ability to deliver customer/sales expectations via phone', 'Experience working with Zoho or similar CRM', 'Excellent verbal and written communication skills', 'Strong listening and presentation skills', 'Ability to multi-task, prioritize, and manage time effectively', 'Must be able to lift 45+ Pounds', 'Must have internet/ basic computer skills in Excel, Word, etc.', 'Reliable attendance/self-starter', 'Must pass pre-employment and random drug testingMust be nice. We are nice people and only want to work with other nice people. No exceptionsWinning attitude/never satisfied with status quo', 'Paid Holidays', 'Paid Time-Off', '401k with company match', 'Health insurance', 'Dental Insurance', 'Life Insurance', 'Family-oriented company', 'Stable business since 1941', 'High School Diploma / G.E.D. (Some college preferred)', 'Customer service experience', 'Prepress and copy center experience preferred', 'Experience in Adobe Illustrator, InDesign, Photoshop, and Acrobat', 'Basic math skills', 'Excellent communication skills', 'Ability to plan and organize, as well as transition from task to task fluidly', 'Sense of urgency', 'Take direction well', 'Able to lift 45+ Pounds', 'Internet / computer skills', 'Experience with Microsoft Excel / Word', 'Able to type approximately 50 WPM', 'Pass pre-employment and random drug testing', 'Must be nice. We are nice people and only want to work with other nice people. No exceptions.', '401(k)', '401(k) Matching', 'Dental Insurance', 'Flexible Spending Account', 'Health Insurance', 'Life Insurance', 'Paid Time Off', '8 Hour Shift', 'Monday to Friday', 'Overtime', 'customer service: 1 year (Preferred)', 'Copy Center: 1 year (Preferred)', 'Prepress/design: 1 year (Preferred)', 'High school or equivalent (Required)', 'One location – 7526 So. State Street, Salt Lake City, Utah 84047', 'Email', 'Phone', 'Chat', 'In person', 'www.sugarhouseprint.com', 'https://www.facebook.com/sugarhousebanners/', 'No']",2020-07-27 17:01:37
Retail Sales Associate,SugarHouse Awning Industries,5 out of 5,"Midvale, UT","['801-563-9600', 'DIRECTIONS', 'FOLLOW US!', 'AwningsCommercial AwningsRestaurant SolutionsResidential AwningsPatio & DeckWindowDrop ShadesCare & Operation', 'Boat CoversOverviewBoat Tops & BiminisSnap-On CoversTie-Down CoversCinch CoversBoat EnclosuresMarine UpholsteryMarine CarpetBoat AccessoriesCare & CleaningBoat & RV Storage', 'Other ProductsHealthcareA/C CoversUTV Tops & EnclosuresCustom Canvas ProductsGeneral Use TarpsSnow TarpsUpholstery & FurnitureRV Trailer Skirting', 'Print SolutionsOverviewMarketing ServicesLarge Format PrintingQuick Turn PrintEventsFleet GraphicsWarehouse & Fulfillment', 'ServicesRepairCleaningInstallationWelding ServicesTake Down & Put UpBoat & RV Storage', 'Gallery', 'Blog', 'CompanyAboutCustomer ReviewsDiscounts & SpecialsRequest an EstimateEmploymentSupport CenterContact Us', 'Greet customer, responding to questions and provide outstanding customer service', 'Direct customers to merchandise within the store', 'Introduce promotions and opportunities to customers', 'Source sales opportunities through inbound lead follow-up', 'Operate cash registers, managing financial transactions', 'Maintain an orderly appearance throughout the sales floor', 'Superior product knowledge', 'Educate customer on the proper care and use of canvas products', 'Quote customers on the cost of repairs and new custom products', 'Respond to live chat and email inquiries', 'Achieve established team sales goals', 'Educate customers about all SugarHouse products and services', 'Proven retail sales experience', 'Excellent customer service skills', 'Ability to deliver customer/sales expectations via phone', 'Experience working with Zoho or similar CRM', 'Excellent verbal and written communication skills', 'Strong listening and presentation skills', 'Ability to multi-task, prioritize, and manage time effectively', 'Must be able to lift 45+ Pounds', 'Must have internet/ basic computer skills in Excel, Word, etc.', 'Reliable attendance/self-starter', 'Must pass pre-employment and random drug testingMust be nice. We are nice people and only want to work with other nice people. No exceptionsWinning attitude/never satisfied with status quo', 'Paid Holidays', 'Paid Time-Off', '401k with company match', 'Health insurance', 'Dental Insurance', 'Life Insurance', 'Family-oriented company', 'Stable business since 1941', 'High School Diploma / G.E.D. (Some college preferred)', 'Customer service experience', 'Prepress and copy center experience preferred', 'Experience in Adobe Illustrator, InDesign, Photoshop, and Acrobat', 'Basic math skills', 'Excellent communication skills', 'Ability to plan and organize, as well as transition from task to task fluidly', 'Sense of urgency', 'Take direction well', 'Able to lift 45+ Pounds', 'Internet / computer skills', 'Experience with Microsoft Excel / Word', 'Able to type approximately 50 WPM', 'Pass pre-employment and random drug testing', 'Must be nice. We are nice people and only want to work with other nice people. No exceptions.', '401(k)', '401(k) Matching', 'Dental Insurance', 'Flexible Spending Account', 'Health Insurance', 'Life Insurance', 'Paid Time Off', '8 Hour Shift', 'Monday to Friday', 'Overtime', 'customer service: 1 year (Preferred)', 'Copy Center: 1 year (Preferred)', 'Prepress/design: 1 year (Preferred)', 'High school or equivalent (Required)', 'One location – 7526 So. State Street, Salt Lake City, Utah 84047', 'Email', 'Phone', 'Chat', 'In person', 'www.sugarhouseprint.com', 'https://www.facebook.com/sugarhousebanners/', 'No']",2020-07-27 17:02:13
Technology Director,Mondo,N/A,"Manhattan, NY","['Working with digital product owners and design/UX to plan and code customer-facing application/site/email templates and builds', 'Work alongside design/UX in iteration to create best in class digital assets.', 'Contribute to omni-channel opportunities through architecture, configuration and component selection', 'Ensure quality, performance, efficiency of business technology platforms/sites/assets', 'Be a source of peer knowledge and evaluation of 3rd party technology vendors and partners', 'Be the technical manager (not project manager) of several large build efforts', 'Find efficiency, opportunity and innovation in customer-facing and business-facing stack integrations, data flow, and operations', 'Contribute to the overall digital and technology roadmap of the client through deep understanding of full-stack architecture and platform (cloud-based) infrastructure.', 'Should have (some/strong) knowledge in cloud application architecture best practices', '5+ years of professional experience in application development for a B2C or B2B business.', 'Expert knowledge of applicable languages and platforms: HTML/CSS/javascript, php, rails, SQL-based databases, application architecture, webservices and API best practices, AWS and cloud architecture, Email platform (Salesforce/Eloqua, etc), CMSs', 'Write well designed, testable, efficient code by using best software development practices', 'Experience with CRM Salesforce, Zoho, other', 'Experience working with cross functional team', 'Experience being the technical lead on complex technical projects.', 'CMS experience ideally Wordpress, and larger (AEM, Sitecore, etc.)', 'Understanding of the Agile software development life cycle', 'Knowledge of release management process and disciplines, including continuous integration and deployment systems', 'High degree of initiative and ability to lead development projects, small and large, without day-to-day supervision', 'Ability to communicate complex information to audiences of various technical knowledge levels', 'Superior organizational skills, and attention to detail', 'You learn new technologies quickly and can comfortably and effectively discuss the tradeoffs and benefits of various approaches with your engineering peers.', 'Integrate data from various back-end services and databases such as Oracle and SQL Server']",2020-07-27 17:02:13
Sales Operations Manager,LQ Digital,2.5 out of 5,"Oakland, CA","['Work with the LQ Client Onboarding team to define the data we need to extract from client CRMs to provide sales insight to marketing efforts', 'Work with LQ Data engineers to design and maintain data pipelines between different data platforms', 'Work with LQ’s BI team to design and maintain data visualizations and pipeline reports for use by Client Services.', 'Work with LQ Client services team to scope, design, and deliver mission critical data infrastructure to enable their decisions.', '4-6 years of direct experience building processes and reports in a cloud hosted CRM solution e.g. Salesforce, Hubspot, Zoho, etc.', '3+ years working with any SQL based query language to extract data joined between multiple tables', 'Understanding of relational database models and the ability to interpret table schemas', '2+ years working with a business stakeholder and delivering data and insights to support their decision-making process', '2+ years interfacing with data engineers to build requirements to enable new reporting functionality', 'Experience serving an external client is preferred but not required']",2020-07-27 17:02:13
