job_title,company,company_rating,location,job_text,date
Inside Sales Representative,Higher Ground Gear,N/A,"Saline, MI 48176","['Responsible for a geographic territory and possibly some specifically targeted', 'Setup end user account calls either directly or with Channel Resellers when applicable to enhance the promotion of HGG Products with the end-user accounts.', 'Setup channel partner account calls to enhance the promotion of HGG Products to the partners organization and to their end-user accounts.', 'Setup training events with Channel Partner accounts to ensure knowledge and grow awareness of products, programs and services by their sales representatives.', 'Work closely with sales reps from major laptop and tablet brands to provide solutions to their hardware deployments. Key partners include Apple, Dell, HP,', 'Engage with third party partners we support and other “influencer” relationships to increase brand awareness and penetration in assigned territory.', 'Work with sales management to ensure the company has an accurate rolling', 'Develop quarterly sales plans for applicable Channel Resellers. Submit to your', 'Maintain and submit a weekly pipeline report of all large opportunities identified above and beyond normal run rate business.', 'Ensure that all Zoho account information is input consistently and accurately for all territory accounts in a timely manner.', 'Consistently provides competitive updates on products, promotions, pricing and services to sales management.', 'Support logistics for all in-territory trade shows and other onsite marketing activities in their territory as reasonably requested.', 'Health Insurance', 'Paid Time Off', '8 Hour Shift', 'Monday to Friday', 'inside sales: 1 year (Preferred)', 'Associate (Preferred)', 'United States (Required)', 'Commission', 'Yes', 'Ops Manager', 'Innovative -- innovative and risk-taking', 'People-oriented -- supportive and fairness-focused', 'Team-oriented -- cooperative and collaborative', 'www.hggear.com', 'https://www.facebook.com/Highergroundgear', 'Waiting period may apply', 'Only full-time employees eligible', 'No']",2020-07-27 16:56:38
Client Relations Specialist,Dynix Diagnostix,N/A,"Palm Beach County, FL","['Resolve routine customer requests with products or services via inbound, outbound calls, or the Internet', 'Speak with customers in a courteous, friendly, and professional manner using protocol procedures', 'Inquire, clarify, and confirm customer requirements and understanding of the solution. Provide additional customer education as needed', 'Qualify and establish inbound new customers requesting Dynix products and services', 'Work in multiple databases to research complex issues and questions', 'Notify clients of test results', 'Review test forms for accuracy', 'Participate in activities designed to improve customer satisfaction and business performance', 'Perform administrative support for medical record management, CRM data maintenance, and internal records to assure HIPAA compliance', ""High School Diploma or GED equivalent required. Bachelor's degree highly desired"", 'Previous experience in a customer service role required', ""Experience working in a contact center/call center environment and/or healthcare industry, such as a physician's office or hospital highly preferred"", 'Knowledge of Microsoft Office suite required. Experience with Zoho.com and/or Laboratory Information Systems preferred', 'Strong verbal and written communication skills and excellent ability to listen and respond', 'Must be courteous with strong customer service orientation', 'Excellent multitasking abilities required', 'Strong flexibility and the ability to manage and adapt to changing priorities quickly', 'Bilingual in English and Spanish highly desirable', 'Monday - Friday 8:00 am -5:00 pm', 'Dental Insurance', 'Health Insurance', 'Paid Time Off', 'Vision Insurance', 'Monday to Friday', ""Bachelor's (Preferred)"", 'United States (Required)', 'https://www.dynixdiagnostix.com/', 'Waiting period may apply', 'No']",2020-07-27 16:56:38
Center Director,Hope and Recovery Resource Center,N/A,"Pocatello, ID 83201","['Bachelor’s Degree in Human Services or related field desired or equivalent experience.', 'Prefer successful and progressive experience in service/program delivery with a nonprofit organization.', 'Demonstrated supervisory/management capacity.', 'Cross-cultural skills, and experience with culturally diverse populations.', 'Demonstrated excellence in written and oral communication skills.', 'Familiarity with recovery-based projects and services preferred.', 'Reports directly to the Executive Director', 'Responsible for the daily operations of the recovery community center.', 'Provide individual (one-on-one) support, system navigation for recoverees and their families, provide resources, referrals, answer phone calls and handle requests for assistance. Up to 25% of time may be dedicated to one-on-one assistance.', 'Works with the Executive Director in establishing the annual budget', 'Maintains daily budgetary records.', 'Oversees the provision of peer recovery support services development, coordination, implementation and management at local level.', 'Ensures that Telephone Recovery Support/Recovery Check-ups operates efficiently in their recovery community center.', 'Works with Peer Coordinator to schedule and implement recovery oriented support groups, trainings and events in accordance with established protocols.', 'Supervise Data/Clerical staff, maintains data system', 'Assists Executive Director in writing reports and keeps pertinent and accurate records.', 'Assist Executive Director in fundraising efforts.', 'Other duties as required', 'Monthly Board Report Volunteer training', 'IROC reports/invoices Recovery Peer volunteer training', 'Appendix D, Appendix C Staff training', 'ZOHO data analysis', 'Annual Report preparation', 'Valley Office Systems', 'Manage Facebook page Bike program', 'Manage Webpage Transportation program', 'Manage Ooma phone system Activity Committee', 'Answer/direct emails', 'FAXing', 'Promotional flyers', 'Maintain policies and procedures', 'Manage budget', 'Deposit/income spreadsheet', 'Expenditures spreadsheet', 'Pay monthly bills', 'Develop Annual budget with Executive Director', 'Document/reply to donations', 'Coordinate annual breakfast', 'Develop fundraising materials', 'Organize fundraising events', 'Peer Coordinator', 'Rural Outreach Coordinator', 'Data Manager', 'Support Peer and Volunteer coordinators in conflict resolution', 'Incident reports', 'Policy implementation', 'Hopes Closet', 'Disability Insurance', 'Flexible Schedule', 'Paid Time Off', 'Monday to Friday', 'A “Fair Chance” job (you or the employer follow Fair Chance hiring practices when performing background checks)', 'A job for which all ages, including older job seekers, are encouraged to apply', 'Open to applicants who do not have a college diploma', 'www.hopeandrecovery.net', 'Only full-time employees eligible', 'No']",2020-07-27 16:56:38
Business Application Administrator,Intellor Group,3.2 out of 5,"Gaithersburg, MD 20877","['Administer user accounts', 'Troubleshoot user issues', 'Research and implement new features', 'Manage the configuration of software applications', 'Monitor applications daily and respond to security or usability concerns', 'Perform application upgrades', 'Serve as the primary point of contact with vendors', 'Develop supporting documentation', 'Bachelor’s degree or higher in a related field and/or a combination of equivalent and relevant work experience', 'Systems administration experience configuring Salesforce or similar CRM product, including workflows, validation rules, and security controls', 'Prior experience in customer support (help desk, live chat, etc)', 'Experience serving as the subject matter expert on software applications', 'Drive and desire to learn and grow both technical and functional skill sets', 'Detail-oriented (critical)', 'Advanced understanding of Zoho is preferred but not required', 'Skill Level: 2-3 years', 'Responsive, reliable, and timely in answering email and instant messages.', 'On time.', 'Excellent interpersonal, verbal and written communication, and organizational skills - must be able to communicate fluently in English both verbally and in writing.', 'Facts and data oriented.', 'Deadline and closure oriented.', 'Strong persuasion, facilitation and influencing skills.', 'Self-driven.', 'Strong analytical, organizational and project management skills.', 'Must be able to thrive in a fast-paced, rapidly evolving environment with varying priorities, based on a team building culture.', '401(k)', '401(k) Matching', 'Dental Insurance', 'Employee Assistance Program', 'Flexible Spending Account', 'Health Insurance', 'Paid Time Off', 'Vision Insurance', 'Monday to Friday', 'United States (Required)', 'One location', '9AM', '5PM', 'www.intellor.com']",2020-07-27 16:56:38
New Home Sales Manager,Classic Homes of Maryland,N/A,"Rockville, MD 20852","['High earning potential', 'Family owned and operated business', 'Work with a wide variety of interesting clients', 'Learn the on-your-lot building process from site work to home delivery', '3-weeks PTO, health insurance, year-end bonuses', 'Must develop an in-depth knowledge of the company’s products, contract documentation, and the home building process', 'Must be able to convert leads to sales through good communication, follow-ups and a positive attitude', 'Perform periodic competitive market analysis, provide pricing, incentive recommendations and contribute to strategic sales planning', 'Achieve high levels of customer satisfaction', 'Develop relationships with key realtors to maximize referral sales', 'Promptly respond to all leads, whether by phone, web, email, or walk-in', 'Enter and update data in Zoho CRM in real-time throughout the day', 'Attend company events such as Open Houses and Seminars', 'Attend weekly staff and sales meetings', 'Minimum 5 years of sales experience', 'Software skills - Google Suite, MS Word, Excel, CRM experience', 'Understand and be responsive to the individual needs of each home buyer', 'Have a basic understanding of the construction process, building materials, and current architectural trends', 'Have a positive attitude and be able to manage, motivate and inspire others', 'Sell effectively over the phone', 'Demonstrate subject matter expertise', 'Manage, prioritize and organize leads', 'Have excellent communication skills', 'Present a professional image at all times', 'The ability to set priorities and exercise flexibility where necessary', 'Must be available to work evenings and weekends', 'Health Insurance', 'Paid Time Off', 'new home sales: 5 years (Preferred)']",2020-07-27 16:56:38
Human Capital Manager Sales,WPS Payroll,N/A,"Los Angeles, CA 90066",[],2020-07-27 16:57:17
Sales Account Manager,Huntington Foam LLC,N/A,"Radford, VA","['Serve as the lead point of contact for all customer account management matters', 'Build and maintain strong, long-lasting client relationships', 'Negotiate contracts and close agreements to maximize profits', 'Develop trusted advisor relationships with key accounts, customer stakeholders and executive sponsors', 'Ensure the timely and successful delivery of our solutions according to customer needs and objectives', 'Clearly communicate the progress of monthly/quarterly initiatives to internal and external stakeholders', 'Develop new business with existing clients and/or identify areas of improvement to meet sales quotas', 'Forecast and track key account metrics (e.g. quarterly sales results and annual forecasts)', 'Prepare reports on account status', 'Collaborate with sales team to identify and grow opportunities within territory', 'Assist with challenging client requests or issue escalations as needed', 'Proven work experience as an Account Manager, Key Account Manager, Sales Account Manager, Junior Account Manager or relevant role', 'Demonstrable ability to communicate, present and influence key stakeholders at all levels of an organization, including executive and C-level', 'Solid experience with CRM software (e.g. Salesforce, Zoho CRM or HubSpot) and MS Office (particularly MS Excel)', 'Experience delivering client-focused solutions to customer needs', 'Proven ability to juggle multiple account management projects at a time, while maintaining sharp attention to detail', 'Excellent listening, negotiation and presentation abilities', 'Strong verbal and written communication skills', 'BA/BS degree in Business Administration, Sales or relevant field', '401(k)', '401(k) Matching', 'Dental Insurance', 'Disability Insurance', 'Health Insurance', 'Paid Time Off', 'Retirement Plan', 'Vision Insurance', 'Monday to Friday', 'Overtime', 'Bonus Pay', 'account management: 5 years (Preferred)', 'sales: 5 years (Preferred)', 'Bonuses', 'One location', 'On the road', 'Yes', 'Team Lead', 'www.hunt-sol.com', 'Yes']",2020-07-27 16:57:17
Customer Service Representative,Ivex Protective Packaging,3.4 out of 5,"Sidney, OH 45365","['Update and maintain customer information in the database.', 'Understand the kind of services we offer during the job training.', 'Provide customers with all the information that they require.', 'Keep track of customer accounts by recording their account information and the issues they have reported.', 'Handle customer complaints actively and ensure its resolution on time.', 'Take orders and calculate the charges by processing customers’ information.', 'Answer customer questions and maintain healthy relationships with the customers.', 'Review customer accounts for any changes.', 'Resolve customer complaints on time and ensure the quality of services is maintained.', 'Handle change in policies of the company and explain them to the customer.', 'Generate sales leads for our clients.', 'Maintain a record of all the tasks undertaken and submit it to the higher management.', 'Bachelor’s degree in any discipline. High School Diploma with relevant experience will also be considered.', '2+ years of experience as a Sales Representative or Front Desk Representative or related role in the Customer Service industry.', 'Excellent knowledge about CRM Softwares like Zoho, Zendesk, etc.', 'Knowledge of social media will be an added benefit.', 'Ability to provide results under pressure.', 'Excellent communication and interpersonal skills.', 'Good problem-solving skills.']",2020-07-27 16:57:17
Client Specialist Associate,Noteswatch,N/A,"San Diego, CA 92122","['Deliver above-and-beyond customer service and experiences through phone, email and social media channels.', 'Explain complex investment principles clearly, helping prospects and customers see the benefits of our products.', 'Troubleshoot customer issues and concerns, investigating why they happened, and communicate to find rapid resolutions.', 'Act as the internal voice of the customer, offering insights to help build a better product.', 'Suggest improvements to company processes. (website, frequently asked questions, etc.)', '2-3 years of relevant work experience.', 'Expertise with customer service, financial services or retail banking.', 'Technical savvy, specifically the ability to navigate multiple systems simultaneously to respond to customer inquiries.', 'Exceptional written communication skills and ability to built rapport - you will speak with our customers through both email and over the phone.', 'Customer service or related experience working with CRM systems (Salesforce, ZenDesk, ZoHo)']",2020-07-27 16:57:17
Operations Manager,Maximus Property Management,N/A,"Philadelphia, PA 19106",[],2020-07-27 16:57:17
Controller,Mochidoki,N/A,"New York, NY 10011","['Evaluate and lead the accounting, cost accounting, payroll, accounts payable, accounts receivable processes', 'Prepare timely monthly financial statements', 'Support month-end and year-end closing processes', 'Monitor the performance of and manage team members as we grow the Finance Department', 'Oversee all tax and regulatory/compliance issues including property, income and sales taxes', 'Manage payroll processes', 'Contribute to decisions regarding financial strategy', 'Identify areas for process improvement', 'Ensure accurate and timely reporting of financial results of all legal entities', 'Evaluate and implement appropriate policies to ensure financial statements are prepared in accordance with GAAP and to ensure books are maintained based on a strong internal control environment.', 'Coordinate annual budget process; ensure timely distribution of budget guidelines and review, analyze and interpret budgetary input', 'Ensure timely and accurate preparation of monthly rolling twelve-month forecast', ""Evaluate the Company's day-to-day operations to recommend efficiencies to enable the organization to meet its operational and profitability objectives"", ""Evaluate the Company's tax strategy and manage tax compliance reporting, including property, income, sales, etc"", 'Develop and maintain a cost accounting and inventory control process to scale with the operational objectives of the Company', ""Bachelor's Degree in accounting or finance"", 'Minimum five years of experience in an entrepreneurial company setting. Experience within wholesale, ecommerce, and manufacturing is a plus.', 'Solid understanding of GAAP reporting.', 'Strong computer/technical and analytical skills.', 'Experience with QuickBooks Online, Expensify, ZOHO inventory, and credit card systems is highly desirable.', 'Dental Insurance', 'Health Insurance', 'Paid Time Off', 'Vision Insurance', 'Monday to Friday', 'financial related ecommerce, wholesale and manufacturing: 3 years (Preferred)', 'related financial/accounting: 5 years (Required)', ""Bachelor's (Required)"", 'United States (Required)', 'Fully Remote', 'http://www. mochidoki.com', 'https://www.facebook.com/mochidoki/', 'Only full-time employees eligible']",2020-07-27 16:57:17
"Technical Support Specialist, Client Success",Tiger Pistol,3.5 out of 5,"Austin, TX 78701","['Providing live phone, email, and chat support for clients, users, and advertisers using our technology, building sustainable relationships and trust through open and proactive communication.', 'Solves emergent issues and puts the customer at the center of every interaction.', 'Responsiveness within established service levels and with a high degree of professionalism.', 'Maintains adherence to ticket service level agreements.', 'Delivering accurate, valid and complete information on Tiger Pistol systems and Social Advertising best practice using the right methods and tools.', 'Training platform users and end advertisers on product features and social advertising best practices.', 'Escalating issues in an appropriate manner through internal processes.', 'Keeping accurate records and document client service actions and discussions.', 'Actively contributing to internal process improvement initiatives', 'Actively participating within your team, ensuring as a group you are achieving your individual and team KPIs.', 'Detailed oriented, self-motivated and highly organized', 'Genuine care for clients and a passion to deliver positive client experiences.', 'Confidence and poise under pressure, particularly when working through challenging and or sensitive client issues.', 'Ability to show initiative, work independently, and prioritize work appropriately.', 'Ability to think critically and objectively.', 'Excellent written and verbal communication skills.', 'A results and team oriented attitude.', 'SaaS and/or Social Media advertising experience.', 'Experience with helpdesk software such as Zendesk, Zoho Desk, Freshdesk, Jira Service Desk or Salesforce Service Cloud.', 'Past success providing chat support, handling more than one conversation at a time.', 'A Bachelor’s degree with 1-3 years experience.', 'Scale-up company with strong growth year over year', 'A solid development team, extremely high standards, and belief in providing autonomy', 'A fun, energetic, and highly collaborative company environment', 'Competitive Salary, 401K offerings, Healthcare benefits, and casual dress code', 'Office located Downtown Austin', 'Cold Brew on tap, drinks & snacks, free downtown parking']",2020-07-27 16:57:17
Team Member (In Store Sales) Chula Vista,Bicycle Warehouse,3.3 out of 5,"Chula Vista, CA 91911","['You will serve on a team whose job is to spread the mission of Bicycle Warehouse - inspiring our Guests passion to ride so they enjoy more freedom, fitness and fun', 'You will engage with all levels of cycling skills and goals from diverse Guests of Bicycle Warehouse', ""You will expand the culture and success of Bicycle Warehouse by getting our Guests to ride more often and better equipped so it's more enjoyable."", 'You will become a trusted advisor to our Guests so they want to continue doing business with us along with referring their family and friends.', 'You will become an expert on all the features and benefits of all our product and how they benefit our Guests.', 'You will become an expert at selling all of our Bikes, Accessories, Clothing, Parts, Maintenance and Services.', 'You will learn and use our GEAR sales process with all Guests:', '""Greeting"" - giving all of our Guests a warm and welcoming greeting into our store. Shaking their hand and introducing yourself', '""Editing"" - learning what our Guests want and need by talking to them about what has them excited about riding or wanting a particular product', '""Appeal"" - learning all of our product features and benefits and presenting the best product and service options so our Guests always have awesome riding experiences', '""Relationship"" - establishing and improving our relationship with our Guests at every interaction. Inviting them to events, rides and back into the store. Following up with them to make sure they LOVE what they purchased. Thanking them for their business and asking for referrals.', 'You will keep our stores visually appealing with continual merchandising and cleaning.', 'You will learn and use our Service Check In process to help our Guests maintain their bikes at 100% so they always have an awesome ride.', 'You will use our core values to continually improve our Guest experiences: service, integrity, teamwork, improvement and fun.', 'You will learn and use all of our software resources - Point of sale, Relationship Management, Intranet, Website, Myagi Training, Zoho (several internal business apps)', ""You will learn and use all of our services - financing, trade in's, warranties, Love It guarantee, returns, special orders, test rides, bike fitting, inventory transferring and more."", 'Raving Fans - when you do it right you will get great feedback from our Guests. They will Rave about the level of service they receive from you', 'Sales - when you do it right your sales will far exceed of your sales goal of $200 per hour', 'Personal Pay - better performance equals better pay.', ""Referrals - when you do it right you get lot's of referrals from the Raving Fans you created"", 'Cycling passion and experience - you have to ride a bike regularly and be totally passionate about it.', 'Selling experience - 2 years of selling and retail experience (or equivalent), something that translates easily to selling bikes, gear and service.', 'The ability to lift bicycles onto display racks above your head', 'The ability to stand on your feet for 8 hours a day on concrete floors', 'The ability to work a flexible schedule including weekends and evenings until 7:30pm', 'The ability to have fun and inspire others to ride their bik', ""If you are just looking for a job, please do not apply. Sorry to be so blunt but it will save us both a bunch of time and effort if we part ways now versus learning it won't work out shortly down the road."", 'If you are looking for career oriented employment and it all sounds like a great fit for you, then we are excited to have you apply.', 'Base pay - $13-$15 per hour', 'Incentive pay', 'Sales over $200/hour earn 5% on parts, accessories, clothes and labor.', 'Team Bonus - each store has monthly sales goals. When the store hits their monthly goals each team member of the store earns an extra bonus.', 'Paid Time Off - each year you get 5 days of earned sick leave along with extra vacation days (up to 10 days total)', 'Purchase Discounts - be able to purchase your cycling product at great discounts.', 'Health Insurance - 50% paid by Bicycle warehouse', ""ESOP (Employee Stock Ownership Plan) - basically it's a profit sharing program that allows the company to share a percentage of the profits with the vested team members.""]",2020-07-27 16:57:17
Regional Sales Representative,Scorpion Internet Marketing,4 out of 5,Remote,"['Achieve monthly and quarterly performance objectives', 'Social media networking', 'Structuring, developing and managing a sales pipeline from prospecting to closing new business', 'Virtual sales presentations and demos via video conferencing', 'Managing prospects and a sales pipeline', '2-5 years inside sales experience, preferably in digital media, internet marketing and/or technology sales', 'Experience selling solutions over the phone and in-person', 'B2B sales experience preferred', 'Track record of exceeding sales goals and quotas', 'Willingness and desire to constantly improve professionally', 'Strong written and verbal communication skills', 'Strong working knowledge of communication channel operations (phone, email and live chat systems)', 'Proficiency with Excel and Word', 'Practical skill level with CRM software such as SalesForce, HubSpot, Zoho, GoldMine, etc.', 'Extremely curious, competitive, ambitious, outgoing and persistent']",2020-07-27 16:57:17
